581334,21733,RED HANGING HEART T-LIGHT HOLDER,4,12/08/2011 12:07,2.95,17841,United Kingdom
581334,20727,LUNCH BAG  BLACK SKULL.,5,12/08/2011 12:07,1.65,17841,United Kingdom
581334,22384,LUNCH BAG PINK POLKADOT,2,12/08/2011 12:07,1.65,17841,United Kingdom
581334,20978,36 PENCILS TUBE SKULLS,5,12/08/2011 12:07,1.25,17841,United Kingdom
581334,23208,LUNCH BAG VINTAGE LEAF DESIGN,5,12/08/2011 12:07,1.65,17841,United Kingdom
581334,22383,LUNCH BAG SUKI DESIGN ,5,12/08/2011 12:07,1.65,17841,United Kingdom
581334,20979,36 PENCILS TUBE RED RETROSPOT,5,12/08/2011 12:07,1.25,17841,United Kingdom
581334,23321,SMALL WHITE HEART OF WICKER,3,12/08/2011 12:07,1.65,17841,United Kingdom
581334,22666,RECIPE BOX PANTRY YELLOW DESIGN,3,12/08/2011 12:07,2.95,17841,United Kingdom
581334,20973,12 PENCIL SMALL TUBE WOODLAND,2,12/08/2011 12:07,0.65,17841,United Kingdom
581334,20975,12 PENCILS SMALL TUBE RED RETROSPOT,1,12/08/2011 12:07,0.65,17841,United Kingdom
581334,22594,CHRISTMAS GINGHAM TREE,3,12/08/2011 12:07,0.85,17841,United Kingdom
581334,22593,CHRISTMAS GINGHAM STAR,3,12/08/2011 12:07,0.85,17841,United Kingdom
581334,22795,SWEETHEART RECIPE BOOK STAND,1,12/08/2011 12:07,6.75,17841,United Kingdom
581334,22061,LARGE CAKE STAND  HANGING STRAWBERY,1,12/08/2011 12:07,2.95,17841,United Kingdom
581334,20724,RED RETROSPOT CHARLOTTE BAG,6,12/08/2011 12:07,0.85,17841,United Kingdom
581334,22993,SET OF 4 PANTRY JELLY MOULDS,12,12/08/2011 12:07,1.25,17841,United Kingdom
581334,84510A,SET OF 4 ENGLISH ROSE COASTERS,8,12/08/2011 12:07,1.25,17841,United Kingdom
581334,22595,GINGHAM HEART DECORATION,8,12/08/2011 12:07,0.85,17841,United Kingdom
581334,23213,STAR WREATH DECORATION WITH BELL,2,12/08/2011 12:07,1.25,17841,United Kingdom
581334,23212,HEART WREATH DECORATION WITH BELL,2,12/08/2011 12:07,1.25,17841,United Kingdom
581334,23220,REINDEER HEART DECORATION GOLD,7,12/08/2011 12:07,0.83,17841,United Kingdom
581334,23221,REINDEER HEART DECORATION SILVER,4,12/08/2011 12:07,0.83,17841,United Kingdom
581334,23224,CHERUB HEART DECORATION GOLD,5,12/08/2011 12:07,0.83,17841,United Kingdom
581334,23228,FILIGREE HEART BIRD WHITE ,1,12/08/2011 12:07,1.25,17841,United Kingdom
581334,23211,RED ROCKING HORSE HAND PAINTED,5,12/08/2011 12:07,1.25,17841,United Kingdom
581334,23210,WHITE ROCKING HORSE HAND PAINTED,10,12/08/2011 12:07,1.25,17841,United Kingdom
581334,79321,CHILLI LIGHTS,24,12/08/2011 12:07,4.95,17841,United Kingdom
581334,22475,SKULL DESIGN TV DINNER TRAY,10,12/08/2011 12:07,1.95,17841,United Kingdom
581334,23500,KEY RING BASEBALL BOOT ASSORTED ,2,12/08/2011 12:07,1.25,17841,United Kingdom
581334,22094,RED RETROSPOT TISSUE BOX,2,12/08/2011 12:07,0.39,17841,United Kingdom
581334,22092,BLUE PAISLEY TISSUE BOX,2,12/08/2011 12:07,0.39,17841,United Kingdom
581334,23322,LARGE WHITE HEART OF WICKER,2,12/08/2011 12:07,2.95,17841,United Kingdom
581334,22469,HEART OF WICKER SMALL,3,12/08/2011 12:07,1.65,17841,United Kingdom
581334,21262,WHITE GOOSE FEATHER CHRISTMAS TREE ,1,12/08/2011 12:07,2.95,17841,United Kingdom
581334,23548,WRAP MAGIC FOREST ,25,12/08/2011 12:07,0.42,17841,United Kingdom
581334,21867,PINK UNION JACK  LUGGAGE TAG,2,12/08/2011 12:07,1.25,17841,United Kingdom
581334,21866,UNION JACK FLAG LUGGAGE TAG,2,12/08/2011 12:07,1.25,17841,United Kingdom
581334,21865,PINK UNION JACK  PASSPORT COVER ,2,12/08/2011 12:07,2.1,17841,United Kingdom
581334,21864,UNION JACK FLAG PASSPORT COVER ,2,12/08/2011 12:07,2.1,17841,United Kingdom
581334,23395,BELLE JARDINIERE CUSHION COVER,22,12/08/2011 12:07,3.75,17841,United Kingdom
581334,21181,PLEASE ONE PERSON METAL SIGN,1,12/08/2011 12:07,2.1,17841,United Kingdom
581334,23241,TREASURE TIN GYMKHANA DESIGN,3,12/08/2011 12:07,2.08,17841,United Kingdom
581334,21668,RED STRIPE CERAMIC DRAWER KNOB,2,12/08/2011 12:07,1.45,17841,United Kingdom
581334,23264,SET OF 3 WOODEN SLEIGH DECORATIONS,12,12/08/2011 12:07,1.25,17841,United Kingdom
581334,23263,SET OF 3 WOODEN HEART DECORATIONS,12,12/08/2011 12:07,1.25,17841,United Kingdom
581334,23300,GARDENERS KNEELING PAD CUP OF TEA ,4,12/08/2011 12:07,1.65,17841,United Kingdom
581334,22212,FOUR HOOK  WHITE LOVEBIRDS,1,12/08/2011 12:07,2.1,17841,United Kingdom
581334,22498,WOODEN REGATTA BUNTING,1,12/08/2011 12:07,5.95,17841,United Kingdom
581334,47563A,RETRO LONGBOARD IRONING BOARD COVER,4,12/08/2011 12:07,1.25,17841,United Kingdom
