581218,22221,CAKE STAND LOVEBIRD 2 TIER PINK,6,12/08/2011 09:23,2.95,14191,United Kingdom
581218,22319,HAIRCLIPS FORTIES FABRIC ASSORTED,72,12/08/2011 09:23,0.19,14191,United Kingdom
581218,84817,DANISH ROSE DECORATIVE PLATE,24,12/08/2011 09:23,0.39,14191,United Kingdom
581218,84819,DANISH ROSE ROUND SEWING BOX,16,12/08/2011 09:23,0.79,14191,United Kingdom
581218,84820,DANISH ROSE TRINKET TRAYS,16,12/08/2011 09:23,0.79,14191,United Kingdom
581218,84821,DANISH ROSE DELUXE COASTER,24,12/08/2011 09:23,0.19,14191,United Kingdom
581218,23552,BICYCLE PUNCTURE REPAIR KIT ,6,12/08/2011 09:23,2.08,14191,United Kingdom
581218,23583,LUNCH BAG PAISLEY PARK  ,10,12/08/2011 09:23,1.65,14191,United Kingdom
581218,23582,VINTAGE DOILY JUMBO BAG RED ,10,12/08/2011 09:23,2.08,14191,United Kingdom
581218,23201,JUMBO BAG ALPHABET,10,12/08/2011 09:23,2.08,14191,United Kingdom
581218,23581,JUMBO BAG PAISLEY PARK,10,12/08/2011 09:23,2.08,14191,United Kingdom
581218,22356,CHARLOTTE BAG PINK POLKADOT,10,12/08/2011 09:23,0.85,14191,United Kingdom
581218,20724,RED RETROSPOT CHARLOTTE BAG,10,12/08/2011 09:23,0.85,14191,United Kingdom
581218,20725,LUNCH BAG RED RETROSPOT,10,12/08/2011 09:23,1.65,14191,United Kingdom
581218,21108,FAIRY CAKE FLANNEL ASSORTED COLOUR,18,12/08/2011 09:23,0.79,14191,United Kingdom
581219,22580,ADVENT CALENDAR GINGHAM SACK,8,12/08/2011 09:28,4.13,,United Kingdom
581219,22581,WOOD STOCKING CHRISTMAS SCANDISPOT,10,12/08/2011 09:28,0.83,,United Kingdom
581219,22582,PACK OF 6 SWEETIE GIFT BOXES,1,12/08/2011 09:28,4.96,,United Kingdom
581219,22586,FELTCRAFT HAIRBAND PINK AND BLUE,1,12/08/2011 09:28,1.63,,United Kingdom
581219,22587,FELTCRAFT HAIRBAND RED AND BLUE,1,12/08/2011 09:28,1.63,,United Kingdom
581219,22589,CARDHOLDER GINGHAM STAR,2,12/08/2011 09:28,4.96,,United Kingdom
581219,22591,CARDHOLDER GINGHAM CHRISTMAS TREE,1,12/08/2011 09:28,6.63,,United Kingdom
581219,22592,CARDHOLDER HOLLY WREATH METAL,3,12/08/2011 09:28,7.46,,United Kingdom
581219,22593,CHRISTMAS GINGHAM STAR,9,12/08/2011 09:28,1.63,,United Kingdom
581219,22594,CHRISTMAS GINGHAM TREE,10,12/08/2011 09:28,1.63,,United Kingdom
581219,22597,MUSICAL ZINC HEART DECORATION ,7,12/08/2011 09:28,0.83,,United Kingdom
581219,22598,CHRISTMAS MUSICAL ZINC TREE,8,12/08/2011 09:28,0.83,,United Kingdom
581219,22599,CHRISTMAS MUSICAL ZINC STAR,6,12/08/2011 09:28,0.83,,United Kingdom
581219,22600,CHRISTMAS RETROSPOT STAR WOOD,1,12/08/2011 09:28,1.63,,United Kingdom
581219,22603,CHRISTMAS RETROSPOT TREE WOOD,1,12/08/2011 09:28,1.63,,United Kingdom
581219,22604,SET OF 4 NAPKIN CHARMS CUTLERY,2,12/08/2011 09:28,4.96,,United Kingdom
581219,22608,PENS ASSORTED FUNKY JEWELED ,2,12/08/2011 09:28,0.42,,United Kingdom
581219,22609,PENS ASSORTED SPACEBALL,2,12/08/2011 09:28,1.63,,United Kingdom
581219,22619,SET OF 6 SOLDIER SKITTLES,2,12/08/2011 09:28,7.46,,United Kingdom
581219,22620,4 TRADITIONAL SPINNING TOPS,6,12/08/2011 09:28,2.46,,United Kingdom
581219,22621,TRADITIONAL KNITTING NANCY,4,12/08/2011 09:28,3.29,,United Kingdom
581219,22624,IVORY KITCHEN SCALES,2,12/08/2011 09:28,16.63,,United Kingdom
581219,22625,RED KITCHEN SCALES,1,12/08/2011 09:28,16.63,,United Kingdom
581219,22629,SPACEBOY LUNCH BOX ,2,12/08/2011 09:28,4.13,,United Kingdom
581219,22630,DOLLY GIRL LUNCH BOX,1,12/08/2011 09:28,4.13,,United Kingdom
581219,22631,CIRCUS PARADE LUNCH BOX ,1,12/08/2011 09:28,4.13,,United Kingdom
581219,22632,HAND WARMER RED RETROSPOT,1,12/08/2011 09:28,4.13,,United Kingdom
581219,22633,HAND WARMER UNION JACK,1,12/08/2011 09:28,4.13,,United Kingdom
581219,22636,CHILDS BREAKFAST SET CIRCUS PARADE,1,12/08/2011 09:28,16.63,,United Kingdom
581219,22650,CERAMIC PIRATE CHEST MONEY BANK,3,12/08/2011 09:28,3.29,,United Kingdom
581219,22651,GENTLEMAN SHIRT REPAIR KIT ,2,12/08/2011 09:28,1.63,,United Kingdom
581219,22653,BUTTON BOX ,19,12/08/2011 09:28,1.63,,United Kingdom
581219,22664,TOY TIDY DOLLY GIRL DESIGN,1,12/08/2011 09:28,4.13,,United Kingdom
581219,22666,RECIPE BOX PANTRY YELLOW DESIGN,5,12/08/2011 09:28,5.79,,United Kingdom
581219,22670,FRENCH WC SIGN BLUE METAL,4,12/08/2011 09:28,2.46,,United Kingdom
