581238,22178,VICTORIAN GLASS HANGING T-LIGHT,6,12/08/2011 10:53,2.46,,United Kingdom
581238,22179,SET 10 NIGHT OWL LIGHTS,2,12/08/2011 10:53,13.29,,United Kingdom
581238,22188,BLACK HEART CARD HOLDER,1,12/08/2011 10:53,8.29,,United Kingdom
581238,22195,LARGE HEART MEASURING SPOONS,2,12/08/2011 10:53,3.29,,United Kingdom
581238,22207,FRYING PAN UNION FLAG,1,12/08/2011 10:53,8.29,,United Kingdom
581238,22278,OVERNIGHT BAG VINTAGE ROSE PAISLEY,3,12/08/2011 10:53,10.79,,United Kingdom
581238,22297,HEART IVORY TRELLIS SMALL,3,12/08/2011 10:53,2.46,,United Kingdom
581238,22300,COFFEE MUG DOG + BALL DESIGN,1,12/08/2011 10:53,4.96,,United Kingdom
581238,22314,OFFICE MUG WARMER CHOC+BLUE,1,12/08/2011 10:53,8.29,,United Kingdom
581238,22327,ROUND SNACK BOXES SET OF 4 SKULLS,1,12/08/2011 10:53,6.63,,United Kingdom
581238,22341,LOVE GARLAND PAINTED ZINC ,1,12/08/2011 10:53,3.29,,United Kingdom
581238,22352,LUNCH BOX WITH CUTLERY RETROSPOT ,4,12/08/2011 10:53,4.13,,United Kingdom
581238,22358,KINGS CHOICE TEA CADDY ,1,12/08/2011 10:53,5.79,,United Kingdom
581238,22367,CHILDRENS APRON SPACEBOY DESIGN,1,12/08/2011 10:53,4.96,,United Kingdom
581238,22379,RECYCLING BAG RETROSPOT ,6,12/08/2011 10:53,4.96,,United Kingdom
581238,22384,LUNCH BAG PINK POLKADOT,2,12/08/2011 10:53,4.96,,United Kingdom
581238,22386,JUMBO BAG PINK POLKADOT,5,12/08/2011 10:53,4.13,,United Kingdom
581238,22411,JUMBO SHOPPER VINTAGE RED PAISLEY,11,12/08/2011 10:53,4.13,,United Kingdom
581238,22414,DOORMAT NEIGHBOURHOOD WITCH ,1,12/08/2011 10:53,14.13,,United Kingdom
581238,22418,10 COLOUR SPACEBOY PEN,1,12/08/2011 10:53,2.46,,United Kingdom
581238,22422,TOOTHPASTE TUBE PEN,5,12/08/2011 10:53,1.25,,United Kingdom
581238,22425,ENAMEL COLANDER CREAM,1,12/08/2011 10:53,9.96,,United Kingdom
581238,22429,ENAMEL MEASURING JUG CREAM,1,12/08/2011 10:53,8.29,,United Kingdom
581238,22457,NATURAL SLATE HEART CHALKBOARD ,12,12/08/2011 10:53,5.79,,United Kingdom
581238,22467,GUMBALL COAT RACK,1,12/08/2011 10:53,4.96,,United Kingdom
581238,22468,BABUSHKA LIGHTS STRING OF 10,1,12/08/2011 10:53,13.29,,United Kingdom
581238,22469,HEART OF WICKER SMALL,1,12/08/2011 10:53,4.13,,United Kingdom
581238,22470,HEART OF WICKER LARGE,1,12/08/2011 10:53,5.79,,United Kingdom
581238,22493,PAINT YOUR OWN CANVAS SET,2,12/08/2011 10:53,3.29,,United Kingdom
581238,22507,MEMO BOARD RETROSPOT  DESIGN,2,12/08/2011 10:53,10.79,,United Kingdom
581238,22549,PICTURE DOMINOES,1,12/08/2011 10:53,2.46,,United Kingdom
581238,22551,PLASTERS IN TIN SPACEBOY,1,12/08/2011 10:53,3.29,,United Kingdom
581238,22621,TRADITIONAL KNITTING NANCY,1,12/08/2011 10:53,3.29,,United Kingdom
581238,22622,BOX OF VINTAGE ALPHABET BLOCKS,1,12/08/2011 10:53,20.79,,United Kingdom
581238,22629,SPACEBOY LUNCH BOX ,3,12/08/2011 10:53,2.46,,United Kingdom
581238,22630,DOLLY GIRL LUNCH BOX,2,12/08/2011 10:53,2.46,,United Kingdom
581238,22632,HAND WARMER RED RETROSPOT,2,12/08/2011 10:53,4.13,,United Kingdom
581238,22644,CERAMIC CHERRY CAKE MONEY BANK,1,12/08/2011 10:53,4.13,,United Kingdom
581238,22659,LUNCH BOX I LOVE LONDON,1,12/08/2011 10:53,4.13,,United Kingdom
581238,22666,RECIPE BOX PANTRY YELLOW DESIGN,16,12/08/2011 10:53,5.79,,United Kingdom
581238,22669,RED BABY BUNTING ,2,12/08/2011 10:53,5.79,,United Kingdom
581238,22692,DOORMAT WELCOME TO OUR HOME,1,12/08/2011 10:53,16.63,,United Kingdom
581238,22694,WICKER STAR ,1,12/08/2011 10:53,3.29,,United Kingdom
581238,22697,GREEN REGENCY TEACUP AND SAUCER,1,12/08/2011 10:53,5.79,,United Kingdom
581238,22698,PINK REGENCY TEACUP AND SAUCER,1,12/08/2011 10:53,5.79,,United Kingdom
581238,22699,ROSES REGENCY TEACUP AND SAUCER ,1,12/08/2011 10:53,5.79,,United Kingdom
581238,22721,SET OF 3 CAKE TINS SKETCHBOOK,2,12/08/2011 10:53,10.79,,United Kingdom
581238,22722,SET OF 6 SPICE TINS PANTRY DESIGN,1,12/08/2011 10:53,8.29,,United Kingdom
581238,22728,ALARM CLOCK BAKELIKE PINK,1,12/08/2011 10:53,8.29,,United Kingdom
581238,22734,SET OF 6 RIBBONS VINTAGE CHRISTMAS,5,12/08/2011 10:53,5.79,,United Kingdom
