573183,23505,PLAYING CARDS I LOVE LONDON ,6,10/28/2011 11:33,1.25,15028,United Kingdom
573183,23309,SET OF 60 I LOVE LONDON CAKE CASES ,10,10/28/2011 11:33,0.55,15028,United Kingdom
573183,23504,PLAYING CARDS JUBILEE UNION JACK,25,10/28/2011 11:33,1.25,15028,United Kingdom
573183,23501,KEY RING BASEBALL BOOT UNION JACK,15,10/28/2011 11:33,1.25,15028,United Kingdom
573183,23005,TRAVEL CARD WALLET I LOVE LONDON,4,10/28/2011 11:33,0.42,15028,United Kingdom
573183,22998,TRAVEL CARD WALLET KEEP CALM,10,10/28/2011 11:33,0.42,15028,United Kingdom
573183,84596F,SMALL MARSHMALLOWS PINK BOWL,1,10/28/2011 11:33,0.42,15028,United Kingdom
573183,22633,HAND WARMER UNION JACK,24,10/28/2011 11:33,2.1,15028,United Kingdom
573183,22091,EMPIRE TISSUE BOX,15,10/28/2011 11:33,0.39,15028,United Kingdom
573183,21891,TRADITIONAL WOODEN SKIPPING ROPE,2,10/28/2011 11:33,1.45,15028,United Kingdom
573183,21892,TRADITIONAL WOODEN CATCH CUP GAME ,4,10/28/2011 11:33,1.25,15028,United Kingdom
573183,23238,SET OF 4 KNICK KNACK TINS LONDON ,1,10/28/2011 11:33,4.15,15028,United Kingdom
573183,21987,PACK OF 6 SKULL PAPER CUPS,2,10/28/2011 11:33,0.65,15028,United Kingdom
573183,22621,TRADITIONAL KNITTING NANCY,4,10/28/2011 11:33,1.65,15028,United Kingdom
573183,22096,PINK PAISLEY SQUARE TISSUE BOX ,1,10/28/2011 11:33,0.39,15028,United Kingdom
573183,23365,SET 12 COLOUR PENCILS LOVE LONDON,20,10/28/2011 11:33,0.65,15028,United Kingdom
573183,22616,PACK OF 12 LONDON TISSUES ,48,10/28/2011 11:33,0.39,15028,United Kingdom
573183,21867,PINK UNION JACK  LUGGAGE TAG,9,10/28/2011 11:33,1.25,15028,United Kingdom
573183,22900,SET 2 TEA TOWELS I LOVE LONDON ,18,10/28/2011 11:33,3.25,15028,United Kingdom
573183,21866,UNION JACK FLAG LUGGAGE TAG,16,10/28/2011 11:33,1.25,15028,United Kingdom
573183,22750,FELTCRAFT PRINCESS LOLA DOLL,1,10/28/2011 11:33,3.75,15028,United Kingdom
573183,46138B,BLUE CHENILLE SHAGGY CUSHION COVER ,2,10/28/2011 11:33,0.85,15028,United Kingdom
573183,23271,CHRISTMAS TABLE SILVER CANDLE SPIKE,6,10/28/2011 11:33,0.83,15028,United Kingdom
573183,23284,DOORMAT KEEP CALM AND COME IN,1,10/28/2011 11:33,8.25,15028,United Kingdom
573184,21137,BLACK RECORD COVER FRAME,48,10/28/2011 11:33,3.39,14110,United Kingdom
573184,22041,"RECORD FRAME 7"" SINGLE SIZE ",48,10/28/2011 11:33,2.1,14110,United Kingdom
573184,20725,LUNCH BAG RED RETROSPOT,10,10/28/2011 11:33,1.65,14110,United Kingdom
573184,22384,LUNCH BAG PINK POLKADOT,10,10/28/2011 11:33,1.65,14110,United Kingdom
573184,20726,LUNCH BAG WOODLAND,10,10/28/2011 11:33,1.65,14110,United Kingdom
573184,20727,LUNCH BAG  BLACK SKULL.,10,10/28/2011 11:33,1.65,14110,United Kingdom
573184,22383,LUNCH BAG SUKI DESIGN ,10,10/28/2011 11:33,1.65,14110,United Kingdom
573184,85150,LADIES & GENTLEMEN METAL SIGN,6,10/28/2011 11:33,2.55,14110,United Kingdom
573184,82551,LAUNDRY 15C METAL SIGN,12,10/28/2011 11:33,1.45,14110,United Kingdom
573184,21166,COOK WITH WINE METAL SIGN ,12,10/28/2011 11:33,2.08,14110,United Kingdom
573184,21165,BEWARE OF THE CAT METAL SIGN ,12,10/28/2011 11:33,1.69,14110,United Kingdom
573184,21169,YOU'RE CONFUSING ME METAL SIGN ,12,10/28/2011 11:33,1.69,14110,United Kingdom
573184,82582,AREA PATROLLED METAL SIGN,12,10/28/2011 11:33,2.1,14110,United Kingdom
573184,21479,WHITE SKULL HOT WATER BOTTLE ,12,10/28/2011 11:33,4.25,14110,United Kingdom
573185,22112,CHOCOLATE HOT WATER BOTTLE,48,10/28/2011 11:34,4.25,17730,United Kingdom
573185,22114,HOT WATER BOTTLE TEA AND SYMPATHY,12,10/28/2011 11:34,4.25,17730,United Kingdom
573185,84510A,SET OF 4 ENGLISH ROSE COASTERS,10,10/28/2011 11:34,1.25,17730,United Kingdom
573185,22776,SWEETHEART 3 TIER CAKE STAND ,4,10/28/2011 11:34,9.95,17730,United Kingdom
573185,22666,RECIPE BOX PANTRY YELLOW DESIGN,6,10/28/2011 11:34,2.95,17730,United Kingdom
573185,22940,FELTCRAFT CHRISTMAS FAIRY,4,10/28/2011 11:34,4.25,17730,United Kingdom
573185,22153,ANGEL DECORATION STARS ON DRESS,48,10/28/2011 11:34,0.42,17730,United Kingdom
573185,22866,HAND WARMER SCOTTY DOG DESIGN,12,10/28/2011 11:34,2.1,17730,United Kingdom
573185,23504,PLAYING CARDS JUBILEE UNION JACK,12,10/28/2011 11:34,1.25,17730,United Kingdom
573185,20971,PINK BLUE FELT CRAFT TRINKET BOX,12,10/28/2011 11:34,1.25,17730,United Kingdom
C573187,22627,MINT KITCHEN SCALES,-1,10/28/2011 11:38,8.5,12709,Germany
573195,20694,FLORAL PINK MONSTER,8,10/28/2011 11:40,3.75,12432,Norway
