581439,16235,RECYCLED PENCIL WITH RABBIT ERASER,2,12/08/2011 16:30,0.42,,United Kingdom
581439,17003,BROCADE RING PURSE ,2,12/08/2011 16:30,0.83,,United Kingdom
581439,17012D,ORIGAMI ROSE INCENSE/CANDLE SET ,1,12/08/2011 16:30,2.46,,United Kingdom
581439,17012F,ORIGAMI SANDLEWOOD INCENSE/CAND SET,1,12/08/2011 16:30,2.46,,United Kingdom
581439,17084P,DRAGONS BLOOD INCENSE,25,12/08/2011 16:30,0.42,,United Kingdom
581439,18097C,WHITE TALL PORCELAIN T-LIGHT HOLDER,1,12/08/2011 16:30,4.96,,United Kingdom
581439,20617,FIRST CLASS PASSPORT COVER ,1,12/08/2011 16:30,4.13,,United Kingdom
581439,20654,FIRST CLASS LUGGAGE TAG ,1,12/08/2011 16:30,2.46,,United Kingdom
581439,20665,RED RETROSPOT PURSE ,1,12/08/2011 16:30,5.79,,United Kingdom
581439,20712,JUMBO BAG WOODLAND ANIMALS,1,12/08/2011 16:30,4.13,,United Kingdom
581439,20713,JUMBO BAG OWLS,1,12/08/2011 16:30,4.13,,United Kingdom
581439,20719,WOODLAND CHARLOTTE BAG,3,12/08/2011 16:30,1.63,,United Kingdom
581439,20723,STRAWBERRY CHARLOTTE BAG,1,12/08/2011 16:30,1.63,,United Kingdom
581439,20724,RED RETROSPOT CHARLOTTE BAG,1,12/08/2011 16:30,1.63,,United Kingdom
581439,20725,LUNCH BAG RED RETROSPOT,3,12/08/2011 16:30,4.13,,United Kingdom
581439,20727,LUNCH BAG  BLACK SKULL.,2,12/08/2011 16:30,4.13,,United Kingdom
581439,20728,LUNCH BAG CARS BLUE,3,12/08/2011 16:30,4.13,,United Kingdom
581439,20733,GOLD MINI TAPE MEASURE ,4,12/08/2011 16:30,0.83,,United Kingdom
581439,20777,CHRYSANTHEMUM NOTEBOOK,1,12/08/2011 16:30,1.63,,United Kingdom
581439,20780,BLACK EAR MUFF HEADPHONES,1,12/08/2011 16:30,10.79,,United Kingdom
581439,20829,GLITTER HANGING BUTTERFLY STRING,1,12/08/2011 16:30,4.13,,United Kingdom
581439,20839,FRENCH PAISLEY CUSHION COVER ,2,12/08/2011 16:30,3.29,,United Kingdom
581439,20840,FRENCH FLORAL CUSHION COVER ,2,12/08/2011 16:30,3.29,,United Kingdom
581439,20866,BLUE ROSE FABRIC MIRROR,3,12/08/2011 16:30,2.46,,United Kingdom
581439,20914,SET/5 RED RETROSPOT LID GLASS BOWLS,2,12/08/2011 16:30,5.79,,United Kingdom
581439,20931,BLUE POT PLANT CANDLE ,1,12/08/2011 16:30,7.46,,United Kingdom
581439,20932,PINK POT PLANT CANDLE,1,12/08/2011 16:30,7.46,,United Kingdom
581439,20969,RED FLORAL FELTCRAFT SHOULDER BAG,1,12/08/2011 16:30,7.46,,United Kingdom
581439,20971,PINK BLUE FELT CRAFT TRINKET BOX,1,12/08/2011 16:30,2.46,,United Kingdom
581439,20972,PINK CREAM FELT CRAFT TRINKET BOX ,2,12/08/2011 16:30,2.46,,United Kingdom
581439,20973,12 PENCIL SMALL TUBE WOODLAND,6,12/08/2011 16:30,1.25,,United Kingdom
581439,20978,36 PENCILS TUBE SKULLS,1,12/08/2011 16:30,2.46,,United Kingdom
581439,20982,12 PENCILS TALL TUBE SKULLS,1,12/08/2011 16:30,1.63,,United Kingdom
581439,21015,DARK BIRD HOUSE TREE DECORATION,1,12/08/2011 16:30,0.83,,United Kingdom
581439,21028,NINJA RABBIT BLACK,1,12/08/2011 16:30,2.46,,United Kingdom
581439,21035,SET/2 RED RETROSPOT TEA TOWELS ,1,12/08/2011 16:30,6.63,,United Kingdom
581439,21064,BOOM BOX SPEAKER BOYS,7,12/08/2011 16:30,4.13,,United Kingdom
581439,21065,BOOM BOX SPEAKER GIRLS,2,12/08/2011 16:30,4.13,,United Kingdom
581439,21068,VINTAGE BILLBOARD LOVE/HATE MUG,1,12/08/2011 16:30,2.46,,United Kingdom
581439,21070,VINTAGE BILLBOARD MUG ,1,12/08/2011 16:30,2.46,,United Kingdom
581439,21080,SET/20 RED RETROSPOT PAPER NAPKINS ,1,12/08/2011 16:30,1.63,,United Kingdom
581439,21088,SET/6 FRUIT SALAD PAPER CUPS,1,12/08/2011 16:30,0.83,,United Kingdom
581439,21098,CHRISTMAS TOILET ROLL,9,12/08/2011 16:30,2.46,,United Kingdom
581439,21109,LARGE CAKE TOWEL CHOCOLATE SPOTS,1,12/08/2011 16:30,13.29,,United Kingdom
581439,21123,SET/10 IVORY POLKADOT PARTY CANDLES,7,12/08/2011 16:30,0.83,,United Kingdom
581439,21126,SET OF 6 GIRLS CELEBRATION CANDLES,2,12/08/2011 16:30,1.25,,United Kingdom
581439,21137,BLACK RECORD COVER FRAME,12,12/08/2011 16:30,4.13,,United Kingdom
581439,21154,RED RETROSPOT OVEN GLOVE ,2,12/08/2011 16:30,2.46,,United Kingdom
581439,21156,RETROSPOT CHILDRENS APRON,1,12/08/2011 16:30,4.13,,United Kingdom
581439,21159,MOODY BOY  DOOR HANGER ,1,12/08/2011 16:30,3.29,,United Kingdom
