573286,22555,PLASTERS IN TIN STRONGMAN,2,10/28/2011 14:38,1.65,,Switzerland
573286,23256,CHILDRENS CUTLERY SPACEBOY ,1,10/28/2011 14:38,4.15,,Switzerland
573286,22077,6 RIBBONS RUSTIC CHARM,7,10/28/2011 14:38,1.95,,Switzerland
573286,85049G,CHOCOLATE BOX RIBBONS ,3,10/28/2011 14:38,1.25,,Switzerland
573286,22082,RIBBON REEL STRIPES DESIGN ,5,10/28/2011 14:38,1.65,,Switzerland
573286,22080,RIBBON REEL POLKADOTS ,5,10/28/2011 14:38,1.65,,Switzerland
573286,21892,TRADITIONAL WOODEN CATCH CUP GAME ,2,10/28/2011 14:38,1.25,,Switzerland
573286,23254,CHILDRENS CUTLERY DOLLY GIRL ,2,10/28/2011 14:38,4.15,,Switzerland
573286,23493,VINTAGE DOILY TRAVEL SEWING KIT,1,10/28/2011 14:38,1.95,,Switzerland
573286,21915,RED  HARMONICA IN BOX ,2,10/28/2011 14:38,1.25,,Switzerland
573286,22555,PLASTERS IN TIN STRONGMAN,1,10/28/2011 14:38,1.65,,Switzerland
573286,85123A,WHITE HANGING HEART T-LIGHT HOLDER,4,10/28/2011 14:38,2.95,,Switzerland
573286,21136,PAINTED METAL PEARS ASSORTED,6,10/28/2011 14:38,1.69,,Switzerland
573286,84879,ASSORTED COLOUR BIRD ORNAMENT,1,10/28/2011 14:38,1.69,,Switzerland
573286,21485,RETROSPOT HEART HOT WATER BOTTLE,2,10/28/2011 14:38,4.95,,Switzerland
573286,22110,BIRD HOUSE HOT WATER BOTTLE,2,10/28/2011 14:38,2.55,,Switzerland
573286,23287,RED VINTAGE SPOT BEAKER,4,10/28/2011 14:38,0.85,,Switzerland
573286,22600,CHRISTMAS RETROSPOT STAR WOOD,8,10/28/2011 14:38,0.85,,Switzerland
573286,22602,RETROSPOT WOODEN HEART DECORATION,4,10/28/2011 14:38,0.85,,Switzerland
573286,21035,SET/2 RED RETROSPOT TEA TOWELS ,2,10/28/2011 14:38,3.25,,Switzerland
573286,21156,RETROSPOT CHILDRENS APRON,4,10/28/2011 14:38,1.95,,Switzerland
573286,21154,RED RETROSPOT OVEN GLOVE ,4,10/28/2011 14:38,1.25,,Switzerland
573286,21242,RED RETROSPOT PLATE ,12,10/28/2011 14:38,1.69,,Switzerland
573286,23431,NATURAL HANGING QUILTED HEARTS ,18,10/28/2011 14:38,0.83,,Switzerland
573286,23286,BLUE VINTAGE SPOT BEAKER,4,10/28/2011 14:38,0.85,,Switzerland
573286,22339,CHRISTMAS TREE PAINTED ZINC ,12,10/28/2011 14:38,0.19,,Switzerland
573286,21592,RETROSPOT CIGAR BOX MATCHES ,4,10/28/2011 14:38,1.25,,Switzerland
573286,85150,LADIES & GENTLEMEN METAL SIGN,1,10/28/2011 14:38,2.55,,Switzerland
573286,21175,GIN + TONIC DIET METAL SIGN,2,10/28/2011 14:38,2.55,,Switzerland
573286,22117,METAL SIGN HER DINNER IS SERVED ,2,10/28/2011 14:38,2.95,,Switzerland
573286,22413,METAL SIGN TAKE IT OR LEAVE IT ,2,10/28/2011 14:38,2.95,,Switzerland
573286,21181,PLEASE ONE PERSON METAL SIGN,1,10/28/2011 14:38,2.1,,Switzerland
573286,22582,PACK OF 6 SWEETIE GIFT BOXES,3,10/28/2011 14:38,2.55,,Switzerland
573286,22603,CHRISTMAS RETROSPOT TREE WOOD,4,10/28/2011 14:38,0.85,,Switzerland
573286,22600,CHRISTMAS RETROSPOT STAR WOOD,2,10/28/2011 14:38,0.85,,Switzerland
573286,22602,RETROSPOT WOODEN HEART DECORATION,8,10/28/2011 14:38,0.85,,Switzerland
573286,22791,T-LIGHT GLASS FLUTED ANTIQUE,6,10/28/2011 14:38,1.25,,Switzerland
573286,22338,STAR DECORATION PAINTED ZINC ,38,10/28/2011 14:38,0.19,,Switzerland
573286,22337,ANGEL DECORATION PAINTED ZINC ,10,10/28/2011 14:38,0.65,,Switzerland
573286,21210,SET OF 72 RETROSPOT PAPER  DOILIES,1,10/28/2011 14:38,1.45,,Switzerland
573287,21533,RETROSPOT LARGE MILK JUG,3,10/28/2011 14:42,4.95,14194,United Kingdom
573287,21912,VINTAGE SNAKES & LADDERS,4,10/28/2011 14:42,3.75,14194,United Kingdom
573287,85150,LADIES & GENTLEMEN METAL SIGN,6,10/28/2011 14:42,2.55,14194,United Kingdom
573287,23350,ROLL WRAP VINTAGE SPOT ,12,10/28/2011 14:42,1.25,14194,United Kingdom
573287,22595,GINGHAM HEART DECORATION,12,10/28/2011 14:42,0.85,14194,United Kingdom
573287,84946,ANTIQUE SILVER T-LIGHT GLASS,12,10/28/2011 14:42,1.25,14194,United Kingdom
573287,22966,GINGERBREAD MAN COOKIE CUTTER,12,10/28/2011 14:42,1.25,14194,United Kingdom
573287,23308,SET OF 60 VINTAGE LEAF CAKE CASES ,24,10/28/2011 14:42,0.55,14194,United Kingdom
573287,23328,SET 6 SCHOOL MILK BOTTLES IN CRATE,4,10/28/2011 14:42,3.75,14194,United Kingdom
573287,84380,SET OF 3 BUTTERFLY COOKIE CUTTERS,12,10/28/2011 14:42,1.45,14194,United Kingdom
