573136,23212,HEART WREATH DECORATION WITH BELL,12,10/27/2011 17:00,1.25,12709,Germany
573136,21485,RETROSPOT HEART HOT WATER BOTTLE,3,10/27/2011 17:00,4.95,12709,Germany
573136,POST,POSTAGE,2,10/27/2011 17:00,18,12709,Germany
573137,16238,PARTY TIME PENCIL ERASERS,1,10/27/2011 17:15,0.42,,United Kingdom
573137,20712,JUMBO BAG WOODLAND ANIMALS,1,10/27/2011 17:15,4.13,,United Kingdom
573137,20723,STRAWBERRY CHARLOTTE BAG,6,10/27/2011 17:15,0.85,,United Kingdom
573137,20724,RED RETROSPOT CHARLOTTE BAG,5,10/27/2011 17:15,0.85,,United Kingdom
573137,20839,FRENCH PAISLEY CUSHION COVER ,3,10/27/2011 17:15,3.29,,United Kingdom
573137,20840,FRENCH FLORAL CUSHION COVER ,2,10/27/2011 17:15,3.29,,United Kingdom
573137,20973,12 PENCIL SMALL TUBE WOODLAND,1,10/27/2011 17:15,1.25,,United Kingdom
573137,20977,36 PENCILS TUBE WOODLAND,1,10/27/2011 17:15,2.46,,United Kingdom
573137,21012,ANTIQUE ALL GLASS CANDLESTICK,2,10/27/2011 17:15,2.46,,United Kingdom
573137,21065,BOOM BOX SPEAKER GIRLS,2,10/27/2011 17:15,4.13,,United Kingdom
573137,21071,VINTAGE BILLBOARD DRINK ME MUG,1,10/27/2011 17:15,2.46,,United Kingdom
573137,21107,CREAM SLICE FLANNEL PINK SPOT ,1,10/27/2011 17:15,5.79,,United Kingdom
573137,21125,SET 6 FOOTBALL CELEBRATION CANDLES,1,10/27/2011 17:15,1.25,,United Kingdom
573137,21147,JINGLE BELLS TREE DECORATION,1,10/27/2011 17:15,1.63,,United Kingdom
573137,21166,COOK WITH WINE METAL SIGN ,1,10/27/2011 17:15,4.13,,United Kingdom
573137,21207,SKULL AND CROSSBONES  GARLAND ,2,10/27/2011 17:15,1.63,,United Kingdom
573137,21213,PACK OF 72 SKULL CAKE CASES,1,10/27/2011 17:15,1.25,,United Kingdom
573137,21231,SWEETHEART CERAMIC TRINKET BOX,1,10/27/2011 17:15,2.46,,United Kingdom
573137,21232,STRAWBERRY CERAMIC TRINKET POT,1,10/27/2011 17:15,2.46,,United Kingdom
573137,21314,SMALL GLASS HEART TRINKET POT,1,10/27/2011 17:15,4.13,,United Kingdom
573137,21327,SKULLS WRITING SET ,1,10/27/2011 17:15,3.29,,United Kingdom
573137,21356,TOAST ITS - FAIRY FLOWER,1,10/27/2011 17:15,0.83,,United Kingdom
573137,21358,TOAST ITS - HAPPY BIRTHDAY,2,10/27/2011 17:15,0.83,,United Kingdom
573137,21383,PACK OF 12 STICKY BUNNIES,2,10/27/2011 17:15,1.25,,United Kingdom
573137,21402,RED  EGG  SPOON,1,10/27/2011 17:15,0.42,,United Kingdom
573137,21403,BLUE EGG  SPOON,1,10/27/2011 17:15,0.42,,United Kingdom
573137,21408,SPOTTY PINK DUCK DOORSTOP,1,10/27/2011 17:15,8.29,,United Kingdom
573137,21462,"NURSERY A,B,C PAINTED LETTERS",1,10/27/2011 17:15,13.29,,United Kingdom
573137,21479,WHITE SKULL HOT WATER BOTTLE ,2,10/27/2011 17:15,8.29,,United Kingdom
573137,21494,ROTATING LEAVES T-LIGHT HOLDER,2,10/27/2011 17:15,2.46,,United Kingdom
573137,21544,SKULLS  WATER TRANSFER TATTOOS ,1,10/27/2011 17:15,1.63,,United Kingdom
573137,21558,SKULL LUNCH BOX WITH CUTLERY ,1,10/27/2011 17:15,4.96,,United Kingdom
573137,21576,LETS GO SHOPPING COTTON TOTE BAG,1,10/27/2011 17:15,4.96,,United Kingdom
573137,21672,WHITE SPOT RED CERAMIC DRAWER KNOB,1,10/27/2011 17:15,3.29,,United Kingdom
573137,21719,LOVELY BONBON STICKER SHEET,1,10/27/2011 17:15,1.63,,United Kingdom
573137,21744,SNOWFLAKE PORTABLE TABLE LIGHT ,4,10/27/2011 17:15,2.46,,United Kingdom
573137,21754,HOME BUILDING BLOCK WORD,1,10/27/2011 17:15,11.63,,United Kingdom
573137,21774,DECORATIVE CATS BATHROOM BOTTLE,1,10/27/2011 17:15,2.46,,United Kingdom
573137,21822,GLITTER CHRISTMAS TREE WITH BELLS,1,10/27/2011 17:15,1.63,,United Kingdom
573137,21828,EIGHT PIECE SNAKE  SET,1,10/27/2011 17:15,2.46,,United Kingdom
573137,21833,CAMOUFLAGE LED TORCH,1,10/27/2011 17:15,3.29,,United Kingdom
573137,21843,RED RETROSPOT CAKE STAND,1,10/27/2011 17:15,20.79,,United Kingdom
573137,21872,GLAMOROUS  MUG,1,10/27/2011 17:15,3.29,,United Kingdom
573137,21877,HOME SWEET HOME MUG,1,10/27/2011 17:15,3.29,,United Kingdom
573137,21890,S/6 WOODEN SKITTLES IN COTTON BAG,1,10/27/2011 17:15,5.79,,United Kingdom
573137,21908,CHOCOLATE THIS WAY METAL SIGN,1,10/27/2011 17:15,4.13,,United Kingdom
573137,21914,BLUE HARMONICA IN BOX ,1,10/27/2011 17:15,2.46,,United Kingdom
