581452,22866,HAND WARMER SCOTTY DOG DESIGN,24,12/08/2011 18:03,2.1,17675,United Kingdom
581452,22867,HAND WARMER BIRD DESIGN,36,12/08/2011 18:03,2.1,17675,United Kingdom
581452,23356,LOVE HOT WATER BOTTLE,12,12/08/2011 18:03,5.95,17675,United Kingdom
581452,23439,HAND WARMER RED LOVE HEART,24,12/08/2011 18:03,2.1,17675,United Kingdom
581452,23497,CLASSIC CHROME BICYCLE BELL ,12,12/08/2011 18:03,1.45,17675,United Kingdom
581452,23576,SNACK TRAY RED VINTAGE DOILY,8,12/08/2011 18:03,1.95,17675,United Kingdom
581452,84029E,RED WOOLLY HOTTIE WHITE HEART.,8,12/08/2011 18:03,4.25,17675,United Kingdom
581452,85123A,WHITE HANGING HEART T-LIGHT HOLDER,32,12/08/2011 18:03,2.55,17675,United Kingdom
581453,21980,PACK OF 12 RED RETROSPOT TISSUES ,24,12/08/2011 18:15,0.39,16401,United Kingdom
581453,21982,PACK OF 12 SUKI TISSUES ,24,12/08/2011 18:15,0.39,16401,United Kingdom
581453,21984,PACK OF 12 PINK PAISLEY TISSUES ,24,12/08/2011 18:15,0.39,16401,United Kingdom
581453,21985,PACK OF 12 HEARTS DESIGN TISSUES ,24,12/08/2011 18:15,0.39,16401,United Kingdom
581453,22197,POPCORN HOLDER,100,12/08/2011 18:15,0.72,16401,United Kingdom
581453,22343,PARTY PIZZA DISH RED RETROSPOT,24,12/08/2011 18:15,0.19,16401,United Kingdom
581453,22344,PARTY PIZZA DISH PINK POLKADOT,24,12/08/2011 18:15,0.19,16401,United Kingdom
581453,22345,PARTY PIZZA DISH BLUE POLKADOT,24,12/08/2011 18:15,0.19,16401,United Kingdom
581453,22346,PARTY PIZZA DISH GREEN POLKADOT,24,12/08/2011 18:15,0.19,16401,United Kingdom
581453,22383,LUNCH BAG SUKI DESIGN ,10,12/08/2011 18:15,1.65,16401,United Kingdom
581453,22431,WATERING CAN BLUE ELEPHANT,6,12/08/2011 18:15,1.95,16401,United Kingdom
581453,22432,WATERING CAN PINK BUNNY,6,12/08/2011 18:15,1.95,16401,United Kingdom
581453,22433,WATERING CAN GREEN DINOSAUR,6,12/08/2011 18:15,1.95,16401,United Kingdom
581453,22555,PLASTERS IN TIN STRONGMAN,24,12/08/2011 18:15,1.65,16401,United Kingdom
581453,22556,PLASTERS IN TIN CIRCUS PARADE ,24,12/08/2011 18:15,1.65,16401,United Kingdom
581453,23293,SET OF 12 FAIRY CAKE BAKING CASES,16,12/08/2011 18:15,0.83,16401,United Kingdom
581453,23310,BUBBLEGUM RING ASSORTED,36,12/08/2011 18:15,0.42,16401,United Kingdom
581453,23551,PACK OF 12 PAISLEY PARK TISSUES ,24,12/08/2011 18:15,0.39,16401,United Kingdom
581453,23583,LUNCH BAG PAISLEY PARK  ,10,12/08/2011 18:15,1.65,16401,United Kingdom
581454,21890,S/6 WOODEN SKITTLES IN COTTON BAG,6,12/08/2011 18:22,3.25,15156,United Kingdom
581454,21791,VINTAGE HEADS AND TAILS CARD GAME ,12,12/08/2011 18:22,1.25,15156,United Kingdom
581454,21891,TRADITIONAL WOODEN SKIPPING ROPE,12,12/08/2011 18:22,1.45,15156,United Kingdom
581454,22605,WOODEN CROQUET GARDEN SET,3,12/08/2011 18:22,14.95,15156,United Kingdom
581454,22607,WOODEN ROUNDERS GARDEN SET ,4,12/08/2011 18:22,9.95,15156,United Kingdom
581454,22442,GROW YOUR OWN FLOWERS SET OF 3,12,12/08/2011 18:22,1.95,15156,United Kingdom
581454,22446,PIN CUSHION BABUSHKA PINK,12,12/08/2011 18:22,1.25,15156,United Kingdom
581454,22752,SET 7 BABUSHKA NESTING BOXES,12,12/08/2011 18:22,3.95,15156,United Kingdom
581454,23552,BICYCLE PUNCTURE REPAIR KIT ,6,12/08/2011 18:22,2.08,15156,United Kingdom
581454,23497,CLASSIC CHROME BICYCLE BELL ,12,12/08/2011 18:22,1.45,15156,United Kingdom
581455,22188,BLACK HEART CARD HOLDER,10,12/08/2011 18:25,2.31,18102,United Kingdom
581455,22189,CREAM HEART CARD HOLDER,10,12/08/2011 18:25,2.31,18102,United Kingdom
581455,82484,WOOD BLACK BOARD ANT WHITE FINISH,12,12/08/2011 18:25,4.8,18102,United Kingdom
581455,23133,LARGE IVORY HEART WALL ORGANISER,10,12/08/2011 18:25,7.05,18102,United Kingdom
581455,23553,LANDMARK FRAME CAMDEN TOWN ,10,12/08/2011 18:25,10.95,18102,United Kingdom
581455,23542,WALL ART 70'S ALPHABET ,12,12/08/2011 18:25,6.67,18102,United Kingdom
581455,23531,WALL ART BIG LOVE ,12,12/08/2011 18:25,4.76,18102,United Kingdom
581455,23530,WALL ART ONLY ONE PERSON ,18,12/08/2011 18:25,3.57,18102,United Kingdom
581455,23401,RUSTIC MIRROR WITH LACE HEART,18,12/08/2011 18:25,4.15,18102,United Kingdom
581455,23404,HOME SWEET HOME BLACKBOARD,10,12/08/2011 18:25,3.26,18102,United Kingdom
581455,23135,SMALL ZINC HEART WALL ORGANISER,18,12/08/2011 18:25,3.32,18102,United Kingdom
581456,23331,DECORATIVE WICKER HEART SMALL,6,12/08/2011 18:42,0.63,17530,United Kingdom
581456,23330,DECORATIVE WICKER HEART MEDIUM,1,12/08/2011 18:42,1.25,17530,United Kingdom
