573269,23212,HEART WREATH DECORATION WITH BELL,1,10/28/2011 13:00,1.25,16764,United Kingdom
573269,20682,RED RETROSPOT CHILDRENS UMBRELLA,1,10/28/2011 13:00,3.25,16764,United Kingdom
573269,85014A,BLACK/BLUE POLKADOT UMBRELLA,1,10/28/2011 13:00,5.95,16764,United Kingdom
573269,85014B,RED RETROSPOT UMBRELLA,4,10/28/2011 13:00,5.95,16764,United Kingdom
573269,20726,LUNCH BAG WOODLAND,1,10/28/2011 13:00,1.65,16764,United Kingdom
573269,20728,LUNCH BAG CARS BLUE,1,10/28/2011 13:00,1.65,16764,United Kingdom
573269,20725,LUNCH BAG RED RETROSPOT,1,10/28/2011 13:00,1.65,16764,United Kingdom
573269,22382,LUNCH BAG SPACEBOY DESIGN ,1,10/28/2011 13:00,1.65,16764,United Kingdom
573269,22662,LUNCH BAG DOLLY GIRL DESIGN,1,10/28/2011 13:00,1.65,16764,United Kingdom
573269,22383,LUNCH BAG SUKI DESIGN ,1,10/28/2011 13:00,1.65,16764,United Kingdom
573269,21931,JUMBO STORAGE BAG SUKI,1,10/28/2011 13:00,2.08,16764,United Kingdom
573269,22380,TOY TIDY SPACEBOY  ,1,10/28/2011 13:00,2.1,16764,United Kingdom
573269,85099B,JUMBO BAG RED RETROSPOT,1,10/28/2011 13:00,2.08,16764,United Kingdom
573269,22689,DOORMAT MERRY CHRISTMAS RED ,1,10/28/2011 13:00,8.25,16764,United Kingdom
573269,48173C,DOORMAT BLACK FLOCK ,1,10/28/2011 13:00,8.25,16764,United Kingdom
573269,20718,RED RETROSPOT SHOPPER BAG,1,10/28/2011 13:00,1.25,16764,United Kingdom
573269,20717,STRAWBERRY SHOPPER BAG,2,10/28/2011 13:00,1.25,16764,United Kingdom
573269,22621,TRADITIONAL KNITTING NANCY,1,10/28/2011 13:00,1.65,16764,United Kingdom
573269,21914,BLUE HARMONICA IN BOX ,1,10/28/2011 13:00,1.25,16764,United Kingdom
573269,21915,RED  HARMONICA IN BOX ,1,10/28/2011 13:00,1.25,16764,United Kingdom
573269,47504K,ENGLISH ROSE GARDEN SECATEURS,3,10/28/2011 13:00,0.79,16764,United Kingdom
573269,23322,LARGE WHITE HEART OF WICKER,1,10/28/2011 13:00,2.95,16764,United Kingdom
573269,22139,RETROSPOT TEA SET CERAMIC 11 PC ,1,10/28/2011 13:00,4.95,16764,United Kingdom
573269,82494L,WOODEN FRAME ANTIQUE WHITE ,6,10/28/2011 13:00,2.95,16764,United Kingdom
573269,21733,RED HANGING HEART T-LIGHT HOLDER,2,10/28/2011 13:00,2.95,16764,United Kingdom
573269,21899,GARAGE KEY FOB,1,10/28/2011 13:00,0.65,16764,United Kingdom
573269,35970,ZINC FOLKART SLEIGH BELLS,2,10/28/2011 13:00,1.69,16764,United Kingdom
573269,23321,SMALL WHITE HEART OF WICKER,4,10/28/2011 13:00,1.65,16764,United Kingdom
573269,22601,CHRISTMAS RETROSPOT ANGEL WOOD,2,10/28/2011 13:00,0.85,16764,United Kingdom
573269,22602,RETROSPOT WOODEN HEART DECORATION,2,10/28/2011 13:00,0.85,16764,United Kingdom
573269,22603,CHRISTMAS RETROSPOT TREE WOOD,2,10/28/2011 13:00,0.85,16764,United Kingdom
573269,22600,CHRISTMAS RETROSPOT STAR WOOD,2,10/28/2011 13:00,0.85,16764,United Kingdom
573269,22594,CHRISTMAS GINGHAM TREE,2,10/28/2011 13:00,0.85,16764,United Kingdom
573269,22593,CHRISTMAS GINGHAM STAR,2,10/28/2011 13:00,0.85,16764,United Kingdom
573269,22595,GINGHAM HEART DECORATION,2,10/28/2011 13:00,0.85,16764,United Kingdom
573269,23212,HEART WREATH DECORATION WITH BELL,1,10/28/2011 13:00,1.25,16764,United Kingdom
573269,22578,WOODEN STAR CHRISTMAS SCANDINAVIAN,2,10/28/2011 13:00,0.29,16764,United Kingdom
573269,22579,WOODEN TREE CHRISTMAS SCANDINAVIAN,2,10/28/2011 13:00,0.29,16764,United Kingdom
573269,22577,WOODEN HEART CHRISTMAS SCANDINAVIAN,2,10/28/2011 13:00,0.29,16764,United Kingdom
573269,23210,WHITE ROCKING HORSE HAND PAINTED,2,10/28/2011 13:00,1.25,16764,United Kingdom
573269,23211,RED ROCKING HORSE HAND PAINTED,2,10/28/2011 13:00,1.25,16764,United Kingdom
573269,22581,WOOD STOCKING CHRISTMAS SCANDISPOT,2,10/28/2011 13:00,0.85,16764,United Kingdom
573269,23213,STAR WREATH DECORATION WITH BELL,2,10/28/2011 13:00,1.25,16764,United Kingdom
573269,84347,ROTATING SILVER ANGELS T-LIGHT HLDR,2,10/28/2011 13:00,2.55,16764,United Kingdom
573269,22121,NOEL WOODEN BLOCK LETTERS ,1,10/28/2011 13:00,5.95,16764,United Kingdom
573269,22119,PEACE WOODEN BLOCK LETTERS,1,10/28/2011 13:00,6.95,16764,United Kingdom
573269,22617,BAKING SET SPACEBOY DESIGN,1,10/28/2011 13:00,4.95,16764,United Kingdom
573269,22634,CHILDS BREAKFAST SET SPACEBOY ,1,10/28/2011 13:00,9.95,16764,United Kingdom
573269,22635,CHILDS BREAKFAST SET DOLLY GIRL ,1,10/28/2011 13:00,9.95,16764,United Kingdom
573269,23346,SPACEBOY BEAKER,2,10/28/2011 13:00,1.25,16764,United Kingdom
