570818,23190,BUNDLE OF 3 SCHOOL EXERCISE BOOKS  ,1,10/12/2011 12:47,1.65,17841,United Kingdom
570818,21212,PACK OF 72 RETROSPOT CAKE CASES,1,10/12/2011 12:47,0.55,17841,United Kingdom
570818,21669,BLUE STRIPE CERAMIC DRAWER KNOB,4,10/12/2011 12:47,1.45,17841,United Kingdom
570818,22134,MINI LADLE LOVE HEART RED ,1,10/12/2011 12:47,0.42,17841,United Kingdom
570818,22570,FELTCRAFT CUSHION RABBIT,2,10/12/2011 12:47,3.75,17841,United Kingdom
570818,22981,PANTRY APPLE CORER,1,10/12/2011 12:47,1.45,17841,United Kingdom
570818,23399,HOME SWEET HOME HANGING HEART,2,10/12/2011 12:47,0.85,17841,United Kingdom
570818,85014B,RED RETROSPOT UMBRELLA,1,10/12/2011 12:47,5.95,17841,United Kingdom
570818,21559,STRAWBERRY LUNCH BOX WITH CUTLERY,1,10/12/2011 12:47,2.55,17841,United Kingdom
570818,23165,LARGE CERAMIC TOP STORAGE JAR,1,10/12/2011 12:47,1.65,17841,United Kingdom
570818,22726,ALARM CLOCK BAKELIKE GREEN,1,10/12/2011 12:47,3.75,17841,United Kingdom
570818,21975,PACK OF 60 DINOSAUR CAKE CASES,2,10/12/2011 12:47,0.55,17841,United Kingdom
570818,21218,RED SPOTTY BISCUIT TIN,1,10/12/2011 12:47,3.75,17841,United Kingdom
570818,21906,PHARMACIE FIRST AID TIN,1,10/12/2011 12:47,6.75,17841,United Kingdom
570818,22663,JUMBO BAG DOLLY GIRL DESIGN,2,10/12/2011 12:47,2.08,17841,United Kingdom
570818,21928,JUMBO BAG SCANDINAVIAN BLUE PAISLEY,1,10/12/2011 12:47,2.08,17841,United Kingdom
570818,20711,JUMBO BAG TOYS ,1,10/12/2011 12:47,2.08,17841,United Kingdom
570818,22597,MUSICAL ZINC HEART DECORATION ,1,10/12/2011 12:47,0.29,17841,United Kingdom
570818,23148,MINIATURE ANTIQUE ROSE HOOK IVORY,2,10/12/2011 12:47,0.83,17841,United Kingdom
570818,47421,ASSORTED COLOUR LIZARD SUCTION HOOK,3,10/12/2011 12:47,0.42,17841,United Kingdom
570818,82581,TOILET METAL SIGN,1,10/12/2011 12:47,0.55,17841,United Kingdom
570818,82580,BATHROOM METAL SIGN,1,10/12/2011 12:47,0.55,17841,United Kingdom
570818,21380,WOODEN HAPPY BIRTHDAY GARLAND,1,10/12/2011 12:47,2.95,17841,United Kingdom
570818,21684,SMALL MEDINA STAMPED METAL BOWL ,1,10/12/2011 12:47,0.85,17841,United Kingdom
570818,21164,HOME SWEET HOME METAL SIGN ,2,10/12/2011 12:47,2.95,17841,United Kingdom
570818,21462,"NURSERY A,B,C PAINTED LETTERS",1,10/12/2011 12:47,6.75,17841,United Kingdom
570818,20668,DISCO BALL CHRISTMAS DECORATION,48,10/12/2011 12:47,0.12,17841,United Kingdom
570818,85071A,BLUE CHARLIE+LOLA PERSONAL DOORSIGN,1,10/12/2011 12:47,0.39,17841,United Kingdom
570818,85071B,RED CHARLIE+LOLA PERSONAL DOORSIGN,1,10/12/2011 12:47,0.39,17841,United Kingdom
570818,85071C,"CHARLIE+LOLA""EXTREMELY BUSY"" SIGN",1,10/12/2011 12:47,0.39,17841,United Kingdom
570818,85071D,CHARLIE+LOLA MY ROOM DOOR SIGN,1,10/12/2011 12:47,0.39,17841,United Kingdom
570818,22844,VINTAGE CREAM DOG FOOD CONTAINER,1,10/12/2011 12:47,8.5,17841,United Kingdom
570818,23427,STOOL HOME SWEET HOME ,1,10/12/2011 12:47,12.5,17841,United Kingdom
570818,23393,HOME SWEET HOME CUSHION COVER ,1,10/12/2011 12:47,3.75,17841,United Kingdom
570818,23395,BELLE JARDINIERE CUSHION COVER,2,10/12/2011 12:47,3.75,17841,United Kingdom
570818,23396,LE JARDIN BOTANIQUE CUSHION COVER,1,10/12/2011 12:47,3.75,17841,United Kingdom
570818,23394,POSTE FRANCE CUSHION COVER,1,10/12/2011 12:47,3.75,17841,United Kingdom
570818,23348,CHILDRENS TOY COOKING UTENSIL SET,1,10/12/2011 12:47,2.08,17841,United Kingdom
570818,22139,RETROSPOT TEA SET CERAMIC 11 PC ,1,10/12/2011 12:47,4.95,17841,United Kingdom
570818,22796,PHOTO FRAME 3 CLASSIC HANGING,1,10/12/2011 12:47,9.95,17841,United Kingdom
570818,22090,PAPER BUNTING RETROSPOT,5,10/12/2011 12:47,2.95,17841,United Kingdom
570818,22176,BLUE OWL SOFT TOY,1,10/12/2011 12:47,2.95,17841,United Kingdom
570818,79321,CHILLI LIGHTS,10,10/12/2011 12:47,5.75,17841,United Kingdom
570818,22175,PINK OWL SOFT TOY,1,10/12/2011 12:47,2.95,17841,United Kingdom
570818,22579,WOODEN TREE CHRISTMAS SCANDINAVIAN,6,10/12/2011 12:47,0.29,17841,United Kingdom
570818,23263,SET OF 3 WOODEN HEART DECORATIONS,4,10/12/2011 12:47,1.25,17841,United Kingdom
570818,22574,HEART WOODEN CHRISTMAS DECORATION,1,10/12/2011 12:47,0.85,17841,United Kingdom
570818,23210,WHITE ROCKING HORSE HAND PAINTED,2,10/12/2011 12:47,1.25,17841,United Kingdom
570818,22573,STAR WOODEN CHRISTMAS DECORATION,2,10/12/2011 12:47,0.85,17841,United Kingdom
570818,23266,SET OF 3 WOODEN STOCKING DECORATION,4,10/12/2011 12:47,1.25,17841,United Kingdom
