573269,23345, DOLLY GIRL BEAKER,3,10/28/2011 13:00,1.25,16764,United Kingdom
573269,22138,BAKING SET 9 PIECE RETROSPOT ,2,10/28/2011 13:00,4.95,16764,United Kingdom
573269,22899,CHILDREN'S APRON DOLLY GIRL ,2,10/28/2011 13:00,2.1,16764,United Kingdom
573269,20914,SET/5 RED RETROSPOT LID GLASS BOWLS,2,10/28/2011 13:00,2.95,16764,United Kingdom
573269,22629,SPACEBOY LUNCH BOX ,3,10/28/2011 13:00,1.95,16764,United Kingdom
573269,22630,DOLLY GIRL LUNCH BOX,3,10/28/2011 13:00,1.95,16764,United Kingdom
573269,23581,JUMBO BAG PAISLEY PARK,1,10/28/2011 13:00,2.08,16764,United Kingdom
573269,23343,JUMBO BAG VINTAGE CHRISTMAS ,3,10/28/2011 13:00,2.08,16764,United Kingdom
573269,23344,JUMBO BAG 50'S CHRISTMAS ,2,10/28/2011 13:00,2.08,16764,United Kingdom
573269,23389,SPACEBOY MINI BACKPACK,2,10/28/2011 13:00,4.15,16764,United Kingdom
573269,23390,DOLLY GIRL MINI BACKPACK,1,10/28/2011 13:00,4.15,16764,United Kingdom
573270,22161,HEART DECORATION RUSTIC HANGING ,24,10/28/2011 13:00,0.19,17418,United Kingdom
573270,22577,WOODEN HEART CHRISTMAS SCANDINAVIAN,24,10/28/2011 13:00,0.29,17418,United Kingdom
573270,35967,FOLK ART METAL STAR T-LIGHT HOLDER,12,10/28/2011 13:00,0.38,17418,United Kingdom
573270,85123A,WHITE HANGING HEART T-LIGHT HOLDER,6,10/28/2011 13:00,2.95,17418,United Kingdom
573270,23382,BOX OF 6 CHRISTMAS CAKE DECORATIONS,4,10/28/2011 13:00,3.75,17418,United Kingdom
573270,85048,15CM CHRISTMAS GLASS BALL 20 LIGHTS,2,10/28/2011 13:00,7.95,17418,United Kingdom
573270,22632,HAND WARMER RED RETROSPOT,12,10/28/2011 13:00,2.1,17418,United Kingdom
573270,85135C,RED DRAGONFLY HELICOPTER,4,10/28/2011 13:00,7.95,17418,United Kingdom
573270,23080,RED METAL BOX TOP SECRET,4,10/28/2011 13:00,8.25,17418,United Kingdom
573270,23081,GREEN METAL BOX ARMY SUPPLIES,4,10/28/2011 13:00,8.25,17418,United Kingdom
573270,22617,BAKING SET SPACEBOY DESIGN,3,10/28/2011 13:00,4.95,17418,United Kingdom
573270,22139,RETROSPOT TEA SET CERAMIC 11 PC ,3,10/28/2011 13:00,4.95,17418,United Kingdom
573270,23205,CHARLOTTE BAG VINTAGE ALPHABET ,10,10/28/2011 13:00,0.85,17418,United Kingdom
573270,23293,SET OF 12 FAIRY CAKE BAKING CASES,8,10/28/2011 13:00,0.83,17418,United Kingdom
573270,85099B,JUMBO BAG RED RETROSPOT,10,10/28/2011 13:00,2.08,17418,United Kingdom
573270,16225,RATTLE SNAKE EGGS,12,10/28/2011 13:00,1.25,17418,United Kingdom
573270,23132,SMALL IVORY HEART WALL ORGANISER,3,10/28/2011 13:00,5.75,17418,United Kingdom
573270,22380,TOY TIDY SPACEBOY  ,5,10/28/2011 13:00,2.1,17418,United Kingdom
C573271,21264,WHITE GOOSE FEATHER TREE 60CM ,-2,10/28/2011 13:00,1.95,14606,United Kingdom
573272,23084,RABBIT NIGHT LIGHT,144,10/28/2011 13:02,1.79,13102,United Kingdom
573272,22558,CLOTHES PEGS RETROSPOT PACK 24 ,12,10/28/2011 13:02,1.65,13102,United Kingdom
573272,22993,SET OF 4 PANTRY JELLY MOULDS,12,10/28/2011 13:02,1.25,13102,United Kingdom
573272,22616,PACK OF 12 LONDON TISSUES ,24,10/28/2011 13:02,0.39,13102,United Kingdom
573272,22629,SPACEBOY LUNCH BOX ,12,10/28/2011 13:02,1.95,13102,United Kingdom
573272,22197,POPCORN HOLDER,48,10/28/2011 13:02,0.85,13102,United Kingdom
573273,23497,CLASSIC CHROME BICYCLE BELL ,36,10/28/2011 13:04,1.45,12678,France
573274,22383,LUNCH BAG SUKI DESIGN ,10,10/28/2011 13:10,4.96,,United Kingdom
573274,22645,CERAMIC HEART FAIRY CAKE MONEY BANK,3,10/28/2011 13:10,4.13,,United Kingdom
573274,22665,RECIPE BOX BLUE SKETCHBOOK DESIGN,2,10/28/2011 13:10,6.63,,United Kingdom
573274,22725,ALARM CLOCK BAKELIKE CHOCOLATE,1,10/28/2011 13:10,8.29,,United Kingdom
573274,22726,ALARM CLOCK BAKELIKE GREEN,14,10/28/2011 13:10,8.29,,United Kingdom
573274,22727,ALARM CLOCK BAKELIKE RED ,3,10/28/2011 13:10,8.29,,United Kingdom
573274,22729,ALARM CLOCK BAKELIKE ORANGE,1,10/28/2011 13:10,8.29,,United Kingdom
573274,22731,3D CHRISTMAS STAMPS STICKERS ,5,10/28/2011 13:10,1.63,,United Kingdom
573274,22733,3D TRADITIONAL CHRISTMAS STICKERS,5,10/28/2011 13:10,1.63,,United Kingdom
573274,22735,RIBBON REEL SOCKS AND MITTENS,1,10/28/2011 13:10,4.13,,United Kingdom
573274,22736,RIBBON REEL MAKING SNOWMEN ,2,10/28/2011 13:10,4.13,,United Kingdom
573274,22737,RIBBON REEL CHRISTMAS PRESENT ,3,10/28/2011 13:10,4.13,,United Kingdom
573274,22738,RIBBON REEL SNOWY VILLAGE,2,10/28/2011 13:10,4.13,,United Kingdom
