581492,22457,NATURAL SLATE HEART CHALKBOARD ,1,12/09/2011 10:03,5.79,,United Kingdom
581492,22464,HANGING METAL HEART LANTERN,1,12/09/2011 10:03,3.29,,United Kingdom
581492,22466,FAIRY TALE COTTAGE NIGHT LIGHT,1,12/09/2011 10:03,4.13,,United Kingdom
581492,22467,GUMBALL COAT RACK,1,12/09/2011 10:03,4.96,,United Kingdom
581492,22478,BIRDHOUSE GARDEN MARKER ,1,12/09/2011 10:03,2.46,,United Kingdom
581492,22486,PLASMATRONIC LAMP,1,12/09/2011 10:03,8.29,,United Kingdom
581492,22488,NATURAL SLATE RECTANGLE CHALKBOARD,1,12/09/2011 10:03,3.29,,United Kingdom
581492,22489,PACK OF 12 TRADITIONAL CRAYONS,5,12/09/2011 10:03,0.83,,United Kingdom
581492,22495,SET OF 2 ROUND TINS CAMEMBERT ,1,12/09/2011 10:03,5.79,,United Kingdom
581492,22540,MINI JIGSAW CIRCUS PARADE ,1,12/09/2011 10:03,0.83,,United Kingdom
581492,22544,MINI JIGSAW SPACEBOY,1,12/09/2011 10:03,0.83,,United Kingdom
581492,22549,PICTURE DOMINOES,3,12/09/2011 10:03,3.29,,United Kingdom
581492,22551,PLASTERS IN TIN SPACEBOY,2,12/09/2011 10:03,3.29,,United Kingdom
581492,22553,PLASTERS IN TIN SKULLS,2,12/09/2011 10:03,3.29,,United Kingdom
581492,22554,PLASTERS IN TIN WOODLAND ANIMALS,3,12/09/2011 10:03,3.29,,United Kingdom
581492,22555,PLASTERS IN TIN STRONGMAN,3,12/09/2011 10:03,3.29,,United Kingdom
581492,22557,PLASTERS IN TIN VINTAGE PAISLEY ,2,12/09/2011 10:03,3.29,,United Kingdom
581492,22558,CLOTHES PEGS RETROSPOT PACK 24 ,3,12/09/2011 10:03,3.29,,United Kingdom
581492,22560,TRADITIONAL MODELLING CLAY,5,12/09/2011 10:03,2.46,,United Kingdom
581492,22565,FELTCRAFT HAIRBANDS PINK AND WHITE ,4,12/09/2011 10:03,1.63,,United Kingdom
581492,22566,FELTCRAFT HAIRBAND PINK AND PURPLE,3,12/09/2011 10:03,1.63,,United Kingdom
581492,22571,ROCKING HORSE RED CHRISTMAS ,4,12/09/2011 10:03,1.63,,United Kingdom
581492,22573,STAR WOODEN CHRISTMAS DECORATION,2,12/09/2011 10:03,1.63,,United Kingdom
581492,22574,HEART WOODEN CHRISTMAS DECORATION,5,12/09/2011 10:03,1.63,,United Kingdom
581492,22576,SWALLOW WOODEN CHRISTMAS DECORATION,3,12/09/2011 10:03,1.63,,United Kingdom
581492,22577,WOODEN HEART CHRISTMAS SCANDINAVIAN,4,12/09/2011 10:03,0.83,,United Kingdom
581492,22578,WOODEN STAR CHRISTMAS SCANDINAVIAN,19,12/09/2011 10:03,0.83,,United Kingdom
581492,22580,ADVENT CALENDAR GINGHAM SACK,9,12/09/2011 10:03,4.13,,United Kingdom
581492,22581,WOOD STOCKING CHRISTMAS SCANDISPOT,11,12/09/2011 10:03,0.83,,United Kingdom
581492,22585,PACK OF 6 BIRDY GIFT TAGS,2,12/09/2011 10:03,2.46,,United Kingdom
581492,22586,FELTCRAFT HAIRBAND PINK AND BLUE,2,12/09/2011 10:03,1.63,,United Kingdom
581492,22589,CARDHOLDER GINGHAM STAR,6,12/09/2011 10:03,4.96,,United Kingdom
581492,22591,CARDHOLDER GINGHAM CHRISTMAS TREE,1,12/09/2011 10:03,6.63,,United Kingdom
581492,22592,CARDHOLDER HOLLY WREATH METAL,3,12/09/2011 10:03,7.46,,United Kingdom
581492,22593,CHRISTMAS GINGHAM STAR,2,12/09/2011 10:03,1.63,,United Kingdom
581492,22594,CHRISTMAS GINGHAM TREE,3,12/09/2011 10:03,1.63,,United Kingdom
581492,22597,MUSICAL ZINC HEART DECORATION ,9,12/09/2011 10:03,0.83,,United Kingdom
581492,22598,CHRISTMAS MUSICAL ZINC TREE,4,12/09/2011 10:03,0.83,,United Kingdom
581492,22599,CHRISTMAS MUSICAL ZINC STAR,5,12/09/2011 10:03,0.83,,United Kingdom
581492,22600,CHRISTMAS RETROSPOT STAR WOOD,2,12/09/2011 10:03,1.63,,United Kingdom
581492,22601,CHRISTMAS RETROSPOT ANGEL WOOD,3,12/09/2011 10:03,1.63,,United Kingdom
581492,22602,RETROSPOT WOODEN HEART DECORATION,3,12/09/2011 10:03,1.63,,United Kingdom
581492,22608,PENS ASSORTED FUNKY JEWELED ,3,12/09/2011 10:03,0.42,,United Kingdom
581492,22614,PACK OF 12 SPACEBOY TISSUES,1,12/09/2011 10:03,0.83,,United Kingdom
581492,22615,PACK OF 12 CIRCUS PARADE TISSUES ,4,12/09/2011 10:03,0.83,,United Kingdom
581492,22616,PACK OF 12 LONDON TISSUES ,1,12/09/2011 10:03,0.83,,United Kingdom
581492,22619,SET OF 6 SOLDIER SKITTLES,4,12/09/2011 10:03,7.46,,United Kingdom
581492,22620,4 TRADITIONAL SPINNING TOPS,3,12/09/2011 10:03,2.46,,United Kingdom
581492,22621,TRADITIONAL KNITTING NANCY,2,12/09/2011 10:03,3.29,,United Kingdom
581492,22629,SPACEBOY LUNCH BOX ,1,12/09/2011 10:03,4.13,,United Kingdom
