581405,21592,RETROSPOT CIGAR BOX MATCHES ,4,12/08/2011 13:50,0.39,13521,United Kingdom
581405,84692,BOX OF 24 COCKTAIL PARASOLS,1,12/08/2011 13:50,0.42,13521,United Kingdom
581405,35970,ZINC FOLKART SLEIGH BELLS,1,12/08/2011 13:50,1.69,13521,United Kingdom
581405,22642,SET OF 4 NAPKIN CHARMS STARS   ,2,12/08/2011 13:50,0.79,13521,United Kingdom
581405,22343,PARTY PIZZA DISH RED RETROSPOT,1,12/08/2011 13:50,0.19,13521,United Kingdom
581405,22196,SMALL HEART MEASURING SPOONS,3,12/08/2011 13:50,0.85,13521,United Kingdom
581405,21563,RED HEART SHAPE LOVE BUCKET ,2,12/08/2011 13:50,0.79,13521,United Kingdom
581405,22195,LARGE HEART MEASURING SPOONS,2,12/08/2011 13:50,1.65,13521,United Kingdom
581405,21530,DAIRY MAID TOASTRACK,1,12/08/2011 13:50,0.79,13521,United Kingdom
581405,21977,PACK OF 60 PINK PAISLEY CAKE CASES,2,12/08/2011 13:50,0.55,13521,United Kingdom
581405,23123,COCKTAIL SWORDS 50 PIECES,1,12/08/2011 13:50,0.83,13521,United Kingdom
581405,20868,SILVER FABRIC MIRROR,1,12/08/2011 13:50,0.39,13521,United Kingdom
581405,21715,GIRLS VINTAGE TIN SEASIDE BUCKET,2,12/08/2011 13:50,2.55,13521,United Kingdom
581405,22638,SET OF 4 NAPKIN CHARMS CROWNS ,2,12/08/2011 13:50,0.79,13521,United Kingdom
581405,22643,SET OF 4 NAPKIN CHARMS LEAVES   ,2,12/08/2011 13:50,0.79,13521,United Kingdom
581405,23212,HEART WREATH DECORATION WITH BELL,1,12/08/2011 13:50,1.25,13521,United Kingdom
581405,21162,TOXIC AREA  DOOR HANGER ,1,12/08/2011 13:50,0.39,13521,United Kingdom
581405,23281,FOLDING BUTTERFLY MIRROR RED  ,2,12/08/2011 13:50,0.83,13521,United Kingdom
581405,23382,BOX OF 6 CHRISTMAS CAKE DECORATIONS,1,12/08/2011 13:50,3.75,13521,United Kingdom
581405,23100,SILVER BELLS TABLE DECORATION,2,12/08/2011 13:50,1.25,13521,United Kingdom
581405,21819,GLITTER CHRISTMAS STAR ,4,12/08/2011 13:50,0.39,13521,United Kingdom
581405,21810,CHRISTMAS HANGING STAR WITH BELL,1,12/08/2011 13:50,0.39,13521,United Kingdom
581405,23212,HEART WREATH DECORATION WITH BELL,1,12/08/2011 13:50,1.25,13521,United Kingdom
581405,23215,JINGLE BELL HEART ANTIQUE SILVER,2,12/08/2011 13:50,2.08,13521,United Kingdom
581405,21810,CHRISTMAS HANGING STAR WITH BELL,3,12/08/2011 13:50,0.39,13521,United Kingdom
581405,21808,"CHRISTMAS GARLAND STARS,TREES",2,12/08/2011 13:50,1.25,13521,United Kingdom
581405,21803,CHRISTMAS TREE STAR DECORATION,4,12/08/2011 13:50,0.42,13521,United Kingdom
581405,22955,36 FOIL STAR CAKE CASES ,4,12/08/2011 13:50,0.79,13521,United Kingdom
581405,22956,36 FOIL HEART CAKE CASES,2,12/08/2011 13:50,0.79,13521,United Kingdom
581405,23320,GIANT 50'S CHRISTMAS CRACKER,2,12/08/2011 13:50,1.25,13521,United Kingdom
581405,22094,RED RETROSPOT TISSUE BOX,4,12/08/2011 13:50,0.39,13521,United Kingdom
581405,22942,CHRISTMAS LIGHTS 10 SANTAS ,1,12/08/2011 13:50,2.95,13521,United Kingdom
581406,46000M,POLYESTER FILLER PAD 45x45cm,240,12/08/2011 13:58,0,,United Kingdom
581406,46000S,POLYESTER FILLER PAD 40x40cm,300,12/08/2011 13:58,0,,United Kingdom
581407,23227,FILIGREE HEART BUTTERFLY WHITE ,4,12/08/2011 13:59,1.25,13263,United Kingdom
581407,21877,HOME SWEET HOME MUG,1,12/08/2011 13:59,1.65,13263,United Kingdom
581407,21873,IF YOU CAN'T STAND THE HEAT MUG,1,12/08/2011 13:59,1.25,13263,United Kingdom
581407,21872,GLAMOROUS  MUG,1,12/08/2011 13:59,1.25,13263,United Kingdom
581407,21068,VINTAGE BILLBOARD LOVE/HATE MUG,3,12/08/2011 13:59,1.25,13263,United Kingdom
581407,22113,GREY HEART HOT WATER BOTTLE,1,12/08/2011 13:59,4.25,13263,United Kingdom
581407,21481,FAWN BLUE HOT WATER BOTTLE,1,12/08/2011 13:59,3.75,13263,United Kingdom
581407,23358,HOT STUFF HOT WATER BOTTLE,4,12/08/2011 13:59,1.25,13263,United Kingdom
581407,22805,BLUE DRAWER KNOB ACRYLIC EDWARDIAN,1,12/08/2011 13:59,1.25,13263,United Kingdom
581407,22577,WOODEN HEART CHRISTMAS SCANDINAVIAN,1,12/08/2011 13:59,0.29,13263,United Kingdom
581407,22581,WOOD STOCKING CHRISTMAS SCANDISPOT,26,12/08/2011 13:59,0.29,13263,United Kingdom
581407,21810,CHRISTMAS HANGING STAR WITH BELL,5,12/08/2011 13:59,0.39,13263,United Kingdom
581407,21809,CHRISTMAS HANGING TREE WITH BELL,5,12/08/2011 13:59,0.39,13263,United Kingdom
581407,23223,CHRISTMAS TREE HANGING SILVER ,2,12/08/2011 13:59,0.83,13263,United Kingdom
581407,23222,CHRISTMAS TREE HANGING GOLD,2,12/08/2011 13:59,0.83,13263,United Kingdom
581407,23266,SET OF 3 WOODEN STOCKING DECORATION,2,12/08/2011 13:59,1.25,13263,United Kingdom
