573125,23170,REGENCY TEA PLATE ROSES ,12,10/27/2011 16:31,1.65,16855,United Kingdom
573125,23172,REGENCY TEA PLATE PINK,12,10/27/2011 16:31,1.65,16855,United Kingdom
573125,23171,REGENCY TEA PLATE GREEN ,12,10/27/2011 16:31,1.65,16855,United Kingdom
573125,22468,BABUSHKA LIGHTS STRING OF 10,2,10/27/2011 16:31,6.75,16855,United Kingdom
573125,22754,SMALL RED BABUSHKA NOTEBOOK ,12,10/27/2011 16:31,0.85,16855,United Kingdom
573125,22698,PINK REGENCY TEACUP AND SAUCER,6,10/27/2011 16:31,2.95,16855,United Kingdom
573125,22699,ROSES REGENCY TEACUP AND SAUCER ,6,10/27/2011 16:31,2.95,16855,United Kingdom
573125,22697,GREEN REGENCY TEACUP AND SAUCER,6,10/27/2011 16:31,2.95,16855,United Kingdom
573126,47590B,PINK HAPPY BIRTHDAY BUNTING,3,10/27/2011 16:32,5.45,15738,United Kingdom
573126,21094,SET/6 RED SPOTTY PAPER PLATES,12,10/27/2011 16:32,0.85,15738,United Kingdom
573126,22090,PAPER BUNTING RETROSPOT,12,10/27/2011 16:32,2.95,15738,United Kingdom
573126,21086,SET/6 RED SPOTTY PAPER CUPS,12,10/27/2011 16:32,0.65,15738,United Kingdom
573126,21746,SMALL RED RETROSPOT WINDMILL,12,10/27/2011 16:32,1.25,15738,United Kingdom
573126,21206,STRAWBERRY HONEYCOMB  GARLAND ,12,10/27/2011 16:32,1.65,15738,United Kingdom
573126,21212,PACK OF 72 RETROSPOT CAKE CASES,24,10/27/2011 16:32,0.55,15738,United Kingdom
573126,21238,RED RETROSPOT CUP,16,10/27/2011 16:32,0.85,15738,United Kingdom
573126,20983,12 PENCILS TALL TUBE RED RETROSPOT,12,10/27/2011 16:32,0.85,15738,United Kingdom
573126,21240,BLUE POLKADOT CUP,16,10/27/2011 16:32,0.85,15738,United Kingdom
573126,22333,RETROSPOT PARTY BAG + STICKER SET,16,10/27/2011 16:32,1.65,15738,United Kingdom
573126,84997C,CHILDRENS CUTLERY POLKADOT BLUE,8,10/27/2011 16:32,4.15,15738,United Kingdom
573126,20675,BLUE POLKADOT BOWL,16,10/27/2011 16:32,1.25,15738,United Kingdom
573126,47599B,BLUE PARTY BAGS ,18,10/27/2011 16:32,2.1,15738,United Kingdom
573126,47599A,PINK PARTY BAGS,30,10/27/2011 16:32,2.1,15738,United Kingdom
573128,22689,DOORMAT MERRY CHRISTMAS RED ,6,10/27/2011 16:34,8.25,13538,United Kingdom
573128,22692,DOORMAT WELCOME TO OUR HOME,6,10/27/2011 16:34,8.25,13538,United Kingdom
573128,48187,DOORMAT NEW ENGLAND,10,10/27/2011 16:34,7.08,13538,United Kingdom
573128,21524,DOORMAT SPOTTY HOME SWEET HOME,10,10/27/2011 16:34,7.08,13538,United Kingdom
573128,23284,DOORMAT KEEP CALM AND COME IN,6,10/27/2011 16:34,8.25,13538,United Kingdom
573129,79321,CHILLI LIGHTS,24,10/27/2011 16:35,4.95,13147,United Kingdom
573130,23054,RECYCLED ACAPULCO MAT LAVENDER,1,10/27/2011 16:41,8.25,13969,United Kingdom
573130,23049,RECYCLED ACAPULCO MAT RED,1,10/27/2011 16:41,8.25,13969,United Kingdom
573130,23052,RECYCLED ACAPULCO MAT TURQUOISE,1,10/27/2011 16:41,8.25,13969,United Kingdom
573130,23050,RECYCLED ACAPULCO MAT GREEN,1,10/27/2011 16:41,8.25,13969,United Kingdom
573130,23051,RECYCLED ACAPULCO MAT BLUE,1,10/27/2011 16:41,8.25,13969,United Kingdom
573130,23053,RECYCLED ACAPULCO MAT PINK,1,10/27/2011 16:41,8.25,13969,United Kingdom
573130,22187,GREEN CHRISTMAS TREE CARD HOLDER,12,10/27/2011 16:41,1.95,13969,United Kingdom
573130,23534,WALL ART STOP FOR TEA ,3,10/27/2011 16:41,5.95,13969,United Kingdom
573130,23542,WALL ART 70'S ALPHABET ,2,10/27/2011 16:41,8.25,13969,United Kingdom
573130,23533,WALL ART GARDEN HAVEN ,3,10/27/2011 16:41,5.95,13969,United Kingdom
573130,23569,TRADTIONAL ALPHABET STAMP SET,6,10/27/2011 16:41,4.95,13969,United Kingdom
573130,23480,MINI LIGHTS WOODLAND MUSHROOMS,4,10/27/2011 16:41,3.75,13969,United Kingdom
573130,23571,TRADITIONAL NAUGHTS & CROSSES,11,10/27/2011 16:41,1.65,13969,United Kingdom
573130,21137,BLACK RECORD COVER FRAME,5,10/27/2011 16:41,3.75,13969,United Kingdom
573130,79190A,RETRO PLASTIC 70'S TRAY,5,10/27/2011 16:41,0.42,13969,United Kingdom
573130,79191B,RETRO PLASTIC POLKA TRAY,5,10/27/2011 16:41,0.85,13969,United Kingdom
573130,22186,RED STAR CARD HOLDER,3,10/27/2011 16:41,1.95,13969,United Kingdom
573130,22423,REGENCY CAKESTAND 3 TIER,1,10/27/2011 16:41,12.75,13969,United Kingdom
573130,35970,ZINC FOLKART SLEIGH BELLS,12,10/27/2011 16:41,1.69,13969,United Kingdom
573130,23570,TRADITIONAL PICK UP STICKS GAME ,12,10/27/2011 16:41,1.25,13969,United Kingdom
573130,22943,CHRISTMAS LIGHTS 10 VINTAGE BAUBLES,4,10/27/2011 16:41,4.95,13969,United Kingdom
