581219,22108,PING! MICROWAVE PLATE,2,12/08/2011 09:28,3.29,,United Kingdom
581219,22109,FULL ENGLISH BREAKFAST PLATE,2,12/08/2011 09:28,7.46,,United Kingdom
581219,22110,BIRD HOUSE HOT WATER BOTTLE,3,12/08/2011 09:28,5.79,,United Kingdom
581219,22111,SCOTTIE DOG HOT WATER BOTTLE,2,12/08/2011 09:28,10.79,,United Kingdom
581219,22112,CHOCOLATE HOT WATER BOTTLE,1,12/08/2011 09:28,10.79,,United Kingdom
581219,22114,HOT WATER BOTTLE TEA AND SYMPATHY,9,12/08/2011 09:28,8.29,,United Kingdom
581219,22115,METAL SIGN EMPIRE TEA,2,12/08/2011 09:28,5.79,,United Kingdom
581219,22116,METAL SIGN HIS DINNER IS SERVED,3,12/08/2011 09:28,1.63,,United Kingdom
581219,22118,JOY WOODEN BLOCK LETTERS,1,12/08/2011 09:28,11.63,,United Kingdom
581219,22119,PEACE WOODEN BLOCK LETTERS,1,12/08/2011 09:28,14.13,,United Kingdom
581219,22129,PARTY CONES CANDY DECORATION,4,12/08/2011 09:28,2.46,,United Kingdom
581219,22131,FOOD CONTAINER SET 3 LOVE HEART ,1,12/08/2011 09:28,4.13,,United Kingdom
581219,22133,PINK LOVE HEART SHAPE CUP,1,12/08/2011 09:28,1.63,,United Kingdom
581219,22135,MINI LADLE LOVE HEART PINK,1,12/08/2011 09:28,0.83,,United Kingdom
581219,22138,BAKING SET 9 PIECE RETROSPOT ,2,12/08/2011 09:28,10.79,,United Kingdom
581219,22139,RETROSPOT TEA SET CERAMIC 11 PC ,2,12/08/2011 09:28,10.79,,United Kingdom
581219,22141,CHRISTMAS CRAFT TREE TOP ANGEL,1,12/08/2011 09:28,4.13,,United Kingdom
581219,22142,CHRISTMAS CRAFT WHITE FAIRY ,1,12/08/2011 09:28,3.29,,United Kingdom
581219,22144,CHRISTMAS CRAFT LITTLE FRIENDS,2,12/08/2011 09:28,4.13,,United Kingdom
581219,22150,3 STRIPEY MICE FELTCRAFT,2,12/08/2011 09:28,4.13,,United Kingdom
581219,22153,ANGEL DECORATION STARS ON DRESS,2,12/08/2011 09:28,0.83,,United Kingdom
581219,22154,ANGEL DECORATION 3 BUTTONS ,2,12/08/2011 09:28,0.83,,United Kingdom
581219,22155,STAR DECORATION RUSTIC,3,12/08/2011 09:28,0.83,,United Kingdom
581219,22158,3 HEARTS HANGING DECORATION RUSTIC,1,12/08/2011 09:28,5.79,,United Kingdom
581219,22163,HEART STRING MEMO HOLDER HANGING,5,12/08/2011 09:28,1.63,,United Kingdom
581219,22165,"DIAMANTE HEART SHAPED WALL MIRROR, ",3,12/08/2011 09:28,10.79,,United Kingdom
581219,22174,PHOTO CUBE,4,12/08/2011 09:28,3.29,,United Kingdom
581219,22178,VICTORIAN GLASS HANGING T-LIGHT,11,12/08/2011 09:28,2.46,,United Kingdom
581219,22179,SET 10 NIGHT OWL LIGHTS,1,12/08/2011 09:28,13.29,,United Kingdom
581219,22189,CREAM HEART CARD HOLDER,1,12/08/2011 09:28,8.29,,United Kingdom
581219,22190,LOCAL CAFE MUG,2,12/08/2011 09:28,2.46,,United Kingdom
581219,22191,IVORY DINER WALL CLOCK,1,12/08/2011 09:28,16.63,,United Kingdom
581219,22192,BLUE DINER WALL CLOCK,1,12/08/2011 09:28,16.63,,United Kingdom
581219,22196,SMALL HEART MEASURING SPOONS,3,12/08/2011 09:28,1.63,,United Kingdom
581219,22197,POPCORN HOLDER,62,12/08/2011 09:28,1.63,,United Kingdom
581219,22207,FRYING PAN UNION FLAG,2,12/08/2011 09:28,8.29,,United Kingdom
581219,22208,WOOD STAMP SET THANK YOU,1,12/08/2011 09:28,3.29,,United Kingdom
581219,22210,WOOD STAMP SET BEST WISHES,1,12/08/2011 09:28,3.29,,United Kingdom
581219,22211,WOOD STAMP SET FLOWERS,1,12/08/2011 09:28,3.29,,United Kingdom
581219,22219,LOVEBIRD HANGING DECORATION WHITE ,2,12/08/2011 09:28,1.63,,United Kingdom
581219,22222,CAKE PLATE LOVEBIRD WHITE,1,12/08/2011 09:28,9.96,,United Kingdom
581219,22303,COFFEE MUG APPLES DESIGN,1,12/08/2011 09:28,4.96,,United Kingdom
581219,22312,OFFICE MUG WARMER POLKADOT,1,12/08/2011 09:28,5.79,,United Kingdom
581219,22321,BIRD DECORATION RED RETROSPOT,2,12/08/2011 09:28,1.63,,United Kingdom
581219,22324,BLUE POLKADOT KIDS BAG,1,12/08/2011 09:28,4.13,,United Kingdom
581219,22327,ROUND SNACK BOXES SET OF 4 SKULLS,1,12/08/2011 09:28,5.79,,United Kingdom
581219,22331,WOODLAND PARTY BAG + STICKER SET,1,12/08/2011 09:28,3.29,,United Kingdom
581219,22335,HEART DECORATION PAINTED ZINC ,9,12/08/2011 09:28,1.25,,United Kingdom
581219,22338,STAR DECORATION PAINTED ZINC ,9,12/08/2011 09:28,0.63,,United Kingdom
581219,22340,NOEL GARLAND PAINTED ZINC ,4,12/08/2011 09:28,0.83,,United Kingdom
