581492,22821,GIFT BAG PSYCHEDELIC APPLES,3,12/09/2011 10:03,0.83,,United Kingdom
581492,22835,HOT WATER BOTTLE I AM SO POORLY,3,12/09/2011 10:03,10.79,,United Kingdom
581492,22865,HAND WARMER OWL DESIGN,2,12/09/2011 10:03,4.13,,United Kingdom
581492,22866,HAND WARMER SCOTTY DOG DESIGN,3,12/09/2011 10:03,4.13,,United Kingdom
581492,22867,HAND WARMER BIRD DESIGN,4,12/09/2011 10:03,4.13,,United Kingdom
581492,22881,NUMBER TILE VINTAGE FONT 2,1,12/09/2011 10:03,4.13,,United Kingdom
581492,22885,NUMBER TILE VINTAGE FONT 6 ,1,12/09/2011 10:03,4.13,,United Kingdom
581492,22888,NUMBER TILE VINTAGE FONT 9 ,1,12/09/2011 10:03,4.13,,United Kingdom
581492,22890,NOVELTY BISCUITS CAKE STAND 3 TIER,1,12/09/2011 10:03,19.96,,United Kingdom
581492,22898,CHILDRENS APRON APPLES DESIGN,1,12/09/2011 10:03,4.13,,United Kingdom
581492,22899,CHILDREN'S APRON DOLLY GIRL ,2,12/09/2011 10:03,4.13,,United Kingdom
581492,22900,SET 2 TEA TOWELS I LOVE LONDON ,3,12/09/2011 10:03,6.63,,United Kingdom
581492,22905,CALENDAR IN SEASON DESIGN,1,12/09/2011 10:03,2.46,,United Kingdom
581492,22907,PACK OF 20 NAPKINS PANTRY DESIGN,1,12/09/2011 10:03,1.63,,United Kingdom
581492,22909,SET OF 20 VINTAGE CHRISTMAS NAPKINS,5,12/09/2011 10:03,1.63,,United Kingdom
581492,22910,PAPER CHAIN KIT VINTAGE CHRISTMAS,7,12/09/2011 10:03,5.79,,United Kingdom
581492,22914,BLUE COAT RACK PARIS FASHION,1,12/09/2011 10:03,10.79,,United Kingdom
581492,22922,FRIDGE MAGNETS US DINER ASSORTED,6,12/09/2011 10:03,1.8,,United Kingdom
581492,22924,FRIDGE MAGNETS LA VIE EN ROSE,6,12/09/2011 10:03,1.8,,United Kingdom
581492,22928,YELLOW GIANT GARDEN THERMOMETER,1,12/09/2011 10:03,12.46,,United Kingdom
581492,22940,FELTCRAFT CHRISTMAS FAIRY,1,12/09/2011 10:03,8.29,,United Kingdom
581492,22941,CHRISTMAS LIGHTS 10 REINDEER,2,12/09/2011 10:03,16.63,,United Kingdom
581492,22943,CHRISTMAS LIGHTS 10 VINTAGE BAUBLES,1,12/09/2011 10:03,10.79,,United Kingdom
581492,22948,METAL DECORATION NAUGHTY CHILDREN ,4,12/09/2011 10:03,1.66,,United Kingdom
581492,22951,60 CAKE CASES DOLLY GIRL DESIGN,2,12/09/2011 10:03,1.25,,United Kingdom
581492,22952,60 CAKE CASES VINTAGE CHRISTMAS,2,12/09/2011 10:03,1.25,,United Kingdom
581492,22955,36 FOIL STAR CAKE CASES ,1,12/09/2011 10:03,4.13,,United Kingdom
581492,22960,JAM MAKING SET WITH JARS,2,12/09/2011 10:03,8.29,,United Kingdom
581492,22961,JAM MAKING SET PRINTED,9,12/09/2011 10:03,3.29,,United Kingdom
581492,22962,JAM JAR WITH PINK LID,3,12/09/2011 10:03,1.63,,United Kingdom
581492,22963,JAM JAR WITH GREEN LID,3,12/09/2011 10:03,1.63,,United Kingdom
581492,22964,3 PIECE SPACEBOY COOKIE CUTTER SET,1,12/09/2011 10:03,4.13,,United Kingdom
581492,22965,3 TRADITIONAl BISCUIT CUTTERS  SET,1,12/09/2011 10:03,4.13,,United Kingdom
581492,22966,GINGERBREAD MAN COOKIE CUTTER,4,12/09/2011 10:03,2.46,,United Kingdom
581492,22969,HOMEMADE JAM SCENTED CANDLES,6,12/09/2011 10:03,3.29,,United Kingdom
581492,22975,SPACEBOY CHILDRENS EGG CUP,2,12/09/2011 10:03,2.46,,United Kingdom
581492,22976,CIRCUS PARADE CHILDRENS EGG CUP ,1,12/09/2011 10:03,2.46,,United Kingdom
581492,22977,DOLLY GIRL CHILDRENS EGG CUP,1,12/09/2011 10:03,2.46,,United Kingdom
581492,22979,PANTRY WASHING UP BRUSH,2,12/09/2011 10:03,3.29,,United Kingdom
581492,22980,PANTRY SCRUBBING BRUSH,1,12/09/2011 10:03,3.29,,United Kingdom
581492,22982,PANTRY PASTRY BRUSH,3,12/09/2011 10:03,2.46,,United Kingdom
581492,22983,CARD BILLBOARD FONT,1,12/09/2011 10:03,0.83,,United Kingdom
581492,22984,CARD GINGHAM ROSE ,1,12/09/2011 10:03,0.83,,United Kingdom
581492,22988,SOLDIERS EGG CUP ,1,12/09/2011 10:03,2.46,,United Kingdom
581492,22989,SET 2 PANTRY DESIGN TEA TOWELS,2,12/09/2011 10:03,6.63,,United Kingdom
581492,22992,REVOLVER WOODEN RULER ,3,12/09/2011 10:03,4.13,,United Kingdom
581492,22993,SET OF 4 PANTRY JELLY MOULDS,3,12/09/2011 10:03,2.46,,United Kingdom
581492,22995,TRAVEL CARD WALLET SUKI,4,12/09/2011 10:03,0.83,,United Kingdom
581492,22996,TRAVEL CARD WALLET VINTAGE TICKET,5,12/09/2011 10:03,0.83,,United Kingdom
581492,22997,TRAVEL CARD WALLET UNION JACK,1,12/09/2011 10:03,0.83,,United Kingdom
