573339,21888,BINGO SET,1,10/30/2011 11:49,3.75,13278,United Kingdom
573339,22936,BAKING MOULD ROSE WHITE CHOCOLATE,2,10/30/2011 11:49,3.25,13278,United Kingdom
573339,22839,3 TIER CAKE TIN GREEN AND CREAM,1,10/30/2011 11:49,14.95,13278,United Kingdom
573339,22665,RECIPE BOX BLUE SKETCHBOOK DESIGN,1,10/30/2011 11:49,2.95,13278,United Kingdom
573339,22477,WATERING CAN GARDEN MARKER,10,10/30/2011 11:49,1.25,13278,United Kingdom
573339,84692,BOX OF 24 COCKTAIL PARASOLS,25,10/30/2011 11:49,0.42,13278,United Kingdom
573339,16016,LARGE CHINESE STYLE SCISSOR,10,10/30/2011 11:49,0.85,13278,United Kingdom
573339,16015,MEDIUM CHINESE STYLE SCISSOR,10,10/30/2011 11:49,0.5,13278,United Kingdom
573339,15030,FAN BLACK FRAME ,10,10/30/2011 11:49,0.29,13278,United Kingdom
573339,84247N,PACK/12 BLUE FOLKART CARDS,1,10/30/2011 11:49,2.95,13278,United Kingdom
573339,17003,BROCADE RING PURSE ,72,10/30/2011 11:49,0.39,13278,United Kingdom
573339,23158,SET OF 5 LUCKY CAT MAGNETS ,12,10/30/2011 11:49,2.08,13278,United Kingdom
573339,22352,LUNCH BOX WITH CUTLERY RETROSPOT ,12,10/30/2011 11:49,2.55,13278,United Kingdom
573339,21949,SET OF 6 STRAWBERRY CHOPSTICKS,12,10/30/2011 11:49,1.25,13278,United Kingdom
573339,21947,SET OF 6 HEART CHOPSTICKS,6,10/30/2011 11:49,1.25,13278,United Kingdom
573339,21948,SET OF 6 CAKE CHOPSTICKS,6,10/30/2011 11:49,1.25,13278,United Kingdom
573339,15034,PAPER POCKET TRAVELING FAN ,24,10/30/2011 11:49,0.14,13278,United Kingdom
573339,20829,GLITTER HANGING BUTTERFLY STRING,6,10/30/2011 11:49,2.1,13278,United Kingdom
573339,20828,GLITTER BUTTERFLY CLIPS,6,10/30/2011 11:49,2.55,13278,United Kingdom
573339,15036,ASSORTED COLOURS SILK FAN,48,10/30/2011 11:49,0.83,13278,United Kingdom
573339,22186,RED STAR CARD HOLDER,10,10/30/2011 11:49,1.95,13278,United Kingdom
573339,23208,LUNCH BAG VINTAGE LEAF DESIGN,10,10/30/2011 11:49,1.65,13278,United Kingdom
573339,20723,STRAWBERRY CHARLOTTE BAG,10,10/30/2011 11:49,0.85,13278,United Kingdom
573339,21932,SCANDINAVIAN PAISLEY PICNIC BAG,4,10/30/2011 11:49,1.65,13278,United Kingdom
573339,20726,LUNCH BAG WOODLAND,10,10/30/2011 11:49,1.65,13278,United Kingdom
573339,20724,RED RETROSPOT CHARLOTTE BAG,10,10/30/2011 11:49,0.85,13278,United Kingdom
573339,22355,CHARLOTTE BAG SUKI DESIGN,10,10/30/2011 11:49,0.85,13278,United Kingdom
573339,23206,LUNCH BAG APPLE DESIGN,10,10/30/2011 11:49,1.65,13278,United Kingdom
573339,22383,LUNCH BAG SUKI DESIGN ,10,10/30/2011 11:49,1.65,13278,United Kingdom
573339,23583,LUNCH BAG PAISLEY PARK  ,10,10/30/2011 11:49,1.65,13278,United Kingdom
573339,23209,LUNCH BAG VINTAGE DOILY ,20,10/30/2011 11:49,1.65,13278,United Kingdom
573339,22382,LUNCH BAG SPACEBOY DESIGN ,10,10/30/2011 11:49,1.65,13278,United Kingdom
573340,23266,SET OF 3 WOODEN STOCKING DECORATION,6,10/30/2011 11:55,1.25,14159,United Kingdom
573340,23264,SET OF 3 WOODEN SLEIGH DECORATIONS,5,10/30/2011 11:55,1.25,14159,United Kingdom
573340,22580,ADVENT CALENDAR GINGHAM SACK,1,10/30/2011 11:55,5.95,14159,United Kingdom
573340,22996,TRAVEL CARD WALLET VINTAGE TICKET,4,10/30/2011 11:55,0.42,14159,United Kingdom
573340,22995,TRAVEL CARD WALLET SUKI,5,10/30/2011 11:55,0.42,14159,United Kingdom
573340,22994,TRAVEL CARD WALLET RETROSPOT,4,10/30/2011 11:55,0.42,14159,United Kingdom
573340,22998,TRAVEL CARD WALLET KEEP CALM,6,10/30/2011 11:55,0.42,14159,United Kingdom
573340,22999,TRAVEL CARD WALLET VINTAGE LEAF,2,10/30/2011 11:55,0.42,14159,United Kingdom
573340,23000,TRAVEL CARD WALLET TRANSPORT,2,10/30/2011 11:55,0.42,14159,United Kingdom
573340,23005,TRAVEL CARD WALLET I LOVE LONDON,2,10/30/2011 11:55,0.42,14159,United Kingdom
573340,23004,TRAVEL CARD WALLET PANTRY,2,10/30/2011 11:55,0.42,14159,United Kingdom
573340,23270,SET OF 2 CERAMIC PAINTED HEARTS ,2,10/30/2011 11:55,1.45,14159,United Kingdom
573340,23263,SET OF 3 WOODEN HEART DECORATIONS,6,10/30/2011 11:55,1.25,14159,United Kingdom
573340,22339,CHRISTMAS TREE PAINTED ZINC ,20,10/30/2011 11:55,0.19,14159,United Kingdom
573340,22338,STAR DECORATION PAINTED ZINC ,20,10/30/2011 11:55,0.19,14159,United Kingdom
573340,22340,NOEL GARLAND PAINTED ZINC ,12,10/30/2011 11:55,0.39,14159,United Kingdom
573340,22580,ADVENT CALENDAR GINGHAM SACK,1,10/30/2011 11:55,5.95,14159,United Kingdom
573340,23378,PACK OF 12 50'S CHRISTMAS TISSUES,6,10/30/2011 11:55,0.39,14159,United Kingdom
