573323,21756,BATH BUILDING BLOCK WORD,2,10/30/2011 10:54,6.25,15708,United Kingdom
573323,21754,HOME BUILDING BLOCK WORD,2,10/30/2011 10:54,6.25,15708,United Kingdom
573323,22725,ALARM CLOCK BAKELIKE CHOCOLATE,2,10/30/2011 10:54,3.75,15708,United Kingdom
573323,22728,ALARM CLOCK BAKELIKE PINK,3,10/30/2011 10:54,3.75,15708,United Kingdom
573323,22727,ALARM CLOCK BAKELIKE RED ,3,10/30/2011 10:54,3.75,15708,United Kingdom
573323,22726,ALARM CLOCK BAKELIKE GREEN,2,10/30/2011 10:54,3.75,15708,United Kingdom
573323,82494L,WOODEN FRAME ANTIQUE WHITE ,6,10/30/2011 10:54,2.95,15708,United Kingdom
573323,82482,WOODEN PICTURE FRAME WHITE FINISH,6,10/30/2011 10:54,2.95,15708,United Kingdom
573323,22193,RED DINER WALL CLOCK,2,10/30/2011 10:54,8.5,15708,United Kingdom
573323,23342,MINT DINER WALL CLOCK,2,10/30/2011 10:54,8.5,15708,United Kingdom
573323,23341,PINK DINER WALL CLOCK,2,10/30/2011 10:54,8.5,15708,United Kingdom
573323,22192,BLUE DINER WALL CLOCK,2,10/30/2011 10:54,8.5,15708,United Kingdom
573323,84406B,CREAM CUPID HEARTS COAT HANGER,2,10/30/2011 10:54,4.15,15708,United Kingdom
573323,22173,METAL 4 HOOK HANGER FRENCH CHATEAU,2,10/30/2011 10:54,3.29,15708,United Kingdom
573323,22189,CREAM HEART CARD HOLDER,2,10/30/2011 10:54,3.95,15708,United Kingdom
573323,22188,BLACK HEART CARD HOLDER,3,10/30/2011 10:54,3.95,15708,United Kingdom
573323,82484,WOOD BLACK BOARD ANT WHITE FINISH,2,10/30/2011 10:54,7.95,15708,United Kingdom
573323,23542,WALL ART 70'S ALPHABET ,1,10/30/2011 10:54,8.25,15708,United Kingdom
573323,23534,WALL ART STOP FOR TEA ,2,10/30/2011 10:54,5.95,15708,United Kingdom
573323,23536,WALL ART VILLAGE SHOW ,1,10/30/2011 10:54,5.95,15708,United Kingdom
573323,23532,WALL ART WORK REST AND PLAY  ,1,10/30/2011 10:54,4.95,15708,United Kingdom
573323,23541,WALL ART CLASSIC PUDDINGS ,1,10/30/2011 10:54,8.25,15708,United Kingdom
573323,23540,WALL ART THE MAGIC FOREST ,1,10/30/2011 10:54,6.95,15708,United Kingdom
573323,23196,VINTAGE LEAF MAGNETIC NOTEPAD,3,10/30/2011 10:54,1.45,15708,United Kingdom
573323,23197,SKETCHBOOK MAGNETIC SHOPPING LIST,3,10/30/2011 10:54,1.45,15708,United Kingdom
573323,23115,RED APPLES CHOPPING BOARD   ,1,10/30/2011 10:54,4.95,15708,United Kingdom
573323,23114,VINTAGE LEAF CHOPPING BOARD  ,1,10/30/2011 10:54,4.95,15708,United Kingdom
573323,23116,VEGETABLE GARDEN CHOPPING BOARD,1,10/30/2011 10:54,4.95,15708,United Kingdom
573323,23522,WALL ART DOG AND BALL ,4,10/30/2011 10:54,2.89,15708,United Kingdom
573323,23521,WALL ART CAT AND BIRD ,4,10/30/2011 10:54,2.89,15708,United Kingdom
573323,22296,HEART IVORY TRELLIS LARGE,12,10/30/2011 10:54,1.65,15708,United Kingdom
573323,23245,SET OF 3 REGENCY CAKE TINS,1,10/30/2011 10:54,4.95,15708,United Kingdom
573323,22626,BLACK KITCHEN SCALES,1,10/30/2011 10:54,8.5,15708,United Kingdom
573323,22625,RED KITCHEN SCALES,2,10/30/2011 10:54,8.5,15708,United Kingdom
573323,22624,IVORY KITCHEN SCALES,2,10/30/2011 10:54,8.5,15708,United Kingdom
573323,23307,SET OF 60 PANTRY DESIGN CAKE CASES ,9,10/30/2011 10:54,0.55,15708,United Kingdom
573323,23308,SET OF 60 VINTAGE LEAF CAKE CASES ,9,10/30/2011 10:54,0.55,15708,United Kingdom
573323,23321,SMALL WHITE HEART OF WICKER,10,10/30/2011 10:54,1.65,15708,United Kingdom
573323,22469,HEART OF WICKER SMALL,10,10/30/2011 10:54,1.65,15708,United Kingdom
573323,22694,WICKER STAR ,6,10/30/2011 10:54,2.1,15708,United Kingdom
573323,23329,DECORATIVE WICKER HEART LARGE,12,10/30/2011 10:54,1.65,15708,United Kingdom
573323,23332,IVORY WICKER HEART LARGE,12,10/30/2011 10:54,1.65,15708,United Kingdom
573324,23321,SMALL WHITE HEART OF WICKER,12,10/30/2011 10:56,1.65,16235,United Kingdom
573324,22469,HEART OF WICKER SMALL,12,10/30/2011 10:56,1.65,16235,United Kingdom
573324,84879,ASSORTED COLOUR BIRD ORNAMENT,8,10/30/2011 10:56,1.69,16235,United Kingdom
573324,82494L,WOODEN FRAME ANTIQUE WHITE ,6,10/30/2011 10:56,2.95,16235,United Kingdom
573324,21993,FLORAL FOLK STATIONERY SET,12,10/30/2011 10:56,1.25,16235,United Kingdom
573324,21352,EUCALYPTUS & PINECONE  WREATH,12,10/30/2011 10:56,2.95,16235,United Kingdom
573324,84947,ANTIQUE SILVER TEA GLASS ENGRAVED,12,10/30/2011 10:56,1.25,16235,United Kingdom
573324,82484,WOOD BLACK BOARD ANT WHITE FINISH,2,10/30/2011 10:56,7.95,16235,United Kingdom
