573452,22930,BAKING MOULD HEART MILK CHOCOLATE,28,10/31/2011 10:45,2.6,17450,United Kingdom
573452,22960,JAM MAKING SET WITH JARS,44,10/31/2011 10:45,4.6,17450,United Kingdom
573452,23243,SET OF TEA COFFEE SUGAR TINS PANTRY,4,10/31/2011 10:45,1.71,17450,United Kingdom
573463,17012B,check,-70,10/31/2011 10:56,0,,United Kingdom
573464,23380,PACK OF 12 VINTAGE DOILY TISSUES,24,10/31/2011 10:56,0.39,15667,United Kingdom
573464,21980,PACK OF 12 RED RETROSPOT TISSUES ,24,10/31/2011 10:56,0.39,15667,United Kingdom
573464,23381,PACK OF 12 VINTAGE LEAF TISSUES ,24,10/31/2011 10:56,0.39,15667,United Kingdom
573464,23379,PACK OF 12 RED APPLE TISSUES,24,10/31/2011 10:56,0.39,15667,United Kingdom
573464,23418,LAVENDER TOILETTE BOTTLE,12,10/31/2011 10:56,2.08,15667,United Kingdom
573464,23012,GLASS APOTHECARY BOTTLE PERFUME,12,10/31/2011 10:56,3.45,15667,United Kingdom
573464,23014,GLASS APOTHECARY BOTTLE ELIXIR,12,10/31/2011 10:56,3.45,15667,United Kingdom
573464,23013,GLASS APOTHECARY BOTTLE TONIC,12,10/31/2011 10:56,3.45,15667,United Kingdom
573464,84946,ANTIQUE SILVER T-LIGHT GLASS,12,10/31/2011 10:56,1.25,15667,United Kingdom
573464,23571,TRADITIONAL NAUGHTS & CROSSES,12,10/31/2011 10:56,1.65,15667,United Kingdom
573464,21981,PACK OF 12 WOODLAND TISSUES ,24,10/31/2011 10:56,0.39,15667,United Kingdom
573464,84836,ZINC METAL HEART DECORATION,24,10/31/2011 10:56,1.25,15667,United Kingdom
573464,35970,ZINC FOLKART SLEIGH BELLS,24,10/31/2011 10:56,1.69,15667,United Kingdom
C573471,85017B,ENVELOPE 50 BLOSSOM IMAGES,-12,10/31/2011 10:58,0.85,14286,United Kingdom
573481,85054,FRENCH ENAMEL POT W LID,6,10/31/2011 11:10,2.95,13994,United Kingdom
573481,22429,ENAMEL MEASURING JUG CREAM,4,10/31/2011 11:10,4.25,13994,United Kingdom
573481,23543,WALL ART KEEP CALM ,4,10/31/2011 11:10,8.25,13994,United Kingdom
573481,22121,NOEL WOODEN BLOCK LETTERS ,3,10/31/2011 11:10,5.95,13994,United Kingdom
573481,23526,WALL ART DOG LICENCE ,4,10/31/2011 11:10,5.95,13994,United Kingdom
573481,23535,WALL ART BICYCLE SAFETY,4,10/31/2011 11:10,5.95,13994,United Kingdom
573481,23213,STAR WREATH DECORATION WITH BELL,12,10/31/2011 11:10,1.25,13994,United Kingdom
573481,23212,HEART WREATH DECORATION WITH BELL,12,10/31/2011 11:10,1.25,13994,United Kingdom
573481,23210,WHITE ROCKING HORSE HAND PAINTED,24,10/31/2011 11:10,1.25,13994,United Kingdom
573481,23479,WIRE EGG BASKET ,4,10/31/2011 11:10,7.85,13994,United Kingdom
573481,23165,LARGE CERAMIC TOP STORAGE JAR,12,10/31/2011 11:10,1.65,13994,United Kingdom
573481,22720,SET OF 3 CAKE TINS PANTRY DESIGN ,3,10/31/2011 11:10,4.95,13994,United Kingdom
573481,22722,SET OF 6 SPICE TINS PANTRY DESIGN,4,10/31/2011 11:10,3.95,13994,United Kingdom
573481,23167,SMALL CERAMIC TOP STORAGE JAR ,12,10/31/2011 11:10,0.83,13994,United Kingdom
573481,23168,CLASSIC CAFE SUGAR DISPENSER,12,10/31/2011 11:10,1.25,13994,United Kingdom
573481,23173,REGENCY TEAPOT ROSES ,2,10/31/2011 11:10,9.95,13994,United Kingdom
573481,22178,VICTORIAN GLASS HANGING T-LIGHT,6,10/31/2011 11:10,1.95,13994,United Kingdom
573481,22460,EMBOSSED GLASS TEALIGHT HOLDER,12,10/31/2011 11:10,1.25,13994,United Kingdom
573481,22727,ALARM CLOCK BAKELIKE RED ,4,10/31/2011 11:10,3.75,13994,United Kingdom
573481,22726,ALARM CLOCK BAKELIKE GREEN,4,10/31/2011 11:10,3.75,13994,United Kingdom
573481,23084,RABBIT NIGHT LIGHT,18,10/31/2011 11:10,2.08,13994,United Kingdom
573481,21314,SMALL GLASS HEART TRINKET POT,8,10/31/2011 11:10,2.1,13994,United Kingdom
573481,22725,ALARM CLOCK BAKELIKE CHOCOLATE,4,10/31/2011 11:10,3.75,13994,United Kingdom
573481,23175,REGENCY MILK JUG PINK ,4,10/31/2011 11:10,3.25,13994,United Kingdom
573481,84931A,PINK SCOTTIE DOG W FLOWER PATTERN,6,10/31/2011 11:10,2.55,13994,United Kingdom
573481,84580,MOUSE TOY WITH PINK T-SHIRT,4,10/31/2011 11:10,3.75,13994,United Kingdom
573481,22176,BLUE OWL SOFT TOY,5,10/31/2011 11:10,2.95,13994,United Kingdom
573481,22175,PINK OWL SOFT TOY,6,10/31/2011 11:10,2.95,13994,United Kingdom
573481,84931B,BLUE SCOTTIE DOG W FLOWER PATTERN,6,10/31/2011 11:10,2.55,13994,United Kingdom
573481,22112,CHOCOLATE HOT WATER BOTTLE,3,10/31/2011 11:10,4.95,13994,United Kingdom
573481,23355,HOT WATER BOTTLE KEEP CALM,4,10/31/2011 11:10,4.95,13994,United Kingdom
573481,84029E,RED WOOLLY HOTTIE WHITE HEART.,4,10/31/2011 11:10,4.25,13994,United Kingdom
