573551,22158,3 HEARTS HANGING DECORATION RUSTIC,12,10/31/2011 13:35,2.95,15044,United Kingdom
573551,21754,HOME BUILDING BLOCK WORD,2,10/31/2011 13:35,6.25,15044,United Kingdom
573551,23490,T-LIGHT HOLDER HANGING LOVE BIRD,10,10/31/2011 13:35,3.75,15044,United Kingdom
573551,84997C,CHILDRENS CUTLERY POLKADOT BLUE,3,10/31/2011 13:35,4.15,15044,United Kingdom
573551,22766,PHOTO FRAME CORNICE,4,10/31/2011 13:35,2.95,15044,United Kingdom
573551,23452,HEART MINI PORTRAIT FRAME,12,10/31/2011 13:35,1.95,15044,United Kingdom
573551,23453,OVAL  MINI PORTRAIT FRAME,8,10/31/2011 13:35,1.95,15044,United Kingdom
573551,23451,SQUARE MINI PORTRAIT FRAME,6,10/31/2011 13:35,1.95,15044,United Kingdom
573551,23454,THREE MINI HANGING FRAMES,4,10/31/2011 13:35,4.15,15044,United Kingdom
573551,22633,HAND WARMER UNION JACK,8,10/31/2011 13:35,2.1,15044,United Kingdom
573551,22866,HAND WARMER SCOTTY DOG DESIGN,8,10/31/2011 13:35,2.1,15044,United Kingdom
573551,23439,HAND WARMER RED LOVE HEART,8,10/31/2011 13:35,2.1,15044,United Kingdom
573551,22867,HAND WARMER BIRD DESIGN,6,10/31/2011 13:35,2.1,15044,United Kingdom
573551,23355,HOT WATER BOTTLE KEEP CALM,4,10/31/2011 13:35,4.95,15044,United Kingdom
573551,22507,MEMO BOARD RETROSPOT  DESIGN,4,10/31/2011 13:35,4.95,15044,United Kingdom
573551,21349,IVY HEART WREATH,1,10/31/2011 13:35,6.75,15044,United Kingdom
573551,82482,WOODEN PICTURE FRAME WHITE FINISH,6,10/31/2011 13:35,2.95,15044,United Kingdom
573551,22112,CHOCOLATE HOT WATER BOTTLE,4,10/31/2011 13:35,4.95,15044,United Kingdom
573551,22114,HOT WATER BOTTLE TEA AND SYMPATHY,4,10/31/2011 13:35,4.25,15044,United Kingdom
573551,84029G,KNITTED UNION FLAG HOT WATER BOTTLE,4,10/31/2011 13:35,4.25,15044,United Kingdom
573551,22768,FAMILY PHOTO FRAME CORNICE,1,10/31/2011 13:35,9.95,15044,United Kingdom
573551,21166,COOK WITH WINE METAL SIGN ,8,10/31/2011 13:35,2.08,15044,United Kingdom
573551,22086,PAPER CHAIN KIT 50'S CHRISTMAS ,2,10/31/2011 13:35,2.95,15044,United Kingdom
573551,22910,PAPER CHAIN KIT VINTAGE CHRISTMAS,4,10/31/2011 13:35,2.95,15044,United Kingdom
573551,82494L,WOODEN FRAME ANTIQUE WHITE ,6,10/31/2011 13:35,2.95,15044,United Kingdom
573551,22947,WOODEN ADVENT CALENDAR RED,2,10/31/2011 13:35,7.95,15044,United Kingdom
573551,21352,EUCALYPTUS & PINECONE  WREATH,4,10/31/2011 13:35,2.95,15044,United Kingdom
573551,22689,DOORMAT MERRY CHRISTMAS RED ,2,10/31/2011 13:35,8.25,15044,United Kingdom
573551,23581,JUMBO BAG PAISLEY PARK,6,10/31/2011 13:35,2.08,15044,United Kingdom
573551,21351,CINAMMON & ORANGE WREATH,4,10/31/2011 13:35,6.75,15044,United Kingdom
573552,23213,STAR WREATH DECORATION WITH BELL,12,10/31/2011 13:43,1.25,13203,United Kingdom
573552,23210,WHITE ROCKING HORSE HAND PAINTED,24,10/31/2011 13:43,1.25,13203,United Kingdom
573552,22596,CHRISTMAS STAR WISH LIST CHALKBOARD,12,10/31/2011 13:43,1.25,13203,United Kingdom
573552,23083,SET 6 PAPER TABLE LANTERN STARS ,6,10/31/2011 13:43,3.75,13203,United Kingdom
573552,84029E,RED WOOLLY HOTTIE WHITE HEART.,4,10/31/2011 13:43,4.25,13203,United Kingdom
573552,21479,WHITE SKULL HOT WATER BOTTLE ,4,10/31/2011 13:43,4.25,13203,United Kingdom
573552,22835,HOT WATER BOTTLE I AM SO POORLY,4,10/31/2011 13:43,4.95,13203,United Kingdom
573552,22867,HAND WARMER BIRD DESIGN,12,10/31/2011 13:43,2.1,13203,United Kingdom
573552,23439,HAND WARMER RED LOVE HEART,12,10/31/2011 13:43,2.1,13203,United Kingdom
573552,22632,HAND WARMER RED RETROSPOT,12,10/31/2011 13:43,2.1,13203,United Kingdom
573552,23233,WRAP POPPIES  DESIGN,25,10/31/2011 13:43,0.42,13203,United Kingdom
573552,22704,WRAP RED APPLES ,25,10/31/2011 13:43,0.42,13203,United Kingdom
573552,21497,FANCY FONTS BIRTHDAY WRAP,25,10/31/2011 13:43,0.42,13203,United Kingdom
573552,23232,WRAP VINTAGE LEAF DESIGN,25,10/31/2011 13:43,0.42,13203,United Kingdom
573552,22711,WRAP CIRCUS PARADE,25,10/31/2011 13:43,0.42,13203,United Kingdom
573552,22419,LIPSTICK PEN RED,12,10/31/2011 13:43,0.42,13203,United Kingdom
573552,22421,LIPSTICK PEN FUSCHIA,12,10/31/2011 13:43,0.42,13203,United Kingdom
573552,22621,TRADITIONAL KNITTING NANCY,12,10/31/2011 13:43,1.65,13203,United Kingdom
573552,23241,TREASURE TIN GYMKHANA DESIGN,6,10/31/2011 13:43,2.08,13203,United Kingdom
573552,22959,WRAP CHRISTMAS VILLAGE,25,10/31/2011 13:43,0.42,13203,United Kingdom
