573546,23489,VINTAGE BELLS GARLAND,6,10/31/2011 13:13,2.89,15974,United Kingdom
573546,84755,COLOUR GLASS T-LIGHT HOLDER HANGING,16,10/31/2011 13:13,0.65,15974,United Kingdom
573546,22178,VICTORIAN GLASS HANGING T-LIGHT,12,10/31/2011 13:13,1.95,15974,United Kingdom
573546,22460,EMBOSSED GLASS TEALIGHT HOLDER,12,10/31/2011 13:13,1.25,15974,United Kingdom
573546,21770,OPEN CLOSED METAL SIGN,2,10/31/2011 13:13,4.95,15974,United Kingdom
573546,21172,PARTY METAL SIGN ,12,10/31/2011 13:13,1.45,15974,United Kingdom
573546,23174,REGENCY SUGAR BOWL GREEN,4,10/31/2011 13:13,4.15,15974,United Kingdom
573546,23175,REGENCY MILK JUG PINK ,4,10/31/2011 13:13,3.25,15974,United Kingdom
573546,22969,HOMEMADE JAM SCENTED CANDLES,12,10/31/2011 13:13,1.45,15974,United Kingdom
573546,23089,GLASS BON BON JAR,12,10/31/2011 13:13,1.95,15974,United Kingdom
573546,23526,WALL ART DOG LICENCE ,4,10/31/2011 13:13,5.95,15974,United Kingdom
573546,23535,WALL ART BICYCLE SAFETY,4,10/31/2011 13:13,5.95,15974,United Kingdom
573546,23539,WALL ART LOVES' SECRET ,4,10/31/2011 13:13,5.95,15974,United Kingdom
573547,84818,damages,-70,10/31/2011 13:21,0,,United Kingdom
573548,16169E,WRAP 50'S  CHRISTMAS,25,10/31/2011 13:22,0.42,13680,United Kingdom
573548,22050,PINK PAISLEY ROSE GIFT WRAP,25,10/31/2011 13:22,0.42,13680,United Kingdom
573548,21500,PINK POLKADOT WRAP ,25,10/31/2011 13:22,0.42,13680,United Kingdom
573548,21498,RED RETROSPOT WRAP ,25,10/31/2011 13:22,0.42,13680,United Kingdom
573548,16169M,WRAP DAISY CARPET ,25,10/31/2011 13:22,0.42,13680,United Kingdom
573548,84029E,RED WOOLLY HOTTIE WHITE HEART.,4,10/31/2011 13:22,4.25,13680,United Kingdom
573548,22217,T-LIGHT HOLDER HANGING LACE,6,10/31/2011 13:22,1.25,13680,United Kingdom
573548,23109,PACK OF SIX LED TEA LIGHTS,6,10/31/2011 13:22,2.89,13680,United Kingdom
573548,82494L,WOODEN FRAME ANTIQUE WHITE ,2,10/31/2011 13:22,2.95,13680,United Kingdom
573548,82482,WOODEN PICTURE FRAME WHITE FINISH,2,10/31/2011 13:22,2.95,13680,United Kingdom
573548,23358,HOT STUFF HOT WATER BOTTLE,3,10/31/2011 13:22,3.75,13680,United Kingdom
573548,23357,HOT WATER BOTTLE SEX BOMB,4,10/31/2011 13:22,4.95,13680,United Kingdom
573548,22114,HOT WATER BOTTLE TEA AND SYMPATHY,4,10/31/2011 13:22,4.25,13680,United Kingdom
573548,21485,RETROSPOT HEART HOT WATER BOTTLE,4,10/31/2011 13:22,4.95,13680,United Kingdom
573548,22112,CHOCOLATE HOT WATER BOTTLE,24,10/31/2011 13:22,4.25,13680,United Kingdom
573548,23355,HOT WATER BOTTLE KEEP CALM,24,10/31/2011 13:22,4.15,13680,United Kingdom
573548,23330,DECORATIVE WICKER HEART MEDIUM,6,10/31/2011 13:22,1.25,13680,United Kingdom
573548,23329,DECORATIVE WICKER HEART LARGE,6,10/31/2011 13:22,1.65,13680,United Kingdom
573548,84596G,SMALL CHOCOLATES PINK BOWL,4,10/31/2011 13:22,0.42,13680,United Kingdom
573548,84596F,SMALL MARSHMALLOWS PINK BOWL,4,10/31/2011 13:22,0.42,13680,United Kingdom
573548,20675,BLUE POLKADOT BOWL,6,10/31/2011 13:22,1.25,13680,United Kingdom
573548,20674,GREEN POLKADOT BOWL,4,10/31/2011 13:22,1.25,13680,United Kingdom
573548,20676,RED RETROSPOT BOWL,6,10/31/2011 13:22,1.25,13680,United Kingdom
573548,20677,PINK POLKADOT BOWL,6,10/31/2011 13:22,1.25,13680,United Kingdom
573548,22578,WOODEN STAR CHRISTMAS SCANDINAVIAN,10,10/31/2011 13:22,0.29,13680,United Kingdom
573548,22579,WOODEN TREE CHRISTMAS SCANDINAVIAN,10,10/31/2011 13:22,0.29,13680,United Kingdom
573548,22577,WOODEN HEART CHRISTMAS SCANDINAVIAN,10,10/31/2011 13:22,0.29,13680,United Kingdom
573548,23264,SET OF 3 WOODEN SLEIGH DECORATIONS,3,10/31/2011 13:22,1.25,13680,United Kingdom
573548,23265,SET OF 3 WOODEN TREE DECORATIONS,3,10/31/2011 13:22,1.25,13680,United Kingdom
573548,23266,SET OF 3 WOODEN STOCKING DECORATION,3,10/31/2011 13:22,1.25,13680,United Kingdom
573548,23274,STAR T-LIGHT HOLDER WILLIE WINKIE,3,10/31/2011 13:22,1.65,13680,United Kingdom
573548,23273,HEART T-LIGHT HOLDER WILLIE WINKIE,3,10/31/2011 13:22,1.65,13680,United Kingdom
573548,23272,TREE T-LIGHT HOLDER WILLIE WINKIE,3,10/31/2011 13:22,1.65,13680,United Kingdom
573548,23101,SILVER STARS TABLE DECORATION,6,10/31/2011 13:22,0.83,13680,United Kingdom
573548,23102,SILVER HEARTS TABLE DECORATION,6,10/31/2011 13:22,0.83,13680,United Kingdom
573548,85123A,WHITE HANGING HEART T-LIGHT HOLDER,6,10/31/2011 13:22,2.95,13680,United Kingdom
