573311,22340,NOEL GARLAND PAINTED ZINC ,5,10/28/2011 16:45,0.39,14071,United Kingdom
573311,21811,HANGING HEART WITH BELL,3,10/28/2011 16:45,0.39,14071,United Kingdom
573311,23571,TRADITIONAL NAUGHTS & CROSSES,2,10/28/2011 16:45,1.65,14071,United Kingdom
573311,23570,TRADITIONAL PICK UP STICKS GAME ,2,10/28/2011 16:45,1.25,14071,United Kingdom
573311,22428,ENAMEL FIRE BUCKET CREAM,1,10/28/2011 16:45,6.95,14071,United Kingdom
573311,23295,SET OF 12 MINI LOAF BAKING CASES,1,10/28/2011 16:45,0.83,14071,United Kingdom
573311,23293,SET OF 12 FAIRY CAKE BAKING CASES,1,10/28/2011 16:45,0.83,14071,United Kingdom
573311,23294,SET OF 6 SNACK LOAF BAKING CASES,1,10/28/2011 16:45,0.83,14071,United Kingdom
573311,23296,SET OF 6 TEA TIME BAKING CASES,1,10/28/2011 16:45,1.25,14071,United Kingdom
573311,22111,SCOTTIE DOG HOT WATER BOTTLE,1,10/28/2011 16:45,4.95,14071,United Kingdom
573311,21523,DOORMAT FANCY FONT HOME SWEET HOME,1,10/28/2011 16:45,8.25,14071,United Kingdom
573311,48138,DOORMAT UNION FLAG,1,10/28/2011 16:45,8.25,14071,United Kingdom
573311,23284,DOORMAT KEEP CALM AND COME IN,1,10/28/2011 16:45,8.25,14071,United Kingdom
573311,23334,IVORY WICKER HEART SMALL,1,10/28/2011 16:45,0.63,14071,United Kingdom
573311,85123A,WHITE HANGING HEART T-LIGHT HOLDER,2,10/28/2011 16:45,2.95,14071,United Kingdom
573311,23332,IVORY WICKER HEART LARGE,1,10/28/2011 16:45,1.65,14071,United Kingdom
573311,23333,IVORY WICKER HEART MEDIUM,1,10/28/2011 16:45,1.25,14071,United Kingdom
573311,23508,MINI PLAYING CARDS DOLLY GIRL ,2,10/28/2011 16:45,0.42,14071,United Kingdom
573311,23507,MINI PLAYING CARDS BUFFALO BILL ,2,10/28/2011 16:45,0.42,14071,United Kingdom
573311,23509,MINI PLAYING CARDS FUN FAIR ,2,10/28/2011 16:45,0.42,14071,United Kingdom
573311,23510,MINI PLAYING CARDS GYMKHANA,2,10/28/2011 16:45,0.42,14071,United Kingdom
573311,23506,MINI PLAYING CARDS SPACEBOY ,2,10/28/2011 16:45,0.42,14071,United Kingdom
573311,22151,PLACE SETTING WHITE HEART,5,10/28/2011 16:45,0.42,14071,United Kingdom
573311,21442,GREEN BIRDHOUSE DECORATION,3,10/28/2011 16:45,0.85,14071,United Kingdom
573311,21441,BLUE BIRDHOUSE DECORATION,3,10/28/2011 16:45,0.85,14071,United Kingdom
573311,22597,MUSICAL ZINC HEART DECORATION ,3,10/28/2011 16:45,0.29,14071,United Kingdom
573311,21172,PARTY METAL SIGN ,2,10/28/2011 16:45,1.45,14071,United Kingdom
573311,85078,SCANDINAVIAN 3 HEARTS NAPKIN RING,4,10/28/2011 16:45,0.19,14071,United Kingdom
573311,23356,LOVE HOT WATER BOTTLE,1,10/28/2011 16:45,5.95,14071,United Kingdom
573311,22110,BIRD HOUSE HOT WATER BOTTLE,1,10/28/2011 16:45,2.55,14071,United Kingdom
573311,23322,LARGE WHITE HEART OF WICKER,1,10/28/2011 16:45,2.95,14071,United Kingdom
573311,84926D,LA PALMIERA TILE COASTER,4,10/28/2011 16:45,0.29,14071,United Kingdom
573311,84926F,PSYCHEDELIC TILE COASTER,4,10/28/2011 16:45,0.29,14071,United Kingdom
573311,22532,MAGIC DRAWING SLATE LEAP FROG ,2,10/28/2011 16:45,0.42,14071,United Kingdom
573311,22533,MAGIC DRAWING SLATE BAKE A CAKE ,2,10/28/2011 16:45,0.42,14071,United Kingdom
573313,22086,PAPER CHAIN KIT 50'S CHRISTMAS ,1,10/28/2011 16:46,5.79,,United Kingdom
573313,22593,CHRISTMAS GINGHAM STAR,1,10/28/2011 16:46,1.63,,United Kingdom
573313,22601,CHRISTMAS RETROSPOT ANGEL WOOD,1,10/28/2011 16:46,1.63,,United Kingdom
573313,23212,HEART WREATH DECORATION WITH BELL,2,10/28/2011 16:46,2.46,,United Kingdom
573313,23263,SET OF 3 WOODEN HEART DECORATIONS,1,10/28/2011 16:46,2.46,,United Kingdom
573313,23313,VINTAGE CHRISTMAS BUNTING,1,10/28/2011 16:46,10.79,,United Kingdom
573313,DOT,DOTCOM POSTAGE,1,10/28/2011 16:46,3.29,,United Kingdom
573314,22526,WHEELBARROW FOR CHILDREN ,1,10/28/2011 17:26,12.75,16987,United Kingdom
573314,22487,WHITE WOOD GARDEN PLANT LADDER,1,10/28/2011 17:26,9.95,16987,United Kingdom
573314,23301,GARDENERS KNEELING PAD KEEP CALM ,10,10/28/2011 17:26,1.65,16987,United Kingdom
573314,23300,GARDENERS KNEELING PAD CUP OF TEA ,10,10/28/2011 17:26,1.65,16987,United Kingdom
573314,23356,LOVE HOT WATER BOTTLE,5,10/28/2011 17:26,5.95,16987,United Kingdom
573314,22835,HOT WATER BOTTLE I AM SO POORLY,5,10/28/2011 17:26,4.95,16987,United Kingdom
573314,22114,HOT WATER BOTTLE TEA AND SYMPATHY,5,10/28/2011 17:26,4.25,16987,United Kingdom
573314,22633,HAND WARMER UNION JACK,5,10/28/2011 17:26,2.1,16987,United Kingdom
