570688,22418,10 COLOUR SPACEBOY PEN,1,10/11/2011 16:29,1.63,,United Kingdom
570688,22423,REGENCY CAKESTAND 3 TIER,2,10/11/2011 16:29,24.96,,United Kingdom
570688,22449,SILK PURSE BABUSHKA PINK,3,10/11/2011 16:29,2.46,,United Kingdom
570688,22452,MEASURING TAPE BABUSHKA PINK,4,10/11/2011 16:29,1.63,,United Kingdom
570688,22465,HANGING METAL STAR LANTERN,4,10/11/2011 16:29,3.29,,United Kingdom
570688,22470,HEART OF WICKER LARGE,1,10/11/2011 16:29,5.79,,United Kingdom
570688,22507,MEMO BOARD RETROSPOT  DESIGN,1,10/11/2011 16:29,10.79,,United Kingdom
570688,22534,MAGIC DRAWING SLATE SPACEBOY ,2,10/11/2011 16:29,0.83,,United Kingdom
570688,22544,MINI JIGSAW SPACEBOY,1,10/11/2011 16:29,0.83,,United Kingdom
570688,22548,HEADS AND TAILS SPORTING FUN,3,10/11/2011 16:29,2.46,,United Kingdom
570688,22555,PLASTERS IN TIN STRONGMAN,1,10/11/2011 16:29,3.29,,United Kingdom
570688,22565,FELTCRAFT HAIRBANDS PINK AND WHITE ,1,10/11/2011 16:29,1.63,,United Kingdom
570688,22566,FELTCRAFT HAIRBAND PINK AND PURPLE,1,10/11/2011 16:29,1.63,,United Kingdom
570688,22571,ROCKING HORSE RED CHRISTMAS ,3,10/11/2011 16:29,1.63,,United Kingdom
570688,22572,ROCKING HORSE GREEN CHRISTMAS ,2,10/11/2011 16:29,1.63,,United Kingdom
570688,22577,WOODEN HEART CHRISTMAS SCANDINAVIAN,8,10/11/2011 16:29,0.83,,United Kingdom
570688,22578,WOODEN STAR CHRISTMAS SCANDINAVIAN,11,10/11/2011 16:29,0.83,,United Kingdom
570688,22579,WOODEN TREE CHRISTMAS SCANDINAVIAN,9,10/11/2011 16:29,0.83,,United Kingdom
570688,22580,ADVENT CALENDAR GINGHAM SACK,2,10/11/2011 16:29,4.13,,United Kingdom
570688,22581,WOOD STOCKING CHRISTMAS SCANDISPOT,7,10/11/2011 16:29,0.83,,United Kingdom
570688,22582,PACK OF 6 SWEETIE GIFT BOXES,1,10/11/2011 16:29,4.96,,United Kingdom
570688,22591,CARDHOLDER GINGHAM CHRISTMAS TREE,1,10/11/2011 16:29,6.63,,United Kingdom
570688,22595,GINGHAM HEART DECORATION,1,10/11/2011 16:29,1.63,,United Kingdom
570688,22597,MUSICAL ZINC HEART DECORATION ,7,10/11/2011 16:29,0.83,,United Kingdom
570688,22598,CHRISTMAS MUSICAL ZINC TREE,1,10/11/2011 16:29,0.83,,United Kingdom
570688,22599,CHRISTMAS MUSICAL ZINC STAR,7,10/11/2011 16:29,0.83,,United Kingdom
570688,22601,CHRISTMAS RETROSPOT ANGEL WOOD,1,10/11/2011 16:29,1.63,,United Kingdom
570688,22613,PACK OF 20 SPACEBOY NAPKINS,1,10/11/2011 16:29,1.63,,United Kingdom
570688,22645,CERAMIC HEART FAIRY CAKE MONEY BANK,1,10/11/2011 16:29,3.29,,United Kingdom
570688,22646,CERAMIC STRAWBERRY CAKE MONEY BANK,1,10/11/2011 16:29,3.29,,United Kingdom
570688,22651,GENTLEMAN SHIRT REPAIR KIT ,1,10/11/2011 16:29,1.63,,United Kingdom
570688,22653,BUTTON BOX ,4,10/11/2011 16:29,1.63,,United Kingdom
570688,22663,JUMBO BAG DOLLY GIRL DESIGN,1,10/11/2011 16:29,4.13,,United Kingdom
570688,22665,RECIPE BOX BLUE SKETCHBOOK DESIGN,1,10/11/2011 16:29,5.79,,United Kingdom
570688,22666,RECIPE BOX PANTRY YELLOW DESIGN,2,10/11/2011 16:29,5.79,,United Kingdom
570688,22675,FRENCH KITCHEN SIGN BLUE METAL,1,10/11/2011 16:29,2.46,,United Kingdom
570688,22680,FRENCH BLUE METAL DOOR SIGN 5,2,10/11/2011 16:29,2.46,,United Kingdom
570688,22697,GREEN REGENCY TEACUP AND SAUCER,1,10/11/2011 16:29,5.79,,United Kingdom
570688,22716,CARD CIRCUS PARADE,2,10/11/2011 16:29,0.83,,United Kingdom
570688,22720,SET OF 3 CAKE TINS PANTRY DESIGN ,1,10/11/2011 16:29,10.79,,United Kingdom
570688,22722,SET OF 6 SPICE TINS PANTRY DESIGN,1,10/11/2011 16:29,8.29,,United Kingdom
570688,22726,ALARM CLOCK BAKELIKE GREEN,1,10/11/2011 16:29,7.46,,United Kingdom
570688,22730,ALARM CLOCK BAKELIKE IVORY,1,10/11/2011 16:29,7.46,,United Kingdom
570688,22734,SET OF 6 RIBBONS VINTAGE CHRISTMAS,1,10/11/2011 16:29,5.79,,United Kingdom
570688,22738,RIBBON REEL SNOWY VILLAGE,1,10/11/2011 16:29,3.29,,United Kingdom
570688,22766,PHOTO FRAME CORNICE,2,10/11/2011 16:29,5.79,,United Kingdom
570688,22795,SWEETHEART RECIPE BOOK STAND,1,10/11/2011 16:29,13.29,,United Kingdom
570688,22800,ANTIQUE TALL SWIRLGLASS TRINKET POT,1,10/11/2011 16:29,7.46,,United Kingdom
570688,22814,CARD PARTY GAMES ,3,10/11/2011 16:29,0.42,,United Kingdom
570688,22815,CARD PSYCHEDELIC APPLES,1,10/11/2011 16:29,0.42,,United Kingdom
