573340,23287,RED VINTAGE SPOT BEAKER,1,10/30/2011 11:55,0.85,14159,United Kingdom
573340,20726,LUNCH BAG WOODLAND,3,10/30/2011 11:55,1.65,14159,United Kingdom
573340,21240,BLUE POLKADOT CUP,2,10/30/2011 11:55,0.85,14159,United Kingdom
573340,21239,PINK  POLKADOT CUP,2,10/30/2011 11:55,0.85,14159,United Kingdom
573340,21238,RED RETROSPOT CUP,2,10/30/2011 11:55,0.85,14159,United Kingdom
573340,22993,SET OF 4 PANTRY JELLY MOULDS,4,10/30/2011 11:55,1.25,14159,United Kingdom
573340,22661,CHARLOTTE BAG DOLLY GIRL DESIGN,4,10/30/2011 11:55,0.85,14159,United Kingdom
573340,23208,LUNCH BAG VINTAGE LEAF DESIGN,1,10/30/2011 11:55,1.65,14159,United Kingdom
573340,23207,LUNCH BAG ALPHABET DESIGN,2,10/30/2011 11:55,1.65,14159,United Kingdom
573340,22383,LUNCH BAG SUKI DESIGN ,6,10/30/2011 11:55,1.65,14159,United Kingdom
573340,20723,STRAWBERRY CHARLOTTE BAG,6,10/30/2011 11:55,0.85,14159,United Kingdom
573340,23204,CHARLOTTE BAG APPLES DESIGN,4,10/30/2011 11:55,0.85,14159,United Kingdom
573340,23206,LUNCH BAG APPLE DESIGN,3,10/30/2011 11:55,1.65,14159,United Kingdom
573340,22646,CERAMIC STRAWBERRY CAKE MONEY BANK,4,10/30/2011 11:55,1.45,14159,United Kingdom
573340,22645,CERAMIC HEART FAIRY CAKE MONEY BANK,4,10/30/2011 11:55,1.45,14159,United Kingdom
573340,22356,CHARLOTTE BAG PINK POLKADOT,4,10/30/2011 11:55,0.85,14159,United Kingdom
573340,22355,CHARLOTTE BAG SUKI DESIGN,5,10/30/2011 11:55,0.85,14159,United Kingdom
573340,23205,CHARLOTTE BAG VINTAGE ALPHABET ,4,10/30/2011 11:55,0.85,14159,United Kingdom
573340,23583,LUNCH BAG PAISLEY PARK  ,4,10/30/2011 11:55,1.65,14159,United Kingdom
573340,22384,LUNCH BAG PINK POLKADOT,4,10/30/2011 11:55,1.65,14159,United Kingdom
573340,22378,WALL TIDY RETROSPOT ,1,10/30/2011 11:55,2.1,14159,United Kingdom
573340,20718,RED RETROSPOT SHOPPER BAG,4,10/30/2011 11:55,1.25,14159,United Kingdom
573340,20724,RED RETROSPOT CHARLOTTE BAG,4,10/30/2011 11:55,0.85,14159,United Kingdom
573340,20725,LUNCH BAG RED RETROSPOT,4,10/30/2011 11:55,1.65,14159,United Kingdom
573340,21034,REX CASH+CARRY JUMBO SHOPPER,2,10/30/2011 11:55,0.95,14159,United Kingdom
573340,23201,JUMBO BAG ALPHABET,2,10/30/2011 11:55,2.08,14159,United Kingdom
573341,22944,CHRISTMAS METAL POSTCARD WITH BELLS,72,10/30/2011 11:55,0.39,16949,United Kingdom
573341,23349,ROLL WRAP VINTAGE CHRISTMAS,12,10/30/2011 11:55,1.25,16949,United Kingdom
573341,23485,BOTANICAL GARDENS WALL CLOCK ,1,10/30/2011 11:55,25,16949,United Kingdom
573341,23311,VINTAGE CHRISTMAS STOCKING ,6,10/30/2011 11:55,2.55,16949,United Kingdom
573341,22816,CARD MOTORBIKE SANTA,12,10/30/2011 11:55,0.42,16949,United Kingdom
573341,22818,CARD CHRISTMAS VILLAGE,12,10/30/2011 11:55,0.42,16949,United Kingdom
573341,84879,ASSORTED COLOUR BIRD ORNAMENT,8,10/30/2011 11:55,1.69,16949,United Kingdom
573341,21340,CLASSIC METAL BIRDCAGE PLANT HOLDER,1,10/30/2011 11:55,12.75,16949,United Kingdom
573341,22355,CHARLOTTE BAG SUKI DESIGN,10,10/30/2011 11:55,0.85,16949,United Kingdom
573341,20718,RED RETROSPOT SHOPPER BAG,10,10/30/2011 11:55,1.25,16949,United Kingdom
573341,85176,SEWING SUSAN 21 NEEDLE SET,12,10/30/2011 11:55,0.85,16949,United Kingdom
573341,90057,DIAMANTE RING ASSORTED IN BOX.,24,10/30/2011 11:55,1.25,16949,United Kingdom
573341,23368,SET 12 COLOUR PENCILS DOLLY GIRL ,16,10/30/2011 11:55,0.65,16949,United Kingdom
573341,20974,12 PENCILS SMALL TUBE SKULL,24,10/30/2011 11:55,0.65,16949,United Kingdom
573341,23108,SET OF 10 LED DOLLY LIGHTS,2,10/30/2011 11:55,6.25,16949,United Kingdom
573341,23534,WALL ART STOP FOR TEA ,3,10/30/2011 11:55,5.95,16949,United Kingdom
573341,21918,SET 12 KIDS COLOUR  CHALK STICKS,24,10/30/2011 11:55,0.42,16949,United Kingdom
573341,23493,VINTAGE DOILY TRAVEL SEWING KIT,10,10/30/2011 11:55,1.95,16949,United Kingdom
573341,22138,BAKING SET 9 PIECE RETROSPOT ,3,10/30/2011 11:55,4.95,16949,United Kingdom
573341,84077,WORLD WAR 2 GLIDERS ASSTD DESIGNS,48,10/30/2011 11:55,0.29,16949,United Kingdom
573341,22617,BAKING SET SPACEBOY DESIGN,3,10/30/2011 11:55,4.95,16949,United Kingdom
573342,22487,WHITE WOOD GARDEN PLANT LADDER,2,10/30/2011 11:56,9.95,14582,United Kingdom
573342,21809,CHRISTMAS HANGING TREE WITH BELL,4,10/30/2011 11:56,0.39,14582,United Kingdom
573342,22831,WHITE BROCANTE SOAP DISH,12,10/30/2011 11:56,2.95,14582,United Kingdom
