573579,23534,WALL ART STOP FOR TEA ,3,10/31/2011 14:19,5.95,15033,United Kingdom
573579,22488,NATURAL SLATE RECTANGLE CHALKBOARD,3,10/31/2011 14:19,1.65,15033,United Kingdom
573579,23535,WALL ART BICYCLE SAFETY,2,10/31/2011 14:19,5.95,15033,United Kingdom
573579,23426,METAL SIGN DROP YOUR PANTS,1,10/31/2011 14:19,2.89,15033,United Kingdom
573579,21174,POTTERING IN THE SHED METAL SIGN,1,10/31/2011 14:19,2.08,15033,United Kingdom
573579,23583,LUNCH BAG PAISLEY PARK  ,2,10/31/2011 14:19,1.65,15033,United Kingdom
573579,17003,BROCADE RING PURSE ,36,10/31/2011 14:19,0.39,15033,United Kingdom
573579,23198,PANTRY MAGNETIC  SHOPPING LIST,2,10/31/2011 14:19,1.45,15033,United Kingdom
573579,23197,SKETCHBOOK MAGNETIC SHOPPING LIST,2,10/31/2011 14:19,1.45,15033,United Kingdom
573579,23196,VINTAGE LEAF MAGNETIC NOTEPAD,2,10/31/2011 14:19,1.45,15033,United Kingdom
573579,22466,FAIRY TALE COTTAGE NIGHT LIGHT,4,10/31/2011 14:19,1.95,15033,United Kingdom
573579,22558,CLOTHES PEGS RETROSPOT PACK 24 ,6,10/31/2011 14:19,1.65,15033,United Kingdom
573579,22910,PAPER CHAIN KIT VINTAGE CHRISTMAS,3,10/31/2011 14:19,2.95,15033,United Kingdom
573579,22086,PAPER CHAIN KIT 50'S CHRISTMAS ,3,10/31/2011 14:19,2.95,15033,United Kingdom
573579,22597,MUSICAL ZINC HEART DECORATION ,12,10/31/2011 14:19,0.29,15033,United Kingdom
573579,22599,CHRISTMAS MUSICAL ZINC STAR,6,10/31/2011 14:19,0.29,15033,United Kingdom
573579,22575,METAL MERRY CHRISTMAS WREATH,3,10/31/2011 14:19,1.95,15033,United Kingdom
573579,22065,CHRISTMAS PUDDING TRINKET POT ,4,10/31/2011 14:19,0.39,15033,United Kingdom
573579,23301,GARDENERS KNEELING PAD KEEP CALM ,6,10/31/2011 14:19,1.65,15033,United Kingdom
573579,21034,REX CASH+CARRY JUMBO SHOPPER,1,10/31/2011 14:19,0.95,15033,United Kingdom
573580,21802,CHRISTMAS TREE HEART DECORATION,1,10/31/2011 14:21,0.83,,United Kingdom
573580,15056bl,EDWARDIAN PARASOL BLACK,2,10/31/2011 14:21,12.46,,United Kingdom
573580,15056n,EDWARDIAN PARASOL NATURAL,2,10/31/2011 14:21,12.46,,United Kingdom
573580,20679,EDWARDIAN PARASOL RED,3,10/31/2011 14:21,12.46,,United Kingdom
573580,20712,JUMBO BAG WOODLAND ANIMALS,2,10/31/2011 14:21,4.13,,United Kingdom
573580,20713,JUMBO BAG OWLS,1,10/31/2011 14:21,4.13,,United Kingdom
573580,20726,LUNCH BAG WOODLAND,1,10/31/2011 14:21,4.96,,United Kingdom
573580,21169,YOU'RE CONFUSING ME METAL SIGN ,1,10/31/2011 14:21,4.13,,United Kingdom
573580,21174,POTTERING IN THE SHED METAL SIGN,2,10/31/2011 14:21,4.13,,United Kingdom
573580,21181,PLEASE ONE PERSON METAL SIGN,2,10/31/2011 14:21,4.13,,United Kingdom
573580,21192,WHITE BELL HONEYCOMB PAPER ,2,10/31/2011 14:21,3.29,,United Kingdom
573580,21218,RED SPOTTY BISCUIT TIN,1,10/31/2011 14:21,8.29,,United Kingdom
573580,21232,STRAWBERRY CERAMIC TRINKET POT,4,10/31/2011 14:21,2.46,,United Kingdom
573580,21257,VICTORIAN SEWING BOX MEDIUM,1,10/31/2011 14:21,15.79,,United Kingdom
573580,21428,SET3 BOOK BOX GREEN GINGHAM FLOWER ,1,10/31/2011 14:21,8.29,,United Kingdom
573580,21507,ELEPHANT BIRTHDAY CARD ,1,10/31/2011 14:21,0.83,,United Kingdom
573580,21580,RABBIT  DESIGN  COTTON TOTE BAG,1,10/31/2011 14:21,4.96,,United Kingdom
573580,21731,RED TOADSTOOL LED NIGHT LIGHT,2,10/31/2011 14:21,4.13,,United Kingdom
573580,21773,DECORATIVE ROSE BATHROOM BOTTLE,1,10/31/2011 14:21,2.46,,United Kingdom
573580,21774,DECORATIVE CATS BATHROOM BOTTLE,1,10/31/2011 14:21,2.46,,United Kingdom
573580,21775,DECORATIVE FLORE BATHROOM BOTTLE,1,10/31/2011 14:21,2.46,,United Kingdom
573580,21803,CHRISTMAS TREE STAR DECORATION,6,10/31/2011 14:21,0.83,,United Kingdom
573580,21864,UNION JACK FLAG PASSPORT COVER ,1,10/31/2011 14:21,4.13,,United Kingdom
573580,21876,POTTERING MUG,2,10/31/2011 14:21,3.29,,United Kingdom
573580,21888,BINGO SET,1,10/31/2011 14:21,7.46,,United Kingdom
573580,21889,WOODEN BOX OF DOMINOES,1,10/31/2011 14:21,3.29,,United Kingdom
573580,21928,JUMBO BAG SCANDINAVIAN BLUE PAISLEY,1,10/31/2011 14:21,4.13,,United Kingdom
573580,21929,JUMBO BAG PINK VINTAGE PAISLEY,1,10/31/2011 14:21,4.13,,United Kingdom
573580,21930,JUMBO STORAGE BAG SKULLS,1,10/31/2011 14:21,4.13,,United Kingdom
573580,21931,JUMBO STORAGE BAG SUKI,1,10/31/2011 14:21,4.13,,United Kingdom
