573585,22207,FRYING PAN UNION FLAG,1,10/31/2011 14:41,8.29,,United Kingdom
573585,22211,WOOD STAMP SET FLOWERS,1,10/31/2011 14:41,3.29,,United Kingdom
573585,22215,CAKE STAND WHITE TWO TIER LACE,1,10/31/2011 14:41,16.63,,United Kingdom
573585,22219,LOVEBIRD HANGING DECORATION WHITE ,13,10/31/2011 14:41,1.63,,United Kingdom
573585,22220,CAKE STAND LOVEBIRD 2 TIER WHITE,1,10/31/2011 14:41,19.96,,United Kingdom
573585,22221,CAKE STAND LOVEBIRD 2 TIER PINK,1,10/31/2011 14:41,19.96,,United Kingdom
573585,22246,MAGIC GARDEN FELT GARLAND ,2,10/31/2011 14:41,4.13,,United Kingdom
573585,22251,BIRDHOUSE DECORATION MAGIC GARDEN,1,10/31/2011 14:41,2.46,,United Kingdom
573585,22260,FELT EGG COSY BLUE RABBIT ,4,10/31/2011 14:41,1.63,,United Kingdom
573585,22261,FELT EGG COSY WHITE RABBIT ,1,10/31/2011 14:41,1.63,,United Kingdom
573585,22262,FELT EGG COSY CHICKEN,1,10/31/2011 14:41,1.63,,United Kingdom
573585,22263,FELT EGG COSY LADYBIRD ,1,10/31/2011 14:41,1.63,,United Kingdom
573585,22273,FELTCRAFT DOLL MOLLY,1,10/31/2011 14:41,5.79,,United Kingdom
573585,22279,POCKET BAG BLUE PAISLEY RED SPOT,2,10/31/2011 14:41,2.46,,United Kingdom
573585,22280,POCKET BAG PINK PAISELY BROWN SPOT,4,10/31/2011 14:41,2.46,,United Kingdom
573585,22282,12 EGG HOUSE PAINTED WOOD,2,10/31/2011 14:41,24.96,,United Kingdom
573585,22284,HEN HOUSE DECORATION,1,10/31/2011 14:41,3.29,,United Kingdom
573585,22294,HEART FILIGREE DOVE  SMALL,1,10/31/2011 14:41,2.46,,United Kingdom
573585,22297,HEART IVORY TRELLIS SMALL,2,10/31/2011 14:41,2.46,,United Kingdom
573585,22308,TEA COSY BLUE STRIPE,1,10/31/2011 14:41,4.96,,United Kingdom
573585,22309,TEA COSY RED  STRIPE,1,10/31/2011 14:41,4.96,,United Kingdom
573585,22310,IVORY KNITTED MUG COSY ,2,10/31/2011 14:41,3.29,,United Kingdom
573585,22316,200 BENDY SKULL STRAWS,1,10/31/2011 14:41,2.46,,United Kingdom
573585,22321,BIRD DECORATION RED RETROSPOT,1,10/31/2011 14:41,1.63,,United Kingdom
573585,22326,ROUND SNACK BOXES SET OF4 WOODLAND ,2,10/31/2011 14:41,5.79,,United Kingdom
573585,22327,ROUND SNACK BOXES SET OF 4 SKULLS,2,10/31/2011 14:41,5.79,,United Kingdom
573585,22328,ROUND SNACK BOXES SET OF 4 FRUITS ,1,10/31/2011 14:41,5.79,,United Kingdom
573585,22329,ROUND CONTAINER SET OF 5 RETROSPOT,2,10/31/2011 14:41,3.29,,United Kingdom
573585,22335,HEART DECORATION PAINTED ZINC ,11,10/31/2011 14:41,1.25,,United Kingdom
573585,22337,ANGEL DECORATION PAINTED ZINC ,21,10/31/2011 14:41,0.63,,United Kingdom
573585,22338,STAR DECORATION PAINTED ZINC ,36,10/31/2011 14:41,0.63,,United Kingdom
573585,22339,CHRISTMAS TREE PAINTED ZINC ,20,10/31/2011 14:41,0.63,,United Kingdom
573585,22340,NOEL GARLAND PAINTED ZINC ,42,10/31/2011 14:41,0.83,,United Kingdom
573585,22348,TEA BAG PLATE RED RETROSPOT,1,10/31/2011 14:41,1.63,,United Kingdom
573585,22349,DOG BOWL CHASING BALL DESIGN,1,10/31/2011 14:41,7.46,,United Kingdom
573585,22350,ILLUSTRATED CAT BOWL ,1,10/31/2011 14:41,4.96,,United Kingdom
573585,22352,LUNCH BOX WITH CUTLERY RETROSPOT ,2,10/31/2011 14:41,4.96,,United Kingdom
573585,22354,RETROSPOT PADDED SEAT CUSHION,4,10/31/2011 14:41,7.46,,United Kingdom
573585,22355,CHARLOTTE BAG SUKI DESIGN,16,10/31/2011 14:41,0.85,,United Kingdom
573585,22356,CHARLOTTE BAG PINK POLKADOT,12,10/31/2011 14:41,0.85,,United Kingdom
573585,22357,KINGS CHOICE BISCUIT TIN,1,10/31/2011 14:41,4.13,,United Kingdom
573585,22362,GLASS JAR PEACOCK BATH SALTS,1,10/31/2011 14:41,5.79,,United Kingdom
573585,22363,GLASS JAR MARMALADE ,2,10/31/2011 14:41,5.79,,United Kingdom
573585,22364,GLASS JAR DIGESTIVE BISCUITS,1,10/31/2011 14:41,5.79,,United Kingdom
573585,22367,CHILDRENS APRON SPACEBOY DESIGN,1,10/31/2011 14:41,4.13,,United Kingdom
573585,22371,AIRLINE BAG VINTAGE TOKYO 78,1,10/31/2011 14:41,8.29,,United Kingdom
573585,22372,AIRLINE BAG VINTAGE WORLD CHAMPION ,1,10/31/2011 14:41,8.29,,United Kingdom
573585,22377,BOTTLE BAG RETROSPOT ,1,10/31/2011 14:41,4.13,,United Kingdom
573585,22378,WALL TIDY RETROSPOT ,2,10/31/2011 14:41,4.13,,United Kingdom
573585,22379,RECYCLING BAG RETROSPOT ,1,10/31/2011 14:41,4.13,,United Kingdom
