573746,85099F,JUMBO BAG STRAWBERRY,10,11/01/2011 09:01,2.08,13461,United Kingdom
573747,20956,PORCELAIN T-LIGHT HOLDERS ASSORTED,12,11/01/2011 09:14,1.25,13697,United Kingdom
573747,21479,WHITE SKULL HOT WATER BOTTLE ,4,11/01/2011 09:14,4.25,13697,United Kingdom
573747,21824,PAINTED METAL STAR WITH HOLLY BELLS,24,11/01/2011 09:14,0.39,13697,United Kingdom
573747,22051,BLUE SCANDINAVIAN PAISLEY WRAP,25,11/01/2011 09:14,0.42,13697,United Kingdom
573747,22114,HOT WATER BOTTLE TEA AND SYMPATHY,4,11/01/2011 09:14,4.25,13697,United Kingdom
573747,22469,HEART OF WICKER SMALL,12,11/01/2011 09:14,1.65,13697,United Kingdom
573747,22574,HEART WOODEN CHRISTMAS DECORATION,12,11/01/2011 09:14,0.85,13697,United Kingdom
573747,22577,WOODEN HEART CHRISTMAS SCANDINAVIAN,24,11/01/2011 09:14,0.29,13697,United Kingdom
573747,22593,CHRISTMAS GINGHAM STAR,12,11/01/2011 09:14,0.85,13697,United Kingdom
573747,22595,GINGHAM HEART DECORATION,12,11/01/2011 09:14,0.85,13697,United Kingdom
573747,22815,CARD PSYCHEDELIC APPLES,24,11/01/2011 09:14,0.42,13697,United Kingdom
573747,84946,ANTIQUE SILVER T-LIGHT GLASS,12,11/01/2011 09:14,1.25,13697,United Kingdom
573748,22086,PAPER CHAIN KIT 50'S CHRISTMAS ,12,11/01/2011 09:24,2.95,14911,EIRE
573748,22470,HEART OF WICKER LARGE,12,11/01/2011 09:24,2.95,14911,EIRE
573748,23130,MISTLETOE HEART WREATH GREEN,8,11/01/2011 09:24,4.15,14911,EIRE
573748,84946,ANTIQUE SILVER T-LIGHT GLASS,24,11/01/2011 09:24,1.25,14911,EIRE
573748,84947,ANTIQUE SILVER TEA GLASS ENGRAVED,12,11/01/2011 09:24,1.25,14911,EIRE
573748,84949,SILVER HANGING T-LIGHT HOLDER,12,11/01/2011 09:24,1.65,14911,EIRE
573748,22141,CHRISTMAS CRAFT TREE TOP ANGEL,12,11/01/2011 09:24,2.1,14911,EIRE
573748,22694,WICKER STAR ,12,11/01/2011 09:24,2.1,14911,EIRE
573748,22696,WICKER WREATH LARGE,6,11/01/2011 09:24,1.95,14911,EIRE
573748,84836,ZINC METAL HEART DECORATION,12,11/01/2011 09:24,1.25,14911,EIRE
573748,23060,HEART BEADED TRELLIS DECORATION,12,11/01/2011 09:24,2.08,14911,EIRE
573748,23490,T-LIGHT HOLDER HANGING LOVE BIRD,6,11/01/2011 09:24,3.75,14911,EIRE
573748,85053,FRENCH ENAMEL CANDLEHOLDER,6,11/01/2011 09:24,2.1,14911,EIRE
573748,84879,ASSORTED COLOUR BIRD ORNAMENT,24,11/01/2011 09:24,1.69,14911,EIRE
573748,21136,PAINTED METAL PEARS ASSORTED,24,11/01/2011 09:24,1.69,14911,EIRE
573748,22469,HEART OF WICKER SMALL,12,11/01/2011 09:24,1.65,14911,EIRE
573748,23012,GLASS APOTHECARY BOTTLE PERFUME,12,11/01/2011 09:24,3.45,14911,EIRE
573748,23013,GLASS APOTHECARY BOTTLE TONIC,12,11/01/2011 09:24,3.45,14911,EIRE
573748,23245,SET OF 3 REGENCY CAKE TINS,8,11/01/2011 09:24,4.95,14911,EIRE
573748,23170,REGENCY TEA PLATE ROSES ,12,11/01/2011 09:24,1.65,14911,EIRE
573748,23171,REGENCY TEA PLATE GREEN ,12,11/01/2011 09:24,1.65,14911,EIRE
573748,23172,REGENCY TEA PLATE PINK,12,11/01/2011 09:24,1.65,14911,EIRE
573748,23174,REGENCY SUGAR BOWL GREEN,12,11/01/2011 09:24,4.15,14911,EIRE
573748,23175,REGENCY MILK JUG PINK ,12,11/01/2011 09:24,3.25,14911,EIRE
573748,22423,REGENCY CAKESTAND 3 TIER,3,11/01/2011 09:24,12.75,14911,EIRE
573748,23497,CLASSIC CHROME BICYCLE BELL ,12,11/01/2011 09:24,1.45,14911,EIRE
573748,23571,TRADITIONAL NAUGHTS & CROSSES,24,11/01/2011 09:24,1.65,14911,EIRE
573748,21790,VINTAGE SNAP CARDS,24,11/01/2011 09:24,0.85,14911,EIRE
573748,23084,RABBIT NIGHT LIGHT,12,11/01/2011 09:24,2.08,14911,EIRE
573748,22555,PLASTERS IN TIN STRONGMAN,12,11/01/2011 09:24,1.65,14911,EIRE
573748,22197,POPCORN HOLDER,36,11/01/2011 09:24,0.85,14911,EIRE
573748,22744,MAKE YOUR OWN MONSOON CARD KIT,6,11/01/2011 09:24,2.95,14911,EIRE
573748,22940,FELTCRAFT CHRISTMAS FAIRY,4,11/01/2011 09:24,4.25,14911,EIRE
573748,22554,PLASTERS IN TIN WOODLAND ANIMALS,12,11/01/2011 09:24,1.65,14911,EIRE
573748,20971,PINK BLUE FELT CRAFT TRINKET BOX,12,11/01/2011 09:24,1.25,14911,EIRE
573748,22271,FELTCRAFT DOLL ROSIE,6,11/01/2011 09:24,2.95,14911,EIRE
573748,22273,FELTCRAFT DOLL MOLLY,6,11/01/2011 09:24,2.95,14911,EIRE
