570871,23319,BOX OF 6 MINI 50'S CRACKERS,2,10/12/2011 16:36,4.96,,United Kingdom
570871,23320,GIANT 50'S CHRISTMAS CRACKER,1,10/12/2011 16:36,5.79,,United Kingdom
570871,23321,SMALL WHITE HEART OF WICKER,6,10/12/2011 16:36,3.29,,United Kingdom
570871,23328,SET 6 SCHOOL MILK BOTTLES IN CRATE,6,10/12/2011 16:36,7.46,,United Kingdom
570871,23344,JUMBO BAG 50'S CHRISTMAS ,1,10/12/2011 16:36,4.13,,United Kingdom
570871,23348,CHILDRENS TOY COOKING UTENSIL SET,1,10/12/2011 16:36,4.13,,United Kingdom
570871,23349,ROLL WRAP VINTAGE CHRISTMAS,2,10/12/2011 16:36,2.46,,United Kingdom
570871,23350,ROLL WRAP VINTAGE SPOT ,2,10/12/2011 16:36,2.46,,United Kingdom
570871,23353,6 GIFT TAGS VINTAGE CHRISTMAS ,3,10/12/2011 16:36,1.63,,United Kingdom
570871,23356,LOVE HOT WATER BOTTLE,1,10/12/2011 16:36,12.46,,United Kingdom
570871,23369,SET 36 COLOUR PENCILS LOVE LONDON,1,10/12/2011 16:36,2.46,,United Kingdom
570871,23370,SET 36 COLOURING PENCILS DOILY,1,10/12/2011 16:36,2.46,,United Kingdom
570871,23371,SET 36 COLOUR PENCILS SPACEBOY ,1,10/12/2011 16:36,2.46,,United Kingdom
570871,23372,SET 36 COLOUR PENCILS DOLLY GIRL,3,10/12/2011 16:36,2.46,,United Kingdom
570871,23379,PACK OF 12 RED APPLE TISSUES,1,10/12/2011 16:36,0.83,,United Kingdom
570871,23400,SHELF WITH 4 HOOKS HOME SWEET HOME,1,10/12/2011 16:36,12.46,,United Kingdom
570871,23403,LETTER HOLDER HOME SWEET HOME,1,10/12/2011 16:36,7.46,,United Kingdom
570871,23435,3 RAFFIA RIBBONS VINTAGE CHRISTMAS,3,10/12/2011 16:36,0.83,,United Kingdom
570871,23483,HANGING  BUTTERFLY T-LIGHT HOLDER,1,10/12/2011 16:36,15.79,,United Kingdom
570871,23511,EMBROIDERED RIBBON REEL EMILY ,1,10/12/2011 16:36,4.13,,United Kingdom
570871,23512,EMBROIDERED RIBBON REEL ROSIE,1,10/12/2011 16:36,4.13,,United Kingdom
570871,23513,EMBROIDERED RIBBON REEL SUSIE ,1,10/12/2011 16:36,4.13,,United Kingdom
570871,23514,EMBROIDERED RIBBON REEL SALLY ,1,10/12/2011 16:36,4.13,,United Kingdom
570871,23517,EMBROIDERED RIBBON REEL REBECCA ,1,10/12/2011 16:36,5.79,,United Kingdom
570871,23521,WALL ART CAT AND BIRD ,1,10/12/2011 16:36,5.79,,United Kingdom
570871,23559,WOODLAND BUNNIES LOLLY MAKERS,2,10/12/2011 16:36,4.13,,United Kingdom
570871,23614,SET 10 CARDS 12 DAYS WRAP  17058,3,10/12/2011 16:36,3.33,,United Kingdom
570871,23620,SET 10 CARDS PERFECT POST 17090,1,10/12/2011 16:36,2.49,,United Kingdom
570871,35648,VINTAGE BEAD PINK PURSE ,1,10/12/2011 16:36,1.63,,United Kingdom
570871,35964,FOLKART CLIP ON STARS,1,10/12/2011 16:36,0.83,,United Kingdom
570871,35970,ZINC FOLKART SLEIGH BELLS,1,10/12/2011 16:36,4.13,,United Kingdom
570871,46775D,SUNSET COLOUR CHUNKY KNITTED THROW,1,10/12/2011 16:36,8.29,,United Kingdom
570871,46776A,WOVEN BUBBLE GUM CUSHION COVER,1,10/12/2011 16:36,4.13,,United Kingdom
570871,46776B,WOVEN BERRIES CUSHION COVER ,1,10/12/2011 16:36,4.13,,United Kingdom
570871,46776C,WOVEN FROST CUSHION COVER,1,10/12/2011 16:36,4.13,,United Kingdom
570871,46776D,WOVEN SUNSET CUSHION COVER ,1,10/12/2011 16:36,4.13,,United Kingdom
570871,46776E,WOVEN CANDY CUSHION COVER ,1,10/12/2011 16:36,4.13,,United Kingdom
570871,46776F,WOVEN ROSE GARDEN CUSHION COVER ,1,10/12/2011 16:36,4.13,,United Kingdom
570871,47563A,RETRO LONGBOARD IRONING BOARD COVER,1,10/12/2011 16:36,3.29,,United Kingdom
570871,47590B,PINK HAPPY BIRTHDAY BUNTING,2,10/12/2011 16:36,10.79,,United Kingdom
570871,47593B,SCOTTIE DOGS BABY BIB,2,10/12/2011 16:36,0.83,,United Kingdom
570871,51014C,"FEATHER PEN,COAL BLACK",1,10/12/2011 16:36,0.83,,United Kingdom
570871,71459,HANGING JAM JAR T-LIGHT HOLDERS,4,10/12/2011 16:36,1.66,,United Kingdom
570871,72807C,SET/3 VANILLA SCENTED CANDLE IN BOX,1,10/12/2011 16:36,8.29,,United Kingdom
570871,82482,WOODEN PICTURE FRAME WHITE FINISH,1,10/12/2011 16:36,5.79,,United Kingdom
570871,82567,"AIRLINE LOUNGE,METAL SIGN",1,10/12/2011 16:36,1.63,,United Kingdom
570871,82582,AREA PATROLLED METAL SIGN,1,10/12/2011 16:36,4.13,,United Kingdom
570871,82583,HOT BATHS METAL SIGN,2,10/12/2011 16:36,4.13,,United Kingdom
570871,84031A,CHARLIE+LOLA RED HOT WATER BOTTLE ,3,10/12/2011 16:36,4.13,,United Kingdom
570871,84031B,CHARLIE LOLA BLUE HOT WATER BOTTLE ,1,10/12/2011 16:36,4.13,,United Kingdom
