573897,21744,SNOWFLAKE PORTABLE TABLE LIGHT ,12,11/01/2011 14:29,2.95,16729,United Kingdom
573897,21822,GLITTER CHRISTMAS TREE WITH BELLS,12,11/01/2011 14:29,0.79,16729,United Kingdom
573897,23108,SET OF 10 LED DOLLY LIGHTS,2,11/01/2011 14:29,6.25,16729,United Kingdom
573897,22466,FAIRY TALE COTTAGE NIGHT LIGHT,2,11/01/2011 14:29,1.95,16729,United Kingdom
573897,22966,GINGERBREAD MAN COOKIE CUTTER,2,11/01/2011 14:29,1.25,16729,United Kingdom
573897,82616B,FRAPPUCINO SCARF KNITTING KIT,2,11/01/2011 14:29,1.25,16729,United Kingdom
573897,82616C,MIDNIGHT GLAMOUR SCARF KNITTING KIT,2,11/01/2011 14:29,1.25,16729,United Kingdom
573897,21731,RED TOADSTOOL LED NIGHT LIGHT,2,11/01/2011 14:29,1.65,16729,United Kingdom
573897,21263,GREEN GOOSE FEATHER TREE 60CM,4,11/01/2011 14:29,1.95,16729,United Kingdom
573897,21262,WHITE GOOSE FEATHER CHRISTMAS TREE ,4,11/01/2011 14:29,2.95,16729,United Kingdom
573897,21264,WHITE GOOSE FEATHER TREE 60CM ,8,11/01/2011 14:29,1.95,16729,United Kingdom
573898,23301,GARDENERS KNEELING PAD KEEP CALM ,3,11/01/2011 14:35,1.65,14562,United Kingdom
573898,23300,GARDENERS KNEELING PAD CUP OF TEA ,3,11/01/2011 14:35,1.65,14562,United Kingdom
573898,22121,NOEL WOODEN BLOCK LETTERS ,3,11/01/2011 14:35,5.95,14562,United Kingdom
573898,22141,CHRISTMAS CRAFT TREE TOP ANGEL,10,11/01/2011 14:35,2.1,14562,United Kingdom
573898,22144,CHRISTMAS CRAFT LITTLE FRIENDS,5,11/01/2011 14:35,2.1,14562,United Kingdom
573898,22111,SCOTTIE DOG HOT WATER BOTTLE,2,11/01/2011 14:35,4.95,14562,United Kingdom
573898,21485,RETROSPOT HEART HOT WATER BOTTLE,2,11/01/2011 14:35,4.95,14562,United Kingdom
573898,22119,PEACE WOODEN BLOCK LETTERS,3,11/01/2011 14:35,6.95,14562,United Kingdom
573898,82486,3 DRAWER ANTIQUE WHITE WOOD CABINET,4,11/01/2011 14:35,8.95,14562,United Kingdom
573898,22624,IVORY KITCHEN SCALES,1,11/01/2011 14:35,8.5,14562,United Kingdom
573898,22841,ROUND CAKE TIN VINTAGE GREEN,1,11/01/2011 14:35,7.95,14562,United Kingdom
573898,23426,METAL SIGN DROP YOUR PANTS,4,11/01/2011 14:35,2.89,14562,United Kingdom
573898,22115,METAL SIGN EMPIRE TEA,3,11/01/2011 14:35,0.79,14562,United Kingdom
573898,22865,HAND WARMER OWL DESIGN,1,11/01/2011 14:35,2.1,14562,United Kingdom
573898,23439,HAND WARMER RED LOVE HEART,2,11/01/2011 14:35,2.1,14562,United Kingdom
573898,22632,HAND WARMER RED RETROSPOT,1,11/01/2011 14:35,2.1,14562,United Kingdom
573898,22866,HAND WARMER SCOTTY DOG DESIGN,4,11/01/2011 14:35,2.1,14562,United Kingdom
573898,22865,HAND WARMER OWL DESIGN,1,11/01/2011 14:35,2.1,14562,United Kingdom
573898,22866,HAND WARMER SCOTTY DOG DESIGN,1,11/01/2011 14:35,2.1,14562,United Kingdom
573898,23439,HAND WARMER RED LOVE HEART,1,11/01/2011 14:35,2.1,14562,United Kingdom
573898,22632,HAND WARMER RED RETROSPOT,3,11/01/2011 14:35,2.1,14562,United Kingdom
573899,22457,NATURAL SLATE HEART CHALKBOARD ,6,11/01/2011 14:41,2.95,15847,United Kingdom
573899,82484,WOOD BLACK BOARD ANT WHITE FINISH,2,11/01/2011 14:41,7.95,15847,United Kingdom
573899,23393,HOME SWEET HOME CUSHION COVER ,4,11/01/2011 14:41,3.75,15847,United Kingdom
573899,22762,CUPBOARD 3 DRAWER MA CAMPAGNE,1,11/01/2011 14:41,14.95,15847,United Kingdom
573899,23397,FOOT STOOL HOME SWEET HOME ,2,11/01/2011 14:41,9.95,15847,United Kingdom
573899,23403,LETTER HOLDER HOME SWEET HOME,4,11/01/2011 14:41,3.75,15847,United Kingdom
573899,84879,ASSORTED COLOUR BIRD ORNAMENT,16,11/01/2011 14:41,1.69,15847,United Kingdom
573899,22574,HEART WOODEN CHRISTMAS DECORATION,12,11/01/2011 14:41,0.85,15847,United Kingdom
573899,22594,CHRISTMAS GINGHAM TREE,12,11/01/2011 14:41,0.85,15847,United Kingdom
573899,22753,SMALL YELLOW BABUSHKA NOTEBOOK ,12,11/01/2011 14:41,0.85,15847,United Kingdom
573899,22759,SET OF 3 NOTEBOOKS IN PARCEL,12,11/01/2011 14:41,1.65,15847,United Kingdom
573899,23322,LARGE WHITE HEART OF WICKER,6,11/01/2011 14:41,2.95,15847,United Kingdom
573899,22585,PACK OF 6 BIRDY GIFT TAGS,12,11/01/2011 14:41,1.25,15847,United Kingdom
573900,22423,REGENCY CAKESTAND 3 TIER,1,11/01/2011 14:45,12.75,17668,United Kingdom
573900,22720,SET OF 3 CAKE TINS PANTRY DESIGN ,3,11/01/2011 14:45,4.95,17668,United Kingdom
573900,22838,3 TIER CAKE TIN RED AND CREAM,3,11/01/2011 14:45,14.95,17668,United Kingdom
573900,23245,SET OF 3 REGENCY CAKE TINS,4,11/01/2011 14:45,4.95,17668,United Kingdom
573900,22722,SET OF 6 SPICE TINS PANTRY DESIGN,4,11/01/2011 14:45,3.95,17668,United Kingdom
