573665,22111,SCOTTIE DOG HOT WATER BOTTLE,4,10/31/2011 16:24,4.95,13982,United Kingdom
573665,23301,GARDENERS KNEELING PAD KEEP CALM ,1,10/31/2011 16:24,1.65,13982,United Kingdom
573665,20724,RED RETROSPOT CHARLOTTE BAG,10,10/31/2011 16:24,0.85,13982,United Kingdom
573665,22114,HOT WATER BOTTLE TEA AND SYMPATHY,4,10/31/2011 16:24,4.25,13982,United Kingdom
573665,84029E,RED WOOLLY HOTTIE WHITE HEART.,4,10/31/2011 16:24,4.25,13982,United Kingdom
573665,84077,WORLD WAR 2 GLIDERS ASSTD DESIGNS,48,10/31/2011 16:24,0.29,13982,United Kingdom
573665,22766,PHOTO FRAME CORNICE,4,10/31/2011 16:24,2.95,13982,United Kingdom
573666,21807,WHITE CHRISTMAS STAR DECORATION,25,10/31/2011 16:24,0.42,15977,United Kingdom
573666,23320,GIANT 50'S CHRISTMAS CRACKER,4,10/31/2011 16:24,2.89,15977,United Kingdom
573666,21809,CHRISTMAS HANGING TREE WITH BELL,48,10/31/2011 16:24,0.39,15977,United Kingdom
573666,21810,CHRISTMAS HANGING STAR WITH BELL,48,10/31/2011 16:24,0.39,15977,United Kingdom
573666,21811,HANGING HEART WITH BELL,48,10/31/2011 16:24,0.39,15977,United Kingdom
573666,21014,SWISS CHALET TREE DECORATION ,24,10/31/2011 16:24,0.29,15977,United Kingdom
573666,22312,OFFICE MUG WARMER POLKADOT,2,10/31/2011 16:24,2.95,15977,United Kingdom
573666,22311,OFFICE MUG WARMER BLACK+SILVER ,2,10/31/2011 16:24,2.95,15977,United Kingdom
573666,23372,SET 36 COLOUR PENCILS DOLLY GIRL,2,10/31/2011 16:24,1.25,15977,United Kingdom
573666,10135,COLOURING PENCILS BROWN TUBE,2,10/31/2011 16:24,1.25,15977,United Kingdom
573666,23369,SET 36 COLOUR PENCILS LOVE LONDON,2,10/31/2011 16:24,1.25,15977,United Kingdom
573666,22847,BREAD BIN DINER STYLE IVORY,1,10/31/2011 16:24,16.95,15977,United Kingdom
573666,84030E,ENGLISH ROSE HOT WATER BOTTLE,2,10/31/2011 16:24,4.25,15977,United Kingdom
573666,84029G,KNITTED UNION FLAG HOT WATER BOTTLE,2,10/31/2011 16:24,4.25,15977,United Kingdom
573666,84029E,RED WOOLLY HOTTIE WHITE HEART.,2,10/31/2011 16:24,4.25,15977,United Kingdom
573666,22114,HOT WATER BOTTLE TEA AND SYMPATHY,2,10/31/2011 16:24,4.25,15977,United Kingdom
573666,21034,REX CASH+CARRY JUMBO SHOPPER,2,10/31/2011 16:24,0.95,15977,United Kingdom
573666,22624,IVORY KITCHEN SCALES,2,10/31/2011 16:24,8.5,15977,United Kingdom
573666,22625,RED KITCHEN SCALES,2,10/31/2011 16:24,8.5,15977,United Kingdom
573666,22627,MINT KITCHEN SCALES,2,10/31/2011 16:24,8.5,15977,United Kingdom
573666,23321,SMALL WHITE HEART OF WICKER,6,10/31/2011 16:24,1.65,15977,United Kingdom
573666,22469,HEART OF WICKER SMALL,3,10/31/2011 16:24,1.65,15977,United Kingdom
573666,21619,4 VANILLA BOTANICAL CANDLES,24,10/31/2011 16:24,1.25,15977,United Kingdom
573666,23323,WHITE WICKER STAR ,6,10/31/2011 16:24,2.1,15977,United Kingdom
573666,22695,WICKER WREATH SMALL,6,10/31/2011 16:24,1.45,15977,United Kingdom
573666,22170,PICTURE FRAME WOOD TRIPLE PORTRAIT,3,10/31/2011 16:24,6.75,15977,United Kingdom
573666,82484,WOOD BLACK BOARD ANT WHITE FINISH,2,10/31/2011 16:24,7.95,15977,United Kingdom
573666,21616,4 PEAR BOTANICAL DINNER CANDLES,36,10/31/2011 16:24,1.25,15977,United Kingdom
573669,POST,POSTAGE,1,10/31/2011 16:49,2.46,,United Kingdom
573670,22176,check,-28,10/31/2011 17:02,0,,United Kingdom
573672,22522,check,-126,10/31/2011 17:04,0,,United Kingdom
573695,23084,RABBIT NIGHT LIGHT,9,10/31/2011 17:13,2.08,15023,United Kingdom
573695,23553,LANDMARK FRAME CAMDEN TOWN ,2,10/31/2011 17:13,12.5,15023,United Kingdom
573695,23554,LANDMARK FRAME OXFORD STREET,1,10/31/2011 17:13,12.5,15023,United Kingdom
573695,23558,LANDMARK FRAME LONDON BRIDGE ,2,10/31/2011 17:13,12.5,15023,United Kingdom
573695,23555,LANDMARK FRAME NOTTING HILL ,2,10/31/2011 17:13,12.5,15023,United Kingdom
573695,23556,LANDMARK FRAME COVENT GARDEN ,2,10/31/2011 17:13,12.5,15023,United Kingdom
573695,23557,LANDMARK FRAME BAKER STREET ,2,10/31/2011 17:13,12.5,15023,United Kingdom
573695,85123A,WHITE HANGING HEART T-LIGHT HOLDER,32,10/31/2011 17:13,2.55,15023,United Kingdom
573695,23407,SET OF 2 TRAYS HOME SWEET HOME,2,10/31/2011 17:13,9.95,15023,United Kingdom
573695,23543,WALL ART KEEP CALM ,1,10/31/2011 17:13,8.25,15023,United Kingdom
573695,23397,FOOT STOOL HOME SWEET HOME ,4,10/31/2011 17:13,9.95,15023,United Kingdom
573726,72817,check,-67,10/31/2011 17:18,0,,United Kingdom
