570864,22147,FELTCRAFT BUTTERFLY HEARTS,12,10/12/2011 15:41,1.45,16945,United Kingdom
570864,22065,CHRISTMAS PUDDING TRINKET POT ,48,10/12/2011 15:41,0.39,16945,United Kingdom
570864,23344,JUMBO BAG 50'S CHRISTMAS ,30,10/12/2011 15:41,2.08,16945,United Kingdom
570864,21544,SKULLS  WATER TRANSFER TATTOOS ,12,10/12/2011 15:41,0.85,16945,United Kingdom
570864,23202,JUMBO BAG VINTAGE LEAF,10,10/12/2011 15:41,2.08,16945,United Kingdom
570864,23203,JUMBO BAG VINTAGE DOILY ,10,10/12/2011 15:41,2.08,16945,United Kingdom
570864,85099C,JUMBO  BAG BAROQUE BLACK WHITE,10,10/12/2011 15:41,2.08,16945,United Kingdom
570864,85099B,JUMBO BAG RED RETROSPOT,20,10/12/2011 15:41,2.08,16945,United Kingdom
570864,22385,JUMBO BAG SPACEBOY DESIGN,10,10/12/2011 15:41,2.08,16945,United Kingdom
570864,21931,JUMBO STORAGE BAG SUKI,10,10/12/2011 15:41,2.08,16945,United Kingdom
570864,22150,3 STRIPEY MICE FELTCRAFT,12,10/12/2011 15:41,1.95,16945,United Kingdom
570864,20727,LUNCH BAG  BLACK SKULL.,10,10/12/2011 15:41,1.65,16945,United Kingdom
570865,23510,MINI PLAYING CARDS GYMKHANA,20,10/12/2011 15:42,0.42,16945,United Kingdom
570865,23506,MINI PLAYING CARDS SPACEBOY ,20,10/12/2011 15:42,0.42,16945,United Kingdom
570865,23503,PLAYING CARDS KEEP CALM & CARRY ON,12,10/12/2011 15:42,1.25,16945,United Kingdom
570865,23504,PLAYING CARDS JUBILEE UNION JACK,12,10/12/2011 15:42,1.25,16945,United Kingdom
570866,21485,RETROSPOT HEART HOT WATER BOTTLE,6,10/12/2011 15:49,4.95,17096,United Kingdom
570866,22111,SCOTTIE DOG HOT WATER BOTTLE,6,10/12/2011 15:49,4.95,17096,United Kingdom
570866,23409,PHOTO FRAME LINEN AND LACE LARGE,12,10/12/2011 15:49,3.75,17096,United Kingdom
570866,23411, TRELLIS COAT RACK,6,10/12/2011 15:49,4.95,17096,United Kingdom
570866,22112,CHOCOLATE HOT WATER BOTTLE,3,10/12/2011 15:49,4.95,17096,United Kingdom
570866,22835,HOT WATER BOTTLE I AM SO POORLY,4,10/12/2011 15:49,4.95,17096,United Kingdom
570866,22796,PHOTO FRAME 3 CLASSIC HANGING,6,10/12/2011 15:49,9.95,17096,United Kingdom
570866,23408,PHOTO FRAME LINEN AND LACE SMALL,12,10/12/2011 15:49,2.08,17096,United Kingdom
570866,17129F,BLUE GLASS GEMS IN BAG,12,10/12/2011 15:49,0.85,17096,United Kingdom
C570867,23290,SPACEBOY CHILDRENS BOWL,-8,10/12/2011 16:17,1.25,12607,USA
C570867,23289,DOLLY GIRL CHILDRENS BOWL,-8,10/12/2011 16:17,1.25,12607,USA
C570867,23256,CHILDRENS CUTLERY SPACEBOY ,-4,10/12/2011 16:17,4.15,12607,USA
C570867,23255,CHILDRENS CUTLERY CIRCUS PARADE,-4,10/12/2011 16:17,4.15,12607,USA
C570867,23254,CHILDRENS CUTLERY DOLLY GIRL ,-4,10/12/2011 16:17,4.15,12607,USA
C570867,23229,VINTAGE DONKEY TAIL GAME ,-6,10/12/2011 16:17,3.75,12607,USA
C570867,23167,SMALL CERAMIC TOP STORAGE JAR ,-12,10/12/2011 16:17,0.83,12607,USA
C570867,23166,MEDIUM CERAMIC TOP STORAGE JAR,-12,10/12/2011 16:17,1.25,12607,USA
C570867,23165,LARGE CERAMIC TOP STORAGE JAR,-12,10/12/2011 16:17,1.65,12607,USA
C570867,23159,SET OF 5 PANCAKE DAY MAGNETS,-12,10/12/2011 16:17,2.08,12607,USA
C570867,23156,SET OF 5 MINI GROCERY MAGNETS,-12,10/12/2011 16:17,2.08,12607,USA
C570867,23078,ICE CREAM PEN LIP GLOSS ,-24,10/12/2011 16:17,1.25,12607,USA
C570867,23077,DOUGHNUT LIP GLOSS ,-20,10/12/2011 16:17,1.25,12607,USA
C570867,23014,GLASS APOTHECARY BOTTLE ELIXIR,-4,10/12/2011 16:17,3.95,12607,USA
C570867,22989,SET 2 PANTRY DESIGN TEA TOWELS,-6,10/12/2011 16:17,3.25,12607,USA
C570867,22983,CARD BILLBOARD FONT,-12,10/12/2011 16:17,0.42,12607,USA
C570867,22974,CHILDRENS DOLLY GIRL MUG,-12,10/12/2011 16:17,1.65,12607,USA
C570867,22972,CHILDREN'S SPACEBOY MUG,-12,10/12/2011 16:17,1.65,12607,USA
C570867,22959,WRAP CHRISTMAS VILLAGE,-25,10/12/2011 16:17,0.42,12607,USA
C570867,22951,60 CAKE CASES DOLLY GIRL DESIGN,-24,10/12/2011 16:17,0.55,12607,USA
C570867,22949,36 DOILIES DOLLY GIRL,-12,10/12/2011 16:17,1.45,12607,USA
C570867,22938,CUPCAKE LACE PAPER SET 6,-12,10/12/2011 16:17,1.95,12607,USA
C570867,22922,FRIDGE MAGNETS US DINER ASSORTED,-12,10/12/2011 16:17,0.85,12607,USA
C570867,22848,BREAD BIN DINER STYLE PINK,-1,10/12/2011 16:17,16.95,12607,USA
C570867,22818,CARD CHRISTMAS VILLAGE,-12,10/12/2011 16:17,0.42,12607,USA
