573937,23232,WRAP VINTAGE LEAF DESIGN,25,11/02/2011 10:40,0.42,15830,United Kingdom
573937,16169E,WRAP 50'S  CHRISTMAS,25,11/02/2011 10:40,0.42,15830,United Kingdom
573937,22704,WRAP RED APPLES ,25,11/02/2011 10:40,0.42,15830,United Kingdom
573937,22959,WRAP CHRISTMAS VILLAGE,25,11/02/2011 10:40,0.42,15830,United Kingdom
573937,22726,ALARM CLOCK BAKELIKE GREEN,4,11/02/2011 10:40,3.75,15830,United Kingdom
573937,22727,ALARM CLOCK BAKELIKE RED ,4,11/02/2011 10:40,3.75,15830,United Kingdom
573937,22730,ALARM CLOCK BAKELIKE IVORY,4,11/02/2011 10:40,3.75,15830,United Kingdom
573937,22895,SET OF 2 TEA TOWELS APPLE AND PEARS,6,11/02/2011 10:40,3.25,15830,United Kingdom
573937,22203,MILK PAN RED RETROSPOT,4,11/02/2011 10:40,3.75,15830,United Kingdom
573937,22207,FRYING PAN UNION FLAG,4,11/02/2011 10:40,4.25,15830,United Kingdom
573937,79066K,RETRO MOD TRAY,10,11/02/2011 10:40,0.85,15830,United Kingdom
573937,22818,CARD CHRISTMAS VILLAGE,12,11/02/2011 10:40,0.42,15830,United Kingdom
573937,22909,SET OF 20 VINTAGE CHRISTMAS NAPKINS,12,11/02/2011 10:40,0.85,15830,United Kingdom
573937,22601,CHRISTMAS RETROSPOT ANGEL WOOD,12,11/02/2011 10:40,0.85,15830,United Kingdom
573937,22603,CHRISTMAS RETROSPOT TREE WOOD,12,11/02/2011 10:40,0.85,15830,United Kingdom
573937,23263,SET OF 3 WOODEN HEART DECORATIONS,12,11/02/2011 10:40,1.25,15830,United Kingdom
573937,22941,CHRISTMAS LIGHTS 10 REINDEER,2,11/02/2011 10:40,8.5,15830,United Kingdom
573937,23284,DOORMAT KEEP CALM AND COME IN,2,11/02/2011 10:40,8.25,15830,United Kingdom
573937,48138,DOORMAT UNION FLAG,2,11/02/2011 10:40,8.25,15830,United Kingdom
573937,23283,DOORMAT VINTAGE LEAF,2,11/02/2011 10:40,8.25,15830,United Kingdom
573937,20914,SET/5 RED RETROSPOT LID GLASS BOWLS,6,11/02/2011 10:40,2.95,15830,United Kingdom
573937,22624,IVORY KITCHEN SCALES,2,11/02/2011 10:40,8.5,15830,United Kingdom
573937,23493,VINTAGE DOILY TRAVEL SEWING KIT,10,11/02/2011 10:40,1.95,15830,United Kingdom
573945,22694,WICKER STAR ,12,11/02/2011 10:44,2.1,17663,United Kingdom
573945,23323,WHITE WICKER STAR ,6,11/02/2011 10:44,2.1,17663,United Kingdom
573945,23343,JUMBO BAG VINTAGE CHRISTMAS ,20,11/02/2011 10:44,2.08,17663,United Kingdom
573945,21201,TROPICAL  HONEYCOMB PAPER GARLAND ,12,11/02/2011 10:44,2.55,17663,United Kingdom
573945,84879,ASSORTED COLOUR BIRD ORNAMENT,16,11/02/2011 10:44,1.69,17663,United Kingdom
573945,23534,WALL ART STOP FOR TEA ,3,11/02/2011 10:44,5.95,17663,United Kingdom
573945,23541,WALL ART CLASSIC PUDDINGS ,2,11/02/2011 10:44,8.25,17663,United Kingdom
573945,22152,PLACE SETTING WHITE STAR,24,11/02/2011 10:44,0.42,17663,United Kingdom
573945,22592,CARDHOLDER HOLLY WREATH METAL,8,11/02/2011 10:44,3.75,17663,United Kingdom
C573949,23014,GLASS APOTHECARY BOTTLE ELIXIR,-4,11/02/2011 10:47,3.95,14511,United Kingdom
C573949,23013,GLASS APOTHECARY BOTTLE TONIC,-4,11/02/2011 10:47,3.95,14511,United Kingdom
C573949,23012,GLASS APOTHECARY BOTTLE PERFUME,-4,11/02/2011 10:47,3.95,14511,United Kingdom
573955,21770,OPEN CLOSED METAL SIGN,2,11/02/2011 10:51,4.95,14216,United Kingdom
573955,23393,HOME SWEET HOME CUSHION COVER ,4,11/02/2011 10:51,3.75,14216,United Kingdom
573955,82482,WOODEN PICTURE FRAME WHITE FINISH,6,11/02/2011 10:51,2.95,14216,United Kingdom
573955,82494L,WOODEN FRAME ANTIQUE WHITE ,6,11/02/2011 10:51,2.95,14216,United Kingdom
573955,22692,DOORMAT WELCOME TO OUR HOME,2,11/02/2011 10:51,8.25,14216,United Kingdom
573955,23284,DOORMAT KEEP CALM AND COME IN,2,11/02/2011 10:51,8.25,14216,United Kingdom
573955,23108,SET OF 10 LED DOLLY LIGHTS,2,11/02/2011 10:51,6.25,14216,United Kingdom
573955,23012,GLASS APOTHECARY BOTTLE PERFUME,4,11/02/2011 10:51,3.95,14216,United Kingdom
573955,22460,EMBOSSED GLASS TEALIGHT HOLDER,12,11/02/2011 10:51,1.25,14216,United Kingdom
573955,22178,VICTORIAN GLASS HANGING T-LIGHT,6,11/02/2011 10:51,1.95,14216,United Kingdom
573955,85123A,WHITE HANGING HEART T-LIGHT HOLDER,6,11/02/2011 10:51,2.95,14216,United Kingdom
573955,84945,MULTI COLOUR SILVER T-LIGHT HOLDER,12,11/02/2011 10:51,0.85,14216,United Kingdom
573955,23490,T-LIGHT HOLDER HANGING LOVE BIRD,6,11/02/2011 10:51,3.75,14216,United Kingdom
573955,82484,WOOD BLACK BOARD ANT WHITE FINISH,2,11/02/2011 10:51,7.95,14216,United Kingdom
573955,82483,WOOD 2 DRAWER CABINET WHITE FINISH,2,11/02/2011 10:51,6.95,14216,United Kingdom
