574077,21172,PARTY METAL SIGN ,1,11/02/2011 15:56,1.45,17999,United Kingdom
574077,22097,SWALLOW SQUARE TISSUE BOX,1,11/02/2011 15:56,0.39,17999,United Kingdom
574077,72802C,VANILLA SCENT CANDLE JEWELLED BOX,2,11/02/2011 15:56,4.25,17999,United Kingdom
574077,20679,EDWARDIAN PARASOL RED,2,11/02/2011 15:56,5.95,17999,United Kingdom
574077,22616,PACK OF 12 LONDON TISSUES ,24,11/02/2011 15:56,0.39,17999,United Kingdom
574077,21326,AGED GLASS SILVER T-LIGHT HOLDER,12,11/02/2011 15:56,0.65,17999,United Kingdom
574077,22508,DOORSTOP RETROSPOT HEART,1,11/02/2011 15:56,3.75,17999,United Kingdom
574077,23424,GINGHAM RECIPE BOOK BOX,1,11/02/2011 15:56,4.95,17999,United Kingdom
574077,20754,RETROSPOT RED WASHING UP GLOVES,1,11/02/2011 15:56,2.1,17999,United Kingdom
574077,20752,BLUE POLKADOT WASHING UP GLOVES,1,11/02/2011 15:56,2.1,17999,United Kingdom
574077,21850,BLUE  DIAMANTE PEN IN GIFT BOX,1,11/02/2011 15:56,4.95,17999,United Kingdom
574077,23209,LUNCH BAG VINTAGE DOILY ,1,11/02/2011 15:56,1.65,17999,United Kingdom
574077,22086,PAPER CHAIN KIT 50'S CHRISTMAS ,1,11/02/2011 15:56,2.95,17999,United Kingdom
574077,22816,CARD MOTORBIKE SANTA,24,11/02/2011 15:56,0.42,17999,United Kingdom
574077,22114,HOT WATER BOTTLE TEA AND SYMPATHY,1,11/02/2011 15:56,4.25,17999,United Kingdom
574077,72803A,ROSE SCENT CANDLE JEWELLED DRAWER,1,11/02/2011 15:56,4.25,17999,United Kingdom
574077,72802B,OCEAN SCENT CANDLE IN JEWELLED BOX,1,11/02/2011 15:56,4.25,17999,United Kingdom
574077,20727,LUNCH BAG  BLACK SKULL.,1,11/02/2011 15:56,1.65,17999,United Kingdom
574077,23101,SILVER STARS TABLE DECORATION,1,11/02/2011 15:56,0.83,17999,United Kingdom
574077,21616,4 PEAR BOTANICAL DINNER CANDLES,1,11/02/2011 15:56,1.25,17999,United Kingdom
574077,21367,MIRRORED WALL ART GENTS,2,11/02/2011 15:56,0.75,17999,United Kingdom
574077,21191,LARGE WHITE HONEYCOMB PAPER BELL  ,1,11/02/2011 15:56,2.1,17999,United Kingdom
574077,85017B,ENVELOPE 50 BLOSSOM IMAGES,1,11/02/2011 15:56,0.42,17999,United Kingdom
574077,21479,WHITE SKULL HOT WATER BOTTLE ,1,11/02/2011 15:56,4.25,17999,United Kingdom
574077,21619,4 VANILLA BOTANICAL CANDLES,1,11/02/2011 15:56,1.25,17999,United Kingdom
574077,21618,4 WILDFLOWER BOTANICAL CANDLES,1,11/02/2011 15:56,1.25,17999,United Kingdom
574077,21617,4 LILY  BOTANICAL DINNER CANDLES,1,11/02/2011 15:56,1.25,17999,United Kingdom
574077,20931,BLUE POT PLANT CANDLE ,1,11/02/2011 15:56,2.95,17999,United Kingdom
574077,90205A,LARGE MINT DIAMANTE HAIRSLIDE,2,11/02/2011 15:56,1.65,17999,United Kingdom
C574078,72807C,SET/3 VANILLA SCENTED CANDLE IN BOX,-1,11/02/2011 16:16,4.25,14911,EIRE
C574078,23427,STOOL HOME SWEET HOME ,-1,11/02/2011 16:16,12.5,14911,EIRE
574079,23211,RED ROCKING HORSE HAND PAINTED,2,11/02/2011 16:19,1.25,17595,United Kingdom
574079,23210,WHITE ROCKING HORSE HAND PAINTED,2,11/02/2011 16:19,1.25,17595,United Kingdom
574079,23331,DECORATIVE WICKER HEART SMALL,3,11/02/2011 16:19,0.63,17595,United Kingdom
574079,23334,IVORY WICKER HEART SMALL,3,11/02/2011 16:19,0.63,17595,United Kingdom
574079,75049L,LARGE CIRCULAR MIRROR MOBILE,3,11/02/2011 16:19,1.25,17595,United Kingdom
574079,23191,BUNDLE OF 3 RETRO NOTE BOOKS,2,11/02/2011 16:19,1.65,17595,United Kingdom
574079,85152,HAND OVER THE CHOCOLATE   SIGN ,1,11/02/2011 16:19,2.1,17595,United Kingdom
574079,82582,AREA PATROLLED METAL SIGN,1,11/02/2011 16:19,2.1,17595,United Kingdom
574079,82583,HOT BATHS METAL SIGN,1,11/02/2011 16:19,2.1,17595,United Kingdom
574079,22362,GLASS JAR PEACOCK BATH SALTS,1,11/02/2011 16:19,2.95,17595,United Kingdom
574079,22359,GLASS JAR KINGS CHOICE,1,11/02/2011 16:19,2.95,17595,United Kingdom
574079,22360,GLASS JAR ENGLISH CONFECTIONERY,1,11/02/2011 16:19,2.95,17595,United Kingdom
574079,22361,GLASS JAR DAISY FRESH COTTON WOOL,1,11/02/2011 16:19,2.95,17595,United Kingdom
574079,23169,CLASSIC GLASS COOKIE JAR,1,11/02/2011 16:19,4.15,17595,United Kingdom
574079,23168,CLASSIC CAFE SUGAR DISPENSER,1,11/02/2011 16:19,1.25,17595,United Kingdom
574079,21326,AGED GLASS SILVER T-LIGHT HOLDER,12,11/02/2011 16:19,0.65,17595,United Kingdom
574079,20765,CHRYSANTHEMUM SKETCHBOOK ,1,11/02/2011 16:19,3.75,17595,United Kingdom
574079,20764,ABSTRACT CIRCLES SKETCHBOOK ,1,11/02/2011 16:19,3.75,17595,United Kingdom
574079,20766,GARDEN PATH SKETCHBOOK,1,11/02/2011 16:19,3.75,17595,United Kingdom
