574287,22163,HEART STRING MEMO HOLDER HANGING,4,11/03/2011 15:09,0.79,14723,United Kingdom
574287,22164,STRING OF STARS CARD HOLDER,4,11/03/2011 15:09,2.95,14723,United Kingdom
574287,21122,SET/10 PINK POLKADOT PARTY CANDLES,1,11/03/2011 15:09,1.25,14723,United Kingdom
574287,21381,MINI WOODEN HAPPY BIRTHDAY GARLAND,2,11/03/2011 15:09,1.69,14723,United Kingdom
574287,22696,WICKER WREATH LARGE,1,11/03/2011 15:09,1.95,14723,United Kingdom
574287,22091,EMPIRE TISSUE BOX,1,11/03/2011 15:09,0.39,14723,United Kingdom
574287,21922,UNION STRIPE WITH FRINGE  HAMMOCK,1,11/03/2011 15:09,7.95,14723,United Kingdom
574287,22095,LADS ONLY TISSUE BOX,1,11/03/2011 15:09,0.39,14723,United Kingdom
574287,23499,SET 12 VINTAGE DOILY CHALK ,2,11/03/2011 15:09,0.42,14723,United Kingdom
574287,21034,REX CASH+CARRY JUMBO SHOPPER,1,11/03/2011 15:09,0.95,14723,United Kingdom
574287,85034A,3 GARDENIA MORRIS BOXED CANDLES,2,11/03/2011 15:09,1.25,14723,United Kingdom
C574288,22178,VICTORIAN GLASS HANGING T-LIGHT,-1,11/03/2011 15:13,14.75,,United Kingdom
574289,22998,TRAVEL CARD WALLET KEEP CALM,72,11/03/2011 15:16,0.42,17750,United Kingdom
574289,23002,TRAVEL CARD WALLET SKULLS,24,11/03/2011 15:16,0.42,17750,United Kingdom
574289,22999,TRAVEL CARD WALLET VINTAGE LEAF,24,11/03/2011 15:16,0.42,17750,United Kingdom
574289,22997,TRAVEL CARD WALLET UNION JACK,24,11/03/2011 15:16,0.42,17750,United Kingdom
574289,22995,TRAVEL CARD WALLET SUKI,24,11/03/2011 15:16,0.42,17750,United Kingdom
574289,22999,TRAVEL CARD WALLET VINTAGE LEAF,24,11/03/2011 15:16,0.42,17750,United Kingdom
574289,23004,TRAVEL CARD WALLET PANTRY,48,11/03/2011 15:16,0.42,17750,United Kingdom
574289,23000,TRAVEL CARD WALLET TRANSPORT,48,11/03/2011 15:16,0.42,17750,United Kingdom
574289,23005,TRAVEL CARD WALLET I LOVE LONDON,48,11/03/2011 15:16,0.42,17750,United Kingdom
574290,23396,LE JARDIN BOTANIQUE CUSHION COVER,4,11/03/2011 15:18,3.75,17403,United Kingdom
574290,23394,POSTE FRANCE CUSHION COVER,2,11/03/2011 15:18,3.75,17403,United Kingdom
574290,22930,BAKING MOULD HEART MILK CHOCOLATE,1,11/03/2011 15:18,2.55,17403,United Kingdom
574290,23217,LAUREL HEART ANTIQUE SILVER,6,11/03/2011 15:18,1.25,17403,United Kingdom
574290,23224,CHERUB HEART DECORATION GOLD,7,11/03/2011 15:18,0.83,17403,United Kingdom
574290,23489,VINTAGE BELLS GARLAND,4,11/03/2011 15:18,2.89,17403,United Kingdom
574290,22441,GROW YOUR OWN BASIL IN ENAMEL MUG,1,11/03/2011 15:18,2.1,17403,United Kingdom
574290,21591,COSY HOUR CIGAR BOX MATCHES ,2,11/03/2011 15:18,1.25,17403,United Kingdom
574290,22185,SLATE TILE NATURAL HANGING,1,11/03/2011 15:18,1.65,17403,United Kingdom
574290,21530,DAIRY MAID TOASTRACK,1,11/03/2011 15:18,0.79,17403,United Kingdom
574290,22720,SET OF 3 CAKE TINS PANTRY DESIGN ,1,11/03/2011 15:18,4.95,17403,United Kingdom
574290,21695,SMALL SILVER FLOWER CANDLE POT,6,11/03/2011 15:18,2.95,17403,United Kingdom
574290,23165,LARGE CERAMIC TOP STORAGE JAR,4,11/03/2011 15:18,1.65,17403,United Kingdom
574290,21742,LARGE ROUND WICKER PLATTER ,1,11/03/2011 15:18,5.95,17403,United Kingdom
574290,23504,PLAYING CARDS JUBILEE UNION JACK,2,11/03/2011 15:18,1.25,17403,United Kingdom
574290,23493,VINTAGE DOILY TRAVEL SEWING KIT,2,11/03/2011 15:18,1.95,17403,United Kingdom
574290,23503,PLAYING CARDS KEEP CALM & CARRY ON,2,11/03/2011 15:18,1.25,17403,United Kingdom
574290,22553,PLASTERS IN TIN SKULLS,1,11/03/2011 15:18,1.65,17403,United Kingdom
574290,21584,RETROSPOT SMALL TUBE MATCHES,8,11/03/2011 15:18,1.65,17403,United Kingdom
574290,22557,PLASTERS IN TIN VINTAGE PAISLEY ,1,11/03/2011 15:18,1.65,17403,United Kingdom
574290,21707,FOLDING UMBRELLA BLACKBLUE POLKADOT,1,11/03/2011 15:18,4.95,17403,United Kingdom
574290,84658,WHITE STITCHED CUSHION COVER,2,11/03/2011 15:18,6.95,17403,United Kingdom
574290,21983,PACK OF 12 BLUE PAISLEY TISSUES ,12,11/03/2011 15:18,0.39,17403,United Kingdom
574290,20828,GLITTER BUTTERFLY CLIPS,1,11/03/2011 15:18,2.55,17403,United Kingdom
574290,23551,PACK OF 12 PAISLEY PARK TISSUES ,12,11/03/2011 15:18,0.39,17403,United Kingdom
574290,20914,SET/5 RED RETROSPOT LID GLASS BOWLS,1,11/03/2011 15:18,2.95,17403,United Kingdom
574290,21485,RETROSPOT HEART HOT WATER BOTTLE,3,11/03/2011 15:18,4.95,17403,United Kingdom
574290,23356,LOVE HOT WATER BOTTLE,2,11/03/2011 15:18,5.95,17403,United Kingdom
574290,23355,HOT WATER BOTTLE KEEP CALM,5,11/03/2011 15:18,4.95,17403,United Kingdom
