574287,22222,CAKE PLATE LOVEBIRD WHITE,1,11/03/2011 15:09,4.95,14723,United Kingdom
574287,21126,SET OF 6 GIRLS CELEBRATION CANDLES,1,11/03/2011 15:09,1.25,14723,United Kingdom
574287,23499,SET 12 VINTAGE DOILY CHALK ,1,11/03/2011 15:09,0.42,14723,United Kingdom
574287,23101,SILVER STARS TABLE DECORATION,1,11/03/2011 15:09,0.83,14723,United Kingdom
574287,22785,SQUARECUSHION COVER PINK UNION JACK,1,11/03/2011 15:09,6.75,14723,United Kingdom
574287,21817,GLITTER CHRISTMAS TREE,1,11/03/2011 15:09,0.39,14723,United Kingdom
574287,23045,PAPER LANTERN 5 POINT STAR MOON ,1,11/03/2011 15:09,4.15,14723,United Kingdom
574287,22556,PLASTERS IN TIN CIRCUS PARADE ,1,11/03/2011 15:09,1.65,14723,United Kingdom
574287,22155,STAR DECORATION RUSTIC,3,11/03/2011 15:09,0.42,14723,United Kingdom
574287,21819,GLITTER CHRISTMAS STAR ,1,11/03/2011 15:09,0.39,14723,United Kingdom
574287,21811,HANGING HEART WITH BELL,1,11/03/2011 15:09,0.39,14723,United Kingdom
574287,21818,GLITTER HEART DECORATION,3,11/03/2011 15:09,0.39,14723,United Kingdom
574287,23466,TUSCAN VILLA DOVECOTE BIRD FEEDER,1,11/03/2011 15:09,8.25,14723,United Kingdom
574287,22155,STAR DECORATION RUSTIC,1,11/03/2011 15:09,0.42,14723,United Kingdom
574287,20668,DISCO BALL CHRISTMAS DECORATION,3,11/03/2011 15:09,0.12,14723,United Kingdom
574287,21810,CHRISTMAS HANGING STAR WITH BELL,1,11/03/2011 15:09,0.39,14723,United Kingdom
574287,21809,CHRISTMAS HANGING TREE WITH BELL,1,11/03/2011 15:09,0.39,14723,United Kingdom
574287,22155,STAR DECORATION RUSTIC,1,11/03/2011 15:09,0.42,14723,United Kingdom
574287,21817,GLITTER CHRISTMAS TREE,1,11/03/2011 15:09,0.39,14723,United Kingdom
574287,22578,WOODEN STAR CHRISTMAS SCANDINAVIAN,4,11/03/2011 15:09,0.29,14723,United Kingdom
574287,22577,WOODEN HEART CHRISTMAS SCANDINAVIAN,3,11/03/2011 15:09,0.29,14723,United Kingdom
574287,22579,WOODEN TREE CHRISTMAS SCANDINAVIAN,3,11/03/2011 15:09,0.29,14723,United Kingdom
574287,21621,VINTAGE UNION JACK BUNTING,2,11/03/2011 15:09,8.5,14723,United Kingdom
574287,23490,T-LIGHT HOLDER HANGING LOVE BIRD,1,11/03/2011 15:09,3.75,14723,United Kingdom
574287,21122,SET/10 PINK POLKADOT PARTY CANDLES,2,11/03/2011 15:09,1.25,14723,United Kingdom
574287,21592,RETROSPOT CIGAR BOX MATCHES ,1,11/03/2011 15:09,1.25,14723,United Kingdom
574287,21591,COSY HOUR CIGAR BOX MATCHES ,1,11/03/2011 15:09,1.25,14723,United Kingdom
574287,21380,WOODEN HAPPY BIRTHDAY GARLAND,1,11/03/2011 15:09,2.95,14723,United Kingdom
574287,22082,RIBBON REEL STRIPES DESIGN ,2,11/03/2011 15:09,1.65,14723,United Kingdom
574287,85034A,3 GARDENIA MORRIS BOXED CANDLES,1,11/03/2011 15:09,1.25,14723,United Kingdom
574287,90200A,PURPLE SWEETHEART BRACELET,1,11/03/2011 15:09,4.25,14723,United Kingdom
574287,90161B,ANT COPPER TURQ BOUDICCA BRACELET,2,11/03/2011 15:09,4.95,14723,United Kingdom
574287,90200B,BLACK SWEETHEART BRACELET,1,11/03/2011 15:09,4.25,14723,United Kingdom
574287,90200E,GREEN SWEETHEART BRACELET,1,11/03/2011 15:09,4.25,14723,United Kingdom
574287,90161C,ANT COPPER LIME BOUDICCA BRACELET,2,11/03/2011 15:09,4.95,14723,United Kingdom
574287,85035C,ROSE 3 WICK MORRIS BOX CANDLE,1,11/03/2011 15:09,1.25,14723,United Kingdom
574287,22457,NATURAL SLATE HEART CHALKBOARD ,2,11/03/2011 15:09,2.95,14723,United Kingdom
574287,22597,MUSICAL ZINC HEART DECORATION ,6,11/03/2011 15:09,0.29,14723,United Kingdom
574287,23301,GARDENERS KNEELING PAD KEEP CALM ,1,11/03/2011 15:09,1.65,14723,United Kingdom
574287,35954,SMALL FOLKART STAR CHRISTMAS DEC,20,11/03/2011 15:09,0.19,14723,United Kingdom
574287,22340,NOEL GARLAND PAINTED ZINC ,2,11/03/2011 15:09,0.39,14723,United Kingdom
574287,22578,WOODEN STAR CHRISTMAS SCANDINAVIAN,3,11/03/2011 15:09,0.29,14723,United Kingdom
574287,22599,CHRISTMAS MUSICAL ZINC STAR,6,11/03/2011 15:09,0.29,14723,United Kingdom
574287,22338,STAR DECORATION PAINTED ZINC ,6,11/03/2011 15:09,0.19,14723,United Kingdom
574287,84879,ASSORTED COLOUR BIRD ORNAMENT,2,11/03/2011 15:09,1.69,14723,United Kingdom
574287,21592,RETROSPOT CIGAR BOX MATCHES ,1,11/03/2011 15:09,1.25,14723,United Kingdom
574287,22937,BAKING MOULD CHOCOLATE CUPCAKES,1,11/03/2011 15:09,2.55,14723,United Kingdom
574287,21121,SET/10 RED POLKADOT PARTY CANDLES,1,11/03/2011 15:09,1.25,14723,United Kingdom
574287,21123,SET/10 IVORY POLKADOT PARTY CANDLES,1,11/03/2011 15:09,1.25,14723,United Kingdom
574287,71270,PHOTO CLIP LINE,1,11/03/2011 15:09,1.25,14723,United Kingdom
