574310,21993,FLORAL FOLK STATIONERY SET,12,11/03/2011 16:56,1.25,13467,United Kingdom
574310,23012,GLASS APOTHECARY BOTTLE PERFUME,1,11/03/2011 16:56,3.95,13467,United Kingdom
574310,23452,HEART MINI PORTRAIT FRAME,6,11/03/2011 16:56,1.95,13467,United Kingdom
574310,22766,PHOTO FRAME CORNICE,4,11/03/2011 16:56,2.95,13467,United Kingdom
574310,23453,OVAL  MINI PORTRAIT FRAME,4,11/03/2011 16:56,1.95,13467,United Kingdom
574310,23451,SQUARE MINI PORTRAIT FRAME,6,11/03/2011 16:56,1.95,13467,United Kingdom
574310,23093,SMALL PARISIENNE HEART PHOTO FRAME ,8,11/03/2011 16:56,2.49,13467,United Kingdom
574310,23203,JUMBO BAG VINTAGE DOILY ,6,11/03/2011 16:56,2.08,13467,United Kingdom
574311,23355,HOT WATER BOTTLE KEEP CALM,6,11/03/2011 16:56,4.95,15640,United Kingdom
574311,23356,LOVE HOT WATER BOTTLE,4,11/03/2011 16:56,5.95,15640,United Kingdom
574311,23389,SPACEBOY MINI BACKPACK,4,11/03/2011 16:56,4.15,15640,United Kingdom
574311,23390,DOLLY GIRL MINI BACKPACK,4,11/03/2011 16:56,4.15,15640,United Kingdom
574311,22468,BABUSHKA LIGHTS STRING OF 10,4,11/03/2011 16:56,6.75,15640,United Kingdom
574311,22112,CHOCOLATE HOT WATER BOTTLE,4,11/03/2011 16:56,4.95,15640,United Kingdom
574311,23203,JUMBO BAG VINTAGE DOILY ,10,11/03/2011 16:56,2.08,15640,United Kingdom
574311,23582,VINTAGE DOILY JUMBO BAG RED ,10,11/03/2011 16:56,2.08,15640,United Kingdom
574311,21928,JUMBO BAG SCANDINAVIAN BLUE PAISLEY,10,11/03/2011 16:56,2.08,15640,United Kingdom
574311,23581,JUMBO BAG PAISLEY PARK,10,11/03/2011 16:56,2.08,15640,United Kingdom
574311,85099B,JUMBO BAG RED RETROSPOT,10,11/03/2011 16:56,2.08,15640,United Kingdom
574311,22411,JUMBO SHOPPER VINTAGE RED PAISLEY,10,11/03/2011 16:56,2.08,15640,United Kingdom
574311,23201,JUMBO BAG ALPHABET,10,11/03/2011 16:56,2.08,15640,United Kingdom
574311,21931,JUMBO STORAGE BAG SUKI,10,11/03/2011 16:56,2.08,15640,United Kingdom
574311,22186,RED STAR CARD HOLDER,6,11/03/2011 16:56,1.95,15640,United Kingdom
574311,22779,WOODEN OWLS LIGHT GARLAND ,4,11/03/2011 16:56,4.25,15640,United Kingdom
574311,22866,HAND WARMER SCOTTY DOG DESIGN,10,11/03/2011 16:56,2.1,15640,United Kingdom
574311,22865,HAND WARMER OWL DESIGN,10,11/03/2011 16:56,2.1,15640,United Kingdom
574311,22867,HAND WARMER BIRD DESIGN,10,11/03/2011 16:56,2.1,15640,United Kingdom
574311,23439,HAND WARMER RED LOVE HEART,10,11/03/2011 16:56,2.1,15640,United Kingdom
574311,22792,FLUTED ANTIQUE CANDLE HOLDER,24,11/03/2011 16:56,0.85,15640,United Kingdom
574311,21012,ANTIQUE ALL GLASS CANDLESTICK,6,11/03/2011 16:56,2.1,15640,United Kingdom
574311,22075,6 RIBBONS ELEGANT CHRISTMAS ,24,11/03/2011 16:56,1.65,15640,United Kingdom
574311,23360,SET 8 CANDLES VINTAGE DOILY,12,11/03/2011 16:56,1.95,15640,United Kingdom
574311,22629,SPACEBOY LUNCH BOX ,6,11/03/2011 16:56,1.95,15640,United Kingdom
574311,22630,DOLLY GIRL LUNCH BOX,6,11/03/2011 16:56,1.95,15640,United Kingdom
574311,23267,SET OF 4 SANTA PLACE SETTINGS,24,11/03/2011 16:56,1.25,15640,United Kingdom
574311,22946,WOODEN ADVENT CALENDAR CREAM,1,11/03/2011 16:56,16.95,15640,United Kingdom
574311,22952,60 CAKE CASES VINTAGE CHRISTMAS,24,11/03/2011 16:56,0.55,15640,United Kingdom
574311,21068,VINTAGE BILLBOARD LOVE/HATE MUG,6,11/03/2011 16:56,1.25,15640,United Kingdom
574311,22636,CHILDS BREAKFAST SET CIRCUS PARADE,6,11/03/2011 16:56,8.5,15640,United Kingdom
574311,84378,SET OF 3 HEART COOKIE CUTTERS,12,11/03/2011 16:56,1.45,15640,United Kingdom
574311,21871,SAVE THE PLANET MUG,12,11/03/2011 16:56,1.65,15640,United Kingdom
574311,21212,PACK OF 72 RETROSPOT CAKE CASES,24,11/03/2011 16:56,0.55,15640,United Kingdom
574311,23058,CHRISTMAS HANGING SNOWFLAKE,12,11/03/2011 16:56,0.79,15640,United Kingdom
574311,23101,SILVER STARS TABLE DECORATION,12,11/03/2011 16:56,0.83,15640,United Kingdom
574311,23207,LUNCH BAG ALPHABET DESIGN,10,11/03/2011 16:56,1.65,15640,United Kingdom
574311,22946,WOODEN ADVENT CALENDAR CREAM,1,11/03/2011 16:56,16.95,15640,United Kingdom
574311,21591,COSY HOUR CIGAR BOX MATCHES ,8,11/03/2011 16:56,1.25,15640,United Kingdom
574311,23382,BOX OF 6 CHRISTMAS CAKE DECORATIONS,6,11/03/2011 16:56,3.75,15640,United Kingdom
574311,84375,SET OF 20 KIDS COOKIE CUTTERS,12,11/03/2011 16:56,2.1,15640,United Kingdom
574311,22943,CHRISTMAS LIGHTS 10 VINTAGE BAUBLES,4,11/03/2011 16:56,4.95,15640,United Kingdom
