574088,23092,LARGE ANTIQUE WHITE PHOTO FRAME,2,11/03/2011 08:56,7.9,18044,United Kingdom
574088,22170,PICTURE FRAME WOOD TRIPLE PORTRAIT,4,11/03/2011 08:56,6.75,18044,United Kingdom
574088,22169,FAMILY ALBUM WHITE PICTURE FRAME,2,11/03/2011 08:56,8.5,18044,United Kingdom
574089,84836,ZINC METAL HEART DECORATION,12,11/03/2011 09:07,1.25,17611,United Kingdom
574089,23479,WIRE EGG BASKET ,2,11/03/2011 09:07,7.85,17611,United Kingdom
574089,84832,ZINC WILLIE WINKIE  CANDLE STICK,12,11/03/2011 09:07,0.85,17611,United Kingdom
574089,23086,ZINC  STAR T-LIGHT HOLDER ,16,11/03/2011 09:07,1.25,17611,United Kingdom
574089,84946,ANTIQUE SILVER T-LIGHT GLASS,12,11/03/2011 09:07,1.25,17611,United Kingdom
574089,21326,AGED GLASS SILVER T-LIGHT HOLDER,12,11/03/2011 09:07,0.65,17611,United Kingdom
574089,22460,EMBOSSED GLASS TEALIGHT HOLDER,12,11/03/2011 09:07,1.25,17611,United Kingdom
574089,22193,RED DINER WALL CLOCK,2,11/03/2011 09:07,8.5,17611,United Kingdom
574089,22192,BLUE DINER WALL CLOCK,2,11/03/2011 09:07,8.5,17611,United Kingdom
574089,22727,ALARM CLOCK BAKELIKE RED ,4,11/03/2011 09:07,3.75,17611,United Kingdom
574089,22730,ALARM CLOCK BAKELIKE IVORY,4,11/03/2011 09:07,3.75,17611,United Kingdom
574089,23012,GLASS APOTHECARY BOTTLE PERFUME,4,11/03/2011 09:07,3.95,17611,United Kingdom
574089,22624,IVORY KITCHEN SCALES,2,11/03/2011 09:07,8.5,17611,United Kingdom
574089,22627,MINT KITCHEN SCALES,2,11/03/2011 09:07,8.5,17611,United Kingdom
574089,21684,SMALL MEDINA STAMPED METAL BOWL ,12,11/03/2011 09:07,0.85,17611,United Kingdom
574089,22979,PANTRY WASHING UP BRUSH,12,11/03/2011 09:07,1.45,17611,United Kingdom
574089,23251,VINTAGE RED ENAMEL TRIM MUG ,12,11/03/2011 09:07,1.25,17611,United Kingdom
574089,23252,VINTAGE RED ENAMEL TRIM JUG ,4,11/03/2011 09:07,3.75,17611,United Kingdom
574089,23250,VINTAGE RED TRIM ENAMEL BOWL ,12,11/03/2011 09:07,1.25,17611,United Kingdom
574089,21915,RED  HARMONICA IN BOX ,12,11/03/2011 09:07,1.25,17611,United Kingdom
574090,23351,ROLL WRAP 50'S CHRISTMAS,12,11/03/2011 09:17,1.25,17442,United Kingdom
574090,23352,ROLL WRAP 50'S RED CHRISTMAS ,12,11/03/2011 09:17,1.25,17442,United Kingdom
574090,23354,6 GIFT TAGS 50'S CHRISTMAS ,24,11/03/2011 09:17,0.83,17442,United Kingdom
574090,35970,ZINC FOLKART SLEIGH BELLS,12,11/03/2011 09:17,1.69,17442,United Kingdom
574090,22727,ALARM CLOCK BAKELIKE RED ,4,11/03/2011 09:17,3.75,17442,United Kingdom
574090,22726,ALARM CLOCK BAKELIKE GREEN,4,11/03/2011 09:17,3.75,17442,United Kingdom
574090,23250,VINTAGE RED TRIM ENAMEL BOWL ,12,11/03/2011 09:17,1.25,17442,United Kingdom
574090,23113,PANTRY CHOPPING BOARD,3,11/03/2011 09:17,4.95,17442,United Kingdom
574090,23117,POPPY FIELDS CHOPPING BOARD,3,11/03/2011 09:17,4.95,17442,United Kingdom
574090,23236,STORAGE TIN VINTAGE DOILY ,6,11/03/2011 09:17,2.89,17442,United Kingdom
574090,23203,JUMBO BAG VINTAGE DOILY ,10,11/03/2011 09:17,2.08,17442,United Kingdom
574090,23356,LOVE HOT WATER BOTTLE,3,11/03/2011 09:17,5.95,17442,United Kingdom
574090,22985,WRAP BILLBOARD FONTS DESIGN,25,11/03/2011 09:17,0.42,17442,United Kingdom
574090,23241,TREASURE TIN GYMKHANA DESIGN,6,11/03/2011 09:17,2.08,17442,United Kingdom
574090,84077,WORLD WAR 2 GLIDERS ASSTD DESIGNS,48,11/03/2011 09:17,0.29,17442,United Kingdom
574090,23238,SET OF 4 KNICK KNACK TINS LONDON ,6,11/03/2011 09:17,4.15,17442,United Kingdom
574090,23502,PLAYING CARDS VINTAGE DOILY ,12,11/03/2011 09:17,1.25,17442,United Kingdom
574090,23535,WALL ART BICYCLE SAFETY,4,11/03/2011 09:17,5.95,17442,United Kingdom
574090,22467,GUMBALL COAT RACK,6,11/03/2011 09:17,2.55,17442,United Kingdom
574090,21918,SET 12 KIDS COLOUR  CHALK STICKS,24,11/03/2011 09:17,0.42,17442,United Kingdom
574091,23328,SET 6 SCHOOL MILK BOTTLES IN CRATE,4,11/03/2011 09:20,3.75,17086,United Kingdom
574091,23581,JUMBO BAG PAISLEY PARK,10,11/03/2011 09:20,2.08,17086,United Kingdom
574091,23344,JUMBO BAG 50'S CHRISTMAS ,10,11/03/2011 09:20,2.08,17086,United Kingdom
574091,23582,VINTAGE DOILY JUMBO BAG RED ,10,11/03/2011 09:20,2.08,17086,United Kingdom
574091,23583,LUNCH BAG PAISLEY PARK  ,20,11/03/2011 09:20,1.65,17086,United Kingdom
574091,20728,LUNCH BAG CARS BLUE,10,11/03/2011 09:20,1.65,17086,United Kingdom
574091,22352,LUNCH BOX WITH CUTLERY RETROSPOT ,6,11/03/2011 09:20,2.55,17086,United Kingdom
