574298,22601,CHRISTMAS RETROSPOT ANGEL WOOD,4,11/03/2011 15:56,1.63,,United Kingdom
574298,22608,PENS ASSORTED FUNKY JEWELED ,2,11/03/2011 15:56,0.42,,United Kingdom
574298,22614,PACK OF 12 SPACEBOY TISSUES,1,11/03/2011 15:56,0.83,,United Kingdom
574298,22616,PACK OF 12 LONDON TISSUES ,1,11/03/2011 15:56,0.83,,United Kingdom
574298,22620,4 TRADITIONAL SPINNING TOPS,1,11/03/2011 15:56,2.46,,United Kingdom
574298,22621,TRADITIONAL KNITTING NANCY,1,11/03/2011 15:56,3.29,,United Kingdom
574298,22629,SPACEBOY LUNCH BOX ,1,11/03/2011 15:56,4.13,,United Kingdom
574298,22630,DOLLY GIRL LUNCH BOX,1,11/03/2011 15:56,4.13,,United Kingdom
574298,22653,BUTTON BOX ,4,11/03/2011 15:56,1.63,,United Kingdom
574298,22659,LUNCH BOX I LOVE LONDON,2,11/03/2011 15:56,4.13,,United Kingdom
574298,22661,CHARLOTTE BAG DOLLY GIRL DESIGN,2,11/03/2011 15:56,1.63,,United Kingdom
574298,22663,JUMBO BAG DOLLY GIRL DESIGN,1,11/03/2011 15:56,4.13,,United Kingdom
574298,22664,TOY TIDY DOLLY GIRL DESIGN,1,11/03/2011 15:56,4.13,,United Kingdom
574298,22665,RECIPE BOX BLUE SKETCHBOOK DESIGN,1,11/03/2011 15:56,5.79,,United Kingdom
574298,22666,RECIPE BOX PANTRY YELLOW DESIGN,6,11/03/2011 15:56,5.79,,United Kingdom
574298,22692,DOORMAT WELCOME TO OUR HOME,1,11/03/2011 15:56,15.79,,United Kingdom
574298,22693,GROW A FLYTRAP OR SUNFLOWER IN TIN,1,11/03/2011 15:56,2.5,,United Kingdom
574298,22697,GREEN REGENCY TEACUP AND SAUCER,2,11/03/2011 15:56,5.79,,United Kingdom
574298,22698,PINK REGENCY TEACUP AND SAUCER,1,11/03/2011 15:56,5.79,,United Kingdom
574298,22714,CARD BIRTHDAY COWBOY,1,11/03/2011 15:56,0.83,,United Kingdom
574298,22716,CARD CIRCUS PARADE,1,11/03/2011 15:56,0.83,,United Kingdom
574298,22717,CARD DOG AND BALL ,1,11/03/2011 15:56,0.83,,United Kingdom
574298,22720,SET OF 3 CAKE TINS PANTRY DESIGN ,2,11/03/2011 15:56,10.79,,United Kingdom
574298,22726,ALARM CLOCK BAKELIKE GREEN,5,11/03/2011 15:56,7.46,,United Kingdom
574298,22727,ALARM CLOCK BAKELIKE RED ,2,11/03/2011 15:56,7.46,,United Kingdom
574298,22730,ALARM CLOCK BAKELIKE IVORY,2,11/03/2011 15:56,7.46,,United Kingdom
574298,22735,RIBBON REEL SOCKS AND MITTENS,1,11/03/2011 15:56,3.29,,United Kingdom
574298,22738,RIBBON REEL SNOWY VILLAGE,1,11/03/2011 15:56,3.29,,United Kingdom
574298,22739,RIBBON REEL CHRISTMAS SOCK BAUBLE,4,11/03/2011 15:56,3.29,,United Kingdom
574298,22741,FUNKY DIVA PEN,2,11/03/2011 15:56,1.63,,United Kingdom
574298,22745,POPPY'S PLAYHOUSE BEDROOM ,2,11/03/2011 15:56,4.13,,United Kingdom
574298,22746,POPPY'S PLAYHOUSE LIVINGROOM ,2,11/03/2011 15:56,4.13,,United Kingdom
574298,22747,POPPY'S PLAYHOUSE BATHROOM,1,11/03/2011 15:56,4.13,,United Kingdom
574298,22754,SMALL RED BABUSHKA NOTEBOOK ,1,11/03/2011 15:56,1.63,,United Kingdom
574298,22757,LARGE RED BABUSHKA NOTEBOOK ,1,11/03/2011 15:56,2.46,,United Kingdom
574298,22759,SET OF 3 NOTEBOOKS IN PARCEL,3,11/03/2011 15:56,3.29,,United Kingdom
574298,22771,CLEAR DRAWER KNOB ACRYLIC EDWARDIAN,3,11/03/2011 15:56,2.46,,United Kingdom
574298,22772,PINK DRAWER KNOB ACRYLIC EDWARDIAN,3,11/03/2011 15:56,2.46,,United Kingdom
574298,22773,GREEN DRAWER KNOB ACRYLIC EDWARDIAN,7,11/03/2011 15:56,2.46,,United Kingdom
574298,22774,RED DRAWER KNOB ACRYLIC EDWARDIAN,4,11/03/2011 15:56,2.46,,United Kingdom
574298,22775,PURPLE DRAWERKNOB ACRYLIC EDWARDIAN,3,11/03/2011 15:56,2.46,,United Kingdom
574298,22791,T-LIGHT GLASS FLUTED ANTIQUE,3,11/03/2011 15:56,2.46,,United Kingdom
574298,22795,SWEETHEART RECIPE BOOK STAND,1,11/03/2011 15:56,13.29,,United Kingdom
574298,22798,ANTIQUE GLASS DRESSING TABLE POT,2,11/03/2011 15:56,5.79,,United Kingdom
574298,22800,ANTIQUE TALL SWIRLGLASS TRINKET POT,1,11/03/2011 15:56,7.46,,United Kingdom
574298,22801,ANTIQUE GLASS PEDESTAL BOWL,1,11/03/2011 15:56,7.46,,United Kingdom
574298,22805,BLUE DRAWER KNOB ACRYLIC EDWARDIAN,3,11/03/2011 15:56,2.46,,United Kingdom
574298,22812,PACK 3 BOXES CHRISTMAS PANNETONE,3,11/03/2011 15:56,4.13,,United Kingdom
574298,22814,CARD PARTY GAMES ,3,11/03/2011 15:56,0.42,,United Kingdom
574298,22816,CARD MOTORBIKE SANTA,4,11/03/2011 15:56,0.42,,United Kingdom
