574280,84946,ANTIQUE SILVER T-LIGHT GLASS,72,11/03/2011 14:47,1.06,13408,United Kingdom
574280,85152,HAND OVER THE CHOCOLATE   SIGN ,12,11/03/2011 14:47,2.1,13408,United Kingdom
574280,22413,METAL SIGN TAKE IT OR LEAVE IT ,12,11/03/2011 14:47,2.95,13408,United Kingdom
574280,23480,MINI LIGHTS WOODLAND MUSHROOMS,24,11/03/2011 14:47,3.75,13408,United Kingdom
574280,23084,RABBIT NIGHT LIGHT,72,11/03/2011 14:47,1.79,13408,United Kingdom
574281,21933,PINK VINTAGE PAISLEY PICNIC BAG,10,11/03/2011 14:47,1.65,14856,United Kingdom
574281,21932,SCANDINAVIAN PAISLEY PICNIC BAG,10,11/03/2011 14:47,1.65,14856,United Kingdom
574281,22231,JIGSAW TREE WITH BIRDHOUSE,12,11/03/2011 14:47,0.59,14856,United Kingdom
574281,22402,MAGNETS PACK OF 4 VINTAGE COLLAGE,12,11/03/2011 14:47,0.39,14856,United Kingdom
574281,22398,MAGNETS PACK OF 4 SWALLOWS,12,11/03/2011 14:47,0.39,14856,United Kingdom
574281,84596F,SMALL MARSHMALLOWS PINK BOWL,16,11/03/2011 14:47,0.42,14856,United Kingdom
574281,22578,WOODEN STAR CHRISTMAS SCANDINAVIAN,48,11/03/2011 14:47,0.29,14856,United Kingdom
574281,22577,WOODEN HEART CHRISTMAS SCANDINAVIAN,24,11/03/2011 14:47,0.29,14856,United Kingdom
574281,23460,SWEETHEART WALL TIDY ,2,11/03/2011 14:47,9.95,14856,United Kingdom
574281,22605,WOODEN CROQUET GARDEN SET,2,11/03/2011 14:47,14.95,14856,United Kingdom
574281,22607,WOODEN ROUNDERS GARDEN SET ,2,11/03/2011 14:47,9.95,14856,United Kingdom
574281,22139,RETROSPOT TEA SET CERAMIC 11 PC ,3,11/03/2011 14:47,4.95,14856,United Kingdom
574281,22866,HAND WARMER SCOTTY DOG DESIGN,12,11/03/2011 14:47,2.1,14856,United Kingdom
574281,22632,HAND WARMER RED RETROSPOT,12,11/03/2011 14:47,2.1,14856,United Kingdom
574281,23084,RABBIT NIGHT LIGHT,48,11/03/2011 14:47,1.79,14856,United Kingdom
574282,23444,Next Day Carriage,1,11/03/2011 14:52,15,15612,United Kingdom
574282,23356,LOVE HOT WATER BOTTLE,15,11/03/2011 14:52,5.95,15612,United Kingdom
574282,84029E,RED WOOLLY HOTTIE WHITE HEART.,5,11/03/2011 14:52,4.25,15612,United Kingdom
574283,22637,PIGGY BANK RETROSPOT ,4,11/03/2011 14:53,2.55,14856,United Kingdom
574284,23147,SINGLE ANTIQUE ROSE HOOK IVORY,12,11/03/2011 15:01,1.45,17644,United Kingdom
574284,47566,PARTY BUNTING,4,11/03/2011 15:01,4.95,17644,United Kingdom
574284,23209,LUNCH BAG VINTAGE DOILY ,10,11/03/2011 15:01,1.65,17644,United Kingdom
574284,23208,LUNCH BAG VINTAGE LEAF DESIGN,10,11/03/2011 15:01,1.65,17644,United Kingdom
574284,23203,JUMBO BAG VINTAGE DOILY ,20,11/03/2011 15:01,2.08,17644,United Kingdom
574284,23581,JUMBO BAG PAISLEY PARK,20,11/03/2011 15:01,2.08,17644,United Kingdom
574284,23202,JUMBO BAG VINTAGE LEAF,20,11/03/2011 15:01,2.08,17644,United Kingdom
574284,22379,RECYCLING BAG RETROSPOT ,5,11/03/2011 15:01,2.1,17644,United Kingdom
574284,22664,TOY TIDY DOLLY GIRL DESIGN,5,11/03/2011 15:01,2.1,17644,United Kingdom
574284,23298,SPOTTY BUNTING,3,11/03/2011 15:01,4.95,17644,United Kingdom
574284,23322,LARGE WHITE HEART OF WICKER,12,11/03/2011 15:01,2.95,17644,United Kingdom
574284,23118,PARISIENNE JEWELLERY DRAWER ,2,11/03/2011 15:01,7.5,17644,United Kingdom
574284,20725,LUNCH BAG RED RETROSPOT,10,11/03/2011 15:01,1.65,17644,United Kingdom
574284,23333,IVORY WICKER HEART MEDIUM,12,11/03/2011 15:01,1.25,17644,United Kingdom
574285,82551,LAUNDRY 15C METAL SIGN,48,11/03/2011 15:01,1.7,17450,United Kingdom
574285,82552,WASHROOM METAL SIGN,96,11/03/2011 15:01,1.7,17450,United Kingdom
574285,21733,RED HANGING HEART T-LIGHT HOLDER,416,11/03/2011 15:01,3.2,17450,United Kingdom
574285,85123A,WHITE HANGING HEART T-LIGHT HOLDER,224,11/03/2011 15:01,3.2,17450,United Kingdom
574285,21175,GIN + TONIC DIET METAL SIGN,144,11/03/2011 15:01,2.66,17450,United Kingdom
574285,21166,COOK WITH WINE METAL SIGN ,96,11/03/2011 15:01,2.41,17450,United Kingdom
574286,23084,RABBIT NIGHT LIGHT,24,11/03/2011 15:02,1.79,17644,United Kingdom
574286,23284,DOORMAT KEEP CALM AND COME IN,4,11/03/2011 15:02,8.25,17644,United Kingdom
574286,23459,DOLLY CABINET 2 DRAWERS ,2,11/03/2011 15:02,12.5,17644,United Kingdom
574286,23583,LUNCH BAG PAISLEY PARK  ,10,11/03/2011 15:02,1.65,17644,United Kingdom
574287,21819,GLITTER CHRISTMAS STAR ,2,11/03/2011 15:09,0.39,14723,United Kingdom
574287,21817,GLITTER CHRISTMAS TREE,1,11/03/2011 15:09,0.39,14723,United Kingdom
