574677,21175,GIN + TONIC DIET METAL SIGN,1,11/06/2011 12:32,2.55,16445,United Kingdom
574677,22413,METAL SIGN TAKE IT OR LEAVE IT ,1,11/06/2011 12:32,2.95,16445,United Kingdom
574677,21162,TOXIC AREA  DOOR HANGER ,2,11/06/2011 12:32,0.39,16445,United Kingdom
574677,22730,ALARM CLOCK BAKELIKE IVORY,1,11/06/2011 12:32,3.75,16445,United Kingdom
574677,22727,ALARM CLOCK BAKELIKE RED ,1,11/06/2011 12:32,3.75,16445,United Kingdom
574677,23355,HOT WATER BOTTLE KEEP CALM,1,11/06/2011 12:32,4.95,16445,United Kingdom
574677,23356,LOVE HOT WATER BOTTLE,1,11/06/2011 12:32,5.95,16445,United Kingdom
574677,84030E,ENGLISH ROSE HOT WATER BOTTLE,1,11/06/2011 12:32,4.25,16445,United Kingdom
574677,23302,KNEELING MAT HOUSEWORK  DESIGN,1,11/06/2011 12:32,1.65,16445,United Kingdom
574677,23301,GARDENERS KNEELING PAD KEEP CALM ,1,11/06/2011 12:32,1.65,16445,United Kingdom
574677,23322,LARGE WHITE HEART OF WICKER,4,11/06/2011 12:32,2.95,16445,United Kingdom
574677,23394,POSTE FRANCE CUSHION COVER,1,11/06/2011 12:32,3.75,16445,United Kingdom
574677,23396,LE JARDIN BOTANIQUE CUSHION COVER,1,11/06/2011 12:32,3.75,16445,United Kingdom
574677,23393,HOME SWEET HOME CUSHION COVER ,2,11/06/2011 12:32,3.75,16445,United Kingdom
574677,21479,WHITE SKULL HOT WATER BOTTLE ,1,11/06/2011 12:32,4.25,16445,United Kingdom
574677,84032B,CHARLIE + LOLA RED HOT WATER BOTTLE,1,11/06/2011 12:32,2.95,16445,United Kingdom
574677,23397,FOOT STOOL HOME SWEET HOME ,1,11/06/2011 12:32,9.95,16445,United Kingdom
574677,23553,LANDMARK FRAME CAMDEN TOWN ,1,11/06/2011 12:32,12.5,16445,United Kingdom
574677,22981,PANTRY APPLE CORER,1,11/06/2011 12:32,1.45,16445,United Kingdom
574677,23202,JUMBO BAG VINTAGE LEAF,1,11/06/2011 12:32,2.08,16445,United Kingdom
574677,23581,JUMBO BAG PAISLEY PARK,1,11/06/2011 12:32,2.08,16445,United Kingdom
574677,22411,JUMBO SHOPPER VINTAGE RED PAISLEY,1,11/06/2011 12:32,2.08,16445,United Kingdom
574677,21034,REX CASH+CARRY JUMBO SHOPPER,6,11/06/2011 12:32,0.95,16445,United Kingdom
574678,23382,BOX OF 6 CHRISTMAS CAKE DECORATIONS,4,11/06/2011 12:36,3.75,13365,United Kingdom
574678,22065,CHRISTMAS PUDDING TRINKET POT ,12,11/06/2011 12:36,1.45,13365,United Kingdom
574678,23247,BISCUIT TIN 50'S CHRISTMAS,6,11/06/2011 12:36,2.89,13365,United Kingdom
574678,23437, 50'S CHRISTMAS GIFT BAG LARGE,12,11/06/2011 12:36,1.25,13365,United Kingdom
574678,23375,50'S CHRISTMAS PAPER GIFT BAG,10,11/06/2011 12:36,0.82,13365,United Kingdom
574678,23378,PACK OF 12 50'S CHRISTMAS TISSUES,24,11/06/2011 12:36,0.39,13365,United Kingdom
574678,23320,GIANT 50'S CHRISTMAS CRACKER,12,11/06/2011 12:36,2.89,13365,United Kingdom
574678,23319,BOX OF 6 MINI 50'S CRACKERS,6,11/06/2011 12:36,2.49,13365,United Kingdom
574678,22809,SET OF 6 T-LIGHTS SANTA,6,11/06/2011 12:36,2.95,13365,United Kingdom
574678,22086,PAPER CHAIN KIT 50'S CHRISTMAS ,6,11/06/2011 12:36,2.95,13365,United Kingdom
574678,22733,3D TRADITIONAL CHRISTMAS STICKERS,18,11/06/2011 12:36,1.25,13365,United Kingdom
574678,22910,PAPER CHAIN KIT VINTAGE CHRISTMAS,6,11/06/2011 12:36,2.95,13365,United Kingdom
574678,23373,VINTAGE CHRISTMAS PAPER GIFT BAG,10,11/06/2011 12:36,0.82,13365,United Kingdom
574678,23436,VINTAGE CHRISTMAS GIFT BAG LARGE ,12,11/06/2011 12:36,1.25,13365,United Kingdom
574678,22945,CHRISTMAS METAL TAGS ASSORTED ,12,11/06/2011 12:36,0.85,13365,United Kingdom
574678,23318,BOX OF 6 MINI VINTAGE CRACKERS,6,11/06/2011 12:36,2.49,13365,United Kingdom
574678,22942,CHRISTMAS LIGHTS 10 SANTAS ,2,11/06/2011 12:36,8.5,13365,United Kingdom
574678,22795,SWEETHEART RECIPE BOOK STAND,2,11/06/2011 12:36,6.75,13365,United Kingdom
574678,22816,CARD MOTORBIKE SANTA,12,11/06/2011 12:36,0.42,13365,United Kingdom
574678,23034,DRAWER KNOB CERAMIC BLACK,6,11/06/2011 12:36,1.45,13365,United Kingdom
574678,85053,FRENCH ENAMEL CANDLEHOLDER,6,11/06/2011 12:36,2.1,13365,United Kingdom
574678,21671,RED SPOT CERAMIC DRAWER KNOB,12,11/06/2011 12:36,1.45,13365,United Kingdom
574678,21668,RED STRIPE CERAMIC DRAWER KNOB,12,11/06/2011 12:36,1.45,13365,United Kingdom
574678,21669,BLUE STRIPE CERAMIC DRAWER KNOB,12,11/06/2011 12:36,1.45,13365,United Kingdom
574678,21673,WHITE SPOT BLUE CERAMIC DRAWER KNOB,12,11/06/2011 12:36,1.45,13365,United Kingdom
574678,23118,PARISIENNE JEWELLERY DRAWER ,2,11/06/2011 12:36,7.5,13365,United Kingdom
574678,23111,PARISIENNE SEWING BOX,2,11/06/2011 12:36,12.5,13365,United Kingdom
