574731,22697,GREEN REGENCY TEACUP AND SAUCER,6,11/06/2011 15:09,2.95,17831,United Kingdom
574732,22899,CHILDREN'S APRON DOLLY GIRL ,6,11/06/2011 15:11,2.1,13523,United Kingdom
574732,22617,BAKING SET SPACEBOY DESIGN,3,11/06/2011 15:11,4.95,13523,United Kingdom
574732,22367,CHILDRENS APRON SPACEBOY DESIGN,8,11/06/2011 15:11,1.95,13523,United Kingdom
574732,22138,BAKING SET 9 PIECE RETROSPOT ,3,11/06/2011 15:11,4.95,13523,United Kingdom
574732,23077,DOUGHNUT LIP GLOSS ,20,11/06/2011 15:11,1.25,13523,United Kingdom
574732,23076,ICE CREAM SUNDAE LIP GLOSS,24,11/06/2011 15:11,1.25,13523,United Kingdom
574732,23310,BUBBLEGUM RING ASSORTED,36,11/06/2011 15:11,0.42,13523,United Kingdom
574732,84077,WORLD WAR 2 GLIDERS ASSTD DESIGNS,48,11/06/2011 15:11,0.29,13523,United Kingdom
574732,21914,BLUE HARMONICA IN BOX ,12,11/06/2011 15:11,1.25,13523,United Kingdom
574732,21915,RED  HARMONICA IN BOX ,12,11/06/2011 15:11,1.25,13523,United Kingdom
574732,22549,PICTURE DOMINOES,72,11/06/2011 15:11,1.25,13523,United Kingdom
574732,21790,VINTAGE SNAP CARDS,24,11/06/2011 15:11,0.85,13523,United Kingdom
574732,21791,VINTAGE HEADS AND TAILS CARD GAME ,12,11/06/2011 15:11,1.25,13523,United Kingdom
574732,21889,WOODEN BOX OF DOMINOES,12,11/06/2011 15:11,1.25,13523,United Kingdom
574732,22620,4 TRADITIONAL SPINNING TOPS,12,11/06/2011 15:11,1.45,13523,United Kingdom
574732,21891,TRADITIONAL WOODEN SKIPPING ROPE,12,11/06/2011 15:11,1.45,13523,United Kingdom
574732,21892,TRADITIONAL WOODEN CATCH CUP GAME ,12,11/06/2011 15:11,1.25,13523,United Kingdom
574732,22622,BOX OF VINTAGE ALPHABET BLOCKS,2,11/06/2011 15:11,11.95,13523,United Kingdom
574732,22623,BOX OF VINTAGE JIGSAW BLOCKS ,3,11/06/2011 15:11,5.95,13523,United Kingdom
574732,22568,FELTCRAFT CUSHION OWL,4,11/06/2011 15:11,3.75,13523,United Kingdom
574732,22621,TRADITIONAL KNITTING NANCY,12,11/06/2011 15:11,1.65,13523,United Kingdom
574732,20969,RED FLORAL FELTCRAFT SHOULDER BAG,4,11/06/2011 15:11,3.75,13523,United Kingdom
574732,20972,PINK CREAM FELT CRAFT TRINKET BOX ,12,11/06/2011 15:11,1.25,13523,United Kingdom
574732,20981,12 PENCILS TALL TUBE WOODLAND,12,11/06/2011 15:11,0.85,13523,United Kingdom
574732,22633,HAND WARMER UNION JACK,12,11/06/2011 15:11,2.1,13523,United Kingdom
574732,22865,HAND WARMER OWL DESIGN,12,11/06/2011 15:11,2.1,13523,United Kingdom
574732,21481,FAWN BLUE HOT WATER BOTTLE,4,11/06/2011 15:11,3.75,13523,United Kingdom
574732,23493,VINTAGE DOILY TRAVEL SEWING KIT,10,11/06/2011 15:11,1.95,13523,United Kingdom
574732,23294,SET OF 6 SNACK LOAF BAKING CASES,8,11/06/2011 15:11,0.83,13523,United Kingdom
574732,23296,SET OF 6 TEA TIME BAKING CASES,8,11/06/2011 15:11,1.25,13523,United Kingdom
574732,23293,SET OF 12 FAIRY CAKE BAKING CASES,8,11/06/2011 15:11,0.83,13523,United Kingdom
574732,23424,GINGHAM RECIPE BOOK BOX,4,11/06/2011 15:11,4.95,13523,United Kingdom
574732,22842,BISCUIT TIN VINTAGE RED,2,11/06/2011 15:11,6.75,13523,United Kingdom
574732,22840,ROUND CAKE TIN VINTAGE RED,4,11/06/2011 15:11,7.95,13523,United Kingdom
574732,22838,3 TIER CAKE TIN RED AND CREAM,1,11/06/2011 15:11,14.95,13523,United Kingdom
574732,22624,IVORY KITCHEN SCALES,2,11/06/2011 15:11,8.5,13523,United Kingdom
574732,21136,PAINTED METAL PEARS ASSORTED,12,11/06/2011 15:11,1.69,13523,United Kingdom
574732,84879,ASSORTED COLOUR BIRD ORNAMENT,12,11/06/2011 15:11,1.69,13523,United Kingdom
574732,21756,BATH BUILDING BLOCK WORD,3,11/06/2011 15:11,6.25,13523,United Kingdom
574732,21754,HOME BUILDING BLOCK WORD,3,11/06/2011 15:11,6.25,13523,United Kingdom
574732,22120,WELCOME  WOODEN BLOCK LETTERS,3,11/06/2011 15:11,9.95,13523,United Kingdom
574732,21755,LOVE BUILDING BLOCK WORD,9,11/06/2011 15:11,6.25,13523,United Kingdom
574732,23092,LARGE ANTIQUE WHITE PHOTO FRAME,2,11/06/2011 15:11,7.9,13523,United Kingdom
574732,22767,TRIPLE PHOTO FRAME CORNICE ,4,11/06/2011 15:11,9.95,13523,United Kingdom
574732,22768,FAMILY PHOTO FRAME CORNICE,4,11/06/2011 15:11,9.95,13523,United Kingdom
574732,22141,CHRISTMAS CRAFT TREE TOP ANGEL,12,11/06/2011 15:11,2.1,13523,United Kingdom
574732,23101,SILVER STARS TABLE DECORATION,12,11/06/2011 15:11,0.83,13523,United Kingdom
574733,22386,JUMBO BAG PINK POLKADOT,20,11/06/2011 15:17,2.08,17082,United Kingdom
574733,85099B,JUMBO BAG RED RETROSPOT,20,11/06/2011 15:17,2.08,17082,United Kingdom
