574654,21034,REX CASH+CARRY JUMBO SHOPPER,2,11/06/2011 11:32,0.95,15571,United Kingdom
574655,22382,LUNCH BAG SPACEBOY DESIGN ,1,11/06/2011 11:35,1.65,16466,United Kingdom
574655,23209,LUNCH BAG VINTAGE DOILY ,1,11/06/2011 11:35,1.65,16466,United Kingdom
574655,20725,LUNCH BAG RED RETROSPOT,1,11/06/2011 11:35,1.65,16466,United Kingdom
574655,22384,LUNCH BAG PINK POLKADOT,1,11/06/2011 11:35,1.65,16466,United Kingdom
574655,22605,WOODEN CROQUET GARDEN SET,1,11/06/2011 11:35,14.95,16466,United Kingdom
574655,21479,WHITE SKULL HOT WATER BOTTLE ,1,11/06/2011 11:35,4.25,16466,United Kingdom
574655,22111,SCOTTIE DOG HOT WATER BOTTLE,1,11/06/2011 11:35,4.95,16466,United Kingdom
574655,23397,FOOT STOOL HOME SWEET HOME ,1,11/06/2011 11:35,9.95,16466,United Kingdom
574655,85123A,WHITE HANGING HEART T-LIGHT HOLDER,12,11/06/2011 11:35,2.95,16466,United Kingdom
574655,22602,RETROSPOT WOODEN HEART DECORATION,12,11/06/2011 11:35,0.85,16466,United Kingdom
574655,85199S,SMALL HANGING IVORY/RED WOOD BIRD,12,11/06/2011 11:35,0.42,16466,United Kingdom
574655,22604,SET OF 4 NAPKIN CHARMS CUTLERY,13,11/06/2011 11:35,2.55,16466,United Kingdom
574655,22640,SET OF 4 NAPKIN CHARMS 3 KEYS ,2,11/06/2011 11:35,2.55,16466,United Kingdom
574655,22639,SET OF 4 NAPKIN CHARMS HEARTS,3,11/06/2011 11:35,2.55,16466,United Kingdom
574655,22694,WICKER STAR ,1,11/06/2011 11:35,2.1,16466,United Kingdom
574655,21745,GAOLERS KEYS DECORATIVE GARDEN ,3,11/06/2011 11:35,3.75,16466,United Kingdom
574655,23313,VINTAGE CHRISTMAS BUNTING,3,11/06/2011 11:35,4.95,16466,United Kingdom
574655,23330,DECORATIVE WICKER HEART MEDIUM,12,11/06/2011 11:35,1.25,16466,United Kingdom
574655,22694,WICKER STAR ,2,11/06/2011 11:35,2.1,16466,United Kingdom
574655,23103,JINGLE BELL HEART DECORATION,4,11/06/2011 11:35,1.65,16466,United Kingdom
574655,23489,VINTAGE BELLS GARLAND,3,11/06/2011 11:35,2.89,16466,United Kingdom
574655,23133,LARGE IVORY HEART WALL ORGANISER,2,11/06/2011 11:35,8.25,16466,United Kingdom
574655,22797,CHEST OF DRAWERS GINGHAM HEART ,1,11/06/2011 11:35,16.95,16466,United Kingdom
574655,22941,CHRISTMAS LIGHTS 10 REINDEER,1,11/06/2011 11:35,8.5,16466,United Kingdom
574656,23321,SMALL WHITE HEART OF WICKER,6,11/06/2011 11:36,1.65,16434,United Kingdom
574656,22799,SWEETHEART WIRE FRUIT BOWL,2,11/06/2011 11:36,8.5,16434,United Kingdom
574656,23323,WHITE WICKER STAR ,6,11/06/2011 11:36,2.1,16434,United Kingdom
574656,23150,IVORY SWEETHEART SOAP DISH,4,11/06/2011 11:36,2.49,16434,United Kingdom
574656,23099,FRENCH CARRIAGE LANTERN,2,11/06/2011 11:36,6.65,16434,United Kingdom
574656,23489,VINTAGE BELLS GARLAND,6,11/06/2011 11:36,2.89,16434,United Kingdom
574656,21616,4 PEAR BOTANICAL DINNER CANDLES,2,11/06/2011 11:36,1.25,16434,United Kingdom
574656,22078,RIBBON REEL LACE DESIGN ,5,11/06/2011 11:36,2.1,16434,United Kingdom
574656,21428,SET3 BOOK BOX GREEN GINGHAM FLOWER ,2,11/06/2011 11:36,4.25,16434,United Kingdom
574656,23481,PEARLISED IVORY HEART SMALL ,24,11/06/2011 11:36,1.25,16434,United Kingdom
574656,71477,COLOUR GLASS. STAR T-LIGHT HOLDER,2,11/06/2011 11:36,3.95,16434,United Kingdom
574656,21672,WHITE SPOT RED CERAMIC DRAWER KNOB,6,11/06/2011 11:36,1.45,16434,United Kingdom
574656,21673,WHITE SPOT BLUE CERAMIC DRAWER KNOB,6,11/06/2011 11:36,1.45,16434,United Kingdom
574656,23035,DRAWER KNOB CERAMIC IVORY,12,11/06/2011 11:36,1.45,16434,United Kingdom
574656,23471,SIX DRAWER OFFICE TIDY,2,11/06/2011 11:36,9.95,16434,United Kingdom
574656,23103,JINGLE BELL HEART DECORATION,24,11/06/2011 11:36,1.65,16434,United Kingdom
574657,22910,PAPER CHAIN KIT VINTAGE CHRISTMAS,16,11/06/2011 11:43,2.95,13772,United Kingdom
574657,22086,PAPER CHAIN KIT 50'S CHRISTMAS ,16,11/06/2011 11:43,2.95,13772,United Kingdom
574657,23247,BISCUIT TIN 50'S CHRISTMAS,2,11/06/2011 11:43,2.89,13772,United Kingdom
574657,23234,BISCUIT TIN VINTAGE CHRISTMAS,3,11/06/2011 11:43,2.89,13772,United Kingdom
574657,23344,JUMBO BAG 50'S CHRISTMAS ,7,11/06/2011 11:43,2.08,13772,United Kingdom
574657,23343,JUMBO BAG VINTAGE CHRISTMAS ,7,11/06/2011 11:43,2.08,13772,United Kingdom
574657,23313,VINTAGE CHRISTMAS BUNTING,7,11/06/2011 11:43,4.95,13772,United Kingdom
574657,23298,SPOTTY BUNTING,3,11/06/2011 11:43,4.95,13772,United Kingdom
574657,22138,BAKING SET 9 PIECE RETROSPOT ,1,11/06/2011 11:43,4.95,13772,United Kingdom
