574509,23366,SET 12 COLOURING PENCILS DOILY,4,11/04/2011 13:25,0.65,16012,United Kingdom
574509,23368,SET 12 COLOUR PENCILS DOLLY GIRL ,3,11/04/2011 13:25,0.65,16012,United Kingdom
574509,20973,12 PENCIL SMALL TUBE WOODLAND,3,11/04/2011 13:25,0.65,16012,United Kingdom
574509,23365,SET 12 COLOUR PENCILS LOVE LONDON,8,11/04/2011 13:25,0.65,16012,United Kingdom
574509,23570,TRADITIONAL PICK UP STICKS GAME ,5,11/04/2011 13:25,1.25,16012,United Kingdom
574509,22732,3D VINTAGE CHRISTMAS STICKERS ,5,11/04/2011 13:25,1.25,16012,United Kingdom
574509,22733,3D TRADITIONAL CHRISTMAS STICKERS,5,11/04/2011 13:25,1.25,16012,United Kingdom
574509,22738,RIBBON REEL SNOWY VILLAGE,5,11/04/2011 13:25,1.65,16012,United Kingdom
574509,22737,RIBBON REEL CHRISTMAS PRESENT ,5,11/04/2011 13:25,1.65,16012,United Kingdom
574509,23571,TRADITIONAL NAUGHTS & CROSSES,4,11/04/2011 13:25,1.65,16012,United Kingdom
574509,21232,STRAWBERRY CERAMIC TRINKET POT,4,11/04/2011 13:25,1.25,16012,United Kingdom
574509,22866,HAND WARMER SCOTTY DOG DESIGN,2,11/04/2011 13:25,2.1,16012,United Kingdom
574509,22633,HAND WARMER UNION JACK,2,11/04/2011 13:25,2.1,16012,United Kingdom
574509,22632,HAND WARMER RED RETROSPOT,2,11/04/2011 13:25,2.1,16012,United Kingdom
574509,22142,CHRISTMAS CRAFT WHITE FAIRY ,3,11/04/2011 13:25,1.45,16012,United Kingdom
574509,22144,CHRISTMAS CRAFT LITTLE FRIENDS,3,11/04/2011 13:25,2.1,16012,United Kingdom
574509,21636,MADRAS NOTEBOOK MEDIUM,12,11/04/2011 13:25,0.75,16012,United Kingdom
574509,22549,PICTURE DOMINOES,2,11/04/2011 13:25,1.45,16012,United Kingdom
574509,22966,GINGERBREAD MAN COOKIE CUTTER,4,11/04/2011 13:25,1.25,16012,United Kingdom
574509,22139,RETROSPOT TEA SET CERAMIC 11 PC ,3,11/04/2011 13:25,4.95,16012,United Kingdom
574509,23300,GARDENERS KNEELING PAD CUP OF TEA ,2,11/04/2011 13:25,1.65,16012,United Kingdom
574509,23301,GARDENERS KNEELING PAD KEEP CALM ,2,11/04/2011 13:25,1.65,16012,United Kingdom
574509,23355,HOT WATER BOTTLE KEEP CALM,2,11/04/2011 13:25,4.95,16012,United Kingdom
574509,22751,FELTCRAFT PRINCESS OLIVIA DOLL,1,11/04/2011 13:25,3.75,16012,United Kingdom
574509,22750,FELTCRAFT PRINCESS LOLA DOLL,1,11/04/2011 13:25,3.75,16012,United Kingdom
C574508,20977,36 PENCILS TUBE WOODLAND,-11,11/04/2011 13:25,1.25,16463,United Kingdom
C574510,22360,GLASS JAR ENGLISH CONFECTIONERY,-1,11/04/2011 13:25,2.95,15110,United Kingdom
C574510,22360,GLASS JAR ENGLISH CONFECTIONERY,-1,11/04/2011 13:25,2.95,15110,United Kingdom
C574510,22114,HOT WATER BOTTLE TEA AND SYMPATHY,-2,11/04/2011 13:25,4.25,15110,United Kingdom
574511,22121,NOEL WOODEN BLOCK LETTERS ,3,11/04/2011 13:26,5.95,15597,United Kingdom
574511,20956,PORCELAIN T-LIGHT HOLDERS ASSORTED,12,11/04/2011 13:26,1.25,15597,United Kingdom
574511,21326,AGED GLASS SILVER T-LIGHT HOLDER,12,11/04/2011 13:26,0.65,15597,United Kingdom
574511,22161,HEART DECORATION RUSTIC HANGING ,24,11/04/2011 13:26,0.19,15597,United Kingdom
574511,21824,PAINTED METAL STAR WITH HOLLY BELLS,24,11/04/2011 13:26,0.39,15597,United Kingdom
574511,22578,WOODEN STAR CHRISTMAS SCANDINAVIAN,24,11/04/2011 13:26,0.29,15597,United Kingdom
574511,22579,WOODEN TREE CHRISTMAS SCANDINAVIAN,24,11/04/2011 13:26,0.29,15597,United Kingdom
574511,22574,HEART WOODEN CHRISTMAS DECORATION,12,11/04/2011 13:26,0.85,15597,United Kingdom
574511,35970,ZINC FOLKART SLEIGH BELLS,12,11/04/2011 13:26,1.69,15597,United Kingdom
574511,84836,ZINC METAL HEART DECORATION,12,11/04/2011 13:26,1.25,15597,United Kingdom
574511,23321,SMALL WHITE HEART OF WICKER,12,11/04/2011 13:26,1.65,15597,United Kingdom
574511,23322,LARGE WHITE HEART OF WICKER,6,11/04/2011 13:26,2.95,15597,United Kingdom
574511,21175,GIN + TONIC DIET METAL SIGN,12,11/04/2011 13:26,2.55,15597,United Kingdom
574511,22694,WICKER STAR ,6,11/04/2011 13:26,2.1,15597,United Kingdom
574511,23332,IVORY WICKER HEART LARGE,12,11/04/2011 13:26,1.65,15597,United Kingdom
574511,23329,DECORATIVE WICKER HEART LARGE,12,11/04/2011 13:26,1.65,15597,United Kingdom
574511,23323,WHITE WICKER STAR ,6,11/04/2011 13:26,2.1,15597,United Kingdom
574511,23330,DECORATIVE WICKER HEART MEDIUM,12,11/04/2011 13:26,1.25,15597,United Kingdom
574511,23333,IVORY WICKER HEART MEDIUM,12,11/04/2011 13:26,1.25,15597,United Kingdom
574511,22470,HEART OF WICKER LARGE,6,11/04/2011 13:26,2.95,15597,United Kingdom
574511,22469,HEART OF WICKER SMALL,12,11/04/2011 13:26,1.65,15597,United Kingdom
