574710,22144,CHRISTMAS CRAFT LITTLE FRIENDS,2,11/06/2011 14:17,2.1,15427,United Kingdom
574710,22142,CHRISTMAS CRAFT WHITE FAIRY ,2,11/06/2011 14:17,1.45,15427,United Kingdom
574710,22141,CHRISTMAS CRAFT TREE TOP ANGEL,2,11/06/2011 14:17,2.1,15427,United Kingdom
574710,22810,SET OF 6 T-LIGHTS SNOWMEN,6,11/06/2011 14:17,2.95,15427,United Kingdom
574710,21739,COSY SLIPPER SHOES SMALL GREEN,4,11/06/2011 14:17,2.95,15427,United Kingdom
574710,23356,LOVE HOT WATER BOTTLE,3,11/06/2011 14:17,5.95,15427,United Kingdom
574710,23355,HOT WATER BOTTLE KEEP CALM,2,11/06/2011 14:17,4.95,15427,United Kingdom
574710,21741,COSY SLIPPER SHOES LARGE GREEN,2,11/06/2011 14:17,2.95,15427,United Kingdom
574710,22867,HAND WARMER BIRD DESIGN,4,11/06/2011 14:17,2.1,15427,United Kingdom
574710,22632,HAND WARMER RED RETROSPOT,4,11/06/2011 14:17,2.1,15427,United Kingdom
574710,22865,HAND WARMER OWL DESIGN,4,11/06/2011 14:17,2.1,15427,United Kingdom
574710,22633,HAND WARMER UNION JACK,4,11/06/2011 14:17,2.1,15427,United Kingdom
574710,23191,BUNDLE OF 3 RETRO NOTE BOOKS,2,11/06/2011 14:17,1.65,15427,United Kingdom
574710,23190,BUNDLE OF 3 SCHOOL EXERCISE BOOKS  ,2,11/06/2011 14:17,1.65,15427,United Kingdom
574710,23192,BUNDLE OF 3 ALPHABET EXERCISE BOOKS,2,11/06/2011 14:17,1.65,15427,United Kingdom
574710,23196,VINTAGE LEAF MAGNETIC NOTEPAD,4,11/06/2011 14:17,1.45,15427,United Kingdom
574710,23197,SKETCHBOOK MAGNETIC SHOPPING LIST,4,11/06/2011 14:17,1.45,15427,United Kingdom
574710,21108,FAIRY CAKE FLANNEL ASSORTED COLOUR,9,11/06/2011 14:17,0.79,15427,United Kingdom
574710,22943,CHRISTMAS LIGHTS 10 VINTAGE BAUBLES,1,11/06/2011 14:17,4.95,15427,United Kingdom
574710,22992,REVOLVER WOODEN RULER ,12,11/06/2011 14:17,1.95,15427,United Kingdom
574710,22991,GIRAFFE WOODEN RULER,12,11/06/2011 14:17,1.95,15427,United Kingdom
574710,22904,CALENDAR PAPER CUT DESIGN,4,11/06/2011 14:17,2.95,15427,United Kingdom
574710,22667,RECIPE BOX RETROSPOT ,2,11/06/2011 14:17,2.95,15427,United Kingdom
574710,20754,RETROSPOT RED WASHING UP GLOVES,3,11/06/2011 14:17,2.1,15427,United Kingdom
574710,22311,OFFICE MUG WARMER BLACK+SILVER ,4,11/06/2011 14:17,2.95,15427,United Kingdom
574710,20751,FUNKY WASHING UP GLOVES ASSORTED,5,11/06/2011 14:17,2.1,15427,United Kingdom
574710,23398,HANGING HEART BONHEUR,3,11/06/2011 14:17,0.85,15427,United Kingdom
574710,23399,HOME SWEET HOME HANGING HEART,3,11/06/2011 14:17,0.85,15427,United Kingdom
574710,23497,CLASSIC CHROME BICYCLE BELL ,3,11/06/2011 14:17,1.45,15427,United Kingdom
574710,22312,OFFICE MUG WARMER POLKADOT,3,11/06/2011 14:17,2.95,15427,United Kingdom
574710,20914,SET/5 RED RETROSPOT LID GLASS BOWLS,2,11/06/2011 14:17,2.95,15427,United Kingdom
574710,22123,PING MICROWAVE APRON,2,11/06/2011 14:17,1.95,15427,United Kingdom
574710,22181,SNOWSTORM PHOTO FRAME FRIDGE MAGNET,8,11/06/2011 14:17,0.85,15427,United Kingdom
574710,22551,PLASTERS IN TIN SPACEBOY,1,11/06/2011 14:17,1.65,15427,United Kingdom
574710,22553,PLASTERS IN TIN SKULLS,2,11/06/2011 14:17,1.65,15427,United Kingdom
574710,47503A,ASS FLORAL PRINT MULTI SCREWDRIVER,12,11/06/2011 14:17,0.42,15427,United Kingdom
574710,23409,PHOTO FRAME LINEN AND LACE LARGE,2,11/06/2011 14:17,3.75,15427,United Kingdom
574710,23403,LETTER HOLDER HOME SWEET HOME,2,11/06/2011 14:17,3.75,15427,United Kingdom
574710,23408,PHOTO FRAME LINEN AND LACE SMALL,3,11/06/2011 14:17,2.08,15427,United Kingdom
574710,23401,RUSTIC MIRROR WITH LACE HEART,1,11/06/2011 14:17,6.25,15427,United Kingdom
574710,23404,HOME SWEET HOME BLACKBOARD,1,11/06/2011 14:17,4.95,15427,United Kingdom
574710,23314,VINTAGE CHRISTMAS TABLECLOTH,1,11/06/2011 14:17,12.5,15427,United Kingdom
574710,23320,GIANT 50'S CHRISTMAS CRACKER,2,11/06/2011 14:17,2.89,15427,United Kingdom
574710,23077,DOUGHNUT LIP GLOSS ,20,11/06/2011 14:17,1.25,15427,United Kingdom
574710,22190,LOCAL CAFE MUG,3,11/06/2011 14:17,2.1,15427,United Kingdom
574710,22943,CHRISTMAS LIGHTS 10 VINTAGE BAUBLES,1,11/06/2011 14:17,4.95,15427,United Kingdom
574710,23084,RABBIT NIGHT LIGHT,4,11/06/2011 14:17,2.08,15427,United Kingdom
574711,82484,WOOD BLACK BOARD ANT WHITE FINISH,4,11/06/2011 14:20,7.95,14517,United Kingdom
574711,82494L,WOODEN FRAME ANTIQUE WHITE ,6,11/06/2011 14:20,2.95,14517,United Kingdom
574711,22141,CHRISTMAS CRAFT TREE TOP ANGEL,6,11/06/2011 14:20,2.1,14517,United Kingdom
