574573,85185B,PINK HORSE SOCK PUPPET KIT,1,11/04/2011 16:35,2.95,14592,United Kingdom
574573,21591,COSY HOUR CIGAR BOX MATCHES ,3,11/04/2011 16:35,1.25,14592,United Kingdom
574573,21787,RAIN PONCHO RETROSPOT,4,11/04/2011 16:35,0.85,14592,United Kingdom
574573,22966,GINGERBREAD MAN COOKIE CUTTER,2,11/04/2011 16:35,1.25,14592,United Kingdom
574573,23177,TREASURE ISLAND BOOK BOX,1,11/04/2011 16:35,2.25,14592,United Kingdom
574573,23176,ABC TREASURE BOOK BOX ,1,11/04/2011 16:35,2.25,14592,United Kingdom
574573,84944,SET OF 6 KASHMIR FOLKART BAUBLES,1,11/04/2011 16:35,1.65,14592,United Kingdom
574573,21494,ROTATING LEAVES T-LIGHT HOLDER,4,11/04/2011 16:35,1.25,14592,United Kingdom
574573,21135,VICTORIAN  METAL POSTCARD SPRING,3,11/04/2011 16:35,1.69,14592,United Kingdom
574573,85184C,SET 4 VALENTINE DECOUPAGE HEART BOX,1,11/04/2011 16:35,2.95,14592,United Kingdom
574573,22605,WOODEN CROQUET GARDEN SET,1,11/04/2011 16:35,14.95,14592,United Kingdom
574573,22607,WOODEN ROUNDERS GARDEN SET ,1,11/04/2011 16:35,9.95,14592,United Kingdom
574573,22093,MOTORING TISSUE BOX,2,11/04/2011 16:35,0.39,14592,United Kingdom
574573,21892,TRADITIONAL WOODEN CATCH CUP GAME ,1,11/04/2011 16:35,1.25,14592,United Kingdom
574573,22621,TRADITIONAL KNITTING NANCY,2,11/04/2011 16:35,1.65,14592,United Kingdom
574573,22940,FELTCRAFT CHRISTMAS FAIRY,1,11/04/2011 16:35,4.25,14592,United Kingdom
574573,22750,FELTCRAFT PRINCESS LOLA DOLL,1,11/04/2011 16:35,3.75,14592,United Kingdom
574573,22749,FELTCRAFT PRINCESS CHARLOTTE DOLL,2,11/04/2011 16:35,3.75,14592,United Kingdom
574573,22114,HOT WATER BOTTLE TEA AND SYMPATHY,3,11/04/2011 16:35,4.25,14592,United Kingdom
574573,22835,HOT WATER BOTTLE I AM SO POORLY,1,11/04/2011 16:35,4.95,14592,United Kingdom
574573,22112,CHOCOLATE HOT WATER BOTTLE,2,11/04/2011 16:35,4.95,14592,United Kingdom
574573,84030E,ENGLISH ROSE HOT WATER BOTTLE,1,11/04/2011 16:35,4.25,14592,United Kingdom
574573,23357,HOT WATER BOTTLE SEX BOMB,2,11/04/2011 16:35,4.95,14592,United Kingdom
574573,22111,SCOTTIE DOG HOT WATER BOTTLE,2,11/04/2011 16:35,4.95,14592,United Kingdom
574573,22476,EMPIRE UNION JACK TV DINNER TRAY,2,11/04/2011 16:35,4.95,14592,United Kingdom
574574,90175B,PINK GLASS CHUNKY CHARM BRACELET,1,11/04/2011 16:42,8.95,,United Kingdom
574574,21098,CHRISTMAS TOILET ROLL,1,11/04/2011 16:42,1.25,,United Kingdom
574574,22943,CHRISTMAS LIGHTS 10 VINTAGE BAUBLES,1,11/04/2011 16:42,4.95,,United Kingdom
574575,85066,CREAM SWEETHEART MINI CHEST,2,11/04/2011 17:03,12.75,14971,United Kingdom
574575,22171,3 HOOK PHOTO SHELF ANTIQUE WHITE,2,11/04/2011 17:03,8.5,14971,United Kingdom
574575,22763,KEY CABINET MA CAMPAGNE,2,11/04/2011 17:03,9.95,14971,United Kingdom
574575,23096,PETIT TRAY CHIC,12,11/04/2011 17:03,1.65,14971,United Kingdom
574575,21726,MULTI HEARTS  STICKERS,10,11/04/2011 17:03,0.85,14971,United Kingdom
574575,21724,PANDA AND BUNNIES STICKER SHEET,10,11/04/2011 17:03,0.85,14971,United Kingdom
574575,22571,ROCKING HORSE RED CHRISTMAS ,34,11/04/2011 17:03,0.85,14971,United Kingdom
574575,22734,SET OF 6 RIBBONS VINTAGE CHRISTMAS,1,11/04/2011 17:03,2.89,14971,United Kingdom
574575,84519A,TOMATO CHARLIE+LOLA COASTER SET,6,11/04/2011 17:03,1.25,14971,United Kingdom
574575,23526,WALL ART DOG LICENCE ,2,11/04/2011 17:03,5.95,14971,United Kingdom
574575,23535,WALL ART BICYCLE SAFETY,1,11/04/2011 17:03,5.95,14971,United Kingdom
574575,23393,HOME SWEET HOME CUSHION COVER ,2,11/04/2011 17:03,3.75,14971,United Kingdom
574575,23394,POSTE FRANCE CUSHION COVER,2,11/04/2011 17:03,3.75,14971,United Kingdom
574575,23396,LE JARDIN BOTANIQUE CUSHION COVER,2,11/04/2011 17:03,3.75,14971,United Kingdom
574575,85183A,CHARLIE & LOLA WASTEPAPER BIN BLUE,5,11/04/2011 17:03,1.25,14971,United Kingdom
574575,82484,WOOD BLACK BOARD ANT WHITE FINISH,2,11/04/2011 17:03,7.95,14971,United Kingdom
574575,21876,POTTERING MUG,6,11/04/2011 17:03,1.65,14971,United Kingdom
574575,21877,HOME SWEET HOME MUG,6,11/04/2011 17:03,1.65,14971,United Kingdom
574575,23490,T-LIGHT HOLDER HANGING LOVE BIRD,6,11/04/2011 17:03,3.75,14971,United Kingdom
574575,23535,WALL ART BICYCLE SAFETY,1,11/04/2011 17:03,5.95,14971,United Kingdom
574575,85071D,CHARLIE+LOLA MY ROOM DOOR SIGN,3,11/04/2011 17:03,0.39,14971,United Kingdom
574575,85071A,BLUE CHARLIE+LOLA PERSONAL DOORSIGN,2,11/04/2011 17:03,0.39,14971,United Kingdom
