574532,23353,6 GIFT TAGS VINTAGE CHRISTMAS ,12,11/04/2011 14:19,0.83,15676,United Kingdom
574532,23354,6 GIFT TAGS 50'S CHRISTMAS ,12,11/04/2011 14:19,0.83,15676,United Kingdom
574532,23370,SET 36 COLOURING PENCILS DOILY,16,11/04/2011 14:19,1.25,15676,United Kingdom
574532,23371,SET 36 COLOUR PENCILS SPACEBOY ,16,11/04/2011 14:19,1.25,15676,United Kingdom
574532,23374,RED SPOT PAPER GIFT BAG,10,11/04/2011 14:19,0.82,15676,United Kingdom
574532,23375,50'S CHRISTMAS PAPER GIFT BAG,10,11/04/2011 14:19,0.82,15676,United Kingdom
574532,23378,PACK OF 12 50'S CHRISTMAS TISSUES,24,11/04/2011 14:19,0.39,15676,United Kingdom
574532,23392,SPACEBOY ROCKET LOLLY MAKERS,6,11/04/2011 14:19,2.08,15676,United Kingdom
574532,23434,3 RAFFIA RIBBONS 50'S CHRISTMAS ,10,11/04/2011 14:19,0.79,15676,United Kingdom
574532,23437, 50'S CHRISTMAS GIFT BAG LARGE,12,11/04/2011 14:19,1.25,15676,United Kingdom
574532,23439,HAND WARMER RED LOVE HEART,12,11/04/2011 14:19,2.1,15676,United Kingdom
574532,23451,SQUARE MINI PORTRAIT FRAME,6,11/04/2011 14:19,1.95,15676,United Kingdom
574532,23452,HEART MINI PORTRAIT FRAME,12,11/04/2011 14:19,1.95,15676,United Kingdom
574532,23454,THREE MINI HANGING FRAMES,4,11/04/2011 14:19,4.15,15676,United Kingdom
574532,23458,DOLLY CABINET 3 DRAWERS ,2,11/04/2011 14:19,14.95,15676,United Kingdom
574532,23460,SWEETHEART WALL TIDY ,2,11/04/2011 14:19,9.95,15676,United Kingdom
574532,23484,HEART TRELLIS TRIPLE T-LIGHT HOLDER,8,11/04/2011 14:19,2.89,15676,United Kingdom
574532,23486,ANTIQUE HEART SHELF UNIT,1,11/04/2011 14:19,16.65,15676,United Kingdom
574532,23487,SWEET HEART CAKE CARRIER,1,11/04/2011 14:19,9.95,15676,United Kingdom
574532,23489,VINTAGE BELLS GARLAND,6,11/04/2011 14:19,2.89,15676,United Kingdom
574532,23491,VINTAGE JINGLE BELLS HEART,2,11/04/2011 14:19,8.25,15676,United Kingdom
574532,23493,VINTAGE DOILY TRAVEL SEWING KIT,10,11/04/2011 14:19,1.95,15676,United Kingdom
574532,23494,VINTAGE DOILY DELUXE SEWING KIT ,3,11/04/2011 14:19,5.95,15676,United Kingdom
574532,23499,SET 12 VINTAGE DOILY CHALK ,24,11/04/2011 14:19,0.42,15676,United Kingdom
574532,23502,PLAYING CARDS VINTAGE DOILY ,12,11/04/2011 14:19,1.25,15676,United Kingdom
574532,23506,MINI PLAYING CARDS SPACEBOY ,20,11/04/2011 14:19,0.42,15676,United Kingdom
574532,23559,WOODLAND BUNNIES LOLLY MAKERS,6,11/04/2011 14:19,2.08,15676,United Kingdom
574532,23569,TRADTIONAL ALPHABET STAMP SET,8,11/04/2011 14:19,4.95,15676,United Kingdom
574532,23571,TRADITIONAL NAUGHTS & CROSSES,12,11/04/2011 14:19,1.65,15676,United Kingdom
574532,23583,LUNCH BAG PAISLEY PARK  ,20,11/04/2011 14:19,1.65,15676,United Kingdom
574532,35970,ZINC FOLKART SLEIGH BELLS,12,11/04/2011 14:19,1.69,15676,United Kingdom
574532,47471,RAINBOW PEGS PHOTO CLIP STRING,24,11/04/2011 14:19,0.65,15676,United Kingdom
574532,47578A,ENGLISH ROSE SMALL SCENTED FLOWER,10,11/04/2011 14:19,0.85,15676,United Kingdom
574532,71101E,STANDING FAIRY POLE SUPPORT ,12,11/04/2011 14:19,0.85,15676,United Kingdom
574532,84029E,RED WOOLLY HOTTIE WHITE HEART.,4,11/04/2011 14:19,4.25,15676,United Kingdom
574532,84077,WORLD WAR 2 GLIDERS ASSTD DESIGNS,48,11/04/2011 14:19,0.29,15676,United Kingdom
574532,84078A,SET/4 WHITE RETRO STORAGE CUBES ,1,11/04/2011 14:19,39.95,15676,United Kingdom
574532,84375,SET OF 20 KIDS COOKIE CUTTERS,12,11/04/2011 14:19,2.1,15676,United Kingdom
574532,84945,MULTI COLOUR SILVER T-LIGHT HOLDER,12,11/04/2011 14:19,0.85,15676,United Kingdom
574532,84946,ANTIQUE SILVER T-LIGHT GLASS,24,11/04/2011 14:19,1.25,15676,United Kingdom
574532,84947,ANTIQUE SILVER TEA GLASS ENGRAVED,12,11/04/2011 14:19,1.25,15676,United Kingdom
574532,85025B,EAU DE NILE HEART SHAPE PHOTO FRAME,24,11/04/2011 14:19,1.65,15676,United Kingdom
574532,85048,15CM CHRISTMAS GLASS BALL 20 LIGHTS,6,11/04/2011 14:19,7.95,15676,United Kingdom
574532,85088,CANDY SPOT HAND BAG,6,11/04/2011 14:19,2.1,15676,United Kingdom
574532,85123A,WHITE HANGING HEART T-LIGHT HOLDER,12,11/04/2011 14:19,2.95,15676,United Kingdom
574532,23444,Next Day Carriage,1,11/04/2011 14:19,15,15676,United Kingdom
574533,16008,SMALL FOLDING SCISSOR(POINTED EDGE),288,11/04/2011 14:24,0.12,12928,United Kingdom
574533,22111,SCOTTIE DOG HOT WATER BOTTLE,24,11/04/2011 14:24,4.25,12928,United Kingdom
574533,22865,HAND WARMER OWL DESIGN,24,11/04/2011 14:24,2.1,12928,United Kingdom
574533,22866,HAND WARMER SCOTTY DOG DESIGN,60,11/04/2011 14:24,2.1,12928,United Kingdom
