574661,22584,PACK OF 6 PANNETONE GIFT BOXES,6,11/06/2011 11:56,2.55,13447,United Kingdom
574661,23330,DECORATIVE WICKER HEART MEDIUM,12,11/06/2011 11:56,1.25,13447,United Kingdom
574661,22469,HEART OF WICKER SMALL,12,11/06/2011 11:56,1.65,13447,United Kingdom
574661,22470,HEART OF WICKER LARGE,6,11/06/2011 11:56,2.95,13447,United Kingdom
574661,22457,NATURAL SLATE HEART CHALKBOARD ,6,11/06/2011 11:56,2.95,13447,United Kingdom
574661,23404,HOME SWEET HOME BLACKBOARD,6,11/06/2011 11:56,4.95,13447,United Kingdom
574661,23439,HAND WARMER RED LOVE HEART,12,11/06/2011 11:56,2.1,13447,United Kingdom
574661,22867,HAND WARMER BIRD DESIGN,12,11/06/2011 11:56,2.1,13447,United Kingdom
574661,22632,HAND WARMER RED RETROSPOT,12,11/06/2011 11:56,2.1,13447,United Kingdom
574661,21485,RETROSPOT HEART HOT WATER BOTTLE,3,11/06/2011 11:56,4.95,13447,United Kingdom
574661,84029E,RED WOOLLY HOTTIE WHITE HEART.,4,11/06/2011 11:56,4.25,13447,United Kingdom
574661,22624,IVORY KITCHEN SCALES,2,11/06/2011 11:56,8.5,13447,United Kingdom
574661,23084,RABBIT NIGHT LIGHT,24,11/06/2011 11:56,1.79,13447,United Kingdom
574661,23486,ANTIQUE HEART SHELF UNIT,1,11/06/2011 11:56,16.65,13447,United Kingdom
574662,23080,RED METAL BOX TOP SECRET,2,11/06/2011 12:01,8.25,16676,United Kingdom
574662,22660,DOORMAT I LOVE LONDON,2,11/06/2011 12:01,8.25,16676,United Kingdom
574662,23284,DOORMAT KEEP CALM AND COME IN,2,11/06/2011 12:01,8.25,16676,United Kingdom
574662,21592,RETROSPOT CIGAR BOX MATCHES ,24,11/06/2011 12:01,1.25,16676,United Kingdom
574662,22636,CHILDS BREAKFAST SET CIRCUS PARADE,2,11/06/2011 12:01,8.5,16676,United Kingdom
574662,22900,SET 2 TEA TOWELS I LOVE LONDON ,12,11/06/2011 12:01,3.25,16676,United Kingdom
574662,23347,I LOVE LONDON BEAKER,12,11/06/2011 12:01,1.25,16676,United Kingdom
574662,22423,REGENCY CAKESTAND 3 TIER,1,11/06/2011 12:01,12.75,16676,United Kingdom
574662,21616,4 PEAR BOTANICAL DINNER CANDLES,12,11/06/2011 12:01,1.25,16676,United Kingdom
574662,22659,LUNCH BOX I LOVE LONDON,12,11/06/2011 12:01,1.95,16676,United Kingdom
574662,23252,VINTAGE RED ENAMEL TRIM JUG ,4,11/06/2011 12:01,3.75,16676,United Kingdom
574662,23247,BISCUIT TIN 50'S CHRISTMAS,6,11/06/2011 12:01,2.89,16676,United Kingdom
574662,23234,BISCUIT TIN VINTAGE CHRISTMAS,6,11/06/2011 12:01,2.89,16676,United Kingdom
574662,21213,PACK OF 72 SKULL CAKE CASES,24,11/06/2011 12:01,0.55,16676,United Kingdom
574662,22417,PACK OF 60 SPACEBOY CAKE CASES,24,11/06/2011 12:01,0.55,16676,United Kingdom
574662,23309,SET OF 60 I LOVE LONDON CAKE CASES ,24,11/06/2011 12:01,0.55,16676,United Kingdom
574662,21217,RED RETROSPOT ROUND CAKE TINS,4,11/06/2011 12:01,9.95,16676,United Kingdom
574662,23245,SET OF 3 REGENCY CAKE TINS,4,11/06/2011 12:01,4.95,16676,United Kingdom
574662,22979,PANTRY WASHING UP BRUSH,12,11/06/2011 12:01,1.45,16676,United Kingdom
574662,22980,PANTRY SCRUBBING BRUSH,12,11/06/2011 12:01,1.65,16676,United Kingdom
574662,23114,VINTAGE LEAF CHOPPING BOARD  ,3,11/06/2011 12:01,4.95,16676,United Kingdom
574662,84029G,KNITTED UNION FLAG HOT WATER BOTTLE,4,11/06/2011 12:01,4.25,16676,United Kingdom
574662,85048,15CM CHRISTMAS GLASS BALL 20 LIGHTS,4,11/06/2011 12:01,7.95,16676,United Kingdom
574662,23236,STORAGE TIN VINTAGE DOILY ,6,11/06/2011 12:01,2.89,16676,United Kingdom
574662,23238,SET OF 4 KNICK KNACK TINS LONDON ,6,11/06/2011 12:01,4.15,16676,United Kingdom
574663,23399,HOME SWEET HOME HANGING HEART,12,11/06/2011 12:04,0.85,13527,United Kingdom
574663,23553,LANDMARK FRAME CAMDEN TOWN ,1,11/06/2011 12:04,12.5,13527,United Kingdom
574663,23558,LANDMARK FRAME LONDON BRIDGE ,1,11/06/2011 12:04,12.5,13527,United Kingdom
574663,21755,LOVE BUILDING BLOCK WORD,2,11/06/2011 12:04,6.25,13527,United Kingdom
574663,23535,WALL ART BICYCLE SAFETY,1,11/06/2011 12:04,5.95,13527,United Kingdom
574663,23534,WALL ART STOP FOR TEA ,2,11/06/2011 12:04,5.95,13527,United Kingdom
574663,23397,FOOT STOOL HOME SWEET HOME ,1,11/06/2011 12:04,9.95,13527,United Kingdom
574663,22141,CHRISTMAS CRAFT TREE TOP ANGEL,2,11/06/2011 12:04,2.1,13527,United Kingdom
574663,21818,GLITTER HEART DECORATION,20,11/06/2011 12:04,0.39,13527,United Kingdom
574663,46000S,POLYESTER FILLER PAD 40x40cm,4,11/06/2011 12:04,1.45,13527,United Kingdom
574663,21314,SMALL GLASS HEART TRINKET POT,8,11/06/2011 12:04,2.1,13527,United Kingdom
