574878,23556,LANDMARK FRAME COVENT GARDEN ,1,11/07/2011 13:18,12.5,14653,United Kingdom
574879,22236,CAKE STAND 3 TIER MAGIC GARDEN,2,11/07/2011 13:22,12.75,13014,United Kingdom
574879,21258,VICTORIAN SEWING BOX LARGE,4,11/07/2011 13:22,12.75,13014,United Kingdom
574879,22625,RED KITCHEN SCALES,2,11/07/2011 13:22,0,13014,United Kingdom
574880,23284,DOORMAT KEEP CALM AND COME IN,2,11/07/2011 13:25,8.25,18016,United Kingdom
574880,22900,SET 2 TEA TOWELS I LOVE LONDON ,3,11/07/2011 13:25,3.25,18016,United Kingdom
574880,22902,TOTE BAG I LOVE LONDON,5,11/07/2011 13:25,2.1,18016,United Kingdom
574880,22197,POPCORN HOLDER,50,11/07/2011 13:25,0.85,18016,United Kingdom
574880,23301,GARDENERS KNEELING PAD KEEP CALM ,3,11/07/2011 13:25,1.65,18016,United Kingdom
574880,22728,ALARM CLOCK BAKELIKE PINK,4,11/07/2011 13:25,3.75,18016,United Kingdom
574880,22727,ALARM CLOCK BAKELIKE RED ,4,11/07/2011 13:25,3.75,18016,United Kingdom
574880,20727,LUNCH BAG  BLACK SKULL.,10,11/07/2011 13:25,1.65,18016,United Kingdom
574880,23002,TRAVEL CARD WALLET SKULLS,72,11/07/2011 13:25,0.42,18016,United Kingdom
574880,22998,TRAVEL CARD WALLET KEEP CALM,72,11/07/2011 13:25,0.42,18016,United Kingdom
574880,22659,LUNCH BOX I LOVE LONDON,5,11/07/2011 13:25,1.95,18016,United Kingdom
574880,22996,TRAVEL CARD WALLET VINTAGE TICKET,96,11/07/2011 13:25,0.42,18016,United Kingdom
574880,23300,GARDENERS KNEELING PAD CUP OF TEA ,5,11/07/2011 13:25,1.65,18016,United Kingdom
574880,21955,DOORMAT UNION JACK GUNS AND ROSES,1,11/07/2011 13:25,8.25,18016,United Kingdom
574880,23553,LANDMARK FRAME CAMDEN TOWN ,3,11/07/2011 13:25,12.5,18016,United Kingdom
574880,23555,LANDMARK FRAME NOTTING HILL ,3,11/07/2011 13:25,12.5,18016,United Kingdom
574880,23556,LANDMARK FRAME COVENT GARDEN ,3,11/07/2011 13:25,12.5,18016,United Kingdom
574881,46000R,POLYESTER FILLER PAD 45x30cm,2,11/07/2011 13:30,1.45,12832,United Kingdom
574881,20956,PORCELAIN T-LIGHT HOLDERS ASSORTED,12,11/07/2011 13:30,1.25,12832,United Kingdom
574881,84945,MULTI COLOUR SILVER T-LIGHT HOLDER,12,11/07/2011 13:30,0.85,12832,United Kingdom
574881,18097C,WHITE TALL PORCELAIN T-LIGHT HOLDER,6,11/07/2011 13:30,2.55,12832,United Kingdom
574881,84946,ANTIQUE SILVER T-LIGHT GLASS,12,11/07/2011 13:30,1.25,12832,United Kingdom
574881,23084,RABBIT NIGHT LIGHT,6,11/07/2011 13:30,2.08,12832,United Kingdom
574881,22310,IVORY KNITTED MUG COSY ,6,11/07/2011 13:30,1.65,12832,United Kingdom
574881,23130,MISTLETOE HEART WREATH GREEN,4,11/07/2011 13:30,4.15,12832,United Kingdom
574881,23534,WALL ART STOP FOR TEA ,3,11/07/2011 13:30,5.95,12832,United Kingdom
574882,23313,VINTAGE CHRISTMAS BUNTING,3,11/07/2011 13:45,4.95,13599,United Kingdom
574882,22910,PAPER CHAIN KIT VINTAGE CHRISTMAS,3,11/07/2011 13:45,2.95,13599,United Kingdom
574882,22816,CARD MOTORBIKE SANTA,36,11/07/2011 13:45,0.42,13599,United Kingdom
574882,22818,CARD CHRISTMAS VILLAGE,24,11/07/2011 13:45,0.42,13599,United Kingdom
574882,23318,BOX OF 6 MINI VINTAGE CRACKERS,3,11/07/2011 13:45,2.49,13599,United Kingdom
574882,79066K,RETRO MOD TRAY,12,11/07/2011 13:45,0.85,13599,United Kingdom
574882,85114B,IVORY ENCHANTED FOREST PLACEMAT,2,11/07/2011 13:45,1.65,13599,United Kingdom
574882,22730,ALARM CLOCK BAKELIKE IVORY,2,11/07/2011 13:45,3.75,13599,United Kingdom
574882,22726,ALARM CLOCK BAKELIKE GREEN,2,11/07/2011 13:45,3.75,13599,United Kingdom
574882,22725,ALARM CLOCK BAKELIKE CHOCOLATE,2,11/07/2011 13:45,3.75,13599,United Kingdom
574882,22727,ALARM CLOCK BAKELIKE RED ,3,11/07/2011 13:45,3.75,13599,United Kingdom
574882,82551,LAUNDRY 15C METAL SIGN,3,11/07/2011 13:45,1.45,13599,United Kingdom
574882,21172,PARTY METAL SIGN ,1,11/07/2011 13:45,1.45,13599,United Kingdom
574882,82552,WASHROOM METAL SIGN,3,11/07/2011 13:45,1.45,13599,United Kingdom
574882,21172,PARTY METAL SIGN ,2,11/07/2011 13:45,1.45,13599,United Kingdom
574882,23166,MEDIUM CERAMIC TOP STORAGE JAR,4,11/07/2011 13:45,1.25,13599,United Kingdom
574882,23165,LARGE CERAMIC TOP STORAGE JAR,3,11/07/2011 13:45,1.65,13599,United Kingdom
574882,22097,SWALLOW SQUARE TISSUE BOX,5,11/07/2011 13:45,0.39,13599,United Kingdom
574882,23316,RED REFECTORY CLOCK ,1,11/07/2011 13:45,9.95,13599,United Kingdom
574882,23317,BLUE REFECTORY CLOCK ,1,11/07/2011 13:45,9.95,13599,United Kingdom
