575086,22187,GREEN CHRISTMAS TREE CARD HOLDER,24,11/08/2011 13:52,1.95,16618,United Kingdom
575086,23320,GIANT 50'S CHRISTMAS CRACKER,48,11/08/2011 13:52,2.49,16618,United Kingdom
575086,22733,3D TRADITIONAL CHRISTMAS STICKERS,18,11/08/2011 13:52,1.25,16618,United Kingdom
575086,22732,3D VINTAGE CHRISTMAS STICKERS ,18,11/08/2011 13:52,1.25,16618,United Kingdom
575087,20719,WOODLAND CHARLOTTE BAG,1,11/08/2011 13:57,0.85,16549,United Kingdom
575087,23583,LUNCH BAG PAISLEY PARK  ,1,11/08/2011 13:57,1.65,16549,United Kingdom
575087,20725,LUNCH BAG RED RETROSPOT,1,11/08/2011 13:57,1.65,16549,United Kingdom
575087,21068,VINTAGE BILLBOARD LOVE/HATE MUG,1,11/08/2011 13:57,1.25,16549,United Kingdom
575087,21874,GIN AND TONIC MUG,1,11/08/2011 13:57,1.65,16549,United Kingdom
575087,23406,HOME SWEET HOME KEY HOLDER,1,11/08/2011 13:57,6.25,16549,United Kingdom
575087,22212,FOUR HOOK  WHITE LOVEBIRDS,1,11/08/2011 13:57,2.1,16549,United Kingdom
575087,23130,MISTLETOE HEART WREATH GREEN,1,11/08/2011 13:57,4.15,16549,United Kingdom
575087,22469,HEART OF WICKER SMALL,1,11/08/2011 13:57,1.65,16549,United Kingdom
575087,22575,METAL MERRY CHRISTMAS WREATH,1,11/08/2011 13:57,1.95,16549,United Kingdom
575087,23332,IVORY WICKER HEART LARGE,1,11/08/2011 13:57,1.65,16549,United Kingdom
575087,22910,PAPER CHAIN KIT VINTAGE CHRISTMAS,1,11/08/2011 13:57,2.95,16549,United Kingdom
575087,22086,PAPER CHAIN KIT 50'S CHRISTMAS ,2,11/08/2011 13:57,2.95,16549,United Kingdom
575087,22897,OVEN MITT APPLES DESIGN,2,11/08/2011 13:57,1.45,16549,United Kingdom
575087,22352,LUNCH BOX WITH CUTLERY RETROSPOT ,1,11/08/2011 13:57,2.55,16549,United Kingdom
575087,23372,SET 36 COLOUR PENCILS DOLLY GIRL,2,11/08/2011 13:57,1.25,16549,United Kingdom
575087,20975,12 PENCILS SMALL TUBE RED RETROSPOT,1,11/08/2011 13:57,0.65,16549,United Kingdom
575087,21754,HOME BUILDING BLOCK WORD,1,11/08/2011 13:57,6.25,16549,United Kingdom
575087,20914,SET/5 RED RETROSPOT LID GLASS BOWLS,1,11/08/2011 13:57,2.95,16549,United Kingdom
575087,85099F,JUMBO BAG STRAWBERRY,1,11/08/2011 13:57,2.08,16549,United Kingdom
575087,21561,DINOSAUR LUNCH BOX WITH CUTLERY,1,11/08/2011 13:57,2.55,16549,United Kingdom
575087,71477,COLOUR GLASS. STAR T-LIGHT HOLDER,1,11/08/2011 13:57,3.95,16549,United Kingdom
575087,22633,HAND WARMER UNION JACK,1,11/08/2011 13:57,2.1,16549,United Kingdom
575087,22865,HAND WARMER OWL DESIGN,1,11/08/2011 13:57,2.1,16549,United Kingdom
575087,22866,HAND WARMER SCOTTY DOG DESIGN,1,11/08/2011 13:57,2.1,16549,United Kingdom
575087,85123A,WHITE HANGING HEART T-LIGHT HOLDER,5,11/08/2011 13:57,2.95,16549,United Kingdom
575087,21169,YOU'RE CONFUSING ME METAL SIGN ,1,11/08/2011 13:57,1.69,16549,United Kingdom
575087,22412,METAL SIGN NEIGHBOURHOOD WITCH ,1,11/08/2011 13:57,2.1,16549,United Kingdom
575087,21210,SET OF 72 RETROSPOT PAPER  DOILIES,1,11/08/2011 13:57,1.45,16549,United Kingdom
575087,23311,VINTAGE CHRISTMAS STOCKING ,1,11/08/2011 13:57,2.55,16549,United Kingdom
575087,21733,RED HANGING HEART T-LIGHT HOLDER,1,11/08/2011 13:57,2.95,16549,United Kingdom
575087,23343,JUMBO BAG VINTAGE CHRISTMAS ,1,11/08/2011 13:57,2.08,16549,United Kingdom
575087,23344,JUMBO BAG 50'S CHRISTMAS ,1,11/08/2011 13:57,2.08,16549,United Kingdom
575087,48116,DOORMAT MULTICOLOUR STRIPE,1,11/08/2011 13:57,8.25,16549,United Kingdom
575087,23681,LUNCH BAG RED VINTAGE DOILY,3,11/08/2011 13:57,1.65,16549,United Kingdom
575087,21733,RED HANGING HEART T-LIGHT HOLDER,1,11/08/2011 13:57,2.95,16549,United Kingdom
575087,23096,PETIT TRAY CHIC,4,11/08/2011 13:57,1.65,16549,United Kingdom
575087,23118,PARISIENNE JEWELLERY DRAWER ,4,11/08/2011 13:57,7.5,16549,United Kingdom
575087,23110,PARISIENNE KEY CABINET ,2,11/08/2011 13:57,5.75,16549,United Kingdom
575087,23400,SHELF WITH 4 HOOKS HOME SWEET HOME,4,11/08/2011 13:57,6.25,16549,United Kingdom
575087,21213,PACK OF 72 SKULL CAKE CASES,1,11/08/2011 13:57,0.55,16549,United Kingdom
575087,23227,FILIGREE HEART BUTTERFLY WHITE ,1,11/08/2011 13:57,1.25,16549,United Kingdom
575087,85123A,WHITE HANGING HEART T-LIGHT HOLDER,1,11/08/2011 13:57,2.95,16549,United Kingdom
575087,21232,STRAWBERRY CERAMIC TRINKET POT,1,11/08/2011 13:57,1.25,16549,United Kingdom
575087,22909,SET OF 20 VINTAGE CHRISTMAS NAPKINS,1,11/08/2011 13:57,0.85,16549,United Kingdom
575087,21080,SET/20 RED RETROSPOT PAPER NAPKINS ,1,11/08/2011 13:57,0.85,16549,United Kingdom
