575138,21428,SET3 BOOK BOX GREEN GINGHAM FLOWER ,4,11/08/2011 15:24,8.29,,United Kingdom
575138,21430,SET/3 RED GINGHAM ROSE STORAGE BOX,2,11/08/2011 15:24,7.46,,United Kingdom
575138,21494,ROTATING LEAVES T-LIGHT HOLDER,2,11/08/2011 15:24,5.79,,United Kingdom
575138,21524,DOORMAT SPOTTY HOME SWEET HOME,1,11/08/2011 15:24,16.63,,United Kingdom
575138,21557,SET OF 6 FUNKY BEAKERS,2,11/08/2011 15:24,5.63,,United Kingdom
575138,21558,SKULL LUNCH BOX WITH CUTLERY ,1,11/08/2011 15:24,4.96,,United Kingdom
575138,21731,RED TOADSTOOL LED NIGHT LIGHT,5,11/08/2011 15:24,4.13,,United Kingdom
575138,21733,RED HANGING HEART T-LIGHT HOLDER,2,11/08/2011 15:24,5.79,,United Kingdom
575138,21786,POLKADOT RAIN HAT ,1,11/08/2011 15:24,0.79,,United Kingdom
575138,21843,RED RETROSPOT CAKE STAND,3,11/08/2011 15:24,20.79,,United Kingdom
575138,21864,UNION JACK FLAG PASSPORT COVER ,1,11/08/2011 15:24,4.13,,United Kingdom
575138,21868,POTTING SHED TEA MUG,1,11/08/2011 15:24,3.29,,United Kingdom
575138,21874,GIN AND TONIC MUG,2,11/08/2011 15:24,3.29,,United Kingdom
575138,21876,POTTERING MUG,3,11/08/2011 15:24,3.29,,United Kingdom
575138,21888,BINGO SET,3,11/08/2011 15:24,7.46,,United Kingdom
575138,21889,WOODEN BOX OF DOMINOES,1,11/08/2011 15:24,3.29,,United Kingdom
575138,21894,POTTING SHED SEED ENVELOPES,1,11/08/2011 15:24,2.46,,United Kingdom
575138,21912,VINTAGE SNAKES & LADDERS,1,11/08/2011 15:24,7.46,,United Kingdom
575138,21928,JUMBO BAG SCANDINAVIAN BLUE PAISLEY,7,11/08/2011 15:24,4.13,,United Kingdom
575138,21929,JUMBO BAG PINK VINTAGE PAISLEY,5,11/08/2011 15:24,4.13,,United Kingdom
575138,21930,JUMBO STORAGE BAG SKULLS,3,11/08/2011 15:24,4.13,,United Kingdom
575138,21931,JUMBO STORAGE BAG SUKI,12,11/08/2011 15:24,4.13,,United Kingdom
575138,21934,SKULL SHOULDER BAG,4,11/08/2011 15:24,3.29,,United Kingdom
575138,21935,SUKI  SHOULDER BAG,2,11/08/2011 15:24,4.13,,United Kingdom
575138,21955,DOORMAT UNION JACK GUNS AND ROSES,1,11/08/2011 15:24,12.46,,United Kingdom
575138,21977,PACK OF 60 PINK PAISLEY CAKE CASES,1,11/08/2011 15:24,2.08,,United Kingdom
575138,21989,PACK OF 20 SKULL PAPER NAPKINS,1,11/08/2011 15:24,1.63,,United Kingdom
575138,22069,BROWN  PIRATE TREASURE CHEST ,4,11/08/2011 15:24,4.13,,United Kingdom
575138,22070,SMALL RED RETROSPOT MUG IN BOX ,1,11/08/2011 15:24,7.46,,United Kingdom
575138,22077,6 RIBBONS RUSTIC CHARM,1,11/08/2011 15:24,4.13,,United Kingdom
575138,22086,PAPER CHAIN KIT 50'S CHRISTMAS ,13,11/08/2011 15:24,6.63,,United Kingdom
575138,22089,PAPER BUNTING VINTAGE PAISLEY,2,11/08/2011 15:24,4.13,,United Kingdom
575138,22132,RED LOVE HEART SHAPE CUP,2,11/08/2011 15:24,1.63,,United Kingdom
575138,22135,MINI LADLE LOVE HEART PINK,1,11/08/2011 15:24,0.83,,United Kingdom
575138,22139,RETROSPOT TEA SET CERAMIC 11 PC ,2,11/08/2011 15:24,10.79,,United Kingdom
575138,22141,CHRISTMAS CRAFT TREE TOP ANGEL,2,11/08/2011 15:24,4.13,,United Kingdom
575138,22142,CHRISTMAS CRAFT WHITE FAIRY ,1,11/08/2011 15:24,3.29,,United Kingdom
575138,22144,CHRISTMAS CRAFT LITTLE FRIENDS,10,11/08/2011 15:24,4.13,,United Kingdom
575138,22173,METAL 4 HOOK HANGER FRENCH CHATEAU,5,11/08/2011 15:24,5.79,,United Kingdom
575138,22174,PHOTO CUBE,1,11/08/2011 15:24,4.13,,United Kingdom
575138,22178,VICTORIAN GLASS HANGING T-LIGHT,3,11/08/2011 15:24,2.46,,United Kingdom
575138,22179,SET 10 NIGHT OWL LIGHTS,2,11/08/2011 15:24,13.29,,United Kingdom
575138,22186,RED STAR CARD HOLDER,2,11/08/2011 15:24,5.79,,United Kingdom
575138,22187,GREEN CHRISTMAS TREE CARD HOLDER,1,11/08/2011 15:24,8.29,,United Kingdom
575138,22195,LARGE HEART MEASURING SPOONS,3,11/08/2011 15:24,3.29,,United Kingdom
575138,22200,FRYING PAN PINK POLKADOT,2,11/08/2011 15:24,8.29,,United Kingdom
575138,22207,FRYING PAN UNION FLAG,1,11/08/2011 15:24,8.29,,United Kingdom
575138,22219,LOVEBIRD HANGING DECORATION WHITE ,14,11/08/2011 15:24,1.63,,United Kingdom
575138,22271,FELTCRAFT DOLL ROSIE,1,11/08/2011 15:24,5.79,,United Kingdom
575138,22278,OVERNIGHT BAG VINTAGE ROSE PAISLEY,2,11/08/2011 15:24,10.79,,United Kingdom
