574883,23201,JUMBO BAG ALPHABET,3,11/07/2011 13:56,2.08,14623,United Kingdom
574883,22138,BAKING SET 9 PIECE RETROSPOT ,2,11/07/2011 13:56,4.95,14623,United Kingdom
574883,22617,BAKING SET SPACEBOY DESIGN,1,11/07/2011 13:56,4.95,14623,United Kingdom
574883,21356,TOAST ITS - FAIRY FLOWER,3,11/07/2011 13:56,1.25,14623,United Kingdom
574883,21354,TOAST ITS - BEST MUM,2,11/07/2011 13:56,1.25,14623,United Kingdom
574883,22964,3 PIECE SPACEBOY COOKIE CUTTER SET,1,11/07/2011 13:56,2.1,14623,United Kingdom
574883,22195,LARGE HEART MEASURING SPOONS,1,11/07/2011 13:56,1.65,14623,United Kingdom
574883,22721,SET OF 3 CAKE TINS SKETCHBOOK,1,11/07/2011 13:56,4.95,14623,United Kingdom
574883,22693,GROW A FLYTRAP OR SUNFLOWER IN TIN,48,11/07/2011 13:56,1.25,14623,United Kingdom
574883,22816,CARD MOTORBIKE SANTA,12,11/07/2011 13:56,0.42,14623,United Kingdom
574884,22112,CHOCOLATE HOT WATER BOTTLE,48,11/07/2011 13:57,4.25,15291,United Kingdom
574885,23473,WOODLAND SMALL RED FELT HEART,12,11/07/2011 14:01,0.83,12472,Germany
574885,23476,WOODLAND LARGE RED FELT HEART,12,11/07/2011 14:01,1.25,12472,Germany
574885,23480,MINI LIGHTS WOODLAND MUSHROOMS,8,11/07/2011 14:01,3.75,12472,Germany
574885,23569,TRADTIONAL ALPHABET STAMP SET,8,11/07/2011 14:01,4.95,12472,Germany
574885,23571,TRADITIONAL NAUGHTS & CROSSES,12,11/07/2011 14:01,1.65,12472,Germany
574885,23570,TRADITIONAL PICK UP STICKS GAME ,12,11/07/2011 14:01,1.25,12472,Germany
574885,23084,RABBIT NIGHT LIGHT,48,11/07/2011 14:01,1.79,12472,Germany
574885,21914,BLUE HARMONICA IN BOX ,12,11/07/2011 14:01,1.25,12472,Germany
574885,22554,PLASTERS IN TIN WOODLAND ANIMALS,12,11/07/2011 14:01,1.65,12472,Germany
574885,POST,POSTAGE,1,11/07/2011 14:01,18,12472,Germany
C574886,23169,CLASSIC GLASS COOKIE JAR,-1,11/07/2011 14:07,3.75,14606,United Kingdom
574887,21014,SWISS CHALET TREE DECORATION ,24,11/07/2011 14:13,0.29,13717,United Kingdom
574887,21698,MOCK LOBSTER FRIDGE MAGNET,12,11/07/2011 14:13,0.39,13717,United Kingdom
574887,22093,MOTORING TISSUE BOX,36,11/07/2011 14:13,0.39,13717,United Kingdom
574887,22269,EGG CUP NATURAL CHICKEN,16,11/07/2011 14:13,0.39,13717,United Kingdom
574887,22267,EASTER DECORATION EGG BUNNY ,24,11/07/2011 14:13,0.39,13717,United Kingdom
574887,22065,CHRISTMAS PUDDING TRINKET POT ,48,11/07/2011 14:13,0.39,13717,United Kingdom
574887,23058,CHRISTMAS HANGING SNOWFLAKE,12,11/07/2011 14:13,0.79,13717,United Kingdom
574887,22372,AIRLINE BAG VINTAGE WORLD CHAMPION ,4,11/07/2011 14:13,4.25,13717,United Kingdom
574887,22375,AIRLINE BAG VINTAGE JET SET BROWN,4,11/07/2011 14:13,4.25,13717,United Kingdom
574887,21935,SUKI  SHOULDER BAG,10,11/07/2011 14:13,1.65,13717,United Kingdom
574887,22374,AIRLINE BAG VINTAGE JET SET RED,4,11/07/2011 14:13,4.25,13717,United Kingdom
574887,22376,AIRLINE BAG VINTAGE JET SET WHITE,4,11/07/2011 14:13,4.25,13717,United Kingdom
574887,21934,SKULL SHOULDER BAG,10,11/07/2011 14:13,1.65,13717,United Kingdom
574887,22371,AIRLINE BAG VINTAGE TOKYO 78,4,11/07/2011 14:13,4.25,13717,United Kingdom
574888,79321,CHILLI LIGHTS,96,11/07/2011 14:21,4.95,16353,United Kingdom
574888,82551,LAUNDRY 15C METAL SIGN,24,11/07/2011 14:21,1.45,16353,United Kingdom
574888,22348,TEA BAG PLATE RED RETROSPOT,24,11/07/2011 14:21,0.85,16353,United Kingdom
574888,82552,WASHROOM METAL SIGN,12,11/07/2011 14:21,1.45,16353,United Kingdom
574888,21218,RED SPOTTY BISCUIT TIN,12,11/07/2011 14:21,3.75,16353,United Kingdom
574888,23543,WALL ART KEEP CALM ,6,11/07/2011 14:21,7.45,16353,United Kingdom
574889,21790,VINTAGE SNAP CARDS,24,11/07/2011 14:22,0.85,16353,United Kingdom
574889,23313,VINTAGE CHRISTMAS BUNTING,15,11/07/2011 14:22,4.95,16353,United Kingdom
574889,79321,CHILLI LIGHTS,24,11/07/2011 14:22,4.95,16353,United Kingdom
574890,20725,LUNCH BAG RED RETROSPOT,100,11/07/2011 14:23,1.45,18229,United Kingdom
574890,22846,BREAD BIN DINER STYLE RED ,4,11/07/2011 14:23,14.95,18229,United Kingdom
574890,22725,ALARM CLOCK BAKELIKE CHOCOLATE,4,11/07/2011 14:23,3.75,18229,United Kingdom
574890,22728,ALARM CLOCK BAKELIKE PINK,4,11/07/2011 14:23,3.75,18229,United Kingdom
574890,22960,JAM MAKING SET WITH JARS,12,11/07/2011 14:23,3.75,18229,United Kingdom
