C574922,23161,REGENCY CAKE FORK,-12,11/07/2011 16:39,1.25,15502,United Kingdom
C574922,23159,SET OF 5 PANCAKE DAY MAGNETS,-12,11/07/2011 16:39,2.08,15502,United Kingdom
C574922,23158,SET OF 5 LUCKY CAT MAGNETS ,-12,11/07/2011 16:39,2.08,15502,United Kingdom
C574922,23154,SET OF 4 JAM JAR MAGNETS,-12,11/07/2011 16:39,2.08,15502,United Kingdom
C574922,22659,LUNCH BOX I LOVE LONDON,-12,11/07/2011 16:39,1.95,15502,United Kingdom
C574922,22631,CIRCUS PARADE LUNCH BOX ,-12,11/07/2011 16:39,1.95,15502,United Kingdom
C574922,23297,SET 40 HEART SHAPE PETIT FOUR CASES,-4,11/07/2011 16:39,1.65,15502,United Kingdom
574923,22456,NATURAL SLATE CHALKBOARD LARGE ,3,11/07/2011 16:40,4.95,17757,United Kingdom
574923,22686,FRENCH BLUE METAL DOOR SIGN No,2,11/07/2011 16:40,1.25,17757,United Kingdom
574923,22676,FRENCH BLUE METAL DOOR SIGN 1,4,11/07/2011 16:40,1.25,17757,United Kingdom
574923,22678,FRENCH BLUE METAL DOOR SIGN 3,4,11/07/2011 16:40,1.25,17757,United Kingdom
574923,22683,FRENCH BLUE METAL DOOR SIGN 8,1,11/07/2011 16:40,1.25,17757,United Kingdom
574923,22680,FRENCH BLUE METAL DOOR SIGN 5,4,11/07/2011 16:40,1.25,17757,United Kingdom
574923,22684,FRENCH BLUE METAL DOOR SIGN 9,3,11/07/2011 16:40,1.25,17757,United Kingdom
574923,20682,RED RETROSPOT CHILDRENS UMBRELLA,2,11/07/2011 16:40,3.25,17757,United Kingdom
574923,23331,DECORATIVE WICKER HEART SMALL,1,11/07/2011 16:40,0.63,17757,United Kingdom
574923,23329,DECORATIVE WICKER HEART LARGE,2,11/07/2011 16:40,1.65,17757,United Kingdom
574923,23332,IVORY WICKER HEART LARGE,4,11/07/2011 16:40,1.65,17757,United Kingdom
574923,22197,POPCORN HOLDER,18,11/07/2011 16:40,0.85,17757,United Kingdom
574923,22996,TRAVEL CARD WALLET VINTAGE TICKET,1,11/07/2011 16:40,0.42,17757,United Kingdom
574923,22417,PACK OF 60 SPACEBOY CAKE CASES,1,11/07/2011 16:40,0.55,17757,United Kingdom
574923,23309,SET OF 60 I LOVE LONDON CAKE CASES ,1,11/07/2011 16:40,0.55,17757,United Kingdom
574923,21086,SET/6 RED SPOTTY PAPER CUPS,1,11/07/2011 16:40,0.65,17757,United Kingdom
574923,22631,CIRCUS PARADE LUNCH BOX ,1,11/07/2011 16:40,1.95,17757,United Kingdom
574923,22659,LUNCH BOX I LOVE LONDON,2,11/07/2011 16:40,1.95,17757,United Kingdom
574923,22722,SET OF 6 SPICE TINS PANTRY DESIGN,2,11/07/2011 16:40,3.95,17757,United Kingdom
574923,21094,SET/6 RED SPOTTY PAPER PLATES,6,11/07/2011 16:40,0.85,17757,United Kingdom
574923,21121,SET/10 RED POLKADOT PARTY CANDLES,4,11/07/2011 16:40,1.25,17757,United Kingdom
574923,21788,KIDS RAIN MAC BLUE,2,11/07/2011 16:40,0.85,17757,United Kingdom
574923,21789,KIDS RAIN MAC PINK,2,11/07/2011 16:40,0.85,17757,United Kingdom
574923,21494,ROTATING LEAVES T-LIGHT HOLDER,6,11/07/2011 16:40,1.25,17757,United Kingdom
574923,22865,HAND WARMER OWL DESIGN,4,11/07/2011 16:40,2.1,17757,United Kingdom
574923,22632,HAND WARMER RED RETROSPOT,3,11/07/2011 16:40,2.1,17757,United Kingdom
574923,22867,HAND WARMER BIRD DESIGN,4,11/07/2011 16:40,2.1,17757,United Kingdom
574923,21080,SET/20 RED RETROSPOT PAPER NAPKINS ,6,11/07/2011 16:40,0.85,17757,United Kingdom
574923,22613,PACK OF 20 SPACEBOY NAPKINS,1,11/07/2011 16:40,0.85,17757,United Kingdom
574923,22667,RECIPE BOX RETROSPOT ,3,11/07/2011 16:40,2.95,17757,United Kingdom
574923,22904,CALENDAR PAPER CUT DESIGN,6,11/07/2011 16:40,2.95,17757,United Kingdom
574923,22114,HOT WATER BOTTLE TEA AND SYMPATHY,1,11/07/2011 16:40,4.25,17757,United Kingdom
574923,84029E,RED WOOLLY HOTTIE WHITE HEART.,1,11/07/2011 16:40,4.25,17757,United Kingdom
574923,22531,MAGIC DRAWING SLATE CIRCUS PARADE  ,10,11/07/2011 16:40,0.42,17757,United Kingdom
574923,22894,TABLECLOTH RED APPLES DESIGN ,1,11/07/2011 16:40,9.95,17757,United Kingdom
574923,23206,LUNCH BAG APPLE DESIGN,1,11/07/2011 16:40,1.65,17757,United Kingdom
574923,22844,VINTAGE CREAM DOG FOOD CONTAINER,1,11/07/2011 16:40,8.5,17757,United Kingdom
574933,22945,CHRISTMAS METAL TAGS ASSORTED ,12,11/07/2011 16:49,0.85,18150,United Kingdom
574933,22142,CHRISTMAS CRAFT WHITE FAIRY ,12,11/07/2011 16:49,1.45,18150,United Kingdom
574933,22144,CHRISTMAS CRAFT LITTLE FRIENDS,6,11/07/2011 16:49,2.1,18150,United Kingdom
574933,20969,RED FLORAL FELTCRAFT SHOULDER BAG,4,11/07/2011 16:49,3.75,18150,United Kingdom
574933,20970,PINK FLORAL FELTCRAFT SHOULDER BAG,4,11/07/2011 16:49,3.75,18150,United Kingdom
574933,20972,PINK CREAM FELT CRAFT TRINKET BOX ,12,11/07/2011 16:49,1.25,18150,United Kingdom
