574856,22170,PICTURE FRAME WOOD TRIPLE PORTRAIT,1,11/07/2011 12:06,13.29,,United Kingdom
574856,22173,METAL 4 HOOK HANGER FRENCH CHATEAU,3,11/07/2011 12:06,5.79,,United Kingdom
574856,22178,VICTORIAN GLASS HANGING T-LIGHT,2,11/07/2011 12:06,2.46,,United Kingdom
574856,22179,SET 10 NIGHT OWL LIGHTS,1,11/07/2011 12:06,13.29,,United Kingdom
574856,22180,RETROSPOT LAMP,1,11/07/2011 12:06,19.96,,United Kingdom
574856,22186,RED STAR CARD HOLDER,3,11/07/2011 12:06,5.79,,United Kingdom
574856,22195,LARGE HEART MEASURING SPOONS,2,11/07/2011 12:06,3.29,,United Kingdom
574856,22196,SMALL HEART MEASURING SPOONS,1,11/07/2011 12:06,1.63,,United Kingdom
574856,22199,FRYING PAN RED RETROSPOT,1,11/07/2011 12:06,8.29,,United Kingdom
574856,22200,FRYING PAN PINK POLKADOT,1,11/07/2011 12:06,8.29,,United Kingdom
574856,22207,FRYING PAN UNION FLAG,2,11/07/2011 12:06,8.29,,United Kingdom
574856,22219,LOVEBIRD HANGING DECORATION WHITE ,2,11/07/2011 12:06,1.63,,United Kingdom
574856,22278,OVERNIGHT BAG VINTAGE ROSE PAISLEY,1,11/07/2011 12:06,10.79,,United Kingdom
574856,22283,6 EGG HOUSE PAINTED WOOD,1,11/07/2011 12:06,15.79,,United Kingdom
574856,22297,HEART IVORY TRELLIS SMALL,1,11/07/2011 12:06,2.46,,United Kingdom
574856,22328,ROUND SNACK BOXES SET OF 4 FRUITS ,2,11/07/2011 12:06,4.13,,United Kingdom
574856,22358,KINGS CHOICE TEA CADDY ,1,11/07/2011 12:06,5.79,,United Kingdom
574856,22371,AIRLINE BAG VINTAGE TOKYO 78,1,11/07/2011 12:06,4.13,,United Kingdom
574856,22374,AIRLINE BAG VINTAGE JET SET RED,2,11/07/2011 12:06,4.13,,United Kingdom
574856,22379,RECYCLING BAG RETROSPOT ,2,11/07/2011 12:06,4.96,,United Kingdom
574856,22381,TOY TIDY PINK POLKADOT,1,11/07/2011 12:06,4.96,,United Kingdom
574856,22385,JUMBO BAG SPACEBOY DESIGN,1,11/07/2011 12:06,4.13,,United Kingdom
574856,22386,JUMBO BAG PINK POLKADOT,7,11/07/2011 12:06,4.13,,United Kingdom
574856,22411,JUMBO SHOPPER VINTAGE RED PAISLEY,23,11/07/2011 12:06,4.13,,United Kingdom
574856,22418,10 COLOUR SPACEBOY PEN,2,11/07/2011 12:06,2.46,,United Kingdom
574856,22422,TOOTHPASTE TUBE PEN,2,11/07/2011 12:06,1.25,,United Kingdom
574856,22456,NATURAL SLATE CHALKBOARD LARGE ,1,11/07/2011 12:06,9.96,,United Kingdom
574856,22457,NATURAL SLATE HEART CHALKBOARD ,2,11/07/2011 12:06,5.79,,United Kingdom
574856,22470,HEART OF WICKER LARGE,1,11/07/2011 12:06,5.79,,United Kingdom
574856,22475,SKULL DESIGN TV DINNER TRAY,1,11/07/2011 12:06,10.79,,United Kingdom
574856,22488,NATURAL SLATE RECTANGLE CHALKBOARD,2,11/07/2011 12:06,3.29,,United Kingdom
574856,22549,PICTURE DOMINOES,2,11/07/2011 12:06,2.46,,United Kingdom
574856,22607,WOODEN ROUNDERS GARDEN SET ,1,11/07/2011 12:06,20.79,,United Kingdom
574856,22621,TRADITIONAL KNITTING NANCY,1,11/07/2011 12:06,3.29,,United Kingdom
574856,22622,BOX OF VINTAGE ALPHABET BLOCKS,1,11/07/2011 12:06,20.79,,United Kingdom
574856,22644,CERAMIC CHERRY CAKE MONEY BANK,2,11/07/2011 12:06,4.13,,United Kingdom
574856,22646,CERAMIC STRAWBERRY CAKE MONEY BANK,1,11/07/2011 12:06,4.13,,United Kingdom
574856,22649,STRAWBERRY FAIRY CAKE TEAPOT,1,11/07/2011 12:06,10.79,,United Kingdom
574856,22652,TRAVEL SEWING KIT,1,11/07/2011 12:06,4.13,,United Kingdom
574856,22654,DELUXE SEWING KIT ,3,11/07/2011 12:06,12.46,,United Kingdom
574856,22659,LUNCH BOX I LOVE LONDON,1,11/07/2011 12:06,4.13,,United Kingdom
574856,22666,RECIPE BOX PANTRY YELLOW DESIGN,9,11/07/2011 12:06,5.79,,United Kingdom
574856,22668,PINK BABY BUNTING,1,11/07/2011 12:06,5.79,,United Kingdom
574856,22670,FRENCH WC SIGN BLUE METAL,3,11/07/2011 12:06,2.46,,United Kingdom
574856,22698,PINK REGENCY TEACUP AND SAUCER,1,11/07/2011 12:06,5.79,,United Kingdom
574856,22699,ROSES REGENCY TEACUP AND SAUCER ,1,11/07/2011 12:06,5.79,,United Kingdom
574856,22720,SET OF 3 CAKE TINS PANTRY DESIGN ,3,11/07/2011 12:06,10.79,,United Kingdom
574856,22722,SET OF 6 SPICE TINS PANTRY DESIGN,1,11/07/2011 12:06,8.29,,United Kingdom
574856,22734,SET OF 6 RIBBONS VINTAGE CHRISTMAS,3,11/07/2011 12:06,5.79,,United Kingdom
574856,22776,SWEETHEART 3 TIER CAKE STAND ,1,11/07/2011 12:06,19.96,,United Kingdom
