575066,23035,DRAWER KNOB CERAMIC IVORY,18,11/08/2011 12:42,1.45,13668,United Kingdom
575066,72817,SET OF 2 CHRISTMAS DECOUPAGE CANDLE,4,11/08/2011 12:42,0.79,13668,United Kingdom
575066,22771,CLEAR DRAWER KNOB ACRYLIC EDWARDIAN,12,11/08/2011 12:42,1.25,13668,United Kingdom
575066,22792,FLUTED ANTIQUE CANDLE HOLDER,12,11/08/2011 12:42,0.85,13668,United Kingdom
575066,84949,SILVER HANGING T-LIGHT HOLDER,6,11/08/2011 12:42,1.65,13668,United Kingdom
575066,23090,VINTAGE GLASS T-LIGHT HOLDER,12,11/08/2011 12:42,0.83,13668,United Kingdom
575066,23487,SWEET HEART CAKE CARRIER,1,11/08/2011 12:42,9.95,13668,United Kingdom
575066,85150,LADIES & GENTLEMEN METAL SIGN,4,11/08/2011 12:42,2.55,13668,United Kingdom
575066,82583,HOT BATHS METAL SIGN,4,11/08/2011 12:42,2.1,13668,United Kingdom
575066,22694,WICKER STAR ,4,11/08/2011 12:42,2.1,13668,United Kingdom
575066,23323,WHITE WICKER STAR ,4,11/08/2011 12:42,2.1,13668,United Kingdom
575067,23480,MINI LIGHTS WOODLAND MUSHROOMS,20,11/08/2011 12:45,3.75,12583,France
575067,23570,TRADITIONAL PICK UP STICKS GAME ,12,11/08/2011 12:45,1.25,12583,France
575067,23367,SET 12 COLOUR PENCILS SPACEBOY ,16,11/08/2011 12:45,0.65,12583,France
575067,22555,PLASTERS IN TIN STRONGMAN,24,11/08/2011 12:45,1.65,12583,France
575067,22951,60 CAKE CASES DOLLY GIRL DESIGN,24,11/08/2011 12:45,0.55,12583,France
575067,22417,PACK OF 60 SPACEBOY CAKE CASES,24,11/08/2011 12:45,0.55,12583,France
575067,21976,PACK OF 60 MUSHROOM CAKE CASES,24,11/08/2011 12:45,0.55,12583,France
575067,20719,WOODLAND CHARLOTTE BAG,20,11/08/2011 12:45,0.85,12583,France
575067,20724,RED RETROSPOT CHARLOTTE BAG,20,11/08/2011 12:45,0.85,12583,France
575067,22356,CHARLOTTE BAG PINK POLKADOT,10,11/08/2011 12:45,0.85,12583,France
575067,22492,MINI PAINT SET VINTAGE ,108,11/08/2011 12:45,0.65,12583,France
575067,22636,CHILDS BREAKFAST SET CIRCUS PARADE,4,11/08/2011 12:45,8.5,12583,France
575067,22197,POPCORN HOLDER,24,11/08/2011 12:45,0.85,12583,France
575067,22083,PAPER CHAIN KIT RETROSPOT,6,11/08/2011 12:45,2.95,12583,France
575067,22326,ROUND SNACK BOXES SET OF4 WOODLAND ,6,11/08/2011 12:45,2.95,12583,France
575067,22328,ROUND SNACK BOXES SET OF 4 FRUITS ,12,11/08/2011 12:45,2.95,12583,France
575067,21207,SKULL AND CROSSBONES  GARLAND ,12,11/08/2011 12:45,1.65,12583,France
575067,22727,ALARM CLOCK BAKELIKE RED ,24,11/08/2011 12:45,3.75,12583,France
575067,22726,ALARM CLOCK BAKELIKE GREEN,16,11/08/2011 12:45,3.75,12583,France
575067,22728,ALARM CLOCK BAKELIKE PINK,12,11/08/2011 12:45,3.75,12583,France
575067,22730,ALARM CLOCK BAKELIKE IVORY,12,11/08/2011 12:45,3.75,12583,France
575067,23445,ICE CREAM BUBBLES,20,11/08/2011 12:45,0.83,12583,France
575067,23298,SPOTTY BUNTING,9,11/08/2011 12:45,4.95,12583,France
575067,POST,POSTAGE,2,11/08/2011 12:45,18,12583,France
575068,20718,RED RETROSPOT SHOPPER BAG,20,11/08/2011 12:46,1.25,14282,United Kingdom
575068,20717,STRAWBERRY SHOPPER BAG,20,11/08/2011 12:46,1.25,14282,United Kingdom
575068,21929,JUMBO BAG PINK VINTAGE PAISLEY,10,11/08/2011 12:46,2.08,14282,United Kingdom
575068,23199,JUMBO BAG APPLES,10,11/08/2011 12:46,2.08,14282,United Kingdom
575068,85099B,JUMBO BAG RED RETROSPOT,10,11/08/2011 12:46,2.08,14282,United Kingdom
575068,23203,JUMBO BAG VINTAGE DOILY ,10,11/08/2011 12:46,2.08,14282,United Kingdom
575068,23583,LUNCH BAG PAISLEY PARK  ,10,11/08/2011 12:46,1.65,14282,United Kingdom
575068,20725,LUNCH BAG RED RETROSPOT,10,11/08/2011 12:46,1.65,14282,United Kingdom
575068,23209,LUNCH BAG VINTAGE DOILY ,10,11/08/2011 12:46,1.65,14282,United Kingdom
575068,22384,LUNCH BAG PINK POLKADOT,10,11/08/2011 12:46,1.65,14282,United Kingdom
575068,22382,LUNCH BAG SPACEBOY DESIGN ,10,11/08/2011 12:46,1.65,14282,United Kingdom
575068,20724,RED RETROSPOT CHARLOTTE BAG,10,11/08/2011 12:46,0.85,14282,United Kingdom
575068,23204,CHARLOTTE BAG APPLES DESIGN,10,11/08/2011 12:46,0.85,14282,United Kingdom
575068,23205,CHARLOTTE BAG VINTAGE ALPHABET ,10,11/08/2011 12:46,0.85,14282,United Kingdom
575068,22355,CHARLOTTE BAG SUKI DESIGN,10,11/08/2011 12:46,0.85,14282,United Kingdom
