574967,22729,ALARM CLOCK BAKELIKE ORANGE,3,11/08/2011 10:51,8.29,,United Kingdom
574967,22730,ALARM CLOCK BAKELIKE IVORY,2,11/08/2011 10:51,8.29,,United Kingdom
574967,22731,3D CHRISTMAS STAMPS STICKERS ,3,11/08/2011 10:51,1.63,,United Kingdom
574967,22737,RIBBON REEL CHRISTMAS PRESENT ,3,11/08/2011 10:51,4.13,,United Kingdom
574967,22737,RIBBON REEL CHRISTMAS PRESENT ,2,11/08/2011 10:51,7.5,,United Kingdom
574967,22745,POPPY'S PLAYHOUSE BEDROOM ,2,11/08/2011 10:51,3.29,,United Kingdom
574967,22746,POPPY'S PLAYHOUSE LIVINGROOM ,2,11/08/2011 10:51,3.29,,United Kingdom
574967,22747,POPPY'S PLAYHOUSE BATHROOM,3,11/08/2011 10:51,3.29,,United Kingdom
574967,22748,POPPY'S PLAYHOUSE KITCHEN,1,11/08/2011 10:51,3.29,,United Kingdom
574967,22772,PINK DRAWER KNOB ACRYLIC EDWARDIAN,7,11/08/2011 10:51,3.29,,United Kingdom
574967,22775,PURPLE DRAWERKNOB ACRYLIC EDWARDIAN,4,11/08/2011 10:51,3.29,,United Kingdom
574967,22805,BLUE DRAWER KNOB ACRYLIC EDWARDIAN,1,11/08/2011 10:51,3.29,,United Kingdom
574967,22835,HOT WATER BOTTLE I AM SO POORLY,1,11/08/2011 10:51,12.46,,United Kingdom
574967,22898,CHILDRENS APRON APPLES DESIGN,3,11/08/2011 10:51,4.96,,United Kingdom
574967,22910,PAPER CHAIN KIT VINTAGE CHRISTMAS,7,11/08/2011 10:51,6.63,,United Kingdom
574967,23168,CLASSIC CAFE SUGAR DISPENSER,6,11/08/2011 10:51,3.29,,United Kingdom
574967,23204,CHARLOTTE BAG APPLES DESIGN,16,11/08/2011 10:51,2.46,,United Kingdom
574967,23205,CHARLOTTE BAG VINTAGE ALPHABET ,6,11/08/2011 10:51,2.46,,United Kingdom
574967,23206,LUNCH BAG APPLE DESIGN,8,11/08/2011 10:51,4.96,,United Kingdom
574967,23207,LUNCH BAG ALPHABET DESIGN,2,11/08/2011 10:51,4.96,,United Kingdom
574967,23208,LUNCH BAG VINTAGE LEAF DESIGN,1,11/08/2011 10:51,4.96,,United Kingdom
574967,23298,SPOTTY BUNTING,7,11/08/2011 10:51,10.79,,United Kingdom
574967,35970,ZINC FOLKART SLEIGH BELLS,2,11/08/2011 10:51,4.13,,United Kingdom
574967,47566,PARTY BUNTING,9,11/08/2011 10:51,10.79,,United Kingdom
574967,79321,CHILLI LIGHTS,8,11/08/2011 10:51,12.46,,United Kingdom
574967,82583,HOT BATHS METAL SIGN,7,11/08/2011 10:51,4.96,,United Kingdom
574967,84029E,RED WOOLLY HOTTIE WHITE HEART.,7,11/08/2011 10:51,9.13,,United Kingdom
574967,84030e,ENGLISH ROSE HOT WATER BOTTLE,1,11/08/2011 10:51,9.13,,United Kingdom
574967,84347,ROTATING SILVER ANGELS T-LIGHT HLDR,17,11/08/2011 10:51,5.79,,United Kingdom
574967,84692,BOX OF 24 COCKTAIL PARASOLS,25,11/08/2011 10:51,1.63,,United Kingdom
574967,84997b,CHILDRENS CUTLERY RETROSPOT RED ,3,11/08/2011 10:51,8.29,,United Kingdom
574967,84997c,CHILDRENS CUTLERY POLKADOT BLUE,3,11/08/2011 10:51,8.29,,United Kingdom
574967,84997d,CHILDRENS CUTLERY POLKADOT PINK,7,11/08/2011 10:51,8.29,,United Kingdom
574967,85049g,CHOCOLATE BOX RIBBONS ,3,11/08/2011 10:51,2.46,,United Kingdom
574967,20719,WOODLAND CHARLOTTE BAG,25,11/08/2011 10:51,2.46,,United Kingdom
574967,20723,STRAWBERRY CHARLOTTE BAG,33,11/08/2011 10:51,2.46,,United Kingdom
574967,20724,RED RETROSPOT CHARLOTTE BAG,46,11/08/2011 10:51,2.46,,United Kingdom
574967,20724,RED RETROSPOT CHARLOTTE BAG,1,11/08/2011 10:51,5.63,,United Kingdom
574967,20725,LUNCH BAG RED RETROSPOT,19,11/08/2011 10:51,4.96,,United Kingdom
574967,20726,LUNCH BAG WOODLAND,5,11/08/2011 10:51,4.96,,United Kingdom
574967,20727,LUNCH BAG  BLACK SKULL.,8,11/08/2011 10:51,4.96,,United Kingdom
574967,20728,LUNCH BAG CARS BLUE,7,11/08/2011 10:51,4.96,,United Kingdom
574967,21154,RED RETROSPOT OVEN GLOVE ,11,11/08/2011 10:51,3.29,,United Kingdom
574967,21155,RED RETROSPOT PEG BAG,5,11/08/2011 10:51,4.96,,United Kingdom
574967,21212,PACK OF 72 RETROSPOT CAKE CASES,12,11/08/2011 10:51,2.08,,United Kingdom
574967,21213,PACK OF 72 SKULL CAKE CASES,2,11/08/2011 10:51,2.08,,United Kingdom
574967,21238,RED RETROSPOT CUP,2,11/08/2011 10:51,1.63,,United Kingdom
574967,21239,PINK  POLKADOT CUP,2,11/08/2011 10:51,1.63,,United Kingdom
574967,21240,BLUE POLKADOT CUP,3,11/08/2011 10:51,1.63,,United Kingdom
574967,21381,MINI WOODEN HAPPY BIRTHDAY GARLAND,1,11/08/2011 10:51,4.13,,United Kingdom
