575583,21591,COSY HOUR CIGAR BOX MATCHES ,2,11/10/2011 11:55,1.25,14456,United Kingdom
575583,85123A,WHITE HANGING HEART T-LIGHT HOLDER,1,11/10/2011 11:55,2.95,14456,United Kingdom
575583,85062,PEARL CRYSTAL PUMPKIN T-LIGHT HLDR,6,11/10/2011 11:55,1.65,14456,United Kingdom
575583,23082,SET 6 PAPER TABLE LANTERN HEARTS ,1,11/10/2011 11:55,3.75,14456,United Kingdom
575583,85036C,ROSE 1 WICK MORRIS BOXED CANDLE,1,11/10/2011 11:55,1.25,14456,United Kingdom
575583,22197,POPCORN HOLDER,6,11/10/2011 11:55,0.85,14456,United Kingdom
575583,22991,GIRAFFE WOODEN RULER,1,11/10/2011 11:55,1.95,14456,United Kingdom
575583,21977,PACK OF 60 PINK PAISLEY CAKE CASES,1,11/10/2011 11:55,0.55,14456,United Kingdom
575583,23322,LARGE WHITE HEART OF WICKER,1,11/10/2011 11:55,2.95,14456,United Kingdom
575583,23343,JUMBO BAG VINTAGE CHRISTMAS ,1,11/10/2011 11:55,2.08,14456,United Kingdom
575583,23344,JUMBO BAG 50'S CHRISTMAS ,1,11/10/2011 11:55,2.08,14456,United Kingdom
575583,23558,LANDMARK FRAME LONDON BRIDGE ,1,11/10/2011 11:55,12.5,14456,United Kingdom
575583,22596,CHRISTMAS STAR WISH LIST CHALKBOARD,1,11/10/2011 11:55,1.25,14456,United Kingdom
575583,22335,HEART DECORATION PAINTED ZINC ,1,11/10/2011 11:55,0.65,14456,United Kingdom
575583,22576,SWALLOW WOODEN CHRISTMAS DECORATION,1,11/10/2011 11:55,0.85,14456,United Kingdom
575583,22158,3 HEARTS HANGING DECORATION RUSTIC,1,11/10/2011 11:55,2.95,14456,United Kingdom
575583,23300,GARDENERS KNEELING PAD CUP OF TEA ,1,11/10/2011 11:55,1.65,14456,United Kingdom
575583,21865,PINK UNION JACK  PASSPORT COVER ,1,11/10/2011 11:55,2.1,14456,United Kingdom
575583,35970,ZINC FOLKART SLEIGH BELLS,1,11/10/2011 11:55,1.69,14456,United Kingdom
575583,22693,GROW A FLYTRAP OR SUNFLOWER IN TIN,24,11/10/2011 11:55,1.25,14456,United Kingdom
575583,22138,BAKING SET 9 PIECE RETROSPOT ,1,11/10/2011 11:55,4.95,14456,United Kingdom
575583,47503A,ASS FLORAL PRINT MULTI SCREWDRIVER,1,11/10/2011 11:55,0.42,14456,United Kingdom
575583,22156,HEART DECORATION WITH PEARLS ,3,11/10/2011 11:55,0.85,14456,United Kingdom
575583,85123A,WHITE HANGING HEART T-LIGHT HOLDER,2,11/10/2011 11:55,2.95,14456,United Kingdom
575583,20727,LUNCH BAG  BLACK SKULL.,2,11/10/2011 11:55,1.65,14456,United Kingdom
575583,47504H,ENGLISH ROSE SPIRIT LEVEL ,1,11/10/2011 11:55,0.79,14456,United Kingdom
575583,85036C,ROSE 1 WICK MORRIS BOXED CANDLE,1,11/10/2011 11:55,1.25,14456,United Kingdom
575583,85035C,ROSE 3 WICK MORRIS BOX CANDLE,2,11/10/2011 11:55,1.25,14456,United Kingdom
575583,22557,PLASTERS IN TIN VINTAGE PAISLEY ,1,11/10/2011 11:55,1.65,14456,United Kingdom
575583,22553,PLASTERS IN TIN SKULLS,1,11/10/2011 11:55,1.65,14456,United Kingdom
575583,84836,ZINC METAL HEART DECORATION,3,11/10/2011 11:55,1.25,14456,United Kingdom
575583,22335,HEART DECORATION PAINTED ZINC ,3,11/10/2011 11:55,0.65,14456,United Kingdom
575583,20893,HANGING BAUBLE T-LIGHT HOLDER SMALL,1,11/10/2011 11:55,2.55,14456,United Kingdom
575583,21990,MODERN FLORAL STATIONERY SET,1,11/10/2011 11:55,1.25,14456,United Kingdom
575583,21991,BOHEMIAN COLLAGE STATIONERY SET,1,11/10/2011 11:55,1.25,14456,United Kingdom
575583,23558,LANDMARK FRAME LONDON BRIDGE ,1,11/10/2011 11:55,12.5,14456,United Kingdom
575583,23538,WALL ART VINTAGE HEART,1,11/10/2011 11:55,4.95,14456,United Kingdom
575584,23203,JUMBO BAG VINTAGE DOILY ,10,11/10/2011 11:55,2.08,12682,France
575584,23199,JUMBO BAG APPLES,10,11/10/2011 11:55,2.08,12682,France
575584,23582,VINTAGE DOILY JUMBO BAG RED ,10,11/10/2011 11:55,2.08,12682,France
575584,20712,JUMBO BAG WOODLAND ANIMALS,10,11/10/2011 11:55,2.08,12682,France
575584,23209,LUNCH BAG VINTAGE DOILY ,10,11/10/2011 11:55,1.65,12682,France
575584,23569,TRADTIONAL ALPHABET STAMP SET,4,11/10/2011 11:55,4.95,12682,France
575584,22086,PAPER CHAIN KIT 50'S CHRISTMAS ,6,11/10/2011 11:55,2.95,12682,France
575584,22910,PAPER CHAIN KIT VINTAGE CHRISTMAS,6,11/10/2011 11:55,2.95,12682,France
575584,21774,DECORATIVE CATS BATHROOM BOTTLE,12,11/10/2011 11:55,1.25,12682,France
575584,85099B,JUMBO BAG RED RETROSPOT,10,11/10/2011 11:55,2.08,12682,France
575584,23200,JUMBO BAG PEARS,10,11/10/2011 11:55,2.08,12682,France
575584,20750,RED RETROSPOT MINI CASES,2,11/10/2011 11:55,7.95,12682,France
575584,POST,POSTAGE,1,11/10/2011 11:55,18,12682,France
