575517,21154,RED RETROSPOT OVEN GLOVE ,4,11/10/2011 10:49,1.25,14562,United Kingdom
575517,21217,RED RETROSPOT ROUND CAKE TINS,2,11/10/2011 10:49,9.95,14562,United Kingdom
575517,22666,RECIPE BOX PANTRY YELLOW DESIGN,6,11/10/2011 10:49,2.95,14562,United Kingdom
575517,85066,CREAM SWEETHEART MINI CHEST,1,11/10/2011 10:49,12.75,14562,United Kingdom
575517,23439,HAND WARMER RED LOVE HEART,3,11/10/2011 10:49,2.1,14562,United Kingdom
575517,22865,HAND WARMER OWL DESIGN,5,11/10/2011 10:49,2.1,14562,United Kingdom
575517,22632,HAND WARMER RED RETROSPOT,3,11/10/2011 10:49,2.1,14562,United Kingdom
575517,22866,HAND WARMER SCOTTY DOG DESIGN,2,11/10/2011 10:49,2.1,14562,United Kingdom
575517,22867,HAND WARMER BIRD DESIGN,5,11/10/2011 10:49,2.1,14562,United Kingdom
575517,23581,JUMBO BAG PAISLEY PARK,2,11/10/2011 10:49,2.08,14562,United Kingdom
575517,85099B,JUMBO BAG RED RETROSPOT,2,11/10/2011 10:49,2.08,14562,United Kingdom
575517,23583,LUNCH BAG PAISLEY PARK  ,3,11/10/2011 10:49,1.65,14562,United Kingdom
575517,22384,LUNCH BAG PINK POLKADOT,3,11/10/2011 10:49,1.65,14562,United Kingdom
575517,22149,FELTCRAFT 6 FLOWER FRIENDS,5,11/10/2011 10:49,2.1,14562,United Kingdom
575517,22720,SET OF 3 CAKE TINS PANTRY DESIGN ,2,11/10/2011 10:49,4.95,14562,United Kingdom
575517,22839,3 TIER CAKE TIN GREEN AND CREAM,1,11/10/2011 10:49,14.95,14562,United Kingdom
575517,22219,LOVEBIRD HANGING DECORATION WHITE ,6,11/10/2011 10:49,0.85,14562,United Kingdom
575517,22082,RIBBON REEL STRIPES DESIGN ,5,11/10/2011 10:49,1.65,14562,United Kingdom
575517,23298,SPOTTY BUNTING,3,11/10/2011 10:49,4.95,14562,United Kingdom
575517,47566,PARTY BUNTING,3,11/10/2011 10:49,4.95,14562,United Kingdom
575517,22111,SCOTTIE DOG HOT WATER BOTTLE,2,11/10/2011 10:49,4.95,14562,United Kingdom
575517,23300,GARDENERS KNEELING PAD CUP OF TEA ,6,11/10/2011 10:49,1.65,14562,United Kingdom
575517,23301,GARDENERS KNEELING PAD KEEP CALM ,6,11/10/2011 10:49,1.65,14562,United Kingdom
575517,23426,METAL SIGN DROP YOUR PANTS,5,11/10/2011 10:49,2.89,14562,United Kingdom
575517,23355,HOT WATER BOTTLE KEEP CALM,6,11/10/2011 10:49,4.95,14562,United Kingdom
575517,23284,DOORMAT KEEP CALM AND COME IN,1,11/10/2011 10:49,8.25,14562,United Kingdom
575517,22667,RECIPE BOX RETROSPOT ,12,11/10/2011 10:49,2.95,14562,United Kingdom
575517,82486,3 DRAWER ANTIQUE WHITE WOOD CABINET,2,11/10/2011 10:49,8.95,14562,United Kingdom
575518,10080,check,22,11/10/2011 10:53,0,,United Kingdom
575519,23084,RABBIT NIGHT LIGHT,48,11/10/2011 10:53,1.79,12682,France
575519,23480,MINI LIGHTS WOODLAND MUSHROOMS,8,11/10/2011 10:53,3.75,12682,France
575519,23353,6 GIFT TAGS VINTAGE CHRISTMAS ,12,11/10/2011 10:53,0.83,12682,France
575519,22617,BAKING SET SPACEBOY DESIGN,3,11/10/2011 10:53,4.95,12682,France
575519,23571,TRADITIONAL NAUGHTS & CROSSES,12,11/10/2011 10:53,1.65,12682,France
575519,23570,TRADITIONAL PICK UP STICKS GAME ,12,11/10/2011 10:53,1.25,12682,France
575519,22941,CHRISTMAS LIGHTS 10 REINDEER,2,11/10/2011 10:53,8.5,12682,France
575519,22899,CHILDREN'S APRON DOLLY GIRL ,6,11/10/2011 10:53,2.1,12682,France
575519,84375,SET OF 20 KIDS COOKIE CUTTERS,12,11/10/2011 10:53,2.1,12682,France
575519,22748,POPPY'S PLAYHOUSE KITCHEN,6,11/10/2011 10:53,2.1,12682,France
575519,21791,VINTAGE HEADS AND TAILS CARD GAME ,12,11/10/2011 10:53,1.25,12682,France
575519,23506,MINI PLAYING CARDS SPACEBOY ,20,11/10/2011 10:53,0.42,12682,France
575519,23506,MINI PLAYING CARDS SPACEBOY ,20,11/10/2011 10:53,0.42,12682,France
575519,22661,CHARLOTTE BAG DOLLY GIRL DESIGN,10,11/10/2011 10:53,0.85,12682,France
575519,POST,POSTAGE,2,11/10/2011 10:53,18,12682,France
575520,22065,CHRISTMAS PUDDING TRINKET POT ,48,11/10/2011 10:56,0.39,17537,United Kingdom
575520,23320,GIANT 50'S CHRISTMAS CRACKER,12,11/10/2011 10:56,2.89,17537,United Kingdom
575520,82616B,FRAPPUCINO SCARF KNITTING KIT,12,11/10/2011 10:56,1.25,17537,United Kingdom
575520,22299,PIG KEYRING WITH LIGHT & SOUND ,24,11/10/2011 10:56,1.25,17537,United Kingdom
575520,23078,ICE CREAM PEN LIP GLOSS ,24,11/10/2011 10:56,1.25,17537,United Kingdom
575520,23077,DOUGHNUT LIP GLOSS ,20,11/10/2011 10:56,1.25,17537,United Kingdom
