575491,82583,HOT BATHS METAL SIGN,1,11/09/2011 17:47,2.1,15531,United Kingdom
575491,82567,"AIRLINE LOUNGE,METAL SIGN",1,11/09/2011 17:47,2.1,15531,United Kingdom
575491,82583,HOT BATHS METAL SIGN,1,11/09/2011 17:47,2.1,15531,United Kingdom
575491,21175,GIN + TONIC DIET METAL SIGN,1,11/09/2011 17:47,2.55,15531,United Kingdom
575491,22843,BISCUIT TIN VINTAGE GREEN,1,11/09/2011 17:47,6.75,15531,United Kingdom
575491,22457,NATURAL SLATE HEART CHALKBOARD ,12,11/09/2011 17:47,2.95,15531,United Kingdom
575491,21992,VINTAGE PAISLEY STATIONERY SET,2,11/09/2011 17:47,1.25,15531,United Kingdom
575491,21991,BOHEMIAN COLLAGE STATIONERY SET,2,11/09/2011 17:47,1.25,15531,United Kingdom
575491,22721,SET OF 3 CAKE TINS SKETCHBOOK,2,11/09/2011 17:47,4.95,15531,United Kingdom
575491,22840,ROUND CAKE TIN VINTAGE RED,2,11/09/2011 17:47,7.95,15531,United Kingdom
575491,22082,RIBBON REEL STRIPES DESIGN ,5,11/09/2011 17:47,1.65,15531,United Kingdom
575491,22720,SET OF 3 CAKE TINS PANTRY DESIGN ,4,11/09/2011 17:47,4.95,15531,United Kingdom
575491,22991,GIRAFFE WOODEN RULER,3,11/09/2011 17:47,1.95,15531,United Kingdom
575491,21866,UNION JACK FLAG LUGGAGE TAG,3,11/09/2011 17:47,1.25,15531,United Kingdom
575491,22843,BISCUIT TIN VINTAGE GREEN,1,11/09/2011 17:47,6.75,15531,United Kingdom
575491,22727,ALARM CLOCK BAKELIKE RED ,1,11/09/2011 17:47,3.75,15531,United Kingdom
575491,22728,ALARM CLOCK BAKELIKE PINK,2,11/09/2011 17:47,3.75,15531,United Kingdom
575491,22726,ALARM CLOCK BAKELIKE GREEN,1,11/09/2011 17:47,3.75,15531,United Kingdom
575491,22083,PAPER CHAIN KIT RETROSPOT,5,11/09/2011 17:47,2.95,15531,United Kingdom
575491,21903,MAN FLU METAL SIGN,5,11/09/2011 17:47,2.1,15531,United Kingdom
575491,21905,MORE BUTTER METAL SIGN ,3,11/09/2011 17:47,0.79,15531,United Kingdom
575491,21166,COOK WITH WINE METAL SIGN ,2,11/09/2011 17:47,2.08,15531,United Kingdom
575491,22208,WOOD STAMP SET THANK YOU,5,11/09/2011 17:47,0.83,15531,United Kingdom
575491,20669,RED HEART LUGGAGE TAG,3,11/09/2011 17:47,1.25,15531,United Kingdom
575491,82551,LAUNDRY 15C METAL SIGN,1,11/09/2011 17:47,1.45,15531,United Kingdom
575491,21164,HOME SWEET HOME METAL SIGN ,1,11/09/2011 17:47,2.95,15531,United Kingdom
575491,22727,ALARM CLOCK BAKELIKE RED ,1,11/09/2011 17:47,3.75,15531,United Kingdom
575491,22726,ALARM CLOCK BAKELIKE GREEN,1,11/09/2011 17:47,3.75,15531,United Kingdom
575491,21158,MOODY GIRL DOOR HANGER ,4,11/09/2011 17:47,0.39,15531,United Kingdom
575491,21164,HOME SWEET HOME METAL SIGN ,1,11/09/2011 17:47,2.95,15531,United Kingdom
575491,22670,FRENCH WC SIGN BLUE METAL,1,11/09/2011 17:47,1.25,15531,United Kingdom
575491,23139,SINGLE WIRE HOOK PINK HEART,12,11/09/2011 17:47,1.45,15531,United Kingdom
575491,85032C,CURIOUS IMAGES GIFT WRAP SET,12,11/09/2011 17:47,0.65,15531,United Kingdom
575491,20992,JAZZ HEARTS PURSE NOTEBOOK,4,11/09/2011 17:47,0.39,15531,United Kingdom
575491,85071D,CHARLIE+LOLA MY ROOM DOOR SIGN,3,11/09/2011 17:47,0.39,15531,United Kingdom
575491,85071C,"CHARLIE+LOLA""EXTREMELY BUSY"" SIGN",3,11/09/2011 17:47,0.39,15531,United Kingdom
575491,85071B,RED CHARLIE+LOLA PERSONAL DOORSIGN,4,11/09/2011 17:47,0.39,15531,United Kingdom
575491,85071A,BLUE CHARLIE+LOLA PERSONAL DOORSIGN,2,11/09/2011 17:47,0.39,15531,United Kingdom
575491,22115,METAL SIGN EMPIRE TEA,1,11/09/2011 17:47,0.79,15531,United Kingdom
575491,21770,OPEN CLOSED METAL SIGN,1,11/09/2011 17:47,4.95,15531,United Kingdom
575491,22115,METAL SIGN EMPIRE TEA,2,11/09/2011 17:47,0.79,15531,United Kingdom
575491,22671,FRENCH LAUNDRY SIGN BLUE METAL,2,11/09/2011 17:47,1.65,15531,United Kingdom
575491,22672,FRENCH BATHROOM SIGN BLUE METAL,2,11/09/2011 17:47,1.65,15531,United Kingdom
575491,22116,METAL SIGN HIS DINNER IS SERVED,2,11/09/2011 17:47,0.79,15531,United Kingdom
575491,21248,DOOR HANGER  MUM + DADS ROOM,2,11/09/2011 17:47,1.45,15531,United Kingdom
575491,21172,PARTY METAL SIGN ,3,11/09/2011 17:47,1.45,15531,United Kingdom
575491,82613B,"METAL SIGN,CUPCAKE SINGLE HOOK",5,11/09/2011 17:47,1.25,15531,United Kingdom
575491,22413,METAL SIGN TAKE IT OR LEAVE IT ,1,11/09/2011 17:47,2.95,15531,United Kingdom
575491,85032B,BLOSSOM IMAGES GIFT WRAP SET,12,11/09/2011 17:47,0.65,15531,United Kingdom
575491,23316,RED REFECTORY CLOCK ,2,11/09/2011 17:47,9.95,15531,United Kingdom
