575477,22371,AIRLINE BAG VINTAGE TOKYO 78,2,11/09/2011 16:14,8.29,,United Kingdom
575477,22378,WALL TIDY RETROSPOT ,5,11/09/2011 16:14,4.13,,United Kingdom
575477,22379,RECYCLING BAG RETROSPOT ,3,11/09/2011 16:14,4.13,,United Kingdom
575477,22383,LUNCH BAG SUKI DESIGN ,2,11/09/2011 16:14,4.13,,United Kingdom
575477,22384,LUNCH BAG PINK POLKADOT,1,11/09/2011 16:14,4.13,,United Kingdom
575477,22386,JUMBO BAG PINK POLKADOT,4,11/09/2011 16:14,4.13,,United Kingdom
575477,22395,PAPERWEIGHT VINTAGE PAISLEY,1,11/09/2011 16:14,4.96,,United Kingdom
575477,22399,MAGNETS PACK OF 4 CHILDHOOD MEMORY,1,11/09/2011 16:14,2.46,,United Kingdom
575477,22413,METAL SIGN TAKE IT OR LEAVE IT ,3,11/09/2011 16:14,5.79,,United Kingdom
575477,22417,PACK OF 60 SPACEBOY CAKE CASES,1,11/09/2011 16:14,1.25,,United Kingdom
575477,22419,LIPSTICK PEN RED,4,11/09/2011 16:14,0.83,,United Kingdom
575477,22421,LIPSTICK PEN FUSCHIA,2,11/09/2011 16:14,0.83,,United Kingdom
575477,22423,REGENCY CAKESTAND 3 TIER,2,11/09/2011 16:14,24.96,,United Kingdom
575477,22441,GROW YOUR OWN BASIL IN ENAMEL MUG,1,11/09/2011 16:14,4.13,,United Kingdom
575477,22446,PIN CUSHION BABUSHKA PINK,9,11/09/2011 16:14,2.46,,United Kingdom
575477,22465,HANGING METAL STAR LANTERN,1,11/09/2011 16:14,3.29,,United Kingdom
575477,22466,FAIRY TALE COTTAGE NIGHT LIGHT,3,11/09/2011 16:14,4.13,,United Kingdom
575477,22469,HEART OF WICKER SMALL,2,11/09/2011 16:14,3.29,,United Kingdom
575477,22477,WATERING CAN GARDEN MARKER,2,11/09/2011 16:14,2.46,,United Kingdom
575477,22478,BIRDHOUSE GARDEN MARKER ,2,11/09/2011 16:14,2.46,,United Kingdom
575477,22479,DAISY GARDEN MARKER,3,11/09/2011 16:14,2.46,,United Kingdom
575477,22487,WHITE WOOD GARDEN PLANT LADDER,2,11/09/2011 16:14,19.96,,United Kingdom
575477,22491,PACK OF 12 COLOURED PENCILS,1,11/09/2011 16:14,1.63,,United Kingdom
575477,22492,MINI PAINT SET VINTAGE ,2,11/09/2011 16:14,1.63,,United Kingdom
575477,22494,EMERGENCY FIRST AID TIN ,1,11/09/2011 16:14,2.46,,United Kingdom
575477,22495,SET OF 2 ROUND TINS CAMEMBERT ,1,11/09/2011 16:14,5.79,,United Kingdom
575477,22551,PLASTERS IN TIN SPACEBOY,1,11/09/2011 16:14,3.29,,United Kingdom
575477,22553,PLASTERS IN TIN SKULLS,4,11/09/2011 16:14,3.29,,United Kingdom
575477,22554,PLASTERS IN TIN WOODLAND ANIMALS,3,11/09/2011 16:14,3.29,,United Kingdom
575477,22557,PLASTERS IN TIN VINTAGE PAISLEY ,2,11/09/2011 16:14,3.29,,United Kingdom
575477,22559,SEASIDE FLYING DISC,1,11/09/2011 16:14,2.46,,United Kingdom
575477,22564,ALPHABET STENCIL CRAFT,1,11/09/2011 16:14,2.46,,United Kingdom
575477,22566,FELTCRAFT HAIRBAND PINK AND PURPLE,1,11/09/2011 16:14,1.63,,United Kingdom
575477,22567,20 DOLLY PEGS RETROSPOT,1,11/09/2011 16:14,2.92,,United Kingdom
575477,22573,STAR WOODEN CHRISTMAS DECORATION,3,11/09/2011 16:14,1.63,,United Kingdom
575477,22574,HEART WOODEN CHRISTMAS DECORATION,3,11/09/2011 16:14,1.63,,United Kingdom
575477,22576,SWALLOW WOODEN CHRISTMAS DECORATION,4,11/09/2011 16:14,1.63,,United Kingdom
575477,22577,WOODEN HEART CHRISTMAS SCANDINAVIAN,15,11/09/2011 16:14,0.83,,United Kingdom
575477,22578,WOODEN STAR CHRISTMAS SCANDINAVIAN,1,11/09/2011 16:14,0.83,,United Kingdom
575477,22579,WOODEN TREE CHRISTMAS SCANDINAVIAN,4,11/09/2011 16:14,0.83,,United Kingdom
575477,22580,ADVENT CALENDAR GINGHAM SACK,7,11/09/2011 16:14,4.13,,United Kingdom
575477,22581,WOOD STOCKING CHRISTMAS SCANDISPOT,4,11/09/2011 16:14,0.83,,United Kingdom
575477,22585,PACK OF 6 BIRDY GIFT TAGS,2,11/09/2011 16:14,2.46,,United Kingdom
575477,22586,FELTCRAFT HAIRBAND PINK AND BLUE,1,11/09/2011 16:14,1.63,,United Kingdom
575477,22589,CARDHOLDER GINGHAM STAR,1,11/09/2011 16:14,4.96,,United Kingdom
575477,22592,CARDHOLDER HOLLY WREATH METAL,5,11/09/2011 16:14,7.46,,United Kingdom
575477,22594,CHRISTMAS GINGHAM TREE,1,11/09/2011 16:14,1.63,,United Kingdom
575477,22595,GINGHAM HEART DECORATION,5,11/09/2011 16:14,1.63,,United Kingdom
575477,22596,CHRISTMAS STAR WISH LIST CHALKBOARD,1,11/09/2011 16:14,2.46,,United Kingdom
575477,22597,MUSICAL ZINC HEART DECORATION ,3,11/09/2011 16:14,0.83,,United Kingdom
