575298,21930,JUMBO STORAGE BAG SKULLS,1,11/09/2011 12:29,2.08,17841,United Kingdom
575298,23203,JUMBO BAG VINTAGE DOILY ,1,11/09/2011 12:29,2.08,17841,United Kingdom
575298,85053,FRENCH ENAMEL CANDLEHOLDER,4,11/09/2011 12:29,2.1,17841,United Kingdom
575298,23394,POSTE FRANCE CUSHION COVER,1,11/09/2011 12:29,3.75,17841,United Kingdom
575298,23393,HOME SWEET HOME CUSHION COVER ,4,11/09/2011 12:29,3.75,17841,United Kingdom
575298,23220,REINDEER HEART DECORATION GOLD,1,11/09/2011 12:29,0.83,17841,United Kingdom
575298,23265,SET OF 3 WOODEN TREE DECORATIONS,2,11/09/2011 12:29,1.25,17841,United Kingdom
575298,23266,SET OF 3 WOODEN STOCKING DECORATION,2,11/09/2011 12:29,1.25,17841,United Kingdom
575298,23263,SET OF 3 WOODEN HEART DECORATIONS,2,11/09/2011 12:29,1.25,17841,United Kingdom
575298,23264,SET OF 3 WOODEN SLEIGH DECORATIONS,5,11/09/2011 12:29,1.25,17841,United Kingdom
575298,22222,CAKE PLATE LOVEBIRD WHITE,2,11/09/2011 12:29,4.95,17841,United Kingdom
575298,23406,HOME SWEET HOME KEY HOLDER,1,11/09/2011 12:29,6.25,17841,United Kingdom
575298,23402,HOME SWEET HOME 3 PEG HANGER ,1,11/09/2011 12:29,3.75,17841,United Kingdom
575298,23403,LETTER HOLDER HOME SWEET HOME,1,11/09/2011 12:29,3.75,17841,United Kingdom
575298,23397,FOOT STOOL HOME SWEET HOME ,2,11/09/2011 12:29,9.95,17841,United Kingdom
575299,23188,VINTAGE  2 METRE FOLDING RULER,12,11/09/2011 12:30,1.65,14691,United Kingdom
575299,23301,GARDENERS KNEELING PAD KEEP CALM ,12,11/09/2011 12:30,1.65,14691,United Kingdom
575299,23300,GARDENERS KNEELING PAD CUP OF TEA ,12,11/09/2011 12:30,1.65,14691,United Kingdom
575299,21479,WHITE SKULL HOT WATER BOTTLE ,4,11/09/2011 12:30,4.25,14691,United Kingdom
575299,22112,CHOCOLATE HOT WATER BOTTLE,6,11/09/2011 12:30,4.95,14691,United Kingdom
575299,23355,HOT WATER BOTTLE KEEP CALM,12,11/09/2011 12:30,4.95,14691,United Kingdom
575299,22835,HOT WATER BOTTLE I AM SO POORLY,8,11/09/2011 12:30,4.95,14691,United Kingdom
575299,23284,DOORMAT KEEP CALM AND COME IN,10,11/09/2011 12:30,7.08,14691,United Kingdom
575299,23109,PACK OF SIX LED TEA LIGHTS,24,11/09/2011 12:30,2.89,14691,United Kingdom
575300,21231,SWEETHEART CERAMIC TRINKET BOX,12,11/09/2011 12:30,1.25,13804,United Kingdom
575300,22649,STRAWBERRY FAIRY CAKE TEAPOT,8,11/09/2011 12:30,4.95,13804,United Kingdom
575300,22722,SET OF 6 SPICE TINS PANTRY DESIGN,4,11/09/2011 12:30,3.95,13804,United Kingdom
575300,21175,GIN + TONIC DIET METAL SIGN,12,11/09/2011 12:30,2.55,13804,United Kingdom
575300,47566,PARTY BUNTING,12,11/09/2011 12:30,4.95,13804,United Kingdom
575300,22549,PICTURE DOMINOES,24,11/09/2011 12:30,1.45,13804,United Kingdom
575300,23076,ICE CREAM SUNDAE LIP GLOSS,24,11/09/2011 12:30,1.25,13804,United Kingdom
575300,84077,WORLD WAR 2 GLIDERS ASSTD DESIGNS,48,11/09/2011 12:30,0.29,13804,United Kingdom
575300,22621,TRADITIONAL KNITTING NANCY,12,11/09/2011 12:30,1.65,13804,United Kingdom
575300,22633,HAND WARMER UNION JACK,12,11/09/2011 12:30,2.1,13804,United Kingdom
575300,22061,LARGE CAKE STAND  HANGING STRAWBERY,2,11/09/2011 12:30,9.95,13804,United Kingdom
575301,23455,SMALL PARLOUR PICTURE FRAME,6,11/09/2011 12:32,2.89,13804,United Kingdom
575301,23456,MEDIUM PARLOUR PICTURE FRAME ,4,11/09/2011 12:32,4.15,13804,United Kingdom
575301,23457,LARGE PARLOUR PICTURE FRAME,3,11/09/2011 12:32,4.95,13804,United Kingdom
575302,20724,RED RETROSPOT CHARLOTTE BAG,100,11/09/2011 12:32,0.72,17086,United Kingdom
575302,22355,CHARLOTTE BAG SUKI DESIGN,20,11/09/2011 12:32,0.85,17086,United Kingdom
575302,85099B,JUMBO BAG RED RETROSPOT,100,11/09/2011 12:32,1.79,17086,United Kingdom
575302,23328,SET 6 SCHOOL MILK BOTTLES IN CRATE,4,11/09/2011 12:32,3.75,17086,United Kingdom
575302,23214,JINGLE BELL HEART ANTIQUE GOLD,12,11/09/2011 12:32,2.08,17086,United Kingdom
575303,22749,FELTCRAFT PRINCESS CHARLOTTE DOLL,1,11/09/2011 12:34,3.75,12893,United Kingdom
575303,23493,VINTAGE DOILY TRAVEL SEWING KIT,1,11/09/2011 12:34,1.95,12893,United Kingdom
575303,21584,RETROSPOT SMALL TUBE MATCHES,2,11/09/2011 12:34,1.65,12893,United Kingdom
575303,23321,SMALL WHITE HEART OF WICKER,4,11/09/2011 12:34,1.65,12893,United Kingdom
575303,22940,FELTCRAFT CHRISTMAS FAIRY,1,11/09/2011 12:34,4.25,12893,United Kingdom
575303,23296,SET OF 6 TEA TIME BAKING CASES,1,11/09/2011 12:34,1.25,12893,United Kingdom
575303,23504,PLAYING CARDS JUBILEE UNION JACK,1,11/09/2011 12:34,1.25,12893,United Kingdom
