575177,22835,HOT WATER BOTTLE I AM SO POORLY,1,11/08/2011 18:41,10.79,,United Kingdom
575177,22841,ROUND CAKE TIN VINTAGE GREEN,1,11/08/2011 18:41,15.79,,United Kingdom
575177,22893,MINI CAKE STAND T-LIGHT HOLDER,2,11/08/2011 18:41,0.83,,United Kingdom
575177,22900,SET 2 TEA TOWELS I LOVE LONDON ,2,11/08/2011 18:41,6.63,,United Kingdom
575177,22902,TOTE BAG I LOVE LONDON,2,11/08/2011 18:41,4.13,,United Kingdom
575177,22904,CALENDAR PAPER CUT DESIGN,1,11/08/2011 18:41,5.79,,United Kingdom
575177,22907,PACK OF 20 NAPKINS PANTRY DESIGN,1,11/08/2011 18:41,1.63,,United Kingdom
575177,22908,PACK OF 20 NAPKINS RED APPLES,2,11/08/2011 18:41,1.63,,United Kingdom
575177,22909,SET OF 20 VINTAGE CHRISTMAS NAPKINS,8,11/08/2011 18:41,1.63,,United Kingdom
575177,22910,PAPER CHAIN KIT VINTAGE CHRISTMAS,3,11/08/2011 18:41,5.79,,United Kingdom
575177,22928,YELLOW GIANT GARDEN THERMOMETER,3,11/08/2011 18:41,12.46,,United Kingdom
575177,22930,BAKING MOULD HEART MILK CHOCOLATE,1,11/08/2011 18:41,4.96,,United Kingdom
575177,22935,BAKING MOULD ROSE MILK CHOCOLATE,1,11/08/2011 18:41,6.63,,United Kingdom
575177,22944,CHRISTMAS METAL POSTCARD WITH BELLS,18,11/08/2011 18:41,0.97,,United Kingdom
575177,22952,60 CAKE CASES VINTAGE CHRISTMAS,2,11/08/2011 18:41,1.25,,United Kingdom
575177,22961,JAM MAKING SET PRINTED,1,11/08/2011 18:41,3.29,,United Kingdom
575177,22975,SPACEBOY CHILDRENS EGG CUP,2,11/08/2011 18:41,2.46,,United Kingdom
575177,22981,PANTRY APPLE CORER,1,11/08/2011 18:41,2.92,,United Kingdom
575177,22993,SET OF 4 PANTRY JELLY MOULDS,2,11/08/2011 18:41,2.46,,United Kingdom
575177,22994,TRAVEL CARD WALLET RETROSPOT,2,11/08/2011 18:41,0.83,,United Kingdom
575177,22995,TRAVEL CARD WALLET SUKI,3,11/08/2011 18:41,0.83,,United Kingdom
575177,22996,TRAVEL CARD WALLET VINTAGE TICKET,1,11/08/2011 18:41,0.83,,United Kingdom
575177,22998,TRAVEL CARD WALLET KEEP CALM,4,11/08/2011 18:41,0.83,,United Kingdom
575177,22999,TRAVEL CARD WALLET VINTAGE LEAF,1,11/08/2011 18:41,0.83,,United Kingdom
575177,23002,TRAVEL CARD WALLET SKULLS,2,11/08/2011 18:41,0.83,,United Kingdom
575177,23004,TRAVEL CARD WALLET PANTRY,2,11/08/2011 18:41,0.83,,United Kingdom
575177,23055,IVORY CHANDELIER T-LIGHT HOLDER,1,11/08/2011 18:41,12.46,,United Kingdom
575177,23084,RABBIT NIGHT LIGHT,12,11/08/2011 18:41,4.13,,United Kingdom
575177,23089,GLASS BON BON JAR,2,11/08/2011 18:41,3.29,,United Kingdom
575177,23100,SILVER BELLS TABLE DECORATION,3,11/08/2011 18:41,2.46,,United Kingdom
575177,23101,SILVER STARS TABLE DECORATION,2,11/08/2011 18:41,2.46,,United Kingdom
575177,23103,JINGLE BELL HEART DECORATION,1,11/08/2011 18:41,3.29,,United Kingdom
575177,23118,PARISIENNE JEWELLERY DRAWER ,1,11/08/2011 18:41,14.96,,United Kingdom
575177,23144,ZINC T-LIGHT HOLDER STARS SMALL,3,11/08/2011 18:41,1.63,,United Kingdom
575177,23157,SET OF 6 NATIVITY MAGNETS ,1,11/08/2011 18:41,4.13,,United Kingdom
575177,23161,REGENCY CAKE FORK,1,11/08/2011 18:41,2.46,,United Kingdom
575177,23179,CLOCK MAGNET MUM'S KITCHEN,1,11/08/2011 18:41,5.79,,United Kingdom
575177,23182,TOILET SIGN OCCUPIED OR VACANT,1,11/08/2011 18:41,2.46,,United Kingdom
575177,23183,MOTHER'S KITCHEN SPOON REST ,1,11/08/2011 18:41,7.46,,United Kingdom
575177,23188,VINTAGE  2 METRE FOLDING RULER,1,11/08/2011 18:41,3.29,,United Kingdom
575177,23192,BUNDLE OF 3 ALPHABET EXERCISE BOOKS,2,11/08/2011 18:41,3.29,,United Kingdom
575177,23193,BUFFALO BILL TREASURE BOOK BOX,1,11/08/2011 18:41,4.58,,United Kingdom
575177,23194,GYMKHANA TREASURE BOOK BOX,1,11/08/2011 18:41,4.58,,United Kingdom
575177,23199,JUMBO BAG APPLES,1,11/08/2011 18:41,4.13,,United Kingdom
575177,23201,JUMBO BAG ALPHABET,2,11/08/2011 18:41,4.13,,United Kingdom
575177,23203,JUMBO BAG VINTAGE DOILY ,2,11/08/2011 18:41,4.13,,United Kingdom
575177,23204,CHARLOTTE BAG APPLES DESIGN,3,11/08/2011 18:41,1.63,,United Kingdom
575177,23206,LUNCH BAG APPLE DESIGN,2,11/08/2011 18:41,4.13,,United Kingdom
575177,23207,LUNCH BAG ALPHABET DESIGN,2,11/08/2011 18:41,4.13,,United Kingdom
575177,23209,LUNCH BAG VINTAGE DOILY ,1,11/08/2011 18:41,4.13,,United Kingdom
