575607,21985,PACK OF 12 HEARTS DESIGN TISSUES ,3,11/10/2011 12:37,0.83,14096,United Kingdom
575607,21986,PACK OF 12 PINK POLKADOT TISSUES,3,11/10/2011 12:37,0.83,14096,United Kingdom
575607,21990,MODERN FLORAL STATIONERY SET,5,11/10/2011 12:37,2.46,14096,United Kingdom
575607,21991,BOHEMIAN COLLAGE STATIONERY SET,5,11/10/2011 12:37,2.46,14096,United Kingdom
575607,21992,VINTAGE PAISLEY STATIONERY SET,8,11/10/2011 12:37,2.46,14096,United Kingdom
575607,21993,FLORAL FOLK STATIONERY SET,9,11/10/2011 12:37,2.46,14096,United Kingdom
575607,22023,EMPIRE BIRTHDAY CARD,1,11/10/2011 12:37,0.83,14096,United Kingdom
575607,22027,TEA PARTY BIRTHDAY CARD,5,11/10/2011 12:37,0.83,14096,United Kingdom
575607,22028,PENNY FARTHING BIRTHDAY CARD,1,11/10/2011 12:37,0.83,14096,United Kingdom
575607,22029,SPACEBOY BIRTHDAY CARD,1,11/10/2011 12:37,0.83,14096,United Kingdom
575607,22031,BOTANICAL LAVENDER BIRTHDAY CARD,5,11/10/2011 12:37,0.83,14096,United Kingdom
575607,22041,"RECORD FRAME 7"" SINGLE SIZE ",1,11/10/2011 12:37,4.96,14096,United Kingdom
575607,22066,LOVE HEART TRINKET POT,1,11/10/2011 12:37,3.29,14096,United Kingdom
575607,22070,SMALL RED RETROSPOT MUG IN BOX ,1,11/10/2011 12:37,7.46,14096,United Kingdom
575607,22074,6 RIBBONS SHIMMERING PINKS ,7,11/10/2011 12:37,1.25,14096,United Kingdom
575607,22075,6 RIBBONS ELEGANT CHRISTMAS ,7,11/10/2011 12:37,3.29,14096,United Kingdom
575607,22077,6 RIBBONS RUSTIC CHARM,5,11/10/2011 12:37,3.29,14096,United Kingdom
575607,22079,RIBBON REEL HEARTS DESIGN ,2,11/10/2011 12:37,3.29,14096,United Kingdom
575607,22081,RIBBON REEL FLORA + FAUNA ,1,11/10/2011 12:37,3.29,14096,United Kingdom
575607,22082,RIBBON REEL STRIPES DESIGN ,1,11/10/2011 12:37,3.29,14096,United Kingdom
575607,22086,PAPER CHAIN KIT 50'S CHRISTMAS ,14,11/10/2011 12:37,5.79,14096,United Kingdom
575607,22107,PIZZA PLATE IN BOX,2,11/10/2011 12:37,3.29,14096,United Kingdom
575607,22108,PING! MICROWAVE PLATE,3,11/10/2011 12:37,3.29,14096,United Kingdom
575607,22109,FULL ENGLISH BREAKFAST PLATE,1,11/10/2011 12:37,7.46,14096,United Kingdom
575607,22116,METAL SIGN HIS DINNER IS SERVED,1,11/10/2011 12:37,1.63,14096,United Kingdom
575607,22119,PEACE WOODEN BLOCK LETTERS,1,11/10/2011 12:37,14.13,14096,United Kingdom
575607,22138,BAKING SET 9 PIECE RETROSPOT ,3,11/10/2011 12:37,10.79,14096,United Kingdom
575607,22139,RETROSPOT TEA SET CERAMIC 11 PC ,2,11/10/2011 12:37,10.79,14096,United Kingdom
575607,22141,CHRISTMAS CRAFT TREE TOP ANGEL,5,11/10/2011 12:37,4.13,14096,United Kingdom
575607,22142,CHRISTMAS CRAFT WHITE FAIRY ,1,11/10/2011 12:37,3.29,14096,United Kingdom
575607,22144,CHRISTMAS CRAFT LITTLE FRIENDS,5,11/10/2011 12:37,4.13,14096,United Kingdom
575607,22147,FELTCRAFT BUTTERFLY HEARTS,1,11/10/2011 12:37,3.29,14096,United Kingdom
575607,22151,PLACE SETTING WHITE HEART,6,11/10/2011 12:37,1.63,14096,United Kingdom
575607,22152,PLACE SETTING WHITE STAR,5,11/10/2011 12:37,1.63,14096,United Kingdom
575607,22173,METAL 4 HOOK HANGER FRENCH CHATEAU,1,11/10/2011 12:37,5.79,14096,United Kingdom
575607,22174,PHOTO CUBE,6,11/10/2011 12:37,3.29,14096,United Kingdom
575607,22178,VICTORIAN GLASS HANGING T-LIGHT,6,11/10/2011 12:37,2.46,14096,United Kingdom
575607,22186,RED STAR CARD HOLDER,1,11/10/2011 12:37,5.79,14096,United Kingdom
575607,22187,GREEN CHRISTMAS TREE CARD HOLDER,1,11/10/2011 12:37,8.29,14096,United Kingdom
575607,22190,LOCAL CAFE MUG,2,11/10/2011 12:37,2.46,14096,United Kingdom
575607,22195,LARGE HEART MEASURING SPOONS,2,11/10/2011 12:37,3.29,14096,United Kingdom
575607,22196,SMALL HEART MEASURING SPOONS,2,11/10/2011 12:37,1.63,14096,United Kingdom
575607,22197,POPCORN HOLDER,3,11/10/2011 12:37,1.63,14096,United Kingdom
575607,22207,FRYING PAN UNION FLAG,1,11/10/2011 12:37,8.29,14096,United Kingdom
575607,22271,FELTCRAFT DOLL ROSIE,1,11/10/2011 12:37,5.79,14096,United Kingdom
575607,22274,FELTCRAFT DOLL EMILY,2,11/10/2011 12:37,5.79,14096,United Kingdom
575607,22280,POCKET BAG PINK PAISELY BROWN SPOT,1,11/10/2011 12:37,2.46,14096,United Kingdom
575607,22305,COFFEE MUG PINK PAISLEY DESIGN,1,11/10/2011 12:37,4.96,14096,United Kingdom
575607,22309,TEA COSY RED  STRIPE,1,11/10/2011 12:37,4.96,14096,United Kingdom
575607,22312,OFFICE MUG WARMER POLKADOT,1,11/10/2011 12:37,5.79,14096,United Kingdom
