575512,21062,PARTY INVITES SPACEMAN,12,11/10/2011 10:36,0.85,14121,United Kingdom
575512,21059,PARTY INVITES DINOSAURS,12,11/10/2011 10:36,0.85,14121,United Kingdom
575512,23192,BUNDLE OF 3 ALPHABET EXERCISE BOOKS,12,11/10/2011 10:36,1.65,14121,United Kingdom
575512,23191,BUNDLE OF 3 RETRO NOTE BOOKS,12,11/10/2011 10:36,1.65,14121,United Kingdom
575512,23240,SET OF 4 KNICK KNACK TINS DOILY ,6,11/10/2011 10:36,4.15,14121,United Kingdom
575512,22767,TRIPLE PHOTO FRAME CORNICE ,4,11/10/2011 10:36,9.95,14121,United Kingdom
575512,22768,FAMILY PHOTO FRAME CORNICE,4,11/10/2011 10:36,9.95,14121,United Kingdom
575512,22492,MINI PAINT SET VINTAGE ,36,11/10/2011 10:36,0.65,14121,United Kingdom
575512,21892,TRADITIONAL WOODEN CATCH CUP GAME ,12,11/10/2011 10:36,1.25,14121,United Kingdom
575512,22610,PENS ASSORTED FUNNY FACE,36,11/10/2011 10:36,0.19,14121,United Kingdom
575512,22693,GROW A FLYTRAP OR SUNFLOWER IN TIN,24,11/10/2011 10:36,1.25,14121,United Kingdom
575512,23492,VINTAGE JINGLE BELLS WREATH,2,11/10/2011 10:36,8.25,14121,United Kingdom
575512,23582,VINTAGE DOILY JUMBO BAG RED ,10,11/10/2011 10:36,2.08,14121,United Kingdom
575512,21932,SCANDINAVIAN PAISLEY PICNIC BAG,10,11/10/2011 10:36,1.65,14121,United Kingdom
575512,21933,PINK VINTAGE PAISLEY PICNIC BAG,10,11/10/2011 10:36,1.65,14121,United Kingdom
575512,85183B,CHARLIE & LOLA WASTEPAPER BIN FLORA,12,11/10/2011 10:36,1.25,14121,United Kingdom
575512,85183A,CHARLIE & LOLA WASTEPAPER BIN BLUE,12,11/10/2011 10:36,1.25,14121,United Kingdom
575512,85099B,JUMBO BAG RED RETROSPOT,10,11/10/2011 10:36,2.08,14121,United Kingdom
575512,23491,VINTAGE JINGLE BELLS HEART,2,11/10/2011 10:36,8.25,14121,United Kingdom
575512,16169E,WRAP 50'S  CHRISTMAS,25,11/10/2011 10:36,0.42,14121,United Kingdom
575512,22821,GIFT BAG PSYCHEDELIC APPLES,12,11/10/2011 10:36,0.65,14121,United Kingdom
575512,22820,GIFT BAG BIRTHDAY,12,11/10/2011 10:36,0.65,14121,United Kingdom
575512,22144,CHRISTMAS CRAFT LITTLE FRIENDS,6,11/10/2011 10:36,2.1,14121,United Kingdom
575512,22141,CHRISTMAS CRAFT TREE TOP ANGEL,6,11/10/2011 10:36,2.1,14121,United Kingdom
575512,23110,PARISIENNE KEY CABINET ,2,11/10/2011 10:36,5.75,14121,United Kingdom
575512,22150,3 STRIPEY MICE FELTCRAFT,6,11/10/2011 10:36,1.95,14121,United Kingdom
575512,22273,FELTCRAFT DOLL MOLLY,6,11/10/2011 10:36,2.95,14121,United Kingdom
575512,23181,BULL DOG BOTTLE TOP WALL CLOCK,2,11/10/2011 10:36,8.25,14121,United Kingdom
575512,79191C,RETRO PLASTIC ELEPHANT TRAY,12,11/10/2011 10:36,0.85,14121,United Kingdom
575512,22418,10 COLOUR SPACEBOY PEN,24,11/10/2011 10:36,0.85,14121,United Kingdom
575512,23126,FELTCRAFT GIRL AMELIE KIT,4,11/10/2011 10:36,4.95,14121,United Kingdom
575512,23127,FELTCRAFT GIRL NICOLE KIT,4,11/10/2011 10:36,4.95,14121,United Kingdom
575512,22650,CERAMIC PIRATE CHEST MONEY BANK,12,11/10/2011 10:36,1.45,14121,United Kingdom
575512,23084,RABBIT NIGHT LIGHT,12,11/10/2011 10:36,2.08,14121,United Kingdom
575512,22457,NATURAL SLATE HEART CHALKBOARD ,6,11/10/2011 10:36,2.95,14121,United Kingdom
575512,84946,ANTIQUE SILVER T-LIGHT GLASS,12,11/10/2011 10:36,1.25,14121,United Kingdom
575512,23486,ANTIQUE HEART SHELF UNIT,1,11/10/2011 10:36,16.65,14121,United Kingdom
575512,23485,BOTANICAL GARDENS WALL CLOCK ,2,11/10/2011 10:36,25,14121,United Kingdom
575512,23493,VINTAGE DOILY TRAVEL SEWING KIT,10,11/10/2011 10:36,1.95,14121,United Kingdom
575512,23499,SET 12 VINTAGE DOILY CHALK ,24,11/10/2011 10:36,0.42,14121,United Kingdom
575512,23497,CLASSIC CHROME BICYCLE BELL ,12,11/10/2011 10:36,1.45,14121,United Kingdom
575512,23569,TRADTIONAL ALPHABET STAMP SET,8,11/10/2011 10:36,4.95,14121,United Kingdom
575512,23570,TRADITIONAL PICK UP STICKS GAME ,12,11/10/2011 10:36,1.25,14121,United Kingdom
575512,23661,MILK MAIDS MUG ,12,11/10/2011 10:36,1.65,14121,United Kingdom
575512,23660,HENRIETTA HEN MUG ,12,11/10/2011 10:36,1.65,14121,United Kingdom
575512,21990,MODERN FLORAL STATIONERY SET,12,11/10/2011 10:36,1.25,14121,United Kingdom
575512,22609,PENS ASSORTED SPACEBALL,36,11/10/2011 10:36,0.19,14121,United Kingdom
575513,35965,,7,11/10/2011 10:39,0,,United Kingdom
575514,22947,WOODEN ADVENT CALENDAR RED,6,11/10/2011 10:40,7.95,12541,Spain
575514,22734,SET OF 6 RIBBONS VINTAGE CHRISTMAS,12,11/10/2011 10:40,2.89,12541,Spain
