575500,22678,FRENCH BLUE METAL DOOR SIGN 3,10,11/10/2011 09:57,1.25,16003,United Kingdom
575500,22679,FRENCH BLUE METAL DOOR SIGN 4,10,11/10/2011 09:57,1.25,16003,United Kingdom
575500,22680,FRENCH BLUE METAL DOOR SIGN 5,10,11/10/2011 09:57,1.25,16003,United Kingdom
575500,22681,FRENCH BLUE METAL DOOR SIGN 6,10,11/10/2011 09:57,1.25,16003,United Kingdom
575500,22685,FRENCH BLUE METAL DOOR SIGN 0,10,11/10/2011 09:57,1.25,16003,United Kingdom
575500,22682,FRENCH BLUE METAL DOOR SIGN 7,10,11/10/2011 09:57,1.25,16003,United Kingdom
575500,22683,FRENCH BLUE METAL DOOR SIGN 8,10,11/10/2011 09:57,1.25,16003,United Kingdom
575500,22686,FRENCH BLUE METAL DOOR SIGN No,12,11/10/2011 09:57,1.25,16003,United Kingdom
575501,23583,LUNCH BAG PAISLEY PARK  ,30,11/10/2011 09:59,1.65,16218,United Kingdom
575501,23301,GARDENERS KNEELING PAD KEEP CALM ,12,11/10/2011 09:59,1.65,16218,United Kingdom
575501,22383,LUNCH BAG SUKI DESIGN ,30,11/10/2011 09:59,1.65,16218,United Kingdom
575501,23209,LUNCH BAG VINTAGE DOILY ,30,11/10/2011 09:59,1.65,16218,United Kingdom
575501,22469,HEART OF WICKER SMALL,40,11/10/2011 09:59,1.45,16218,United Kingdom
575501,22650,CERAMIC PIRATE CHEST MONEY BANK,12,11/10/2011 09:59,1.45,16218,United Kingdom
575501,22197,POPCORN HOLDER,100,11/10/2011 09:59,0.72,16218,United Kingdom
575501,23096,PETIT TRAY CHIC,12,11/10/2011 09:59,1.65,16218,United Kingdom
575501,23452,HEART MINI PORTRAIT FRAME,18,11/10/2011 09:59,1.95,16218,United Kingdom
575501,23453,OVAL  MINI PORTRAIT FRAME,8,11/10/2011 09:59,1.95,16218,United Kingdom
575501,22297,HEART IVORY TRELLIS SMALL,24,11/10/2011 09:59,1.25,16218,United Kingdom
575501,20725,LUNCH BAG RED RETROSPOT,20,11/10/2011 09:59,1.65,16218,United Kingdom
575502,23320,GIANT 50'S CHRISTMAS CRACKER,12,11/10/2011 10:10,2.89,16700,United Kingdom
575502,23503,PLAYING CARDS KEEP CALM & CARRY ON,12,11/10/2011 10:10,1.25,16700,United Kingdom
575502,23531,WALL ART BIG LOVE ,3,11/10/2011 10:10,6.95,16700,United Kingdom
575502,22150,3 STRIPEY MICE FELTCRAFT,6,11/10/2011 10:10,1.95,16700,United Kingdom
575502,22328,ROUND SNACK BOXES SET OF 4 FRUITS ,6,11/10/2011 10:10,2.95,16700,United Kingdom
575502,22616,PACK OF 12 LONDON TISSUES ,48,11/10/2011 10:10,0.39,16700,United Kingdom
575502,22659,LUNCH BOX I LOVE LONDON,12,11/10/2011 10:10,1.95,16700,United Kingdom
575502,22996,TRAVEL CARD WALLET VINTAGE TICKET,24,11/10/2011 10:10,0.42,16700,United Kingdom
575502,23004,TRAVEL CARD WALLET PANTRY,24,11/10/2011 10:10,0.42,16700,United Kingdom
575502,23202,JUMBO BAG VINTAGE LEAF,10,11/10/2011 10:10,2.08,16700,United Kingdom
575502,23203,JUMBO BAG VINTAGE DOILY ,10,11/10/2011 10:10,2.08,16700,United Kingdom
575502,23208,LUNCH BAG VINTAGE LEAF DESIGN,10,11/10/2011 10:10,1.65,16700,United Kingdom
575502,23207,LUNCH BAG ALPHABET DESIGN,10,11/10/2011 10:10,1.65,16700,United Kingdom
575502,23209,LUNCH BAG VINTAGE DOILY ,10,11/10/2011 10:10,1.65,16700,United Kingdom
575502,22142,CHRISTMAS CRAFT WHITE FAIRY ,12,11/10/2011 10:10,1.45,16700,United Kingdom
575502,23505,PLAYING CARDS I LOVE LONDON ,12,11/10/2011 10:10,1.25,16700,United Kingdom
575502,23158,SET OF 5 LUCKY CAT MAGNETS ,12,11/10/2011 10:10,2.08,16700,United Kingdom
575502,23343,JUMBO BAG VINTAGE CHRISTMAS ,10,11/10/2011 10:10,2.08,16700,United Kingdom
575502,21790,VINTAGE SNAP CARDS,12,11/10/2011 10:10,0.85,16700,United Kingdom
575502,22141,CHRISTMAS CRAFT TREE TOP ANGEL,6,11/10/2011 10:10,2.1,16700,United Kingdom
575502,22720,SET OF 3 CAKE TINS PANTRY DESIGN ,3,11/10/2011 10:10,4.95,16700,United Kingdom
575503,35933,,-2,11/10/2011 10:19,0,,United Kingdom
575504,23247,BISCUIT TIN 50'S CHRISTMAS,6,11/10/2011 10:29,2.89,14895,United Kingdom
575504,22960,JAM MAKING SET WITH JARS,6,11/10/2011 10:29,4.25,14895,United Kingdom
575504,22988,SOLDIERS EGG CUP ,12,11/10/2011 10:29,1.25,14895,United Kingdom
575504,23316,RED REFECTORY CLOCK ,2,11/10/2011 10:29,9.95,14895,United Kingdom
575504,21844,RED RETROSPOT MUG,18,11/10/2011 10:29,2.95,14895,United Kingdom
575504,84378,SET OF 3 HEART COOKIE CUTTERS,12,11/10/2011 10:29,1.45,14895,United Kingdom
575504,22423,REGENCY CAKESTAND 3 TIER,6,11/10/2011 10:29,12.75,14895,United Kingdom
575504,47566,PARTY BUNTING,8,11/10/2011 10:29,4.95,14895,United Kingdom
