575202,23209,LUNCH BAG VINTAGE DOILY ,10,11/09/2011 10:14,1.65,13018,United Kingdom
575202,23078,ICE CREAM PEN LIP GLOSS ,24,11/09/2011 10:14,1.25,13018,United Kingdom
575202,23571,TRADITIONAL NAUGHTS & CROSSES,12,11/09/2011 10:14,1.65,13018,United Kingdom
575202,21889,WOODEN BOX OF DOMINOES,12,11/09/2011 10:14,1.25,13018,United Kingdom
575202,22568,FELTCRAFT CUSHION OWL,4,11/09/2011 10:14,3.75,13018,United Kingdom
575202,22750,FELTCRAFT PRINCESS LOLA DOLL,4,11/09/2011 10:14,3.75,13018,United Kingdom
575202,22271,FELTCRAFT DOLL ROSIE,6,11/09/2011 10:14,2.95,13018,United Kingdom
575202,21509,COWBOYS AND INDIANS BIRTHDAY CARD ,12,11/09/2011 10:14,0.42,13018,United Kingdom
575202,21508,VINTAGE KID DOLLY CARD ,12,11/09/2011 10:14,0.42,13018,United Kingdom
575202,22031,BOTANICAL LAVENDER BIRTHDAY CARD,12,11/09/2011 10:14,0.42,13018,United Kingdom
575202,21506,"FANCY FONT BIRTHDAY CARD, ",12,11/09/2011 10:14,0.42,13018,United Kingdom
575202,21504,SKULLS GREETING CARD,12,11/09/2011 10:14,0.42,13018,United Kingdom
575202,23661,MILK MAIDS MUG ,12,11/09/2011 10:14,1.65,13018,United Kingdom
575202,23583,LUNCH BAG PAISLEY PARK  ,10,11/09/2011 10:14,1.65,13018,United Kingdom
575202,23566,EGG CUP MILKMAID HEIDI,12,11/09/2011 10:14,1.25,13018,United Kingdom
575202,23326,HANGING MINI COLOURED BOTTLES,48,11/09/2011 10:14,0.63,13018,United Kingdom
575202,85048,15CM CHRISTMAS GLASS BALL 20 LIGHTS,4,11/09/2011 10:14,7.95,13018,United Kingdom
575202,22940,FELTCRAFT CHRISTMAS FAIRY,4,11/09/2011 10:14,4.25,13018,United Kingdom
575202,23085,ANTIQUE SILVER BAUBLE LAMP  ,2,11/09/2011 10:14,10.4,13018,United Kingdom
575202,23499,SET 12 VINTAGE DOILY CHALK ,24,11/09/2011 10:14,0.42,13018,United Kingdom
575202,23084,RABBIT NIGHT LIGHT,6,11/09/2011 10:14,2.08,13018,United Kingdom
575203,23084,RABBIT NIGHT LIGHT,24,11/09/2011 10:14,1.79,13018,United Kingdom
575204,23355,HOT WATER BOTTLE KEEP CALM,6,11/09/2011 10:16,4.95,15027,United Kingdom
575204,22112,CHOCOLATE HOT WATER BOTTLE,6,11/09/2011 10:16,4.95,15027,United Kingdom
575204,22111,SCOTTIE DOG HOT WATER BOTTLE,6,11/09/2011 10:16,4.95,15027,United Kingdom
575204,22534,MAGIC DRAWING SLATE SPACEBOY ,24,11/09/2011 10:16,0.42,15027,United Kingdom
575205,79321,CHILLI LIGHTS,48,11/09/2011 10:18,4.95,13147,United Kingdom
575206,23452,HEART MINI PORTRAIT FRAME,12,11/09/2011 10:26,1.65,14298,United Kingdom
575206,23453,OVAL  MINI PORTRAIT FRAME,8,11/09/2011 10:26,1.65,14298,United Kingdom
575206,23451,SQUARE MINI PORTRAIT FRAME,12,11/09/2011 10:26,1.65,14298,United Kingdom
575206,23481,PEARLISED IVORY HEART SMALL ,24,11/09/2011 10:26,1.04,14298,United Kingdom
575206,23482,PEARLISED IVORY HEART LARGE ,24,11/09/2011 10:26,1.45,14298,United Kingdom
575206,23343,JUMBO BAG VINTAGE CHRISTMAS ,50,11/09/2011 10:26,1.79,14298,United Kingdom
575206,23581,JUMBO BAG PAISLEY PARK,30,11/09/2011 10:26,1.79,14298,United Kingdom
575206,23344,JUMBO BAG 50'S CHRISTMAS ,50,11/09/2011 10:26,1.79,14298,United Kingdom
575206,21137,BLACK RECORD COVER FRAME,48,11/09/2011 10:26,3.39,14298,United Kingdom
575206,82001S,SILVER RECORD COVER FRAME,48,11/09/2011 10:26,3.39,14298,United Kingdom
575206,23431,NATURAL HANGING QUILTED HEARTS ,48,11/09/2011 10:26,0.72,14298,United Kingdom
575206,23497,CLASSIC CHROME BICYCLE BELL ,12,11/09/2011 10:26,1.25,14298,United Kingdom
575206,23122,PARTY CHARMS 50 PIECES,36,11/09/2011 10:26,0.72,14298,United Kingdom
575206,22699,ROSES REGENCY TEACUP AND SAUCER ,24,11/09/2011 10:26,2.55,14298,United Kingdom
575206,22697,GREEN REGENCY TEACUP AND SAUCER,24,11/09/2011 10:26,2.55,14298,United Kingdom
575206,84991,60 TEATIME FAIRY CAKE CASES,48,11/09/2011 10:26,0.42,14298,United Kingdom
575206,22951,60 CAKE CASES DOLLY GIRL DESIGN,24,11/09/2011 10:26,0.42,14298,United Kingdom
575206,84992,72 SWEETHEART FAIRY CAKE CASES,24,11/09/2011 10:26,0.42,14298,United Kingdom
575206,21976,PACK OF 60 MUSHROOM CAKE CASES,24,11/09/2011 10:26,0.42,14298,United Kingdom
575206,21977,PACK OF 60 PINK PAISLEY CAKE CASES,24,11/09/2011 10:26,0.42,14298,United Kingdom
575206,23307,SET OF 60 PANTRY DESIGN CAKE CASES ,48,11/09/2011 10:26,0.42,14298,United Kingdom
575206,21169,YOU'RE CONFUSING ME METAL SIGN ,12,11/09/2011 10:26,1.45,14298,United Kingdom
575206,85152,HAND OVER THE CHOCOLATE   SIGN ,12,11/09/2011 10:26,1.85,14298,United Kingdom
