575491,21742,LARGE ROUND WICKER PLATTER ,2,11/09/2011 17:47,5.95,15531,United Kingdom
575491,21281,VINTAGE KITCHEN PRINT SEAFOOD,3,11/09/2011 17:47,2.55,15531,United Kingdom
575491,23532,WALL ART WORK REST AND PLAY  ,1,11/09/2011 17:47,4.95,15531,United Kingdom
575491,21758,VINTAGE SHELLS PRINT,2,11/09/2011 17:47,6.45,15531,United Kingdom
575491,23531,WALL ART BIG LOVE ,1,11/09/2011 17:47,6.95,15531,United Kingdom
575491,23539,WALL ART LOVES' SECRET ,1,11/09/2011 17:47,5.95,15531,United Kingdom
575491,23543,WALL ART KEEP CALM ,2,11/09/2011 17:47,8.25,15531,United Kingdom
575491,23300,GARDENERS KNEELING PAD CUP OF TEA ,3,11/09/2011 17:47,1.65,15531,United Kingdom
575491,23301,GARDENERS KNEELING PAD KEEP CALM ,2,11/09/2011 17:47,1.65,15531,United Kingdom
575491,23302,KNEELING MAT HOUSEWORK  DESIGN,3,11/09/2011 17:47,1.65,15531,United Kingdom
575491,23534,WALL ART STOP FOR TEA ,3,11/09/2011 17:47,5.95,15531,United Kingdom
575491,23556,LANDMARK FRAME COVENT GARDEN ,1,11/09/2011 17:47,12.5,15531,United Kingdom
575491,23555,LANDMARK FRAME NOTTING HILL ,1,11/09/2011 17:47,12.5,15531,United Kingdom
575491,23558,LANDMARK FRAME LONDON BRIDGE ,1,11/09/2011 17:47,12.5,15531,United Kingdom
575491,23553,LANDMARK FRAME CAMDEN TOWN ,1,11/09/2011 17:47,12.5,15531,United Kingdom
575491,72122,COFFEE SCENT PILLAR CANDLE,3,11/09/2011 17:47,0.95,15531,United Kingdom
575491,23493,VINTAGE DOILY TRAVEL SEWING KIT,3,11/09/2011 17:47,1.95,15531,United Kingdom
575491,85185B,PINK HORSE SOCK PUPPET KIT,2,11/09/2011 17:47,2.95,15531,United Kingdom
575491,21710,FOLDING UMBRELLA PINKWHITE POLKADOT,1,11/09/2011 17:47,4.95,15531,United Kingdom
575491,22633,HAND WARMER UNION JACK,1,11/09/2011 17:47,2.1,15531,United Kingdom
575491,23240,SET OF 4 KNICK KNACK TINS DOILY ,3,11/09/2011 17:47,4.15,15531,United Kingdom
575491,84569D,PACK 6 HEART/ICE-CREAM PATCHES,12,11/09/2011 17:47,1.25,15531,United Kingdom
575491,21706,FOLDING UMBRELLA RED/WHITE POLKADOT,1,11/09/2011 17:47,4.95,15531,United Kingdom
575491,21707,FOLDING UMBRELLA BLACKBLUE POLKADOT,1,11/09/2011 17:47,4.95,15531,United Kingdom
575491,21708,FOLDING UMBRELLA CREAM POLKADOT,1,11/09/2011 17:47,4.95,15531,United Kingdom
575491,21711,FOLDING UMBRELLA WHITE/RED POLKADOT,1,11/09/2011 17:47,4.95,15531,United Kingdom
575491,21280,VINTAGE KITCHEN PRINT VEGETABLES,6,11/09/2011 17:47,2.55,15531,United Kingdom
575491,23359,SET OF 12 T-LIGHTS VINTAGE DOILY,12,11/09/2011 17:47,1.95,15531,United Kingdom
575491,21326,AGED GLASS SILVER T-LIGHT HOLDER,12,11/09/2011 17:47,0.65,15531,United Kingdom
575491,22121,NOEL WOODEN BLOCK LETTERS ,2,11/09/2011 17:47,5.95,15531,United Kingdom
575491,21756,BATH BUILDING BLOCK WORD,2,11/09/2011 17:47,6.25,15531,United Kingdom
575491,21754,HOME BUILDING BLOCK WORD,2,11/09/2011 17:47,6.25,15531,United Kingdom
575491,22693,GROW A FLYTRAP OR SUNFLOWER IN TIN,24,11/09/2011 17:47,1.25,15531,United Kingdom
575491,85099C,JUMBO  BAG BAROQUE BLACK WHITE,10,11/09/2011 17:47,2.08,15531,United Kingdom
575491,85099B,JUMBO BAG RED RETROSPOT,10,11/09/2011 17:47,2.08,15531,United Kingdom
575491,21929,JUMBO BAG PINK VINTAGE PAISLEY,9,11/09/2011 17:47,2.08,15531,United Kingdom
575491,85099F,JUMBO BAG STRAWBERRY,9,11/09/2011 17:47,2.08,15531,United Kingdom
575491,22423,REGENCY CAKESTAND 3 TIER,1,11/09/2011 17:47,12.75,15531,United Kingdom
575491,22114,HOT WATER BOTTLE TEA AND SYMPATHY,2,11/09/2011 17:47,4.25,15531,United Kingdom
575491,22565,FELTCRAFT HAIRBANDS PINK AND WHITE ,12,11/09/2011 17:47,0.85,15531,United Kingdom
575491,85185B,PINK HORSE SOCK PUPPET KIT,1,11/09/2011 17:47,2.95,15531,United Kingdom
575491,22438,BALLOON ART MAKE YOUR OWN FLOWERS,3,11/09/2011 17:47,1.95,15531,United Kingdom
575491,22749,FELTCRAFT PRINCESS CHARLOTTE DOLL,1,11/09/2011 17:47,3.75,15531,United Kingdom
575491,23128,FELTCRAFT BOY JEAN-PAUL KIT,2,11/09/2011 17:47,4.95,15531,United Kingdom
575491,23439,HAND WARMER RED LOVE HEART,1,11/09/2011 17:47,2.1,15531,United Kingdom
575491,22865,HAND WARMER OWL DESIGN,2,11/09/2011 17:47,2.1,15531,United Kingdom
575491,22149,FELTCRAFT 6 FLOWER FRIENDS,2,11/09/2011 17:47,2.1,15531,United Kingdom
575491,22150,3 STRIPEY MICE FELTCRAFT,2,11/09/2011 17:47,1.95,15531,United Kingdom
575491,23356,LOVE HOT WATER BOTTLE,2,11/09/2011 17:47,5.95,15531,United Kingdom
575491,22138,BAKING SET 9 PIECE RETROSPOT ,3,11/09/2011 17:47,4.95,15531,United Kingdom
