575486,72598,SET/12 TAPER CANDLES,24,11/09/2011 17:07,0.85,14911,EIRE
575486,23434,3 RAFFIA RIBBONS 50'S CHRISTMAS ,20,11/09/2011 17:07,0.79,14911,EIRE
575486,22943,CHRISTMAS LIGHTS 10 VINTAGE BAUBLES,24,11/09/2011 17:07,4.25,14911,EIRE
575486,85048,15CM CHRISTMAS GLASS BALL 20 LIGHTS,24,11/09/2011 17:07,6.95,14911,EIRE
575486,84978,HANGING HEART JAR T-LIGHT HOLDER,36,11/09/2011 17:07,1.06,14911,EIRE
575486,23144,ZINC T-LIGHT HOLDER STARS SMALL,36,11/09/2011 17:07,0.83,14911,EIRE
575486,23250,VINTAGE RED TRIM ENAMEL BOWL ,24,11/09/2011 17:07,1.25,14911,EIRE
575486,23251,VINTAGE RED ENAMEL TRIM MUG ,24,11/09/2011 17:07,1.25,14911,EIRE
575486,23252,VINTAGE RED ENAMEL TRIM JUG ,8,11/09/2011 17:07,3.75,14911,EIRE
575486,23249,VINTAGE RED ENAMEL TRIM PLATE,12,11/09/2011 17:07,1.65,14911,EIRE
575486,23168,CLASSIC CAFE SUGAR DISPENSER,12,11/09/2011 17:07,1.25,14911,EIRE
575486,23169,CLASSIC GLASS COOKIE JAR,6,11/09/2011 17:07,4.15,14911,EIRE
575486,22561,WOODEN SCHOOL COLOURING SET,24,11/09/2011 17:07,1.65,14911,EIRE
575486,84029E,RED WOOLLY HOTTIE WHITE HEART.,12,11/09/2011 17:07,4.25,14911,EIRE
575486,21189,WHITE HONEYCOMB PAPER GARLAND ,12,11/09/2011 17:07,1.65,14911,EIRE
575486,23489,VINTAGE BELLS GARLAND,18,11/09/2011 17:07,2.89,14911,EIRE
575486,35961,FOLKART ZINC HEART CHRISTMAS DEC,24,11/09/2011 17:07,0.85,14911,EIRE
575487,21616,4 PEAR BOTANICAL DINNER CANDLES,12,11/09/2011 17:11,1.25,15450,United Kingdom
575487,21014,SWISS CHALET TREE DECORATION ,24,11/09/2011 17:11,0.29,15450,United Kingdom
575487,21015,DARK BIRD HOUSE TREE DECORATION,24,11/09/2011 17:11,0.29,15450,United Kingdom
575487,22578,WOODEN STAR CHRISTMAS SCANDINAVIAN,24,11/09/2011 17:11,0.29,15450,United Kingdom
575487,22579,WOODEN TREE CHRISTMAS SCANDINAVIAN,24,11/09/2011 17:11,0.29,15450,United Kingdom
575487,22577,WOODEN HEART CHRISTMAS SCANDINAVIAN,24,11/09/2011 17:11,0.29,15450,United Kingdom
575487,22144,CHRISTMAS CRAFT LITTLE FRIENDS,6,11/09/2011 17:11,2.1,15450,United Kingdom
575487,22952,60 CAKE CASES VINTAGE CHRISTMAS,24,11/09/2011 17:11,0.55,15450,United Kingdom
575487,22909,SET OF 20 VINTAGE CHRISTMAS NAPKINS,12,11/09/2011 17:11,0.85,15450,United Kingdom
575487,23314,VINTAGE CHRISTMAS TABLECLOTH,2,11/09/2011 17:11,12.5,15450,United Kingdom
575487,23311,VINTAGE CHRISTMAS STOCKING ,6,11/09/2011 17:11,2.55,15450,United Kingdom
575487,85048,15CM CHRISTMAS GLASS BALL 20 LIGHTS,2,11/09/2011 17:11,7.95,15450,United Kingdom
575487,21136,PAINTED METAL PEARS ASSORTED,8,11/09/2011 17:11,1.69,15450,United Kingdom
575487,84879,ASSORTED COLOUR BIRD ORNAMENT,8,11/09/2011 17:11,1.69,15450,United Kingdom
575487,22170,PICTURE FRAME WOOD TRIPLE PORTRAIT,4,11/09/2011 17:11,6.75,15450,United Kingdom
575487,23396,LE JARDIN BOTANIQUE CUSHION COVER,4,11/09/2011 17:11,3.75,15450,United Kingdom
575487,46000S,POLYESTER FILLER PAD 40x40cm,4,11/09/2011 17:11,1.45,15450,United Kingdom
575487,71459,HANGING JAM JAR T-LIGHT HOLDERS,12,11/09/2011 17:11,0.85,15450,United Kingdom
575487,22923,FRIDGE MAGNETS LES ENFANTS ASSORTED,12,11/09/2011 17:11,0.85,15450,United Kingdom
575487,22430,ENAMEL WATERING CAN CREAM,4,11/09/2011 17:11,4.95,15450,United Kingdom
575487,22865,HAND WARMER OWL DESIGN,12,11/09/2011 17:11,2.1,15450,United Kingdom
575487,22632,HAND WARMER RED RETROSPOT,12,11/09/2011 17:11,2.1,15450,United Kingdom
575487,23366,SET 12 COLOURING PENCILS DOILY,16,11/09/2011 17:11,0.65,15450,United Kingdom
575487,23367,SET 12 COLOUR PENCILS SPACEBOY ,16,11/09/2011 17:11,0.65,15450,United Kingdom
575487,22418,10 COLOUR SPACEBOY PEN,24,11/09/2011 17:11,0.85,15450,United Kingdom
575487,23077,DOUGHNUT LIP GLOSS ,20,11/09/2011 17:11,1.25,15450,United Kingdom
575487,21231,SWEETHEART CERAMIC TRINKET BOX,12,11/09/2011 17:11,1.25,15450,United Kingdom
575487,47591D,PINK FAIRY CAKE CHILDRENS APRON,8,11/09/2011 17:11,1.95,15450,United Kingdom
575487,22367,CHILDRENS APRON SPACEBOY DESIGN,8,11/09/2011 17:11,1.95,15450,United Kingdom
575487,82613D,METAL SIGN CUPCAKE SINGLE HOOK,8,11/09/2011 17:11,1.25,15450,United Kingdom
575490,22998,TRAVEL CARD WALLET KEEP CALM,4,11/09/2011 17:44,0.42,15031,United Kingdom
575490,22996,TRAVEL CARD WALLET VINTAGE TICKET,4,11/09/2011 17:44,0.42,15031,United Kingdom
575490,23005,TRAVEL CARD WALLET I LOVE LONDON,4,11/09/2011 17:44,0.42,15031,United Kingdom
