575875,35953,FOLKART STAR CHRISTMAS DECORATIONS,8,11/11/2011 13:06,0.61,,United Kingdom
575875,35964,FOLKART CLIP ON STARS,2,11/11/2011 13:06,0.83,,United Kingdom
575875,35970,ZINC FOLKART SLEIGH BELLS,2,11/11/2011 13:06,4.13,,United Kingdom
575875,37340,MULTICOLOUR SPRING FLOWER MUG,6,11/11/2011 13:06,1.38,,United Kingdom
575875,37500,TEA TIME TEAPOT IN GIFT BOX,2,11/11/2011 13:06,8.29,,United Kingdom
575875,46776F,WOVEN ROSE GARDEN CUSHION COVER ,1,11/11/2011 13:06,4.13,,United Kingdom
575875,47310M,SMALL POP BOX FUNKY MONKEY,2,11/11/2011 13:06,1.63,,United Kingdom
575875,47480,HANGING PHOTO CLIP ROPE LADDER,1,11/11/2011 13:06,3.29,,United Kingdom
575875,47563A,RETRO LONGBOARD IRONING BOARD COVER,1,11/11/2011 13:06,3.29,,United Kingdom
575875,47566B,TEA TIME PARTY BUNTING,1,11/11/2011 13:06,10.79,,United Kingdom
575875,47593B,SCOTTIE DOGS BABY BIB,5,11/11/2011 13:06,0.83,,United Kingdom
575875,48111,DOORMAT 3 SMILEY CATS,1,11/11/2011 13:06,15.79,,United Kingdom
575875,51014C,"FEATHER PEN,COAL BLACK",1,11/11/2011 13:06,0.83,,United Kingdom
575875,70007,HI TEC ALPINE HAND WARMER,2,11/11/2011 13:06,3.29,,United Kingdom
575875,71053,WHITE METAL LANTERN,15,11/11/2011 13:06,8.29,,United Kingdom
575875,71459,HANGING JAM JAR T-LIGHT HOLDERS,4,11/11/2011 13:06,1.66,,United Kingdom
575875,71477,COLOUR GLASS. STAR T-LIGHT HOLDER,1,11/11/2011 13:06,6.63,,United Kingdom
575875,72122,COFFEE SCENT PILLAR CANDLE,1,11/11/2011 13:06,1.88,,United Kingdom
575875,72128,COLUMBIAN CANDLE ROUND,1,11/11/2011 13:06,1.63,,United Kingdom
575875,72807A,SET/3 ROSE CANDLE IN JEWELLED BOX,1,11/11/2011 13:06,8.29,,United Kingdom
575875,72817,SET OF 2 CHRISTMAS DECOUPAGE CANDLE,1,11/11/2011 13:06,1.63,,United Kingdom
575875,79066K,RETRO MOD TRAY,3,11/11/2011 13:06,1.63,,United Kingdom
575875,79190A,RETRO PLASTIC 70'S TRAY,1,11/11/2011 13:06,0.83,,United Kingdom
575875,79321,CHILLI LIGHTS,1,11/11/2011 13:06,12.46,,United Kingdom
575875,82551,LAUNDRY 15C METAL SIGN,1,11/11/2011 13:06,2.46,,United Kingdom
575875,82583,HOT BATHS METAL SIGN,1,11/11/2011 13:06,4.13,,United Kingdom
575875,84006,MAGIC TREE -PAPER FLOWERS,3,11/11/2011 13:06,1.63,,United Kingdom
575875,84032A,CHARLIE+LOLA PINK HOT WATER BOTTLE,3,11/11/2011 13:06,3.29,,United Kingdom
575875,84032B,CHARLIE + LOLA RED HOT WATER BOTTLE,2,11/11/2011 13:06,3.29,,United Kingdom
575875,84077,WORLD WAR 2 GLIDERS ASSTD DESIGNS,5,11/11/2011 13:06,0.63,,United Kingdom
575875,84086C,PINK/PURPLE RETRO RADIO,1,11/11/2011 13:06,4.13,,United Kingdom
575875,84279P,CHERRY BLOSSOM  DECORATIVE FLASK,1,11/11/2011 13:06,8.29,,United Kingdom
575875,84378,SET OF 3 HEART COOKIE CUTTERS,1,11/11/2011 13:06,2.46,,United Kingdom
575875,84380,SET OF 3 BUTTERFLY COOKIE CUTTERS,2,11/11/2011 13:06,2.46,,United Kingdom
575875,84535B,FAIRY CAKES NOTEBOOK A6 SIZE,1,11/11/2011 13:06,1.46,,United Kingdom
575875,84536A,ENGLISH ROSE NOTEBOOK A7 SIZE,1,11/11/2011 13:06,0.83,,United Kingdom
575875,84558A,3D DOG PICTURE PLAYING CARDS,1,11/11/2011 13:06,5.79,,United Kingdom
575875,84568,GIRLS ALPHABET IRON ON PATCHES ,21,11/11/2011 13:06,0.42,,United Kingdom
575875,84569D,PACK 6 HEART/ICE-CREAM PATCHES,3,11/11/2011 13:06,2.46,,United Kingdom
575875,84580,MOUSE TOY WITH PINK T-SHIRT,1,11/11/2011 13:06,4.13,,United Kingdom
575875,84581,DOG TOY WITH PINK CROCHET SKIRT,1,11/11/2011 13:06,4.13,,United Kingdom
575875,84598,BOYS ALPHABET IRON ON PATCHES,6,11/11/2011 13:06,0.42,,United Kingdom
575875,84692,BOX OF 24 COCKTAIL PARASOLS,2,11/11/2011 13:06,0.83,,United Kingdom
575875,84880,WHITE WIRE EGG HOLDER,1,11/11/2011 13:06,15.79,,United Kingdom
575875,84882,GREEN WIRE STANDING CANDLE HOLDER,1,11/11/2011 13:06,7.46,,United Kingdom
575875,84923,PINK BUTTERFLY HANDBAG W BOBBLES,1,11/11/2011 13:06,4.13,,United Kingdom
575875,84946,ANTIQUE SILVER T-LIGHT GLASS,16,11/11/2011 13:06,2.46,,United Kingdom
575875,84970L,SINGLE HEART ZINC T-LIGHT HOLDER,1,11/11/2011 13:06,2.08,,United Kingdom
575875,84970S,HANGING HEART ZINC T-LIGHT HOLDER,2,11/11/2011 13:06,2.08,,United Kingdom
575875,84978,HANGING HEART JAR T-LIGHT HOLDER,2,11/11/2011 13:06,2.46,,United Kingdom
