570690,22653,BUTTON BOX ,1,10/11/2011 16:37,1.63,,United Kingdom
570690,22665,RECIPE BOX BLUE SKETCHBOOK DESIGN,1,10/11/2011 16:37,5.79,,United Kingdom
570690,22666,RECIPE BOX PANTRY YELLOW DESIGN,4,10/11/2011 16:37,5.79,,United Kingdom
570690,22669,RED BABY BUNTING ,1,10/11/2011 16:37,5.79,,United Kingdom
570690,22671,FRENCH LAUNDRY SIGN BLUE METAL,1,10/11/2011 16:37,3.29,,United Kingdom
570690,22692,DOORMAT WELCOME TO OUR HOME,1,10/11/2011 16:37,15.79,,United Kingdom
570690,22693,GROW A FLYTRAP OR SUNFLOWER IN TIN,3,10/11/2011 16:37,2.5,,United Kingdom
570690,22694,WICKER STAR ,2,10/11/2011 16:37,4.13,,United Kingdom
570690,22731,3D CHRISTMAS STAMPS STICKERS ,1,10/11/2011 16:37,2.46,,United Kingdom
570690,22734,SET OF 6 RIBBONS VINTAGE CHRISTMAS,1,10/11/2011 16:37,5.79,,United Kingdom
570690,22735,RIBBON REEL SOCKS AND MITTENS,1,10/11/2011 16:37,3.29,,United Kingdom
570690,22736,RIBBON REEL MAKING SNOWMEN ,1,10/11/2011 16:37,3.29,,United Kingdom
570690,22738,RIBBON REEL SNOWY VILLAGE,4,10/11/2011 16:37,3.29,,United Kingdom
570690,22739,RIBBON REEL CHRISTMAS SOCK BAUBLE,2,10/11/2011 16:37,3.29,,United Kingdom
570690,22753,SMALL YELLOW BABUSHKA NOTEBOOK ,2,10/11/2011 16:37,1.63,,United Kingdom
570690,22754,SMALL RED BABUSHKA NOTEBOOK ,2,10/11/2011 16:37,1.63,,United Kingdom
570690,22795,SWEETHEART RECIPE BOOK STAND,1,10/11/2011 16:37,13.29,,United Kingdom
570690,22816,CARD MOTORBIKE SANTA,4,10/11/2011 16:37,0.42,,United Kingdom
570690,22818,CARD CHRISTMAS VILLAGE,4,10/11/2011 16:37,0.42,,United Kingdom
570690,22866,HAND WARMER SCOTTY DOG DESIGN,1,10/11/2011 16:37,4.13,,United Kingdom
570690,22905,CALENDAR IN SEASON DESIGN,1,10/11/2011 16:37,2.46,,United Kingdom
570690,22909,SET OF 20 VINTAGE CHRISTMAS NAPKINS,1,10/11/2011 16:37,1.63,,United Kingdom
570690,22910,PAPER CHAIN KIT VINTAGE CHRISTMAS,1,10/11/2011 16:37,5.79,,United Kingdom
570690,22944,CHRISTMAS METAL POSTCARD WITH BELLS,12,10/11/2011 16:37,0.97,,United Kingdom
570690,22946,WOODEN ADVENT CALENDAR CREAM,2,10/11/2011 16:37,16.95,,United Kingdom
570690,22950,36 DOILIES VINTAGE CHRISTMAS,1,10/11/2011 16:37,2.92,,United Kingdom
570690,22951,60 CAKE CASES DOLLY GIRL DESIGN,1,10/11/2011 16:37,1.25,,United Kingdom
570690,22952,60 CAKE CASES VINTAGE CHRISTMAS,1,10/11/2011 16:37,1.25,,United Kingdom
570690,22960,JAM MAKING SET WITH JARS,2,10/11/2011 16:37,8.29,,United Kingdom
570690,22961,JAM MAKING SET PRINTED,4,10/11/2011 16:37,3.29,,United Kingdom
570690,22962,JAM JAR WITH PINK LID,1,10/11/2011 16:37,1.63,,United Kingdom
570690,22963,JAM JAR WITH GREEN LID,1,10/11/2011 16:37,1.63,,United Kingdom
570690,22969,HOMEMADE JAM SCENTED CANDLES,2,10/11/2011 16:37,3.29,,United Kingdom
570690,22990,COTTON APRON PANTRY DESIGN,1,10/11/2011 16:37,10.79,,United Kingdom
570690,22993,SET OF 4 PANTRY JELLY MOULDS,2,10/11/2011 16:37,2.46,,United Kingdom
570690,23031,DRAWER KNOB CRACKLE GLAZE PINK,2,10/11/2011 16:37,3.29,,United Kingdom
570690,23032,DRAWER KNOB CRACKLE GLAZE IVORY,4,10/11/2011 16:37,3.29,,United Kingdom
570690,23033,DRAWER KNOB CERAMIC RED,2,10/11/2011 16:37,3.29,,United Kingdom
570690,23050,RECYCLED ACAPULCO MAT GREEN,1,10/11/2011 16:37,16.63,,United Kingdom
570690,23088,ZINC HEART FLOWER T-LIGHT HOLDER,1,10/11/2011 16:37,2.46,,United Kingdom
570690,23108,SET OF 10 LED DOLLY LIGHTS,1,10/11/2011 16:37,12.46,,United Kingdom
570690,23158,SET OF 5 LUCKY CAT MAGNETS ,1,10/11/2011 16:37,4.13,,United Kingdom
570690,23199,JUMBO BAG APPLES,1,10/11/2011 16:37,4.13,,United Kingdom
570690,23200,JUMBO BAG PEARS,1,10/11/2011 16:37,4.13,,United Kingdom
570690,23202,JUMBO BAG VINTAGE LEAF,1,10/11/2011 16:37,4.13,,United Kingdom
570690,23203,JUMBO BAG VINTAGE DOILY ,5,10/11/2011 16:37,2.08,,United Kingdom
570690,23204,CHARLOTTE BAG APPLES DESIGN,6,10/11/2011 16:37,1.63,,United Kingdom
570690,23210,WHITE ROCKING HORSE HAND PAINTED,1,10/11/2011 16:37,2.46,,United Kingdom
570690,23211,RED ROCKING HORSE HAND PAINTED,1,10/11/2011 16:37,2.46,,United Kingdom
570690,23212,HEART WREATH DECORATION WITH BELL,1,10/11/2011 16:37,2.46,,United Kingdom
