575612,22356,CHARLOTTE BAG PINK POLKADOT,10,11/10/2011 12:47,0.85,17416,United Kingdom
575612,20719,WOODLAND CHARLOTTE BAG,10,11/10/2011 12:47,0.85,17416,United Kingdom
575612,22661,CHARLOTTE BAG DOLLY GIRL DESIGN,10,11/10/2011 12:47,0.85,17416,United Kingdom
575612,21479,WHITE SKULL HOT WATER BOTTLE ,8,11/10/2011 12:47,4.25,17416,United Kingdom
575612,21485,RETROSPOT HEART HOT WATER BOTTLE,6,11/10/2011 12:47,4.95,17416,United Kingdom
575612,22111,SCOTTIE DOG HOT WATER BOTTLE,6,11/10/2011 12:47,4.95,17416,United Kingdom
575612,22113,GREY HEART HOT WATER BOTTLE,4,11/10/2011 12:47,4.25,17416,United Kingdom
575612,23355,HOT WATER BOTTLE KEEP CALM,4,11/10/2011 12:47,4.95,17416,United Kingdom
575612,23356,LOVE HOT WATER BOTTLE,3,11/10/2011 12:47,5.95,17416,United Kingdom
575612,84029E,RED WOOLLY HOTTIE WHITE HEART.,4,11/10/2011 12:47,4.25,17416,United Kingdom
575612,84030E,ENGLISH ROSE HOT WATER BOTTLE,4,11/10/2011 12:47,4.25,17416,United Kingdom
575612,20969,RED FLORAL FELTCRAFT SHOULDER BAG,4,11/10/2011 12:47,3.75,17416,United Kingdom
575612,20972,PINK CREAM FELT CRAFT TRINKET BOX ,12,11/10/2011 12:47,1.25,17416,United Kingdom
575612,22271,FELTCRAFT DOLL ROSIE,6,11/10/2011 12:47,2.95,17416,United Kingdom
575612,20970,PINK FLORAL FELTCRAFT SHOULDER BAG,4,11/10/2011 12:47,3.75,17416,United Kingdom
575612,22273,FELTCRAFT DOLL MOLLY,6,11/10/2011 12:47,2.95,17416,United Kingdom
575612,20971,PINK BLUE FELT CRAFT TRINKET BOX,12,11/10/2011 12:47,1.25,17416,United Kingdom
575612,22274,FELTCRAFT DOLL EMILY,6,11/10/2011 12:47,2.95,17416,United Kingdom
575612,22834,HAND WARMER BABUSHKA DESIGN,12,11/10/2011 12:47,2.1,17416,United Kingdom
575612,22867,HAND WARMER BIRD DESIGN,12,11/10/2011 12:47,2.1,17416,United Kingdom
575612,22866,HAND WARMER SCOTTY DOG DESIGN,12,11/10/2011 12:47,2.1,17416,United Kingdom
575612,22633,HAND WARMER UNION JACK,12,11/10/2011 12:47,2.1,17416,United Kingdom
575612,22632,HAND WARMER RED RETROSPOT,12,11/10/2011 12:47,2.1,17416,United Kingdom
575612,22865,HAND WARMER OWL DESIGN,12,11/10/2011 12:47,2.1,17416,United Kingdom
575612,23439,HAND WARMER RED LOVE HEART,12,11/10/2011 12:47,2.1,17416,United Kingdom
575612,22065,CHRISTMAS PUDDING TRINKET POT ,48,11/10/2011 12:47,0.39,17416,United Kingdom
575612,23583,LUNCH BAG PAISLEY PARK  ,10,11/10/2011 12:47,1.65,17416,United Kingdom
575612,23582,VINTAGE DOILY JUMBO BAG RED ,10,11/10/2011 12:47,2.08,17416,United Kingdom
575612,23581,JUMBO BAG PAISLEY PARK,10,11/10/2011 12:47,2.08,17416,United Kingdom
575612,21117,BLOND DOLL DOORSTOP,12,11/10/2011 12:47,1.25,17416,United Kingdom
575612,22091,EMPIRE TISSUE BOX,36,11/10/2011 12:47,0.39,17416,United Kingdom
575612,22092,BLUE PAISLEY TISSUE BOX,36,11/10/2011 12:47,0.39,17416,United Kingdom
575612,22093,MOTORING TISSUE BOX,36,11/10/2011 12:47,0.39,17416,United Kingdom
575613,23118,check,-6,11/10/2011 12:47,0,,United Kingdom
575614,22121,check,-10,11/10/2011 12:48,0,,United Kingdom
575615,82582,??,-130,11/10/2011 12:51,0,,United Kingdom
C575616,23469,CARD HOLDER LOVE BIRD SMALL,-2,11/10/2011 12:51,4.15,15805,United Kingdom
C575616,23470,CARD HOLDER LOVE BIRD LARGE ,-4,11/10/2011 12:51,5.39,15805,United Kingdom
575617,21014,check,-90,11/10/2011 12:53,0,,United Kingdom
575618,22608,PENS ASSORTED FUNKY JEWELED ,36,11/10/2011 12:57,0.19,15463,United Kingdom
575618,84947,ANTIQUE SILVER TEA GLASS ENGRAVED,12,11/10/2011 12:57,1.25,15463,United Kingdom
575618,22219,LOVEBIRD HANGING DECORATION WHITE ,12,11/10/2011 12:57,0.85,15463,United Kingdom
575618,21175,GIN + TONIC DIET METAL SIGN,12,11/10/2011 12:57,2.55,15463,United Kingdom
575618,23012,GLASS APOTHECARY BOTTLE PERFUME,4,11/10/2011 12:57,3.95,15463,United Kingdom
575618,22457,NATURAL SLATE HEART CHALKBOARD ,6,11/10/2011 12:57,2.95,15463,United Kingdom
575618,23076,ICE CREAM SUNDAE LIP GLOSS,24,11/10/2011 12:57,1.25,15463,United Kingdom
575619,22835,HOT WATER BOTTLE I AM SO POORLY,24,11/10/2011 12:59,4.25,14712,United Kingdom
575619,22112,CHOCOLATE HOT WATER BOTTLE,24,11/10/2011 12:59,4.25,14712,United Kingdom
575619,23355,HOT WATER BOTTLE KEEP CALM,24,11/10/2011 12:59,4.15,14712,United Kingdom
575619,22111,SCOTTIE DOG HOT WATER BOTTLE,24,11/10/2011 12:59,4.25,14712,United Kingdom
