571080,23322,LARGE WHITE HEART OF WICKER,6,10/13/2011 15:19,2.95,13719,United Kingdom
571080,23323,WHITE WICKER STAR ,6,10/13/2011 15:19,2.1,13719,United Kingdom
571080,23321,SMALL WHITE HEART OF WICKER,12,10/13/2011 15:19,1.65,13719,United Kingdom
571080,23082,SET 6 PAPER TABLE LANTERN HEARTS ,6,10/13/2011 15:19,3.75,13719,United Kingdom
571080,23396,LE JARDIN BOTANIQUE CUSHION COVER,4,10/13/2011 15:19,3.75,13719,United Kingdom
571080,23393,HOME SWEET HOME CUSHION COVER ,4,10/13/2011 15:19,3.75,13719,United Kingdom
571080,23395,BELLE JARDINIERE CUSHION COVER,4,10/13/2011 15:19,3.75,13719,United Kingdom
571080,23425,STORAGE TIN HOME SWEET HOME,6,10/13/2011 15:19,2.49,13719,United Kingdom
571080,23414,ZINC BOX SIGN HOME,2,10/13/2011 15:19,9.95,13719,United Kingdom
571080,22762,CUPBOARD 3 DRAWER MA CAMPAGNE,1,10/13/2011 15:19,14.95,13719,United Kingdom
571080,23535,WALL ART BICYCLE SAFETY,4,10/13/2011 15:19,5.95,13719,United Kingdom
571080,23169,CLASSIC GLASS COOKIE JAR,6,10/13/2011 15:19,4.15,13719,United Kingdom
571080,23013,GLASS APOTHECARY BOTTLE TONIC,4,10/13/2011 15:19,3.95,13719,United Kingdom
571080,46000M,POLYESTER FILLER PAD 45x45cm,12,10/13/2011 15:19,1.55,13719,United Kingdom
571081,84836,ZINC METAL HEART DECORATION,12,10/13/2011 15:23,1.25,16775,United Kingdom
571081,23026,DRAWER KNOB VINTAGE GLASS STAR,6,10/13/2011 15:23,2.08,16775,United Kingdom
571081,22470,HEART OF WICKER LARGE,4,10/13/2011 15:23,2.95,16775,United Kingdom
571081,23322,LARGE WHITE HEART OF WICKER,3,10/13/2011 15:23,2.95,16775,United Kingdom
571081,23067,HANGING ENGRAVED METAL HEART,1,10/13/2011 15:23,4.15,16775,United Kingdom
571081,22139,RETROSPOT TEA SET CERAMIC 11 PC ,1,10/13/2011 15:23,4.95,16775,United Kingdom
571081,23411, TRELLIS COAT RACK,1,10/13/2011 15:23,4.95,16775,United Kingdom
571081,21034,REX CASH+CARRY JUMBO SHOPPER,1,10/13/2011 15:23,0.95,16775,United Kingdom
571081,23396,LE JARDIN BOTANIQUE CUSHION COVER,2,10/13/2011 15:23,3.75,16775,United Kingdom
571081,23393,HOME SWEET HOME CUSHION COVER ,2,10/13/2011 15:23,3.75,16775,United Kingdom
571081,23424,GINGHAM RECIPE BOOK BOX,2,10/13/2011 15:23,4.95,16775,United Kingdom
571081,46000M,POLYESTER FILLER PAD 45x45cm,4,10/13/2011 15:23,1.55,16775,United Kingdom
571081,21733,RED HANGING HEART T-LIGHT HOLDER,3,10/13/2011 15:23,2.95,16775,United Kingdom
571081,85123A,WHITE HANGING HEART T-LIGHT HOLDER,3,10/13/2011 15:23,2.95,16775,United Kingdom
571081,22804,PINK HANGING HEART T-LIGHT HOLDER,2,10/13/2011 15:23,2.95,16775,United Kingdom
571081,22113,GREY HEART HOT WATER BOTTLE,2,10/13/2011 15:23,4.25,16775,United Kingdom
571081,23355,HOT WATER BOTTLE KEEP CALM,1,10/13/2011 15:23,4.95,16775,United Kingdom
571081,22835,HOT WATER BOTTLE I AM SO POORLY,1,10/13/2011 15:23,4.95,16775,United Kingdom
571081,22112,CHOCOLATE HOT WATER BOTTLE,1,10/13/2011 15:23,4.95,16775,United Kingdom
571081,22797,CHEST OF DRAWERS GINGHAM HEART ,1,10/13/2011 15:23,16.95,16775,United Kingdom
571081,22487,WHITE WOOD GARDEN PLANT LADDER,1,10/13/2011 15:23,9.95,16775,United Kingdom
571081,22171,3 HOOK PHOTO SHELF ANTIQUE WHITE,1,10/13/2011 15:23,8.5,16775,United Kingdom
571081,82494L,WOODEN FRAME ANTIQUE WHITE ,2,10/13/2011 15:23,2.95,16775,United Kingdom
571081,82482,WOODEN PICTURE FRAME WHITE FINISH,2,10/13/2011 15:23,2.95,16775,United Kingdom
571081,23067,HANGING ENGRAVED METAL HEART,1,10/13/2011 15:23,4.15,16775,United Kingdom
571081,22283,6 EGG HOUSE PAINTED WOOD,1,10/13/2011 15:23,7.95,16775,United Kingdom
571081,22794,SWEETHEART WIRE MAGAZINE RACK,1,10/13/2011 15:23,7.95,16775,United Kingdom
571082,16236,KITTY PENCIL ERASERS,1,10/13/2011 15:25,0.42,,United Kingdom
571082,16237,SLEEPING CAT ERASERS,1,10/13/2011 15:25,0.42,,United Kingdom
571082,20719,WOODLAND CHARLOTTE BAG,4,10/13/2011 15:25,1.63,,United Kingdom
571082,20723,STRAWBERRY CHARLOTTE BAG,4,10/13/2011 15:25,1.63,,United Kingdom
571082,20724,RED RETROSPOT CHARLOTTE BAG,4,10/13/2011 15:25,1.63,,United Kingdom
571082,20838,FRENCH LATTICE CUSHION COVER ,3,10/13/2011 15:25,3.29,,United Kingdom
571082,20840,FRENCH FLORAL CUSHION COVER ,3,10/13/2011 15:25,3.29,,United Kingdom
571082,20961,STRAWBERRY BATH SPONGE ,1,10/13/2011 15:25,2.46,,United Kingdom
571082,20974,12 PENCILS SMALL TUBE SKULL,1,10/13/2011 15:25,1.25,,United Kingdom
