575656,23311,VINTAGE CHRISTMAS STOCKING ,12,11/10/2011 14:29,2.55,13319,United Kingdom
575656,22086,PAPER CHAIN KIT 50'S CHRISTMAS ,24,11/10/2011 14:29,2.95,13319,United Kingdom
575656,22186,RED STAR CARD HOLDER,12,11/10/2011 14:29,1.95,13319,United Kingdom
575656,22596,CHRISTMAS STAR WISH LIST CHALKBOARD,12,11/10/2011 14:29,1.25,13319,United Kingdom
575656,84879,ASSORTED COLOUR BIRD ORNAMENT,40,11/10/2011 14:29,1.69,13319,United Kingdom
575656,23144,ZINC T-LIGHT HOLDER STARS SMALL,24,11/10/2011 14:29,0.83,13319,United Kingdom
575656,22178,VICTORIAN GLASS HANGING T-LIGHT,24,11/10/2011 14:29,1.95,13319,United Kingdom
575656,22725,ALARM CLOCK BAKELIKE CHOCOLATE,8,11/10/2011 14:29,3.75,13319,United Kingdom
575656,22726,ALARM CLOCK BAKELIKE GREEN,16,11/10/2011 14:29,3.75,13319,United Kingdom
575656,22730,ALARM CLOCK BAKELIKE IVORY,8,11/10/2011 14:29,3.75,13319,United Kingdom
575656,22727,ALARM CLOCK BAKELIKE RED ,16,11/10/2011 14:29,3.75,13319,United Kingdom
575656,23032,DRAWER KNOB CRACKLE GLAZE IVORY,18,11/10/2011 14:29,1.65,13319,United Kingdom
575656,23029,DRAWER KNOB CRACKLE GLAZE GREEN,12,11/10/2011 14:29,1.65,13319,United Kingdom
575656,20914,SET/5 RED RETROSPOT LID GLASS BOWLS,12,11/10/2011 14:29,2.95,13319,United Kingdom
575656,79321,CHILLI LIGHTS,4,11/10/2011 14:29,5.75,13319,United Kingdom
575656,22960,JAM MAKING SET WITH JARS,12,11/10/2011 14:29,3.75,13319,United Kingdom
575656,22961,JAM MAKING SET PRINTED,24,11/10/2011 14:29,1.45,13319,United Kingdom
575656,23298,SPOTTY BUNTING,12,11/10/2011 14:29,4.95,13319,United Kingdom
575656,23240,SET OF 4 KNICK KNACK TINS DOILY ,12,11/10/2011 14:29,4.15,13319,United Kingdom
575656,22835,HOT WATER BOTTLE I AM SO POORLY,12,11/10/2011 14:29,4.95,13319,United Kingdom
575656,23356,LOVE HOT WATER BOTTLE,12,11/10/2011 14:29,5.95,13319,United Kingdom
575656,22865,HAND WARMER OWL DESIGN,48,11/10/2011 14:29,2.1,13319,United Kingdom
575656,22867,HAND WARMER BIRD DESIGN,24,11/10/2011 14:29,2.1,13319,United Kingdom
575656,22750,FELTCRAFT PRINCESS LOLA DOLL,8,11/10/2011 14:29,3.75,13319,United Kingdom
575656,22952,60 CAKE CASES VINTAGE CHRISTMAS,48,11/10/2011 14:29,0.55,13319,United Kingdom
575656,22326,ROUND SNACK BOXES SET OF4 WOODLAND ,6,11/10/2011 14:29,2.95,13319,United Kingdom
575656,23292,SPACEBOY CHILDRENS CUP,8,11/10/2011 14:29,1.25,13319,United Kingdom
575656,23290,SPACEBOY CHILDRENS BOWL,8,11/10/2011 14:29,1.25,13319,United Kingdom
575656,23289,DOLLY GIRL CHILDRENS BOWL,8,11/10/2011 14:29,1.25,13319,United Kingdom
575656,23291,DOLLY GIRL CHILDRENS CUP,8,11/10/2011 14:29,1.25,13319,United Kingdom
575656,22457,NATURAL SLATE HEART CHALKBOARD ,12,11/10/2011 14:29,2.95,13319,United Kingdom
575656,22946,WOODEN ADVENT CALENDAR CREAM,2,11/10/2011 14:29,16.95,13319,United Kingdom
575656,22940,FELTCRAFT CHRISTMAS FAIRY,8,11/10/2011 14:29,4.25,13319,United Kingdom
575656,23208,LUNCH BAG VINTAGE LEAF DESIGN,10,11/10/2011 14:29,1.65,13319,United Kingdom
575656,23206,LUNCH BAG APPLE DESIGN,10,11/10/2011 14:29,1.65,13319,United Kingdom
575656,23209,LUNCH BAG VINTAGE DOILY ,10,11/10/2011 14:29,1.65,13319,United Kingdom
575656,23207,LUNCH BAG ALPHABET DESIGN,10,11/10/2011 14:29,1.65,13319,United Kingdom
575657,23583,LUNCH BAG PAISLEY PARK  ,10,11/10/2011 14:30,1.65,13319,United Kingdom
575657,23581,JUMBO BAG PAISLEY PARK,10,11/10/2011 14:30,2.08,13319,United Kingdom
575657,23582,VINTAGE DOILY JUMBO BAG RED ,10,11/10/2011 14:30,2.08,13319,United Kingdom
575657,23681,LUNCH BAG RED VINTAGE DOILY,10,11/10/2011 14:30,1.65,13319,United Kingdom
575657,23084,RABBIT NIGHT LIGHT,18,11/10/2011 14:30,2.08,13319,United Kingdom
575658,23084,RABBIT NIGHT LIGHT,12,11/10/2011 14:31,2.08,13319,United Kingdom
575659,20829,GLITTER HANGING BUTTERFLY STRING,8,11/10/2011 14:35,2.1,13576,United Kingdom
575659,22041,"RECORD FRAME 7"" SINGLE SIZE ",48,11/10/2011 14:35,2.1,13576,United Kingdom
575659,82001S,SILVER RECORD COVER FRAME,24,11/10/2011 14:35,3.39,13576,United Kingdom
575659,22065,CHRISTMAS PUDDING TRINKET POT ,48,11/10/2011 14:35,0.39,13576,United Kingdom
575659,85036B,CHOCOLATE 1 WICK MORRIS BOX CANDLE,18,11/10/2011 14:35,1.25,13576,United Kingdom
575659,21137,BLACK RECORD COVER FRAME,72,11/10/2011 14:35,3.39,13576,United Kingdom
575659,22118,JOY WOODEN BLOCK LETTERS,3,11/10/2011 14:35,4.95,13576,United Kingdom
