575673,21672,WHITE SPOT RED CERAMIC DRAWER KNOB,12,11/10/2011 15:04,1.45,14863,United Kingdom
575673,21668,RED STRIPE CERAMIC DRAWER KNOB,12,11/10/2011 15:04,1.45,14863,United Kingdom
575673,21669,BLUE STRIPE CERAMIC DRAWER KNOB,12,11/10/2011 15:04,1.45,14863,United Kingdom
575673,21670,BLUE SPOT CERAMIC DRAWER KNOB,12,11/10/2011 15:04,1.45,14863,United Kingdom
575673,22774,RED DRAWER KNOB ACRYLIC EDWARDIAN,12,11/10/2011 15:04,1.25,14863,United Kingdom
575674,22061,LARGE CAKE STAND  HANGING STRAWBERY,2,11/10/2011 15:06,9.95,13468,United Kingdom
575674,75049L,LARGE CIRCULAR MIRROR MOBILE,12,11/10/2011 15:06,1.25,13468,United Kingdom
575674,22644,CERAMIC CHERRY CAKE MONEY BANK,12,11/10/2011 15:06,1.45,13468,United Kingdom
575674,37448,CERAMIC CAKE DESIGN SPOTTED MUG,12,11/10/2011 15:06,1.49,13468,United Kingdom
575674,21638,ASSORTED TUTTI FRUTTI NOTEBOOK,12,11/10/2011 15:06,2.1,13468,United Kingdom
575674,22179,SET 10 NIGHT OWL LIGHTS,2,11/10/2011 15:06,6.75,13468,United Kingdom
575674,20685,DOORMAT RED RETROSPOT,2,11/10/2011 15:06,8.25,13468,United Kingdom
575675,23493,VINTAGE DOILY TRAVEL SEWING KIT,1,11/10/2011 15:07,1.95,18283,United Kingdom
575676,22487,WHITE WOOD GARDEN PLANT LADDER,4,11/10/2011 15:09,8.5,13499,United Kingdom
575676,21811,HANGING HEART WITH BELL,48,11/10/2011 15:09,0.39,13499,United Kingdom
575676,22161,HEART DECORATION RUSTIC HANGING ,48,11/10/2011 15:09,0.19,13499,United Kingdom
575676,21810,CHRISTMAS HANGING STAR WITH BELL,48,11/10/2011 15:09,0.39,13499,United Kingdom
575676,22470,HEART OF WICKER LARGE,40,11/10/2011 15:09,2.55,13499,United Kingdom
575676,22577,WOODEN HEART CHRISTMAS SCANDINAVIAN,192,11/10/2011 15:09,0.29,13499,United Kingdom
575676,22578,WOODEN STAR CHRISTMAS SCANDINAVIAN,192,11/10/2011 15:09,0.29,13499,United Kingdom
575676,23404,HOME SWEET HOME BLACKBOARD,6,11/10/2011 15:09,4.95,13499,United Kingdom
575677,21463,MIRRORED DISCO BALL ,1,11/10/2011 15:18,5.95,,United Kingdom
575677,22278,OVERNIGHT BAG VINTAGE ROSE PAISLEY,1,11/10/2011 15:18,4.95,,United Kingdom
575677,20767,BLUE PAISLEY JOURNAL ,1,11/10/2011 15:18,2.55,,United Kingdom
575677,21464,DISCO BALL ROTATOR BATTERY OPERATED,1,11/10/2011 15:18,4.25,,United Kingdom
575678,21810,CHRISTMAS HANGING STAR WITH BELL,48,11/10/2011 15:23,0.39,16169,United Kingdom
575678,22186,RED STAR CARD HOLDER,12,11/10/2011 15:23,1.95,16169,United Kingdom
575678,22909,SET OF 20 VINTAGE CHRISTMAS NAPKINS,24,11/10/2011 15:23,0.85,16169,United Kingdom
575678,22142,CHRISTMAS CRAFT WHITE FAIRY ,24,11/10/2011 15:23,1.45,16169,United Kingdom
575678,22144,CHRISTMAS CRAFT LITTLE FRIENDS,12,11/10/2011 15:23,2.1,16169,United Kingdom
575678,35970,ZINC FOLKART SLEIGH BELLS,12,11/10/2011 15:23,1.69,16169,United Kingdom
575678,22577,WOODEN HEART CHRISTMAS SCANDINAVIAN,24,11/10/2011 15:23,0.29,16169,United Kingdom
575678,22578,WOODEN STAR CHRISTMAS SCANDINAVIAN,24,11/10/2011 15:23,0.29,16169,United Kingdom
575678,22579,WOODEN TREE CHRISTMAS SCANDINAVIAN,24,11/10/2011 15:23,0.29,16169,United Kingdom
575678,20668,DISCO BALL CHRISTMAS DECORATION,24,11/10/2011 15:23,0.12,16169,United Kingdom
575678,35471D,SET OF 3 BIRD LIGHT PINK FEATHER ,24,11/10/2011 15:23,0.39,16169,United Kingdom
575678,22086,PAPER CHAIN KIT 50'S CHRISTMAS ,12,11/10/2011 15:23,2.95,16169,United Kingdom
575678,22910,PAPER CHAIN KIT VINTAGE CHRISTMAS,24,11/10/2011 15:23,2.95,16169,United Kingdom
575678,23489,VINTAGE BELLS GARLAND,12,11/10/2011 15:23,2.89,16169,United Kingdom
575678,22897,OVEN MITT APPLES DESIGN,10,11/10/2011 15:23,1.45,16169,United Kingdom
575678,22896,PEG BAG APPLES DESIGN,6,11/10/2011 15:23,2.55,16169,United Kingdom
575678,23196,VINTAGE LEAF MAGNETIC NOTEPAD,12,11/10/2011 15:23,1.45,16169,United Kingdom
575678,22939,ADULT APRON APPLE DELIGHT,4,11/10/2011 15:23,4.95,16169,United Kingdom
575678,22930,BAKING MOULD HEART MILK CHOCOLATE,6,11/10/2011 15:23,2.55,16169,United Kingdom
575678,85054,FRENCH ENAMEL POT W LID,6,11/10/2011 15:23,2.95,16169,United Kingdom
575678,22841,ROUND CAKE TIN VINTAGE GREEN,2,11/10/2011 15:23,7.95,16169,United Kingdom
575678,22895,SET OF 2 TEA TOWELS APPLE AND PEARS,6,11/10/2011 15:23,3.25,16169,United Kingdom
575678,20979,36 PENCILS TUBE RED RETROSPOT,16,11/10/2011 15:23,1.25,16169,United Kingdom
575678,23569,TRADTIONAL ALPHABET STAMP SET,4,11/10/2011 15:23,4.95,16169,United Kingdom
575678,23283,DOORMAT VINTAGE LEAF,2,11/10/2011 15:23,8.25,16169,United Kingdom
