575647,85099B,JUMBO BAG RED RETROSPOT,4,11/10/2011 14:16,2.08,16440,United Kingdom
575647,20914,SET/5 RED RETROSPOT LID GLASS BOWLS,8,11/10/2011 14:16,2.95,16440,United Kingdom
575647,23208,LUNCH BAG VINTAGE LEAF DESIGN,6,11/10/2011 14:16,1.65,16440,United Kingdom
575647,23691,WRAP KEEP CALM BIRTHDAY,25,11/10/2011 14:16,0.42,16440,United Kingdom
575647,22720,SET OF 3 CAKE TINS PANTRY DESIGN ,2,11/10/2011 14:16,4.95,16440,United Kingdom
575647,20726,LUNCH BAG WOODLAND,6,11/10/2011 14:16,1.65,16440,United Kingdom
575647,20728,LUNCH BAG CARS BLUE,6,11/10/2011 14:16,1.65,16440,United Kingdom
C575648,23085,ANTIQUE SILVER BAUBLE LAMP  ,-2,11/10/2011 14:22,8.25,16523,United Kingdom
575649,23180,MUM'S KITCHEN CLOCK,1,11/10/2011 14:23,4.95,,United Kingdom
575649,22730,ALARM CLOCK BAKELIKE IVORY,2,11/10/2011 14:23,3.75,,United Kingdom
575649,46000M,POLYESTER FILLER PAD 45x45cm,1,11/10/2011 14:23,1.55,,United Kingdom
575649,21629,SQUARE FLOOR CUSHION VINTAGE RED,1,11/10/2011 14:23,7.95,,United Kingdom
575649,22727,ALARM CLOCK BAKELIKE RED ,1,11/10/2011 14:23,3.75,,United Kingdom
575649,22807,SET OF 6 T-LIGHTS TOADSTOOLS,1,11/10/2011 14:23,2.95,,United Kingdom
575649,21039,RED RETROSPOT SHOPPING BAG,1,11/10/2011 14:23,2.55,,United Kingdom
575649,23335,EGG FRYING PAN IVORY ,2,11/10/2011 14:23,2.08,,United Kingdom
575649,22189,CREAM HEART CARD HOLDER,2,11/10/2011 14:23,3.95,,United Kingdom
575649,22940,FELTCRAFT CHRISTMAS FAIRY,1,11/10/2011 14:23,4.25,,United Kingdom
575649,22751,FELTCRAFT PRINCESS OLIVIA DOLL,2,11/10/2011 14:23,3.75,,United Kingdom
575649,23128,FELTCRAFT BOY JEAN-PAUL KIT,2,11/10/2011 14:23,4.95,,United Kingdom
575649,21913,VINTAGE SEASIDE JIGSAW PUZZLES,2,11/10/2011 14:23,3.75,,United Kingdom
575649,22550,HOLIDAY FUN LUDO,2,11/10/2011 14:23,3.75,,United Kingdom
575649,23229,VINTAGE DONKEY TAIL GAME ,2,11/10/2011 14:23,3.75,,United Kingdom
575649,21912,VINTAGE SNAKES & LADDERS,4,11/10/2011 14:23,3.75,,United Kingdom
575649,22804,PINK HANGING HEART T-LIGHT HOLDER,4,11/10/2011 14:23,2.95,,United Kingdom
575649,21733,RED HANGING HEART T-LIGHT HOLDER,6,11/10/2011 14:23,2.95,,United Kingdom
575649,85066,CREAM SWEETHEART MINI CHEST,1,11/10/2011 14:23,12.75,,United Kingdom
575649,22605,WOODEN CROQUET GARDEN SET,1,11/10/2011 14:23,14.95,,United Kingdom
575649,23344,JUMBO BAG 50'S CHRISTMAS ,9,11/10/2011 14:23,2.08,,United Kingdom
575649,23319,BOX OF 6 MINI 50'S CRACKERS,6,11/10/2011 14:23,2.49,,United Kingdom
575649,22111,SCOTTIE DOG HOT WATER BOTTLE,2,11/10/2011 14:23,4.95,,United Kingdom
575649,84029E,RED WOOLLY HOTTIE WHITE HEART.,5,11/10/2011 14:23,4.25,,United Kingdom
575649,23356,LOVE HOT WATER BOTTLE,4,11/10/2011 14:23,5.95,,United Kingdom
575649,22114,HOT WATER BOTTLE TEA AND SYMPATHY,2,11/10/2011 14:23,4.25,,United Kingdom
575649,23355,HOT WATER BOTTLE KEEP CALM,5,11/10/2011 14:23,4.95,,United Kingdom
575649,22720,SET OF 3 CAKE TINS PANTRY DESIGN ,2,11/10/2011 14:23,4.95,,United Kingdom
575649,22191,IVORY DINER WALL CLOCK,2,11/10/2011 14:23,8.5,,United Kingdom
575649,22847,BREAD BIN DINER STYLE IVORY,4,11/10/2011 14:23,14.95,,United Kingdom
575649,22781,GUMBALL MAGAZINE RACK,1,11/10/2011 14:23,7.65,,United Kingdom
575649,22467,GUMBALL COAT RACK,3,11/10/2011 14:23,2.55,,United Kingdom
C575650,22726,ALARM CLOCK BAKELIKE GREEN,-1,11/10/2011 14:24,3.75,14194,United Kingdom
C575651,22624,IVORY KITCHEN SCALES,-1,11/10/2011 14:26,8.5,17653,United Kingdom
C575651,22617,BAKING SET SPACEBOY DESIGN,-1,11/10/2011 14:26,4.95,17653,United Kingdom
C575651,22139,RETROSPOT TEA SET CERAMIC 11 PC ,-1,11/10/2011 14:26,4.95,17653,United Kingdom
C575651,21754,HOME BUILDING BLOCK WORD,-1,11/10/2011 14:26,6.25,17653,United Kingdom
C575651,23348,CHILDRENS TOY COOKING UTENSIL SET,-1,11/10/2011 14:26,2.08,17653,United Kingdom
C575651,23329,DECORATIVE WICKER HEART LARGE,-3,11/10/2011 14:26,1.65,17653,United Kingdom
575652,84813,SET OF 4 DIAMOND NAPKIN RINGS,16,11/10/2011 14:28,10.95,12748,United Kingdom
575652,20748,KENSINGTON COFFEE SET,6,11/10/2011 14:28,12.75,12748,United Kingdom
575652,22605,WOODEN CROQUET GARDEN SET,10,11/10/2011 14:28,12.75,12748,United Kingdom
